MP,Date,Language,Title,Url,Content
Damian BOESELAGER,2021-10-19,EN,General budget of the European Union for the financial year 2022 - all sections (debate),https://www.europarl.europa.eu/doceo/document/CRE-9-2021-10-19-INT-2-168-0000_EN.html,"  Damian Boeselager,  rapporteur. – Madam President, I am still in shock from this morning’s attack on our rule of law, and also on our institutions by extension, so excuse me if I’m still grappling with this, especially also because good institutions are really the solid rock on which we stand.
They are extremely important and a source of – and the first line of defence for – the prosperity and progress of our continent. Good institutions allow us all to negotiate our different ideas, our different interests and preferences, and decide a common political direction. They provide judgments, solve conflicts, discover fraud and fight villains who selfishly seek to profit off the community. 
Whereas bad institutions, on the other hand, allow a small number of foul apples to put their own power and money above the progress of the many. Bad institutions turn a blind eye to fraud and corruption and bad institutions open the door to state capture, inaction and inequality of citizens in front of the law. Bad institutions allow politicians like Prime Minister Morawiecki to act against the interest of his own people. 
So what is a good institution then? It’s, quite simply, one that is up to the task, that has the legal means, the people and the political backing to do its job, one that is independent and that can’t be corrupted. Do I think that our current institutions are up to the task? To be honest – and this is quite sad – I don’t think they fully are. We ourselves are completely to blame for this. Despite massive changes in the world and great new challenges for the EU, national governments have not reformed the EU since the treaty change in 2007, and the Council continues to block better decision-making. 
The EU institutions are not given the means to do their jobs well. We have had the stable staffing policy and cuts of staff for the last years, and somehow this golden calf of austerity really is hurting our institutions and endangering the progress and prosperity that I have been talking about. So we can’t really continue as we currently are. There are many reasons why this has become more of a problem today. 
First, let’s look at the recovery plan. We have an unprecedented amount of money that is flowing through the different budgets to the Member States. Hundreds of people are needed to really look in the various institutions, to supervise the planning, to monitor the spending of money and to organise the flow of it. Corona has also seen a vast increase in capacities to try to basically grapple with the situation, we have Brexit and other difficult procedures at our borders, and we obviously need to fight climate change, where more resources are needed. 
So Mr Ressler and I have been tasked to defend the Commission’s budget, but also the other institutions’ budgets, against indiscriminate and horizontal cuts. I wanted to use the opportunity here to thank the fellow shadows for the great cooperation that we had in coming up with Parliament’s position on these matters. 
Despite all these challenges that I have been outlining, the Council did not come up with a better and more, let’s say, detailed view on where we stand, but really tried to just go for stable staffing, austerity and always the same old narrative.
But today, Madam Minister, when we also formally start our discussions about the budget, I would ask you to potentially take into account all these factors that I’ve been mentioning and not just see these numbers, but also the tasks that stand behind them because they are quite important and we need to save our institutions.
To say it with slightly more fun words: to stop villains getting fatter, let’s make our institutions matter, to rebut the Polish letter, let’s make our institutions better. 
"
Damian BOESELAGER,2021-10-19,EN,General budget of the European Union for the financial year 2022 - all sections (debate),https://www.europarl.europa.eu/doceo/document/CRE-9-2021-10-19-INT-2-210-0000_EN.html,"  Damian Boeselager,  rapporteur. – Madam President, I would like to thank colleagues, the Minister and the Commissioner for these exchanges. I think we can see this as a start of our formal negotiation to really try to come to the best outcome for our institutions. 
I just wanted to quickly react to some of the comments that have been made, so I didn’t really fully get the translation of what you were saying, but I’m very thankful for the cooperation we have had so far, and also for you mentioning the potential differences or implications that the Polish situation might have on the budget, because I think that’s actually also relevant if you think about it. How can we transfer money to a country that does not accept the treaties? How can we actually believe that the judges will follow up with due diligence if they’re not bound by our common order? And I think that’s a question that we had discussed this morning, and that the Commission also is currently looking into. 
Mr Kuhs asked what he should tell his grandchildren and I actually quite enjoyed this question because I think the first answer would be to tell them that, you know, a Europe of segregated nations with closed borders to each other is not a Europe that they want to live in. 
The second thing, though, which has more to do with the budget, is the question of how we should invest in the future. My colleagues have mentioned many of the points that we believe are relevant for future investment: climate youth programmes, digitisation, ensuring the future competitiveness. I think to get out of this crisis well, the Recovery and Resilience Facility (RRF) is a good tool, but the whole budget is very important to actually build back better.
In terms of institutional changes that we can also consider to have in the future better working mode, I think it’s important that when we talk about the budget, we also see the context of the overall architecture of our financial and fiscal framework. And here I’m very happy that we are starting this process of understanding that the RRF was a one time tool, but we have an ongoing understanding or issue with the fact that we have a currency union, but not yet a fiscal union, and that is something that we also need to get to.
To end, let me close with what I started with. I think it’s important that we come to a good conclusion for our institutions, for our European Union, to strengthen them, to strengthen the Ombudsman, the Court of Justice, the Court of Auditors, all these institutions that make up our European Union, and I also very much look forward to then, at some point, coming to a conclusion on this budget.
"
Damian BOESELAGER,2021-10-07,EN,European Union Agency for Asylum (debate),https://www.europarl.europa.eu/doceo/document/CRE-9-2021-10-07-INT-4-013-0000_EN.html,"  Damian Boeselager,  on behalf of the Verts/ALE Group. – Mr President, today I woke up to the sad news in the media which we had all more or less been expecting: Greece, Croatia, and Romania are pushing people back over European borders to stop them from applying for asylum. At the same time, today, we have the Afghanistan resettlement forum, where we more or less expect that national ministers will agree not to resettle a single soul in Europe. What a day this is already.
Why is all this happening? There’s a very simple truth. In the absence of an actual European asylum system, a system that could easily cope with the numbers that we are currently seeing and propose the stability of their asylum claims, we have reverted to a system of violence and terror. Violence and terror as deterrence so that people don’t come. We try to match their suffering that they experienced at home with the suffering that they will experience here. 
Pushing people back is just the most obvious symbol of the system. Tents at the seaside where, yet again, families freeze with their children this winter is a second, and another 100 people dying in the Mediterranean over the last two weeks is a third. In the absence of a system, we use suffering to keep control. What a shame for this continent and our enlightened society, but then, enlightenment hasn’t stopped us from committing the worst atrocities in history.
Now the weird thing is that there is a solution. Building a functioning European asylum system does not mean that everyone who comes can stay. It just means that we adhere to our European values while we are processing the asylum claims. I’m happy that, with the European Asylum Agency, we are an ever—so—little step closer to such a system. While the agency cannot process claims itself yet, it can start organising solidarity between Member States. While some changes would be linked to a Dublin reform, it can already start to set minimum standards and ensure that the rights of asylum seekers are safeguarded in the different European systems. The agency, obviously, with the Fundamental Rights Officer, will have a much stronger role in this as well.
In November, I will go visit Samos again. I am quite afraid to go there because I know that I will look people in the eye and have to say that, over the last two years since I last visited, I didn’t really achieve much. However, I am happy that, at least with the European Asylum Agency, we can go in the direction of trying to build a better system. Let’s see this as a start to actually work with those who want to work constructively on a better European asylum system, so that we can give back decency to the people who are arriving and, by extension, to ourselves.
"
Damian BOESELAGER,2021-10-06,EN,The state of play on the submitted RRF recovery plans awaiting approval (debate),https://www.europarl.europa.eu/doceo/document/CRE-9-2021-10-06-INT-3-254-0000_EN.html,"  Damian Boeselager (Verts/ALE).   – Mr President, I say to the Commissioner: stand firm. EU taxpayers’ money should not reward governments that violate the most fundamental principles of the European Union. This is especially true for governments that do not accept the primacy of EU law or have a history of corruption, embezzlement and fraud. I therefore urge you not to approve the current Polish or Hungarian plans until we know that this money actually benefits the citizens and safeguards their rights. Stand firm. 
In addition, Commissioner, let’s prepare well for the future. If you act smartly now, you will be able to stop the flow of recovery money every six months for the next five years. For that to work, I ask you to ensure that the plans have strict six-month targets in improving the rule of law and fighting corruption, and second, to let Parliament help you. Make backroom deals public and give us access to all operational agreements between you and the national governments. Commissioner, we are fighting a good fight. Let’s make sure the tide turns, we improve the rule of law, we fight corruption, and benefit the citizens of this Union. I ask you to stand firm.
"
Damian BOESELAGER,2021-09-14,EN,Presentation by the Council of its position on the draft general budget - 2022 financial year (debate),https://www.europarl.europa.eu/doceo/document/CRE-9-2021-09-14-INT-2-125-0000_EN.html,"  Damian Boeselager,  rapporteur. – Mr President, our European institutions are in a delicate situation. On the one hand, the economic consequences of the COVID crisis necessitate prudence in spending and planning. On the other, the crisis itself and our responses to it force us to do things differently, to invest and to recover. 
Minister, let me tell you that I have sympathy for your prudent approach and I myself and the shadows have applied that prudence in developing our position on the budget. We have spoken extensively to all institutions, we have looked at each budgetary line and we have tried to understand clearly where the needs lie. We made clear that this is not a time for unreasonable budgetary increases. But it seems to me that the Council and Parliament still fundamentally diverge in their approach to the budget. Whereas the Council is applying horizontal cuts, the Parliament’s reading is based on a detailed analysis of the needs of each European institution, which supervise, execute and implement EU law and policy.
It is one of those needs that I want to especially highlight in this context. As you know, the recovery fund leads to an unprecedented flow of EU money to our economies. I have negotiated this law and I am immensely proud of what we have achieved. However, the Council completely ignores that additional money also requires additional supervision. In this context, it seems bizarre to me that the Council cuts posts and budget for the Court of Auditors and, by the way, also for the European Anti-Fraud Office (OLAF). We should be increasing these budgets because European citizens demand that funds are not being wasted or defrauded. I also cannot understand why you would like to cut many other institutions like the Court of Justice or the European External Action Service (EEAS). All of those posts are, in our view, fully justified and based on the reality on the ground. 
Finally, I want to remind you of the incredibly important need to reform and update our European institutions at all times to meet the challenges of our time. We owe it to citizens to constantly rejuvenate and reform from within. That’s why I’m incredibly proud that, with COVID, our Parliament has risen to this task and has started a process of internal rejuvenation and reform, which is actually ongoing as we speak. In open process, we have looked at ways in which to be better at scrutiny, we want to improve the committee culture and the hearings in the way they work and we want to strengthen the plenary debates to be more engaging and representative of our issues. I invite all institutions to undergo a similar process of rejuvenation and internal reform. 
In the same spirit, I invite you, Minister, to push the Council to actually actively engage in the Conference on the Future of Europe, where these debates are taking place on a grander scale. It’s our shared responsibility to ensure that our institutions are ready for the 21st century and that we can actually work for the well-being and interests of our citizens. I can only hope that the Council and Commission join us in the spirit of responsibility, reform and rejuvenation.
"
Damian BOESELAGER,2021-09-14,EN,Situation in Afghanistan (debate),https://www.europarl.europa.eu/doceo/document/CRE-9-2021-09-14-INT-2-196-0000_EN.html,"  Damian Boeselager (Verts/ALE).   – Madam President, to anyone who feels empathy, these images from Afghanistan are heartbreaking and shocking to witness. For years, European countries tried to work together towards a more resilient Afghanistan and in this endeavour relied heavily on locals to support this. 
Amongst these locals are journalists, activists, human rights defenders, women and young people. They knew they took a risk but they still did it, and they were brave enough to support with us and to work with us for a better future for their country. Now they ask for our help, they ask to be saved, but we hear European leaders fostering this narrative of defence and trying to score political gains by playing into nationalistic fears. This is disgraceful.
With our resolution today we ask all European leaders to be courageous and compassionate. We ask them ambitiously to step up resettlement pledges at the September Resettlement Forum. We are talking about tens of thousands of pledges that we would need. 
Second, we ask for safe and legal pathways to be established. We heard about humanitarian visas and we ask for deportations to Afghanistan to be halted, and lastly, to cooperate with all involved actors to ensure that no lives are lost.
"
Damian BOESELAGER,2021-09-14,EN,EU Blue Card Directive (debate),https://www.europarl.europa.eu/doceo/document/CRE-9-2021-09-14-INT-2-335-0000_EN.html,"  Damian Boeselager,  on behalf of the Verts/ALE Group. – Mr President, just yesterday I talked to a young entrepreneur from Berlin, who told me it took him one and a half years to get a visa for the programmer to come to Berlin. One and a half years during which this IT professional could have gone anywhere in the world. In a global competition for talent, that’s just not good enough.
If you want to attract talent to Europe, you need to be attractive, and that’s why I’m super happy that today we can celebrate the agreement on the new Blue Card with you from the Commission as well, because finally, people can move from one Member State to the next within one month. Finally, people can take with them the years they agglomerated on long-term residence from one country to the next, making it much more attractive to come to Europe in the first place. And finally, IT professionals can apply for the Blue Card even without a university degree, making this Blue Card the ultimate European tech visa.
So today is a day of celebration, and tomorrow we should put our heads together again to ensure that it comes into effect as fast as possible and to tackle, one by one, all pathways for labour migration so that people don’t have to wait one and a half years if they have a job offer in Europe.
"
Damian BOESELAGER,2021-07-07,EN,Breaches of EU law and of the rights of LGBTIQ citizens in Hungary as a result of the adopted legal changes in the Hungarian Parliament - The outcome of 22 June hearings under Article 7(1) of the TEU regarding Poland and Hungary (debate),https://www.europarl.europa.eu/doceo/document/CRE-9-2021-07-07-INT-3-115-0000_EN.html,"  Damian Boeselager (Verts/ALE).   – Mr President, Commissioner Jourová, today, despite all odds, is a day of hope. It has been three years since we initiated Article 7 against Hungary. Three years of big words and empty threats. Three years over which the deconstruction of the Hungarian democracy has accelerated. Every day Orbán's government violates the rules that our freedom as a European community are built on. Rules to safeguard the free press and show fair elections, to ensure the independence of judges, rules to protect the diversity of our societies. 
The new law is another terrible example of how Orbán violates these rules. But today still is a day of hope, because today the European Commission has the power to change this course; because today Parliament and Council stand behind you asking for a strong response; because today the rule of law mechanism is in place; and finally, because today you have the power to make the payment of seven billion euros, equalling 5% of Hungary’s annual GDP, conditional on the change of course. So I urge you to use these powers, then today can be a day of hope. 
"
Damian BOESELAGER,2021-06-08,EN,European Parliament’s scrutiny on the ongoing assessment by the Commission and the Council of the national recovery and resilience plans (debate),https://www.europarl.europa.eu/doceo/document/CRE-9-2021-06-08-INT-2-111-0000_EN.html,"  Damian Boeselager,  on behalf of the Verts/ALE Group. – Mr President, I would like to say to President von der Leyen that the Recovery and Resilience Facility (RRF) is no ordinary law. If we get it right, it can be a blueprint for future European fiscal architecture, enabling a more resilient, sustainable and fair economy for all European citizens.
My Group supported you in setting it up. However, looking at the plans submitted by the Member States, we are concerned. Some Member States treat the RRF as a simple refinancing tool, which means that the stimulus effect is neutralised and costs are simply shifted to the European level. Many Member States avoid ambitious reforms necessary to modernise the administration, even though the regulation requires them to do so. And most importantly for my Group, many Member States try the old practice of greenwashing, trying to sell hybrid cars, gas boilers and other dirty investments as green.
President von der Leyen, do not give in to these reluctant governments. Do not approve plans that don’t fully comply with the law. Tell President Macron that he should address the French CSR. Tell Chancellor Merkel that she cannot use EU funds to get rid of her hybrid cars. Tell Prime Minister Draghi that he needs to fight greenwashing. And tell all governments across the EU to enforce the ‘do no significant harm’ principle. You have the full backing of this House to ensure that money is not wasted on national pet projects but used to fuel a green and a real tradition with a lasting impact. You said it: ‘Long live Europe’. I would say: ‘Long live a better and reformed Europe’.
"
Damian BOESELAGER,2021-05-19,EN,New avenues for legal labour migration (debate),https://www.europarl.europa.eu/doceo/document/CRE-9-2021-05-19-INT-3-170-0000_EN.html,"  Damian Boeselager,  on behalf of the Verts/ALE Group. – Madam President, what image comes to our mind when we hear the term ‘migrant’? What happens if you replace that term with ‘international talent’ or even ‘expat community’?
Our debate on migration is distorted. The fears of losing our culture are inflated by right wing populist rhetoric. However, migration lies at the basis of all European culture, as the Vice President said. Today, 95% of all migrants come to Europe regularly, many of them with some form of a work visa, contributing to our society’s diversity, to our economy – and, to be frank, offsetting the effects of an aging society on our pension schemes – and helping us through this crisis, as it has been said before.
I come from the private sector, and I’m in close exchange with many start-ups across the continent. Next to a lack of access to capital, their key success factor is access to international talent. Only sufficient talent will enable them to thrive and create jobs for Europeans as well. But we still fail to attract the best talent and skills. In fact, even under Trump, the US was more attractive to migrants than the European Union.
Why? Because first, we are still seen as a rather racist society. And second, because we don’t have a unified labour migration system, but 27 separate ones. Our national governments still think it makes sense to compete against each other when it comes to migration.
With this report, we have shown that there is a separate way: a new way. Together as one House we ask to Europeanise our system to ensure that we get to a European migration code, and that migrants can profit from the full European labour market, and that we can profit from them.
Second, we ask to foster equal conditions for everyone who works here, no matter where they’re from, when it comes to wages, rights and working conditions. We have to fight labour exploitation.
And third, we ask for new pathways, and I’m very happy that the Vice President has mentioned some of them, like the talent pool, which I’m presenting at some point as a pilot project. But there are others: youth mobility schemes, visas for job and vocational training, the Long-Term Residence Directive and the single permit. It’s clear: Europe is strongest if we work together, especially when it comes to labour migration.
"
Damian BOESELAGER,2021-04-29,EN,Announcement of voting results,https://www.europarl.europa.eu/doceo/document/CRE-9-2021-04-29-INT-4-009-0000_EN.html,"  Damian Boeselager (Verts/ALE).   – Mr President, by now I have spent more time as a remote Parliamentarian than as under normal circumstances. I have learned to negotiate laws via Webex, I engage with citizens over Zoom, and I plead with the Commission via Teams. My team at home is constantly working remotely and my office is as empty as the plenary in Strasbourg. Even though I’m proud to say that this institution has weathered the circumstances really well, I can’t wait to go back to normality.
But what will the new normality look like? What can be learned from these times? And what do we really want to return? We don’t have these answers yet but the discussions over the 2022 budget were very much marked by these questions. And so I want to thank the shadow rapporteurs, but also the Bureau and especially the EP administration for finding good solutions and for really engaging in this debate and scrutinising the budget in the best way we can to find answers and to create space for these answers.
Together we agreed to strengthen the legislative capacity of this House. We agreed to find ways to travel less, to be more efficient and to be greener and more transparent. We agreed to pay more attention to gender—related budgeting and – and that’s very important for me as well – we created space for the Conference on the Future of Europe to work. So, because of all of these reasons and also because it was my first rapporteurship, I would like you to vote in favour and I ask you for that.
"
