MP,Date,Language,Title,Url,Content
Damian BOESELAGER,2022-05-03,EN,The follow up of the Conference on the Future of Europe (debate),https://www.europarl.europa.eu/doceo/document/CRE-9-2022-05-03-INT-2-213-0000_EN.html,"  Damian Boeselager (Verts/ALE),  blue-card speech. – I just have a very simple question. I was here on Saturday and saw the conclusions, I also read the conclusions and my question is: why are you misrepresenting what’s in there, which is actually that we want to strengthen regional parliaments and that we want to strengthen cooperation between national and the European Parliament? 
So there’s nothing about abolishment of the national regional parliaments, so why are you misrepresenting the results?
"
Damian BOESELAGER,2022-05-03,EN,The follow up of the Conference on the Future of Europe (debate),https://www.europarl.europa.eu/doceo/document/CRE-9-2022-05-03-INT-2-222-0000_EN.html,"  Damian Boeselager (Verts/ALE),  blue-card speech. – Mr Benifei, I was just wondering if you would ever run on a transnational list?
"
Damian BOESELAGER,2022-05-03,EN,The follow up of the Conference on the Future of Europe (debate),https://www.europarl.europa.eu/doceo/document/CRE-9-2022-05-03-INT-2-232-0000_EN.html,"  Damian Boeselager (Verts/ALE),  blue-card speech. – Actually, I think I will retract my blue—card because I don’t think I’m getting anywhere. 
"
Damian BOESELAGER,2022-05-03,EN,The follow up of the Conference on the Future of Europe (debate),https://www.europarl.europa.eu/doceo/document/CRE-9-2022-05-03-INT-2-249-0000_EN.html,"  Damian Boeselager (Verts/ALE).   – Madam President, fellow Europeans, earlier today, Vladimir Klitschko, who is the mayor of Kiev, wrote that, for Putin, Ukraine is a provocation because it is a democracy. Democracy is a provocation for some people. And we can also see this, sadly, in this Chamber. So what do we have to do? We have to dare more democracy. That’s exactly what they fear. Let us dare more democracy. I said this also on Saturday at the conclusion and I say it now after we voted positively on the transnational list, we need to dare more democracy. 
If you look at the conclusions that all these citizens that actually dared more democracy came up with, you see that there’s a lot of very positive stuff in there: abolishing the veto, making the Council more transparent, calling it a Senate to make it a real second chamber, and giving more rights and powers to Parliament, including the right of initiative, budgetary powers and so on. 
So we need to seriously follow up on this. I am very happy that from the Constitution Committee we already requested to trigger Article 48, to trigger Treaty change, and I hope that the countries will follow up, but I also hope that we can follow up on all the other ideas that don’t need Treaty change.
(The speaker agreed to take a blue-card speech)
"
Damian BOESELAGER,2022-05-03,EN,The follow up of the Conference on the Future of Europe (debate),https://www.europarl.europa.eu/doceo/document/CRE-9-2022-05-03-INT-2-251-0000_EN.html,"  Damian Boeselager (Verts/ALE),  blue-card reply. – So I think it’s very good that you made the effort to go out there. And I think it’s also okay to have a different vision of how Europe should go, which is a vision of where prime ministers and chancellors sit in backroom deals and battle all the deals out on how Europe should work. I just believe that we should fight and I’m fighting for a Europe, where you have a parliamentary democracy, where we can have these debates and where we can fill the government that can then be dis—elected if people don’t like it. I think this gives more voice to citizens also if they’re critical about different policies. But I’m having these conversations and I’m happy to see your study results as well.
"
Damian BOESELAGER,2022-05-03,EN,The follow up of the Conference on the Future of Europe (debate),https://www.europarl.europa.eu/doceo/document/CRE-9-2022-05-03-INT-2-258-0000_EN.html,"  Damian Boeselager (Verts/ALE),  blue-card speech. – Apparently it’s my democratic right to ask questions, so I will make use of that. 
I wanted to ask you, if you, as an Italian running on a French list, believe there is something like a European identity?
"
Damian BOESELAGER,2022-05-02,EN,Election of the Members of the European Parliament by direct universal suffrage (debate),https://www.europarl.europa.eu/doceo/document/CRE-9-2022-05-02-INT-1-046-0000_EN.html,"  Damian Boeselager,  on behalf of the Verts/ALE Group. – Mr President, 18 years ago today, 10 countries joined the European Union in enlarging the ‘original club’. And I think what we have learned and seen over the last 20 years is that basically, the backroom deals between chancellors, prime ministers and presidents do not work anymore. And why is that? Because they are too non—transparent, and they’re inefficient.
And so what we need to do now in this mandate as well is to give a voice to European citizens. And this is exactly what the second vote does. It gives a second voice to citizens, allowing them to actually express what kind of Europe they want. Is it a more restrictive Europe, a conservative Europe, where migration is a bit curbed, where you have more money for small and medium-sized businesses, and money for Europol? Or is it a more social Europe, where you have minimum wages and I don’t know what? Or is it more liberal, or is it more bold, whatever kind of Europe they want. So you dare more democracy, you don’t take a single thing away from citizens – you give them a vote.
So don’t listen to those people who tell you it’s otherwise. Don’t listen to those who say, ‘28 people, they are so far away from the citizens’. That’s not what this is about. It’s about bringing European parties closer to citizens; that they can, actually, for the first time in their lives, vote for them, say: I like this European programme, I like this European candidate, I like this European party, I want this. Currently, they can’t. And so this is what this is about.
Don’t listen to the people who say, ‘oh, the small and medium—sized Member States, they won’t have a voice’. This is not true. In the first place, if you look at Europe, small and medium Member States field the biggest and most prominent figures already. But it’s not only that. In the file, as Verhofstadt also said, there are enough conditions in there to ensure that this is not the case. So don’t listen to them.
This is really about all of us thinking, as a Parliament, how can we ensure that we can make the step towards a European parliamentary democracy, how we can dare more democracy? And that’s why I would really ask you to vote in favour. 
There are other positive elements, we have heard about them. There’s voting age 16, and this is an indication which is positive. There’s a better gender representation with quotas and zipped lists, and there’s a lot more positive in there that is in regard to minimum standards. 
But there’s also one really negative element in there and I have to mention this. We introduce a threshold of 3.5% for Germany, which, from my perspective, is really sad and bad. I have not heard a single sound argument why this is needed. There’s not a single sound argument out there, and it does take away five million votes from European citizens. That is as much as the smallest five Member States together.
I would still ask you to vote in favour, even though it reduces my likelihood of getting re—elected, because I think it’s so important that we give citizens a voice, and that we dare more democracy with the second vote.
"
Damian BOESELAGER,2022-05-02,EN,Election of the Members of the European Parliament by direct universal suffrage (debate),https://www.europarl.europa.eu/doceo/document/CRE-9-2022-05-02-INT-1-052-0000_EN.html,"  Damian Boeselager (Verts/ALE),  blue-card speech. – Paolo, there’s no animal like the EU, so you won’t find any comparisons in other systems. The second point, on bringing European citizens closer; you change nothing by just giving them a second vote. How can that bring citizens further away from the European Union the first time they can actually vote for a European party that you’re part of? And third, on the Spitzenkandidat, there is no system on this earth where the Spitzenkandidat is actually registered in the law. So this is in Germany – I don’t think in any other system – this is by practice, so why do you think that this is worse than, for example, the German system?
"
Damian BOESELAGER,2022-05-02,EN,Election of the Members of the European Parliament by direct universal suffrage (debate),https://www.europarl.europa.eu/doceo/document/CRE-9-2022-05-02-INT-1-070-0000_EN.html,"  Damian Boeselager (Verts/ALE),  blue-card speech. – My question is in regard to the European parties. I mean, how many of your voters really know the EPP? That’s my first question. And the second question is: if you don’t like the transnational list system, what is your idea of improving the European Union? Because we have already lost one Member State, the United Kingdom. We need to get more democratic. What’s your idea of improving the European Union?
"
Damian BOESELAGER,2022-04-06,EN,Data Governance Act (debate),https://www.europarl.europa.eu/doceo/document/CRE-9-2022-04-06-INT-3-090-0000_EN.html,"  Damian Boeselager,  on behalf of the Verts/ALE Group. – Madam President, I wanted to start by thanking Angelika Niebler for the very constructive cooperation that we had on this file. It was very nice working with you and very fact-based. That was exemplary. 
I think today’s vote shows that we have actually advanced quite far in our digital policy. You will hear that my voice is still a bit deep because I have jetlag from coming back from the US and talking about data policy to the different stakeholders over there. I realised how close we are to the sweet spot of personal data protection and still enabling innovation at the same time. This is built on the fact that we had a European success with saying that there is a philosophical right of your own data being your own, in a sense, of having that right.
Now, we need to transfer that to the industrial data space. We also need to get to a situation where the usage rights for industrial data are equally clear. The Data Governance Act is really helpful because it basically makes it possible to have neutral platforms and data intermediaries if you want data stock exchanges that you can trust and actually share and trade your data. And then, when we get to the data act, I think we have the obligation to ensure that basically we are now applying what we learned from GDPR to the industrial data space in clarifying who is able to trade co-generated data sets.
The whole idea behind this is that we can really unlock the innovation potential that we have in our start—ups and that we have in our industries with a lot of very innovative and new concepts and new business models that, as the Commissioner said, will create a lot of jobs. 
"
Damian BOESELAGER,2022-04-06,EN,Violations of right to seek asylum and non-refoulement in the EU Member States (debate),https://www.europarl.europa.eu/doceo/document/CRE-9-2022-04-06-INT-3-282-0000_EN.html,"  Damian Boeselager (Verts/ALE).   – Madam President, dear Commissioner, dear colleagues, I travelled to Greece recently and I saw – and have heard this before – that a systematic violation of the right to seek asylum in Greece is happening. I will try to outline it to you. Basically, since March 2020, no-one has been returned from Greece to Turkey, and that is Turkey’s fault. But just a year later, the Greek Government still imposed a law, which is the inadmissibility procedure or joint ministerial decree, which basically says that everyone who comes through Turkey, and who comes from Afghanistan, Syria, Somalia, Pakistan or Bangladesh, has to be returned to Turkey. But as I just explained, no one is being returned to Turkey. So this was, from the beginning, absolutely trying to stop the right to seek asylum. 
And so we have a Kafkaesque situation, where people are being told to go to police stations to be returned, to then ask Turkey whether they would take them, and Turkey doesn’t even answer this. Then the people are being told: okay, you have to wait for a year. They don’t have access to food; they don’t have access to accommodation. We really have to stop this. I ask the Commission to do something about this to guarantee the right of asylum in Europe.
"
Damian BOESELAGER,2022-03-08,EN,The deterioration of the situation of refugees as a consequence of the Russian aggression against Ukraine (debate),https://www.europarl.europa.eu/doceo/document/CRE-9-2022-03-08-INT-2-186-0000_EN.html,"  Damian Boeselager (Verts/ALE).   – Mr President, every morning when we wake to the live documentary of this terrifying war on social media, I feel helpless when I see the images of bombed streets, burning nuclear plants and lines of people fleeing. I feel helpless. But while our options within Ukraine are limited, our options for helping those who are fleeing the war are not. That’s why I wanted to thank you very much, Commissioner, for your swift action and for bringing all the countries together to grant legal protection so fast. And that’s why I want to thank everyone who’s opening their doors currently in Poland, Hungary, Slovakia and Romania, but also all across the continent. 
But much more needs to be done and we have to adapt to the situation and every moment. So, I would ask you, Commissioner, to also ensure that everyone who’s fleeing is protected, no matter their skin colour or nationality – also the Russians and Belarussians fleeing their crazy tyrants. 
Even if we decide that some can’t stay, please make sure that they’re all covered by health protection so that they can go to the hospitals to tend to their mental and physical wounds after fleeing. And please ensure that we have a new approach to the European asylum system, so that we can learn from this humane reaction to the fleeing refugees, in our new asylum system.
"
Damian BOESELAGER,2022-03-07,EN,Shrinking space for civil society in Europe (debate),https://www.europarl.europa.eu/doceo/document/CRE-9-2022-03-07-INT-1-108-0000_EN.html,"  Damian Boeselager,  on behalf of the Verts/ALE Group. – Mr President, thank you to Anna, and on behalf of Erik, I would like to thank everyone – the rapporteur, shadows and technical staff, for the great collaboration on this report. 
It’s a very timely report indeed. The recent intensified crackdown on civil society in Belarus and Russia shows one important truth: an organised civil society is a horror for any form of autocratic leadership because it shows if and how they fail their societies. But we don’t need to look that far. Sadly, we see civil society organisations also being targeted and limited in our own Member States. Some leaders don’t want to allow societies to correct their mistakes. 
I’ve witnessed systematic persecution and criminalisation in the field of migration, an area where all our governments are currently failing. And the recent events in Ukraine show another and more humane face for Europe in that matter. So let us build on this humane Europe and show that every human being is worth saving, no matter how far they’ve travelled and no matter what their skin colour. 
Let us build a humane Europe, Commissioner, by supporting civil society organisations, ensuring sufficient funding for CSOs and developing a green strategy for safeguarding civic spaces in the EU.
"
Damian BOESELAGER,2021-12-15,EN,State of play of the RRF (Recovery and Resilience Facility) (debate),https://www.europarl.europa.eu/doceo/document/CRE-9-2021-12-15-INT-3-178-0000_EN.html,"  Damian Boeselager,  on behalf of the Verts/ALE Group. – Madam President, I also want to start on a positive note because I think we have achieved a lot when we look at this year. I think there was a lot of work done, both at Member State level and by the Commission, but also obviously within this Parliament, trying to hold you all accountable in this work. If we think about the adoption of the RRF Regulation, the preparation and also approval of some of the plans, at least the payment requests, the scrutiny that has been done, a lot of work was done. So congratulations on that. 
But, obviously, now we are entering the next year and so the question is what kind of ambition and what kind of control is necessary for the next phase of the RRF? And here I want to ask us to really try to stay on top of this ambition because we still need to stay strong when it comes to Hungary and Poland and some of the other elements in the plans – we need to ensure that they are corrected. We need to ensure that the operational arrangements are of high quality and fair to all Member States and ensure especially that we have agreed on spending and where it is supposed to go. 
I would also say that some of the Member States, like Germany, can be ambitious in re-routing some of the money. I mean, there are still EUR four billion, under the new German government, going to hybrid cars, so I think if we have a change of government, this can also be reflected. And this is true for Bulgaria as well. 
And then we come to control, and here I think we have a couple of elements, which really mean that we need to step-up our game. The first one is we promised to green bond holders that the money will really be spent on green spending. So we need to keep this promise by actually sample-sizing, by testing, by scrutinising in detail the projects that are supposed to be green. And we need to keep the promise to EU citizens that we will use this money to really build solidarity and a strong Union when it comes to economic governance. 
So I wish us all a restful and great break to be able to do that well.
"
Damian BOESELAGER,2021-11-23,EN,2022 budgetary procedure: joint text (debate),https://www.europarl.europa.eu/doceo/document/CRE-9-2021-11-23-INT-2-218-0000_EN.html,"  Damian Boeselager,  rapporteur. – Mr President, for the third year in a row now, I was locked away on a rainy November weekend with my colleagues and with the national diplomats to battle over the annual budget, while surviving on very bad sandwiches and bad coffee. For the third year in a row, I have left these negotiations with a curious realisation. Some EU capitals fundamentally reduce these negotiations to how much they have to pay and seem very often to disregard what they actually get for it, their return on investment.
In light of this, it may be worth going back to why we actually have a European Union budget. We have it because, some time ago, Presidents and Prime Ministers made a confession, collectively, rationally and out of political self-interest. They made the confession that, in the past, conflicting national interests have led us to radicalisation and, ultimately, war. They made the confession that every nation, however grand and historically powerful, is too small to tackle the issues of our time alone. I would say they made the confession that all our individual nations lost part of their sovereignty exactly because, alone, they cannot safeguard or represent their citizens’ rights when it comes to climate change, healthcare, rising energy prices, leadership and research, global trade, national security and so many other fields which we see represented in our budget. This is why we have a common European budget, and this is why we have a common European institution that helps us thrive and regain some of the sovereignty that our individual nation states have lost.
But let’s get back to the content of next year’s budget. From Parliament’s side, the final outcome, as Karlo Ressler has said, is a success. We have barely ever seen such a focused budget underlining our priorities, be it in the fight against climate change, in our solidarity via vaccination campaigns and in supporting our research excellence, just to name a couple of examples. So big congratulations to Karlo and all his colleagues and shadow rapporteurs for the great work. 
On my side of the table, when it comes to strengthening the institutions of the European Union, I believe we have also achieved quite a lot. First of all, this is true for the European Court of Justice. Justice is always on the side of the weak and the persecuted. Strengthening the Court with additional staff and funds therefore means safeguarding the weakest in our societies against those abusing positions of power, and that is always worth it. Second, we were able to reinforce the Court of Auditors to scrutinise the correct spending of the billions flowing by the European Recovery Instrument. A common responsibility requires hard checks and balances, and the Court is crucial in this regard. Third, I’m also very happy that we were able to reinforce the capacities of Parliament, of this House. After years of increased workload, we have finally managed to strengthen our core legislative capacities, which will improve the quality of legislation for all European citizens. 
Let me close by thanking the Council Presidency for their fair negotiations and the Commissioner for very creative solutions, Karlo for the great collaboration, Johan for the calm advice, and my shadows for the continuous support throughout the negotiations, but also to my team – Caroline, Zita and Johannes – for their hard work over the last year. 
"
Damian BOESELAGER,2021-11-10,EN,"The escalating humanitarian crisis on the EU-Belarusian border, in particular in Poland (debate)",https://www.europarl.europa.eu/doceo/document/CRE-9-2021-11-10-INT-1-064-0000_EN.html,"  Damian Boeselager (Verts/ALE).   – Mr President, one day after the anniversary of the fall of the Berlin Wall, I hear today: walls, walls, walls, fences, barriers, border guards, police, hybrid threat and weapons. It feels like no one cares about the people, the individual stories on the ground anymore. Compassion, colleagues, is not something that we should lose once we become politicians. 
Let us make sure, first and foremost, that we care for the lives of those in need, and then we can care, secondly, about everything else. But first, we need to care about the lives of the people in need. Once people are safe, we should stop being naive. The weakness that Lukashenko is trying to exploit is not compassion. The weakness he is trying to exploit is that we do not have a European asylum system. None of this would happen if we had a good and decent procedure for people to go through, across Europe, while we find ways to stop Lukashenko from engaging in human trafficking. 
High Representative, I have two questions. First, will you ensure that there is access for the UNHCR to the European side of the border with Belarus? Second, do you believe that the right to seek asylum in Europe is still intact for the people at the border?
"
Damian BOESELAGER,2021-10-20,EN,Pushbacks at the EU's external border (debate),https://www.europarl.europa.eu/doceo/document/CRE-9-2021-10-20-INT-3-344-0000_EN.html,"  Damian Boeselager (Verts/ALE).   – Madam President, after two years of absence, I will be going back to the Greek islands in a couple of weeks, and I’m a bit afraid to go because I’ve just promised myself two years ago that I would improve the situation. But Fortress Europe is still a reality. We build wires and walls and a few of our guards hunt and beat people up, take away their phones and throw them back over the borders. 
Over the last year, 300 illegal explosions have been recorded in Greece. Two weeks ago, we learned how Croatia is using shadow armies to push people back. And just today, as Sophia has also said, lawyers are suing Frontex – an EU agency – for its role in human rights violations. 
Commissioner Johansson do not waiver in your defence of asylum law. Help Europe to live up to its values of compassion, law and human rights and let us turn Fortress Europe again into a shelter. For that, let’s set up independent mechanisms to monitor our border guards, make EU funds for migration conditional on safeguarding human rights and trigger infringement procedures against all countries that don’t follow European laws.
And please, by all means, never, never, ever legalise pushbacks.
"
Damian BOESELAGER,2021-10-19,EN,The Rule of law crisis in Poland and the primacy of EU law (debate),https://www.europarl.europa.eu/doceo/document/CRE-9-2021-10-19-INT-2-101-0000_EN.html,"  Damian Boeselager (Verts/ALE).   – Mr President, I say to the Prime Minister: thanks for coming, but I really wonder, why did you come? Did you come here to shift the narrative with the help of the claps from the far-right? Is this really what you’re trying to do?
First, your puppet chord attacks the basis of this House, the Treaties. Second, you write a letter saying that the EU is turning into an autocracy. And third, you come and talk here about legal order, while you’ve been trying to curtail the freedom of your judges for years. I really don’t understand why you came here today, and I think soon you will see that your advisers are wrong and that you have gone far too far with what you have been doing.
The Polish people do not want to leave the European Union. We cannot, Commission President, have money flow to a government that does not respect the treaties and therefore we cannot control where it is going. So I ask you to under no circumstance accept the Polish recovery plan and make sure that this tribunal and the judgment are repealed.
"
