MP,Date,Language,Title,Url,Content
Dino GIARRUSSO,2023-11-22,IT,"Humanitarian situation in Gaza, the need for the release of hostages and for an immediate humanitarian truce leading to a ceasefire and the prospects for peace and security in the Middle East (debate)",https://www.europarl.europa.eu/doceo/document/CRE-9-2023-11-22-INT-3-042-0000_IT.html,"  Dino Giarrusso (NI).   – Signor Presidente, onorevoli colleghi, bambini morti per attacchi scriteriati; donne e uomini civili uccisi senza pietà solo perché palestinesi; persino neonati che muoiono nelle incubatrici perché è stata sottratta la corrente elettrica persino agli ospedali: questo succede in Palestina; queste sono le gravi responsabilità di Netanyahu. 
Un mese fa, in quest'Aula ho chiesto all'Europa di condannare questo orrore, queste violazioni del diritto internazionale e non è successo nulla. Abbiamo condannato giustamente l'azione terroristica di Hamas, abbiamo condannato giustamente l'atto di guerra della Russia di Putin. Ma cosa aspettiamo a condannare la politica criminale di Netanyahu? 
È una vergogna accusare di antisemitismo chi critica questo governo di Israele: migliaia di ebrei stanno protestando in tutto il mondo contro i crimini di Netanyahu. Che fa l'Europa? Non vi fanno orrore quei bambini disperati, quei corpi in terra senza più calore? Esistono morti di serie A e di serie B? Esistono crimini e violazioni del diritto che l'Europa tollera? 
No. Dunque, per rispetto a quei bambini palestinesi innocenti uccisi dalle scelte di Netanyahu, l'Europa deve prendere posizione e condannare subito o non sarà più Unione europea ma sarà squallida ipocrisia.
"
Dino GIARRUSSO,2023-10-19,IT,Generational renewal in the EU farms of the future (debate),https://www.europarl.europa.eu/doceo/document/CRE-9-2023-10-19-INT-4-091-0000_IT.html,"  Dino Giarrusso (NI).   – Signor Presidente, onorevoli colleghi, molte bellissime località rurali in Europa – ce ne sono tante in Sicilia e in Sardegna – oggi si spopolano, vengono abbandonate dai giovani, dalle nuove generazioni, con un triplo risultato negativo: intere zone delle nostre regioni che rischiano di diventare città fantasma, l'avanzare pericolosissimo della desertificazione e la dipendenza sempre maggiore dalle importazioni, con un minore controllo sul prodotto e sulla filiera e con la perdita di enormi opportunità lavorative ed economiche per le nostre comunità.
L'agricoltura in Italia e in Europa è una potenziale miniera d'oro infinita, ma serve cura nel sostenerla, serve un ricambio generazionale e serve aiutare i giovani a scoprire le opportunità enormi che oggi l'agricoltura può offrire. Quindi, impegniamoci nel prevedere fondi ad hoc per aiutare i giovani imprenditori agricoli, oltre alle misure già previste nella PAC, e troviamo misure per accompagnare gradualmente gli imprenditori agricoli che si avvicinano alla pensione verso un autentico e fruttuoso ricambio generazionale.
Non uccidiamo le nostre comunità rurali, aiutiamo i giovani a rimanere e a crescere.
"
Dino GIARRUSSO,2023-10-18,IT,"The despicable terrorist attacks by Hamas against Israel, Israel’s right to defend itself in line with humanitarian and international law and the humanitarian situation in Gaza (debate)",https://www.europarl.europa.eu/doceo/document/CRE-9-2023-10-18-INT-3-037-0000_IT.html,"  Dino Giarrusso (NI).   – Signor Presidente, onorevoli colleghi, la violenza terrorista di Hamas, la strage di civili, il rapimento e l'uccisione di ragazzi e bambini senza colpa sono un orrore atroce. Giustissimo dunque ribadire il diritto di Israele a difendersi e vivere in pace e giustissimo condannare il terrore, ma non basta.
Se siamo onesti, non possiamo tacere che la risposta alle atrocità di Hamas, cioè tagliare acqua e luce al popolo palestinese e costringerlo a un nuovo esodo, è indegna, perché nega il diritto a esistere e vivere dignitosamente a bambini, donne e famiglie che non sono terroristi, non sono colpevoli di strage, ma sono soltanto esseri umani palestinesi che hanno e devono avere sempre il diritto di vivere e vivere in pace, esattamente come lo hanno gli israeliani.
La gente di Gaza deve essere tutelata dalle Istituzioni europee, esattamente come Israele. Riprendiamo il lavoro di Yitzhak Rabin, lottiamo per due popoli in due Stati, ma non chiudiamo gli occhi ipocritamente sulle violenze che sta subendo l'incolpevole popolo palestinese.
Gridiamolo a gran voce: ""Israele, libero! Palestina libera!"". Sarebbe fatale vedere solo una parte dei crimini e delle violazioni del diritto internazionale, sarebbe una vergogna per l'Europa e io non voglio vergognarmi di essere europeo!
"
Dino GIARRUSSO,2023-10-05,IT,The new European strategy for a better internet for kids (BIK+) (debate),https://www.europarl.europa.eu/doceo/document/CRE-9-2023-10-05-INT-4-081-0000_IT.html,"  Dino Giarrusso (NI).   – Signora Presidente, onorevoli colleghi, è inutile prenderci in giro, è inutile girarci attorno. Oggi i minori, i bambini, fin dalla più tenera età, utilizzano le nuove tecnologie, utilizzano i telefonini, utilizzano i device, l'iPad e il digitale. Tecnologie che non sono cattive o buone in sé. Peraltro, anche quei bambini che non le hanno utilizzano, quelle degli amici, dei compagnetti ecc. Il problema sono i contenuti che vengono veicolati grazie alle nuove tecnologie e l'educazione all'utilizzo delle nuove tecnologie. Naturalmente c'è preoccupazione per la diffusione della pornografia tra piccolissimi, tra minori, ma c'è anche il bullismo online, che è un problema enorme che non dobbiamo dimenticare.
Io credo che l'unica strada possibile per evitare danni e per evitare di crescere generazioni abituate alla violenza online senza controllo sia quella di un'educazione fin dalla più tenera età all'utilizzo delle nuove tecnologie. Quindi auspico un regolamento, che possa essere adottato da tutti gli Stati membri, per l'educazione, fin dalla scuola primaria, alle nuove tecnologie.
"
Dino GIARRUSSO,2023-10-03,IT,European Media Freedom Act (debate),https://www.europarl.europa.eu/doceo/document/CRE-9-2023-10-03-INT-2-078-0000_IT.html,"  Dino Giarrusso (NI).   – Signora Presidente, onorevoli colleghi, oggi è indispensabile parlare di Julian Assange, perché ogniqualvolta discutiamo di libertà di stampa, di regole riguardo alla stampa, noi abbiamo il dovere di fare opera di memoria rispetto alla storia di Julian Assange.
Julian vive di fatto recluso da anni senza alcuna colpa, anzi, per aver fatto esclusivamente il proprio dovere di giornalista: informare i cittadini, rendendoli così maggiormente consapevoli di ciò che accade nel mondo. 
Io vengo dalla Sicilia, terra dove purtroppo la mafia ha ucciso giornalisti come Pippo Fava, Mario Francese, Mauro De Mauro, Peppino Impastato, Beppe Alfano e altri. La camorra ha ucciso Giancarlo Siani. Tutti loro non avevano colpe, se non quella di raccontare la verità. Anche in memoria dei giornalisti vittime di mafia, come quelli che ho citato e la maltese Daphne Caruana, noi dobbiamo impedire che Julian Assange viva una morte anticipata, una morte in terra, recluso come un pericoloso criminale, quando invece è solo un giornalista. 
Presidente, colleghi, oggi tutti noi dovremmo gridare a gran voce, senza esitazioni: ""Liberate Julian Assange! Free Assange now!"".
"
Dino GIARRUSSO,2023-09-14,IT,Violence and discrimination in the world of sports after the FIFA Women’s World Cup (debate),https://www.europarl.europa.eu/doceo/document/CRE-9-2023-09-14-INT-4-061-0000_IT.html,"  Dino Giarrusso (NI).   – Signora Presidente, onorevoli colleghi, immaginate se alla fine dei mondiali in Qatar, un dirigente argentino fosse andato a baciare in bocca Leo Messi: cosa sarebbe successo? E perché invece un dirigente spagnolo lo ha fatto con una donna?
Il problema delle molestie e poi degli stupri è un problema innanzitutto culturale e va combattuto educando i bambini e i ragazzi al rispetto reciproco e a una consapevolezza completa della sessualità propria e altrui.
Ma va combattuto anche a livello legislativo: in Italia oggi una donna ha solo un anno di tempo per denunciare una molestia o uno stupro; fino a poco tempo fa solo sei mesi. I grandi scandali degli ultimi anni non avrebbero avuto alcuna conseguenza penale in Italia, poiché nascevano da denunce arrivate dopo diversi anni da donne coraggiose che avevano superato il trauma.
Propongo dunque che l'Europa stabilisca l'obbligo per tutti gli Stati membri di provvedere all'educazione sessuale dei propri giovani cittadini e di prevedere un limite di almeno cinque anni per una donna che vuole denunciare una molestia o uno stupro subiti. Senza nuove regole, temo, parleremo ancora per decenni di cultura dello stupro e di molestie rimaste impunite.
"
Dino GIARRUSSO,2023-09-12,IT,EU-Tunisia Agreement - aspects related to external migration policy (debate),https://www.europarl.europa.eu/doceo/document/CRE-9-2023-09-12-INT-2-095-0000_IT.html,"  Dino Giarrusso (NI).   – Signor Presidente, onorevoli colleghi, in questo momento, mentre noi parliamo, la costa sud dell'isola di Lampedusa è letteralmente invasa da barchini che i criminali responsabili del traffico di esseri umani continuano a usare, mettendo a rischio migliaia di vite, arricchendosi ed esasperando la realtà quotidiana di una piccola isola che porta sulle sue spalle, sulle sue esili spalle, un peso che dovrebbe essere condiviso da tutta l'Europa. 
Quest'estate sono andato personalmente a Porto Empedocle, dove la situazione era insostenibile. Dunque, piuttosto che glorificare un accordo al ribasso con la Tunisia che non risolve nulla, l'Europa si prenda la responsabilità di togliere al paese di primo approdo ciò che un solo paese non può reggere. 
Gli abitanti di Lampedusa sono eroi e sto candidando quel popolo di eroi al Premio Sacharov e invito tutti i colleghi e i gruppi a farsi un esame di coscienza e firmare la candidatura: oggi una piccola isola sta facendo il lavoro che dovrebbero fare 27 Stati membri, mentre madri e figli, come è stato giustamente ricordato, muoiono nel deserto senza avere alcuna colpa. 
L'Europa si vergogni di questa tragedia e si assuma le sue – perché sono sue – responsabilità ora.
"
Dino GIARRUSSO,2023-07-12,IT,The need for EU action on search and rescue in the Mediterranean (debate),https://www.europarl.europa.eu/doceo/document/CRE-9-2023-07-12-INT-3-085-0000_IT.html,"  Dino Giarrusso (NI).   – Signora Presidente, onorevoli colleghi, cittadini europei tutti, diciamoci la verità, l'accordo di Dublino rappresenta un fallimento completo. Imporre ai paesi di primo ingresso di affrontare in solitudine un fenomeno epocale che riguarda tutta l'Europa è una vergogna.
In Italia e in Grecia arrivano migliaia di migranti ogni giorno e per l'aiuto e il soccorso in mare servono mezzi, uomini e soldi di tutti i paesi europei, poiché donne, bambini e uomini su quelle navi vengono in Europa, non in Italia.
La destra italiana ha tentato un accordo al ribasso, che non tocca l'assurda regola del paese di primo ingresso, e proprio gli alleati europei della destra italiana hanno rifiutato persino quell'accordo al ribasso.
E così assistiamo a tragedie immani come quella di Cutro, quella di Pylos: migliaia di bambini, donne e uomini morti in mare, nell'indifferenza di tanti che a questo orrore sembrano incredibilmente assuefatti.
Cancelliamo Dublino, come aveva promesso von der Leyen all'insediamento, e condividiamo la responsabilità di aiuto e soccorso in mare, così cancelleremo per sempre la vergogna di un Mediterraneo trasformato in un enorme cimitero marino di esseri umani senza alcuna colpa.
"
Dino GIARRUSSO,2023-06-13,IT,Artificial Intelligence Act (debate),https://www.europarl.europa.eu/doceo/document/CRE-9-2023-06-13-INT-2-173-0000_IT.html,"  Dino Giarrusso (NI).   – Signora Presidente, onorevoli colleghi, l'intelligenza artificiale è un'opportunità, l'ennesima che ci viene donata dal progresso tecnologico, ma al tempo stesso può diventare un rischio per le nostre comunità. Per questo l'intelligenza artificiale sviluppata e utilizzata in Europa deve essere antropocentrica e rispettare i diritti fondamentali e i valori dell'Unione sanciti dai trattati. 
Noi dobbiamo lavorare per sostenere l'innovazione e le imprese, aumentando la certezza del diritto in tutti gli Stati membri, rendendo chiara la regolamentazione del settore e facile per i privati e per le autorità pubbliche il rispetto dei nuovi obblighi. Dobbiamo indirizzare l'innovazione verso un miglioramento delle nostre vite, nel rispetto dei diritti, e per questo vedo con preoccupazione il diffondersi del riconoscimento facciale e di ogni altro strumento che possa essere usato a fini discriminatori. 
Ringrazio il relatore per il lavoro svolto in questa direzione e auspico che non si ceda alle sirene di chi vorrebbe una deregulation pericolosa, ma al contrario si crei insieme un mercato unico digitale integrato e un contesto legislativo che premi l'imprenditorialità e l'innovazione, tutelando la sicurezza e i diritti, nostri e delle prossime generazioni.
"
Dino GIARRUSSO,2023-06-13,IT,Ensuring food security and the long-term resilience of EU agriculture (debate),https://www.europarl.europa.eu/doceo/document/CRE-9-2023-06-13-INT-2-440-0000_IT.html,"  Dino Giarrusso (NI).   – Signor Presidente, onorevoli colleghi, la disponibilità di cibo e di cibo salutare per tutti è un diritto inalienabile. Oggi anche in Europa rischiamo di intraprendere una strada che in pochi anni potrebbe rendere insufficiente la disponibilità di cibo, come del resto già oggi è inadeguata l'accessibilità di cibo sano per milioni di cittadini europei. 
Siamo ad un bivio e dobbiamo intraprendere la strada giusta: non l'intensificazione brutale della produzione che consuma il suolo e inquina, ma la sostenibilità di un'ampia produzione, che oggi, grazie alle innovazioni tecnologiche, può essere compatibile con la tutela dell'ambiente, con la qualità dei prodotti e l'accessibilità del cibo, anche per chi ha redditi medio-bassi. 
Lo studio della Commissione ci mostra che l'UE deve rafforzare sostenibilità e resilienza dell'intero sistema alimentare, e questo passa da una legge quadro, che indichi anche la promozione di diete sane e compatibili con la tutela ambientale, oltre che l'incentivazione di quelle buone pratiche di produzione, distribuzione e consumo che potranno continuare a rendere l'Italia e l'Europa, anche in futuro, la culla di una alimentazione sana e sostenibile per tutti. 
"
Dino GIARRUSSO,2023-05-31,IT,"Geographical Indications for wine, spirit drinks and agricultural products (debate)",https://www.europarl.europa.eu/doceo/document/CRE-9-2023-05-31-INT-1-235-0000_IT.html,"  Dino Giarrusso (NI).   – Signora Presidente, onorevoli colleghi, il sistema delle indicazioni geografiche ha fatto tanto per le eccellenze europee, risultando utile ai produttori, specie a quelli virtuosi e ai consumatori, europei e non solo. Per migliorarlo si potevano forse semplificare alcune procedure di riconoscimento degli enti, non altro. 
La Commissione dovrebbe ricordare che gli operatori del sistema DOP e IGP in pochi anni hanno contribuito a creare un sistema alimentare di qualità riconosciuto in tutto il mondo, che vale oltre 75 miliardi di euro, e dobbiamo tutelarli, aiutarli, ancora e meglio. 
La battaglia all'interno dell'Unione per primeggiare in un settore non deve essere accompagnata da regole che svantaggiano alcuni Stati membri favorendone altri. È per questo che i compromessi che abbiamo raggiunto in AGRI, anche grazie al lavoro fatto con il collega De Castro che ringrazio, ci rassicurano.
Abbiamo il dovere di preservare quelle buone pratiche, come il sistema DOP e IGP, che hanno portato alla ricchezza e allo sviluppo di interi settori e regioni e non permetteremo che, con la scusa di migliorarle, si affossi un sistema che in Europa ha funzionato e funziona. 
"
Dino GIARRUSSO,2023-05-11,IT,"European Citizens' Initiative ""Stop Finning – Stop the trade"" (debate)",https://www.europarl.europa.eu/doceo/document/CRE-9-2023-05-11-INT-4-028-0000_IT.html,"  Dino Giarrusso (NI).   – Signor Presidente, onorevoli colleghi, la prima volta che ho sentito parlare di finning, in italiano ""spinnamento"", era nel lontano 2009 e già allora si parlava di bandire questa pratica orrenda. Siamo nel 2023 e, se è lodevole che dei cittadini si stiano battendo per abolirla, è triste che questo non sia avvenuto prima, già anni fa.
Il finning sta portando a rischio di estinzione molte specie di squali e ciò compromette gravemente l'intero ecosistema marino. È una pratica barbara, violenta e inaccettabile che serve ad alimentare un mercato illegale, che vede la Cina protagonista per l'assurda e antiscientifica credenza che la zuppa di pinne abbia proprietà curative. Ancora nel 2023 discutiamo di questo.
Abbiamo come Europa l'obbligo di vietare questa pratica e combattere nelle sedi internazionali affinché sia vietata ovunque, per fermare questo massacro e non rischiare, come spesso accade, di fissare regole rigide per noi ma consentire che altri non le rispettino, senza pagare alcuna conseguenza.
Stop finning now!
"
Dino GIARRUSSO,2023-05-11,IT,Protecting and restoring marine ecosystems for sustainable and resilient fisheries - Agreement of the IGC on Marine Biodiversity of Areas Beyond National Jurisdiction (High Seas Treaty) (debate),https://www.europarl.europa.eu/doceo/document/CRE-9-2023-05-11-INT-4-057-0000_IT.html,"  Dino Giarrusso (NI).   – Signor Presidente, onorevoli colleghi, il mese scorso alle Nazioni Unite si è finalmente trovato, dopo anni di negoziato, un accordo sulla necessità di avere un approccio olistico complessivo per la conservazione delle risorse delle aree più sensibili, e non solo delle acque internazionali.
Dobbiamo scongiurare in ogni modo lo scioglimento progressivo dei ghiacciai, coniugando la battaglia per l'azzeramento delle emissioni di CO2 con quella per la conservazione degli oceani, giacché le due battaglie sono strettamente collegate, sono di fatto un'unica missione che abbiamo il dovere di portare a termine.
La minaccia del deep sea mining è dunque pericolosa e inaccettabile, visto che questa pratica rischia di creare danni immani e irreparabili ai ghiacciai, agli stock ittici, alla biodiversità di aree che hanno un valore ambientale ed economico inestimabile e che sono importantissime anche per la ricerca scientifica.
L'Unione europea sia leader di questa battaglia di civiltà e non ceda di un passo rispetto alla tutela degli oceani, dicendo anche un no secco al deep sea mining.
"
Dino GIARRUSSO,2023-05-10,IT,The role of farmers as enablers of the green transition and a resilient agricultural sector (continuation of debate),https://www.europarl.europa.eu/doceo/document/CRE-9-2023-05-10-INT-3-025-0000_IT.html,"  Dino Giarrusso (NI).   – Signor Presidente, onorevoli colleghi, la figura dell'agricoltore è da sempre centrale nell'evoluzione della società e oggi più che mai è fondamentale per accompagnare l'umanità verso un mondo più sostenibile e verso una maggiore sicurezza alimentare.
La transizione ecologica deve avere l'agricoltore quale figura chiave per la nostra corretta convivenza in un pianeta che si appresta ad avere dieci miliardi di abitanti. Dunque, o sarà sostenibile o non sarà, cioè non avrà un futuro.
Abbiamo trovato una visione condivisa sul phasing out dai pesticidi, ma dobbiamo ascoltare con maggiore attenzione le richieste del settore e incoraggiare gli esempi virtuosi. Ci sono smart farm efficienti e sostenibili in Sardegna, in Sicilia, in Austria, in molte regioni europee.
Valorizziamo questi esempi, investiamo più soldi europei in progetti virtuosi che mettano l'agricoltore al centro della nostra azione di rinnovamento verso una sostenibilità completa. Una transizione autentica che possa renderci più ricchi e assicurare un futuro a noi, ai nostri figli e al pianeta intero.
"
Dino GIARRUSSO,2023-04-18,IT,The need for a coherent strategy for EU-China Relations (debate),https://www.europarl.europa.eu/doceo/document/CRE-9-2023-04-18-INT-2-063-0000_IT.html,"  Dino Giarrusso (NI).   – Signor Presidente, colleghi, gli ultimi eventi e gli incontri fra leader europei e vertici della Cina hanno evidenziato in modo lampante come serva una politica estera comune europea.
L'Europa deve essere presente e assicurare equilibrio in un momento nel quale le tensioni evidenti, come la guerra in Ucraina, e quelle sotterranee, non meno pericolose, ci obbligano a essere uniti e svolgere quel ruolo di mediatore autorevole fra le altre grandi potenze, Cina e Stati Uniti in particolare, e fra i continenti, pensiamo all'Africa.
I rapporti economici e diplomatici con la Cina vanno alimentati, senza mai trascurare però il rispetto dei diritti umani e senza penalizzare le nostre realtà produttive, le nostre eccellenze e il nostro ingegno.
Evitare tensioni eccessive fra Stati Uniti e Cina è dunque un compito preciso dell'Europa, che nessun altro potrebbe svolgere, ma che necessita di unità, di compattezza politica, di autorevolezza e consapevolezza di quanto sia importante il ruolo dell'Europa nei prossimi decenni. Anche osservando ciò che accade in Africa, che ci riguarda molto da vicino, e sempre tenendo presente l'emergenza climatica e ambientale che la Cina non può ignorare.
Non perdiamo più troppo tempo, per favore, uniamoci e agiamo insieme.
"
Dino GIARRUSSO,2023-04-17,IT,One-minute speeches on matters of political importance,https://www.europarl.europa.eu/doceo/document/CRE-9-2023-04-17-INT-1-246-0000_IT.html,"  Dino Giarrusso (NI).   – Signor Presidente, colleghi, Covid e guerra hanno aggravato problemi che rischiano di travolgere l'umanità e lo stesso pianeta. Parlo della crescita drammatica delle disuguaglianze e dunque della povertà e dell'emergenza climatica e ambientale.
L'articolo 25 della direttiva dell'Unione europea, la Corporate Sustainability Due Diligence directive, indica l'obbligo per le imprese con più di 250 dipendenti di valutare la sostenibilità in termini ambientali e sociali a breve, medio e lungo termine. È l'introduzione ufficiale del concetto di ""società benefit"", già riconosciuto in Italia dal 2015 e richiesto a livello europeo da una petizione che ha raccolto oltre 475 000 firme.
Le ""società benefit"" devono essere il futuro e per ogni impresa deve diventare conveniente, dal punto di vista economico e dell'immagine, essere sostenibile al cento per cento. 
Questo Parlamento, e in particolare la commissione JURI, si impegni a confermare l'articolo 25 senza snaturarlo. Il futuro, ricordiamolo sempre, lo costruiamo noi.
"
Dino GIARRUSSO,2023-03-16,IT,"European Citizens’ Initiative ""Save bees and farmers! Towards a bee-friendly agriculture for a healthy environment"" (debate)",https://www.europarl.europa.eu/doceo/document/CRE-9-2023-03-16-INT-4-022-0000_IT.html,"  Dino Giarrusso (NI).   – Signora Presidente, onorevoli colleghi, è importante che dei cittadini europei stiano in qualche modo obbligando il Parlamento a discutere di come salvaguardare le api, creature fondamentali per il ruolo di impollinazione e dunque per la vita umana e per l'equilibrio biologico. 
Il valore di ciò che fanno le api nel mondo può essere stimato in circa 153 miliardi di euro l'anno, circa 15 miliardi solo in Europa. Chiediamo quindi, senza perdere altro tempo, almeno quattro interventi immediati: fondi e un programma per il ripristino ragionato in Europa di un habitat di fiori selvatici; riorientare i pagamenti della PAC per sostenere i servizi di impollinazione e il ripopolamento delle api, dove la loro presenza si è drasticamente rarefatta; riformare la regolamentazione dei pesticidi per prevenire futuri danni alle api; migliorare la biosicurezza del suolo e delle piante in vaso attualmente in commercio. 
Ricordiamoci tutti che, con la sofferenza di queste creature, l'intero patrimonio biologico e tutta l'economia ad esso legata è a rischio. Dunque, non agire sarebbe da incoscienti. 
"
Dino GIARRUSSO,2023-03-15,IT,Deaths at sea: a common EU response to save lives and action to ensure safe and legal pathways (debate),https://www.europarl.europa.eu/doceo/document/CRE-9-2023-03-15-INT-3-264-0000_IT.html,"  Dino Giarrusso (NI).   – Signor Presidente, onorevoli colleghi, l'Italia, i meravigliosi mari italiani diventano cimiteri per migliaia di esseri umani, di donne, di bambini. A Cutro il lutto ci ha travolto. E il governo italiano non ha saputo salvare la vita di bambini, donne e uomini e ha osato dire, con il ministro Piantedosi, che la colpa è di chi parte con i propri figli. È uno schiaffo a secoli di civiltà. Le vite umane vanno salvate sempre e chi scappa da persecuzioni e guerra va accolto. Questo orrore riempie di vergogna non solo noi italiani, ma tutti i cittadini europei.
Sono stato eletto quattro anni fa e dal primo giorno ho chiesto una revisione dei trattati di Dublino che scaricano su un solo Paese la responsabilità di affrontare un fenomeno migratorio epocale per dimensioni e impatto, che riguarda tutti i Paesi europei. 26.000 morti dalla strage di Lampedusa a oggi. Capite? 
A fronte di un governo italiano inane, impreparato, goffo, almeno l'Europa prenda atto di come questa realtà drammatica possa essere affrontata solo prendendosi ciascuno la propria responsabilità: investendo uomini, mezzi e denaro per salvare vite oggi e creare condizioni per stroncare domani il business di esseri umani. 
L'Europa operi una scelta di dignità e umanità e rispetti le proprie radici. Se non lo farà, i nostri mari saranno ancora cimiteri d'acqua. 
"
