MP,Date,Language,Title,Url,Content
Dino GIARRUSSO,2023-02-16,IT,Availability of fertilisers in the EU (debate),https://www.europarl.europa.eu/doceo/document/CRE-9-2023-02-16-INT-4-047-0000_IT.html,"  Dino Giarrusso (NI).   – Signor Presidente, onorevoli colleghi, crisi e speculazioni, queste ultime spesso legate alla folle guerra fra Russia e Ucraina, ci obbligano a dare risposte immediate ai nostri agricoltori riguardo il prezzo dei fertilizzanti, il problema dei fertilizzanti, perché abbiamo da una parte agricoltori costretti a un aumento che arriva al 130 % del costo dei fertilizzanti, una mazzata terrificante, e dall'altra consumatori ai quali dobbiamo garantire sicurezza alimentare e prezzi non proibitivi.
Bene il sostegno al settore, bene calmierare i prezzi, ma non basta. Questa crisi dovrebbe farci definitivamente promuovere due pratiche importantissime. In primo luogo, l'uso di nuove tecnologie di irrorazione digitali che possano ridurre la quantità di fertilizzanti fino al 90 % in meno, mantenendone l'efficacia, con conseguente risparmio economico e riduzione dell'inquinamento. In secondo luogo, la promozione e lo sviluppo di fertilizzanti organici ottenuti da scarti di prodotti agricoli, pratica che dovremmo sostenere con forza, giacché in questo modo i nostri produttori sarebbero parte della catena di produzione nei processi microbiologici per produrre fertilizzanti naturali e avrebbero una nuova chance per offrire prodotti sani a prezzi accessibili. Quella è la strada che dobbiamo percorrere insieme.
"
Dino GIARRUSSO,2023-02-13,IT,One-minute speeches on matters of political importance,https://www.europarl.europa.eu/doceo/document/CRE-9-2023-02-13-INT-1-247-0000_IT.html,"  Dino Giarrusso (NI).   – Signora Presidente, onorevoli colleghi, l'alcol è una droga, ed è una droga legale ma che può nuocere gravemente alla salute e causare dipendenza psicologica e fisica, aumentare il rischio di tumori, malattie cardiache, disagio sociale.
Il modo migliore per combattere l'abuso di alcol e tutte le sue possibili nefaste conseguenze è quello di fare informazione corretta su questa sostanza e su tutti gli alimenti che la contengono. Pensare di combattere i possibili danni dell'alcol equiparando nelle etichette il vino e le sigarette è la cosa più sbagliata e antiscientifica che si possa fare ed è esattamente il contrario di ciò di cui abbiamo bisogno. Il vino contiene alcol e dunque il consumo di vino va certamente controllato, ma su questo prodotto, che in Europa e in Italia in particolare ha delle eccellenze inarrivabili, va fatta un'informazione corretta, creando quella cultura sana del vino che accompagna da secoli chi sa gustarlo e consumarlo con la giusta moderazione, senza cadere nella dipendenza.
Non faccia l'Europa gli stessi errori già visti con il Nutri-Score, e abbia il coraggio, piuttosto, di lavorare seriamente alla prevenzione degli abusi da alcol e alla corretta informazione alimentare, a partire da quella riguardante il vino.
"
Dino GIARRUSSO,2023-01-18,IT,Terrorist threats posed by far-right extremist networks defying the democratic constitutional order (debate),https://www.europarl.europa.eu/doceo/document/CRE-9-2023-01-18-INT-3-259-0000_IT.html,"  Dino Giarrusso (NI).   – Signora Presidente, onorevoli colleghi, l'Europa nasce per unire popoli che orgogliosamente hanno origini etniche e culturali differenti, ciò che rende forte e necessaria l'unione fra popoli diversi con obiettivi affini. 
La bellezza di queste diverse radici è dimostrata dai fiori e dai frutti che hanno dato, come le nostre splendide capitali, stupefacenti per la loro storia ed oggi metropoli multiculturali. Per questo, ogni episodio di razzismo o intolleranza etnica, come quelli avvenuti di recente a Parigi, a Bruxelles e in Italia, è da condannare con la massima severità. Dobbiamo fermare la nascita di formazioni che si ispirano all'estrema destra e simpatizzano per Hitler e tutte le organizzazioni che rigettano la democrazia e la libera espressione del voto, come è accaduto in USA e in Brasile. 
Razzismo e antisemitismo vanno combattuti dai primi anni di vita dei nostri bambini, da famiglie, scuole, gruppi sportivi, ricreativi e culturali. Ma se tornano a inquinare con organizzazioni strutturate le nostre vite vanno stroncati con durezza e senza la minima tolleranza, partendo proprio da qui, dalle alte istituzioni europee. 
Subculture mortifere che hanno rischiato di travolgere l'intera umanità nel secolo scorso, non possono e non devono trovare spazio oggi nella nostra Europa. 
"
Dino GIARRUSSO,2023-01-18,IT,Small-scale fisheries situation in the EU and future perspectives (debate),https://www.europarl.europa.eu/doceo/document/CRE-9-2023-01-18-INT-3-485-0000_IT.html,"  Dino Giarrusso (NI).   – Signora Presidente, onorevoli colleghi, la pesca artigianale svolge un ruolo fondamentale nell'UE, rappresentando circa il 76 % dei pescherecci attivi e il 50 % degli equipaggi. Ha un ruolo chiave per la sicurezza e la sovranità alimentare e un'importanza strategica per il progresso socioeconomico delle comunità costiere e la conservazione delle tradizioni culturali locali. 
Per garantire la sopravvivenza della pesca artigianale servono misure immediate che tutelino i profitti. Teoricamente si può già attingere dal FEAMPA su tanti aspetti, ma noi chiediamo con forza il rafforzamento della catena di valore; interventi su prezzi di garanzia per assicurare un reddito equo; favorire le filiere corte creando mercati di origine; creazione di programmi di sostegno per ridurre i costi di produzione anche alla luce dell'aumento del carburante; fondo di compensazione salariale che permetta di conteggiare, ai fini della pensione, anche il periodo di sospensione delle attività di pesca, ma soprattutto snellimento e facilitazione delle procedure di richiesta. 
La pesca artigianale in comunità come Mazara del Vallo, Sciacca, Santa Flavia, Acitrezza è un patrimonio culturale ed economico da tutelare; senza l'aiuto reale e facilmente ottenibile dall'Europa, invece, rischia di estinguersi con danni tremendi. 
"
Dino GIARRUSSO,2023-01-16,IT,One-minute speeches on matters of political importance,https://www.europarl.europa.eu/doceo/document/CRE-9-2023-01-16-INT-1-195-0000_IT.html,"  Dino Giarrusso (NI).   – Signor Presidente, onorevoli colleghi, oggi in Italia è stato arrestato Matteo Messina Denaro, boss della mafia, considerato uno dei latitanti più pericolosi al mondo. 
È un'ottima notizia, una vittoria dei cittadini onesti, della magistratura e delle forze dell'ordine contro il maledetto cancro chiamato mafia e contro tutte quelle forze politiche e imprenditoriali che con la mafia hanno avuto a che fare, tanto da vedere alcuni loro importanti esponenti condannati per mafia. 
Eppure, in un giorno così importante, dobbiamo chiederci come sia possibile per un boss restare latitante per trent'anni dopo aver oppresso milioni di siciliani. Trent'anni impunito. E come sia possibile che fosse libero in una clinica del centro di Palermo come un qualunque cittadino. Come è possibile, chi ha coperto questo feroce criminale fino a stamattina? E perché? E perché, anche dopo questo arresto per cui sono state fondamentali le intercettazioni, come del resto per scoprire il Quatargate, in Italia c'è chi vorrebbe limitarle, perché?
Cari colleghi, è ora di accelerare con la Procura antimafia europea e di lavorare insieme per sconfiggere la cultura mafiosa, la cultura della sopraffazione, della corruzione, dell'omertà e dei legami politici opachi. Gli italiani onesti stanno facendo la loro parte, la faccia anche l'Europa, la faccia questo palazzo, la si faccia anche tutti noi. 
"
Dino GIARRUSSO,2022-12-13,IT,Suspicions of corruption from Qatar and the broader need for transparency and accountability in the European institutions (debate) (debate),https://www.europarl.europa.eu/doceo/document/CRE-9-2022-12-13-INT-2-317-0000_IT.html,"  Dino Giarrusso (NI).   – Signor Presidente, onorevoli colleghi, quale vergogna grave e profondissima oggi ricopre questo palazzo! Quanti miliardi di euro costa questo palazzo? Quanto costa ad ogni singolo cittadino? Quanti miliardi di euro costiamo noi? E quanti miliardi di sogni, desideri, speranze di una vita migliore, i cittadini europei affidano a questo Parlamento?
Quei miliardi di sogni sono stati traditi, il patto di fiducia con i cittadini è stato infangato. Abbiamo visto sacchi di soldi a casa di colleghi, ex colleghi, sindacalisti, rappresentanti di ONG. Sembravano i sequestri che vengono fatti agli spacciatori e ai mafiosi. Montagne di contanti. Vergogna!
È una giornata terribile e io chiedo a tutti voi, dalla Presidente Metsola in giù, di reagire con forza ma non solo con le parole, con i fatti!
Serve una legge spazzacorrotti anche in Europa, servono regole durissime, serve punire i colpevoli oggi, ma anche creare condizioni affinché nessuno possa più rubare in questo modo il futuro dei cittadini europei, la loro fiducia e i loro soldi.
Buttiamo fuori da questo palazzo i corrotti, i corruttori e la possibilità stessa di corrompere in futuro, altrimenti questo Parlamento non avrà più ragione di esistere.
"
Dino GIARRUSSO,2022-12-12,IT,A long-term vision for the EU's rural areas (debate),https://www.europarl.europa.eu/doceo/document/CRE-9-2022-12-12-INT-1-138-0000_IT.html,"  Dino Giarrusso (NI).   – Signora Presidente, onorevoli colleghi, le aree rurali costituiscono un aspetto essenziale dello stile di vita europeo e sono fondamentali per il funzionamento economico, sociale e ambientale della nostra società. Ospitano ben 137 milioni di persone.
Nonostante i loro punti di forza le zone rurali, in particolare quelle remote e meno sviluppate e ve ne sono tante in Sicilia e in Sardegna, si trovano ad affrontare sfide significative e difficili da vincere se non verranno adeguatamente supportate.
Per questo il Green Deal europeo deve aprire nuove opportunità, in particolare per quel che riguarda la transizione verso un'economia a basse emissioni di carbonio.
Valorizziamo queste aree così importanti nell'assicurare la nostra produzione e la nostra autonomia alimentare, salvaguardando le nostre risorse naturali, i nostri paesaggi e la nostra biodiversità, nonché il nostro patrimonio culturale.
Bene dunque che vi sia un piano d'azione rurale, ma attenzione a non lasciarlo isolato come un totem. Al contrario, lo sviluppo delle aree rurali va armonizzato a quello delle aree urbane, per le quali è indispensabile.
"
Dino GIARRUSSO,2022-12-12,IT,One-minute speeches on matters of political importance,https://www.europarl.europa.eu/doceo/document/CRE-9-2022-12-12-INT-1-236-0000_IT.html,"  Dino Giarrusso (NI).   – Signora Presidente, onorevoli colleghi, quest'Aula, questa istituzione costa miliardi di euro ogni anno ai cittadini europei e miliardi di speranze, di desideri, di diverse visioni del futuro dipendono anche dal nostro lavoro e da come onoriamo la fiducia che ci è stata accordata.
Le notizie di questi giorni, i sacchi di soldi nascosti in casa come nelle peggiori commediaccie e la totale mancanza di rispetto verso i cittadini europei che lobbisti di paesi terzi, insieme a deputati infedeli, ex deputati, collaboratori e sindacalisti hanno spudoratamente dimostrato, sono una delle pagine più tristi e schifose di questa istituzione.
La disonestà di alcuni non può distruggere il buon lavoro di altri, è vero, ma qui ci sono 450 milioni di europei da difendere, tutelare, rispettare.
Dimostriamo di essere superiori a questo schifo con i fatti e creiamo sistemi anticorruzione più efficienti, altrimenti questo palazzo, questa istituzione e, dunque, tutto il nostro lavoro non avrà più senso.
"
Dino GIARRUSSO,2022-11-23,IT,The need for a European solution on asylum and migration including search and rescue (debate),https://www.europarl.europa.eu/doceo/document/CRE-9-2022-11-23-INT-3-042-0000_IT.html,"  Dino Giarrusso (NI).   – Signor Presidente, onorevoli colleghi, la parola che dovrebbe risuonare oggi in questo palazzo parlando di immigrazione è una sola: vergogna. 
Vergogna, shame, honte, vergüenza. 
Perché è vergognoso che ancora oggi sia il paese di primo approdo, l'Italia, a dover affrontare da solo un fenomeno epocale che riguarda tutta l'Europa. Il Canale di Sicilia è il confine fra Africa ed Europa, non un confine italiano. Eppure l'Italia da sola impegna navi, uomini, soldi, mezzi.
I sindacati di polizia, SEAP in testa, denunciano da anni come molti dei nostri agenti migliori siano costretti a lasciare sguarnite le nostre città, perché l'Italia da sola deve gestire decine di migliaia di arrivi. Parlare di ricollocamenti è un modo ipocrita per sviare l'attenzione, è prima che servono soldi, mezzi e uomini di tutti i paesi europei.
Presidente von der Leyen, Le abbiamo dato fiducia perché ha promesso di cancellare gli accordi di Dublino. Dopo tre anni e mezzo non è stato fatto nulla. Bisogna combattere i trafficanti di uomini, salvare le vite umane, ma va fatto come Europa, non scaricando tutto sull'Italia.
Parlare di Europa unita sarà una vergognosa ipocrisia finché non sarà unita nell'affrontare l'immigrazione di massa. E fino ad allora la parola da dire sarà solo una: vergogna. 
"
Dino GIARRUSSO,2022-10-20,IT,Commission implementing Regulation (EU) 2022/1614 of 15 September 2022 determining the existing deep-sea fishing areas and establishing a list of areas where vulnerable marine ecosystems are known to occur or are likely to occur (debate),https://www.europarl.europa.eu/doceo/document/CRE-9-2022-10-20-INT-4-056-0000_IT.html,"  Dino Giarrusso (NI).   – Signora Presidente, onorevoli colleghi, già dal 2016 questo Parlamento discute dell'importanza cruciale, per l'equilibrio ambientale ed economico dei nostri mari, delle aree marine vulnerabili e di come preservarle al meglio, ma dopo tanti anni, nonostante i passi già fatti, siamo ancora qui a discuterne anziché agire. Ed è sbagliato, anzi inconcepibile, per almeno tre ragioni.
Uno: una ragione legislativa, giacché questo è un atto di implementazione che doveva entrare in vigore già dal 2018. Una ragione politica, perché già il 9 ottobre abbiamo espresso, votando l'Ocean government resolution, la nostra posizione. E poi c'è una ragione ambientale, perché per definizione queste sono le aree marine più vulnerabili, con ecosistemi che impiegano anche cento anni per rigenerarsi.
Basta discutere quindi, difendiamo i nostri mari, preserviamo il futuro dei nostri pescatori, perché difendendo i mari si aiuta la pesca sana e sostenibile ed è importante difendere i nostri pescatori, i loro figli e la cultura legata alla pesca e alla cura del mare.
"
Dino GIARRUSSO,2022-10-17,IT,One-minute speeches on matters of political importance,https://www.europarl.europa.eu/doceo/document/CRE-9-2022-10-17-INT-1-244-0000_IT.html,"  Dino Giarrusso (NI).   – Signor Presidente, onorevoli colleghi, l'iniziativa ""Good Food Good Farming"" ci dice che quasi un cittadino europeo su tre ha i capelli contaminati da pesticidi: dato allarmante, che rivela l'enorme contaminazione di terreni e acque.
Le strategie Farm to Fork e sulla biodiversità per il 2030 indicano una riduzione del 50 % entro il 2030, ma molti Stati sono indietro nell'accogliere la proposta di regolamento che fissa vincoli per gli Stati membri. L'Italia ha un piano nazionale scaduto dal febbraio 2019 e il governo Draghi sembra non aver colto l'importanza della transizione ecologica, che passa anche da una rivoluzione culturale riguardo coltivazioni e allevamenti. Abbiamo il dovere di spiegare ai cittadini quanto e come sia importante ripulire la nostra agricoltura e dunque le nostre acque, il nostro sangue, i nostri capelli dai pesticidi e da ogni tipo di veleno.
È una transizione che porterà benefici per tutti e che può essere anche un business e rilanciare l'agricoltura anziché affossarla, come dice chi non vuole cambiare nulla. Però servono coraggio, visione e risorse. L'Europa li possiede? Vuole spenderli?
"
Dino GIARRUSSO,2022-10-06,IT,COVID-19 – Sustaining EU preparedness and response: looking ahead (debate),https://www.europarl.europa.eu/doceo/document/CRE-9-2022-10-06-INT-4-120-0000_IT.html,"  Dino Giarrusso (NI).   – Signor Presidente, onorevoli colleghi, trovo positivo un approccio alla gestione della pandemia che va gradualmente dallo stato di emergenza a una modalità più sostenibile, che può proteggere la salute pubblica ma che nel contempo possa mantenere aperte e resilienti la società e l'economia. 
Non è ancora chiaro, invece, come si intende promuovere la ricerca pubblica europea e quella privata, né come si terrà conto degli studi finanziati dall'UE e di quelli indipendenti. Per questo trovo necessario che la Commissione indichi la strada affinché tutti gli Stati membri dispongano delle capacità finanziarie e organizzative e delle forniture necessarie per gestire sia gli aumenti dei casi di COVID-19 sia quelli di potenziali altre malattie che metterebbero a dura prova la tenuta dei sistemi sanitari nazionali. 
Dobbiamo garantire e assicurare la salute ma nel contempo la libertà dei cittadini, adottando un protocollo unico, standard, anche riguardo ad eventuali limitazioni che ci auguriamo non avvengano mai più. Io avevo chiesto questo nel febbraio 2020 con un'interrogazione urgente. Non è arrivata e mi auguro arrivi e che arrivi subito. 
"
Dino GIARRUSSO,2022-09-15,IT,Ecological Disaster in the Oder River (debate),https://www.europarl.europa.eu/doceo/document/CRE-9-2022-09-15-INT-4-164-0000_IT.html,"  Dino Giarrusso (NI).   – Signora Presidente, onorevoli colleghi, il disastro ecologico che ha colpito quest'estate il fiume Oder deve farci capire che non abbiamo più tempo per aspettare un graduale abbandono delle cattive pratiche in termini di pesticidi o gestione delle acque reflue. La gestione di un fiume così importante, che parte dalla Repubblica Ceca per poi creare un confine naturale fra Germania e Polonia, deve rappresentare per tutta l'Europa un esempio e un monito.
Ma non è solo il disastro del fiume Oder a dover preoccuparci: tutte le emergenze ambientali, l'accelerazione nei cambiamenti climatici, l'uso ormai inaccettabile di veleni e la gestione incosciente delle acque sono un campanello d'allarme che nessuno di noi può più fingere di non sentire.
La siccità di quest'estate in Europa ha aumentato la salinità e diminuito l'ossigenazione dei corsi d'acqua, causando enormi disagi alla fauna e alla flora acquatica, con milioni di pesci morti proprio per queste cause.
Questo passo indietro di dodici anni deve spingere l'Europa a prendere decisioni forti non solo sui pesticidi e sulla gestione dello smaltimento dei rifiuti industriali, onde evitare nuove catastrofi che si ripercuoteranno per anni su biodiversità e produzione agricola, ma su tutta la gestione di quel patrimonio immenso senza il quale non sarebbe possibile la vita, cioè l'acqua.
Far capire all'umanità che l'acqua, fonte di vita, è oggi preziosa quanto e più del petrolio deve essere uno dei principali obiettivi dell'Europa nei prossimi dieci anni.
"
Dino GIARRUSSO,2022-09-13,IT,EU response to the increase in energy prices in Europe (debate),https://www.europarl.europa.eu/doceo/document/CRE-9-2022-09-13-INT-2-314-0000_IT.html,"  Dino Giarrusso (NI).   – Signora Presidente, onorevoli colleghi, in Italia i cittadini non riescono a fare la spesa e le imprese chiudono e licenziano i lavoratori, aggravando la crisi. E questo perché? Perché arrivano bollette astronomiche, indegne, folli in rapporto al tenore di vita degli italiani e degli europei tutti.
Cosa fa l'Europa per aiutarli? Balbetta, prende tempo, perde tempo. Ma la crisi non aspetta i tempi lunghi dell'Europa: servono investimenti epocali per spingere fonti di energia pulita, per emanciparci dal ricatto violento del costo del gas russo e non solo. E nel frattempo, per l'immediato, servono scelte coraggiose, serve la volontà e la capacità di reagire duramente e rendere impotente chi oggi ha il potere di ricattarci.
Con le chiacchiere dell'Europa cittadini e imprese non pagano le bollette, ma muoiono. Basta parlare, colleghi, basta parlare Presidente von der Leyen: è ora che l'Europa agisca e dimostri di esistere e tutelare i cittadini, le imprese e l'ambiente, ribellandosi con azioni concrete a questo schifo e dando vita a una nuova era che, se non inizia oggi, purtroppo potrebbe non iniziare mai più.
"
Dino GIARRUSSO,2022-07-04,IT,One-minute speeches on matters of political importance,https://www.europarl.europa.eu/doceo/document/CRE-9-2022-07-04-INT-1-255-0000_IT.html,"  Dino Giarrusso (NI).   – Signora Presidente, onorevoli colleghi, la Presidente von der Leyen ha elogiato con forza il Superbonus 110, una misura italiana definita dall'Europa rivoluzionaria, transizione ecologica che crea sviluppo e lavoro tutelando l'ambiente. 
Purtroppo, dal novembre 2021 questa misura subisce un attacco frontale dal governo Draghi. Cambiando le regole in corsa, si è bloccata la circolazione dei crediti, penalizzando le aziende e privandole della liquidità per lavorare. Si rischia una catastrofe economica e sociale senza precedenti.
Intesa Sanpaolo denuncia 16 miliardi di crediti impegnati e quattro erogati. I crediti bloccati ammonterebbero a decine di miliardi, cioè decine di migliaia di aziende distrutte, centinaia di migliaia di posti di lavoro spazzati via.
Chiedo all'Europa di utilizzare ogni mezzo di dissuasione consentito dai trattati verso il governo italiano, al cui senso di responsabilità mi appello: riattivate subito i canali di aziende partecipate dallo Stato, Poste italiane e Cassa Depositi e Prestiti, rispettate il patto con le imprese, che stanno dando una spinta al PIL senza precedenti.
L'Italia ha sottoscritto al G20 del dicembre 2020 accordi sulla transizione ecologica e questa misura va in quella direzione. Abbiamo avuto i primi suicidi di imprenditori distrutti da queste scelte scellerate. Prima che si suicidi l'Italia intera, sbloccate la circolazione dei crediti, evitando così la rovina per centinaia di migliaia di italiani.
"
Dino GIARRUSSO,2022-06-22,IT,One-minute speeches on matters of political importance,https://www.europarl.europa.eu/doceo/document/CRE-9-2022-06-22-INT-1-313-0000_IT.html,"  Dino Giarrusso (NI).   – Signora Presidente, onorevoli colleghi, decine di migliaia di ettari della Sardegna subiscono una progressiva invasione di locuste che divorano 200-250 tonnellate di vegetali al giorno. Si tratta di una delle infestazioni più gravi degli ultimi decenni e le cause sono da ricercarsi principalmente nella desertificazione legata all'abbandono dei terreni e ai cambiamenti climatici. 
Ho affermato anche in altre occasioni che dobbiamo ripensare il sistema degli incentivi e degli indennizzi all'agricoltura e premiare coloro che lavorano la terra, piuttosto che elargire fondi in base alla mera proprietà, perché proprio sul terreno incolto prolifera l'invasione dei celiferi. 
In Sardegna si è già costituito un comitato spontaneo di agricoltori che vedono ormai la loro annata compromessa. Mi hanno contattato personalmente e io mi sono subito attivato per coinvolgere la Commissione e il Comitato PAFF per chiedere l'applicazione immediata delle misure previste dai regolamenti vigenti. 
In attesa di interventi risolutivi di difesa dal parassita, chiediamo di garantire alla Sardegna la possibilità di modificare in via straordinaria il suo programma di sviluppo rurale, per inserire efficaci misure di emergenza già previste dalla PAC e dalla normativa europea per compensare le perdite dei produttori, oltre a finanziare progetti di ricerca sulle strategie di contrasto e di coesistenza con il parassita. Dobbiamo muoverci subito. Gli agricoltori sardi non possono aspettare o i danni saranno irreparabili. 
"
Dino GIARRUSSO,2022-06-06,IT,One-minute speeches on matters of political importance,https://www.europarl.europa.eu/doceo/document/CRE-9-2022-06-06-INT-1-263-0000_IT.html,"  Dino Giarrusso (NI).   – Signora Presidente, onorevoli colleghi, sessant'anni di PAC, il cui obiettivo dovrebbe essere proprio sostenere l'agricoltura e gli agricoltori, assicurando cibo salubre, di qualità, sostenibile per l'ambiente, capace di creare ricchezza e lavoro, oltre a combattere i cambiamenti climatici. 
Con la guerra in Ucraina si rischia di terremotare l'intero sistema alimentare europeo e mondiale, e a questo rischio dobbiamo rispondere riducendo drasticamente la nostra dipendenza da approvvigionamenti esteri e aiutando l'autosufficienza, specie riguardo il grano, nei paesi europei, Italia in testa, il che significa anche gestire con cura fertilizzanti e pesticidi.
Qualcuno invece tenta di approfittare della guerra per tornare indietro a pratiche disastrose dal punto di vista ambientale – parlo di pesticidi e non solo – che porterebbero danni tanto agli agricoltori quanto ai consumatori, cioè a tutti i cittadini europei. Allora serve coraggio. I soldi della PAC sono soldi nostri, miliardi di euro nostri, che vanno usati per andare avanti, non indietro, per sostenere i nostri agricoltori, stimolare la produzione di eccellenza, incoraggiare il biologico e tutelare i cittadini. Mai passi indietro, guardiamo avanti e usiamo bene i nostri soldi.
"
