MP,Date,Language,Title,Url,Content
Dino GIARRUSSO,2022-05-02,IT,EU action plan for organic agriculture (debate),https://www.europarl.europa.eu/doceo/document/CRE-9-2022-05-02-INT-1-138-0000_IT.html,"  Dino Giarrusso (NI).   – Signora Presidente, onorevoli colleghi, oggi ricordiamo Sir Plumb, sapendo che il biologico è l'unica strada per la tutela ambientale, sicurezza alimentare e maggiore indipendenza da produttori extra UE, nonché prevenzione dei danni provocati da prodotti non sani alla salute dei cittadini. 
Dobbiamo quindi essere ambiziosi, pretendere obiettivi quali il 25% minimo della produzione biologica e un autentico bando dei pesticidi dannosi. L'Italia è già al 20% del bio, la Sicilia al 22%. Dunque è possibile. Allora premiamo i produttori, diamo più soldi agli agricoltori siciliani, sardi, italiani o di qualunque altra regione europea che siano davvero virtuosi, che facciano davvero il biologico. Stop invece agli aiuti a chi non li merita. 
Dopo anni di pandemia e guerra stiamo vivendo sulla nostra pelle quanto ci costi dipendere da altri paesi produttori di cui spesso importiamo prodotti di scarsa qualità che abbassano il prezzo delle nostre eccellenze. È un sistema che non funziona e che spetta a noi cambiare per renderlo funzionale ad un futuro felice per noi e per i nostri figli. Ci vogliono coraggio e mani libere. Le abbiamo, onorevoli colleghi?
"
Dino GIARRUSSO,2022-04-04,IT,One-minute speeches on matters of political importance,https://www.europarl.europa.eu/doceo/document/CRE-9-2022-04-04-INT-1-167-0000_IT.html,"  Dino Giarrusso (NI).   – Signor Presidente, onorevoli colleghi, non so se vi rendete conto di quanto sta accadendo: abbiamo una guerra e abbiamo degli sciacalli che sfruttano la guerra infame promossa da Putin per arricchirsi, alzando il prezzo dell'energia e mettendo in ginocchio intere famiglie, imprese, settori che contano milioni di lavoratori. In Sicilia e Sardegna, come in molte zone d'Europa, la situazione è allo stremo: agricoltori, pescatori, autotrasportatori sono in ginocchio per il caro energia.
Allora smettiamola subito con le cure palliative: è l'ora di renderci autosufficienti dal punto di vista energetico e non cianciando di porcherie come il nucleare, ma promuovendo con tanti soldi europei le fonti realmente pulite, eolico, solare e marino in primis.
Chi ha paura degli impianti offshore che sfruttano vento e correnti marine? Chi? Forse chi vuole fermare la transizione verde ama stare sotto il tallone di Putin e dei suoi oligarchi. I cittadini europei non vogliono, invece! L'Europa vuole energia pulita e indipendenza completa dai padroni delle fonti fossili. Ora! Non quando sarà troppo tardi o quando scoppierà un'altra guerra.
"
Dino GIARRUSSO,2022-03-23,IT,Need for an urgent EU action plan to ensure food security inside and outside the EU in light of the Russian invasion of Ukraine (debate),https://www.europarl.europa.eu/doceo/document/CRE-9-2022-03-23-INT-1-160-0000_IT.html,"  Dino Giarrusso (NI).   – Signora Presidente, onorevoli colleghi, questa guerra sciagurata e sanguinosa non può essere pagata dai cittadini europei. Dipendiamo troppo da idrocarburi e materie prime importate e dobbiamo lavorare affinché l'agricoltura europea sia presto autosufficiente e sostenibile, restando sicura per i consumatori. 
Incentiviamo la produzione interna, specie di grano, mais e girasole. Diamo risorse che rendano conveniente coltivare e trasformare il prodotto qui. Smettiamo la pessima abitudine di importare sottocosto del grano di cui non sempre abbiamo certezza della qualità – leggi glifosato – per abbassare il prezzo del grano nostrano in un perverso gioco di mercato dove ci perdono gli agricoltori e ci guadagnano solo le multinazionali.
Ristoriamo chi ha subito perdite, aiutiamo chi vorrà produrre in modo virtuoso, rendendoci indipendenti dalle materie prime russe e ucraine, ma senza nemmeno pensare di utilizzare la guerra per tradire il lavoro fatto finora sul biologico, la limitazione dei pesticidi, la sostenibilità e la difesa della biodiversità. 
Oggi siamo chiamati ad una grande responsabilità, abbiamo in mano il futuro di milioni di cittadini europei e dei loro figli. Non possiamo tirarci indietro né voltarci dall'altra parte. 
"
Dino GIARRUSSO,2022-02-14,IT,Implementation report on on-farm animal welfare (debate),https://www.europarl.europa.eu/doceo/document/CRE-9-2022-02-14-INT-1-089-0000_IT.html,"  Dino Giarrusso (NI).   – Signora Presidente, onorevoli colleghi, le direttive europee sul benessere animale, nonostante gli studi e gli sforzi fatti dal Parlamento europeo, hanno sì consentito di ottenere cambiamenti strutturali riguardo alcune modalità di allevamento – direttive su galline ovaiole, suini e vitelli –, ma hanno avuto un impatto modesto se valutiamo la direttiva generale e la direttiva sui volatili.
La disomogeneità sembra il limite più importante all'interno dell'Unione: le direttive non specificano nel dettaglio i requisiti riguardanti le modalità di rispetto delle norme e di controllo, con conseguenze inaccettabili.
I sistemi europei di etichettatura relativi al benessere degli animali, in prevalenza privati, sono tutti volontari e nei fatti sono sistemi molto diversi fra loro in termini di funzionamento e concezione e non esiste nemmeno in prospettiva un'etichettatura obbligatoria e uguale nell'UE. La Commissione proceda dunque sulle direttive per aumentarne l'efficacia, migliorarne leggibilità e precisione e uniformare gli Stati membri.
La crisi sanitaria svela l'importanza di una corretta gestione degli allevamenti, anche per la salute nostra e dei nostri figli. Ascoltiamo gli operatori del settore e i medici per trovare un approccio definitivo, pragmatico e realistico sia riguardo le pratiche di allevamento che le prassi commerciali.
"
Dino GIARRUSSO,2021-12-14,EN,"Outcome of Global Summit Nutrition for Growth (Japan, 7-8 December) and increased food insecurity in developing countries (debate)",https://www.europarl.europa.eu/doceo/document/CRE-9-2021-12-14-INT-2-303-0000_EN.html,"  Dino Giarrusso (NI).   – Mr President, the Nutrition World Summit held in Japan last week was a crucial moment to discuss the future of food and nutrition at a global level. We all know nowadays how important nutrition is, but also how present is the malnutrition issue. For this reason we, as the EU, must commit on a three-strategy focus: health, food and resilience. 149 million children under five are stunted, 49 million are under weight, but another 40 million suffer obesity. 
The EU must stand as leader for nutrition in all terms – know-how, sustainable and healthy consumption of resources, promotion of European diets such as the Mediterranean one – the Italian one – as good practices, and also an efficient programme directed at those areas where children don’t have access to food.
We have an ambitious goal now. No more children dead. No more disease by malnutrition. No more waste of food. In 2021 it’s time to act, and not to talk anymore.
"
Dino GIARRUSSO,2021-11-23,IT,"Common agricultural policy - support for strategic plans to be drawn up by Member States and financed by the EAGF and by the EAFRD - Common agricultural policy: financing, management and monitoring - Common agricultural policy – amendment of the CMO and other regulations (debate)",https://www.europarl.europa.eu/doceo/document/CRE-9-2021-11-23-INT-2-023-0000_IT.html,"  Dino Giarrusso (NI).   – Signora Presidente, onorevoli colleghi, la PAC è uno dei punti che dà senso all'esistenza stessa dell'Europa. Non siamo soddisfatti dei troppi compromessi al ribasso, avremmo voluto un cambiamento immediato e più netto. Ma tenerci la vecchia PAC sarebbe stato un suicidio per agricoltori e consumatori europei.
Passi avanti importanti ci sono. Lo stop ai soldi per chi sfrutta i lavoratori, ed è un grande risultato. Viene introdotto il concetto di benessere animale e lotteremo affinché sia davvero rispettato sempre più e contro ogni crudeltà.
Ma dobbiamo fare di più per la canapa, la pianta del futuro, e dobbiamo soprattutto puntare sull'agricoltura come pilastro della transizione ecologica e dunque del nostro futuro. Il 60 % delle risorse per l'architettura verde, il 25 % per gli ecoschemi, che avremmo voluto obbligatori e dovremo mettere obbligatori, e il 4 % degli ettari inattivi per noi sono solo l'inizio di una rivoluzione verde, che va condotta insieme agli agricoltori, specie ai piccoli, e non contro di essi.
Piani nazionali e futuri accordi commerciali con altre economie devono prevedere il rispetto di norme stringenti sulla ecologia. Mai più importare prodotti che non rispettano gli standard che noi imponiamo ai nostri produttori. C'è un futuro verde ricco per la nostra Europa e realizzarlo dipende solo da noi.
"
Dino GIARRUSSO,2021-11-10,EN,One-minute speeches on matters of political importance,https://www.europarl.europa.eu/doceo/document/CRE-9-2021-11-10-INT-1-239-0000_EN.html,"  Dino Giarrusso (NI).   – Mr President, the flooding that has hit Sicily in the past weeks apparently will be a common phenomenon in the future. We have been talking about the rise of one or one and a half degrees on the planet for years, and I think was not enough to convince the people about the real issue of climate change. But now, with a temperature higher than the seasonal average, a more evident phenomenon is waking up the conscience. The fury of the wind is more even than some degrees more for a human being. That’s why we must act and take a decision now to avoid the first Mediterranean hurricane, which will be also the last. I am very close to my island. I hope the Solidarity Fund will be activated.
La Sicilia si rialzerà e dobbiamo aiutarla, perché è una perla della nostra Europa!
"
Dino GIARRUSSO,2021-10-18,IT,Farm to Fork Strategy (debate),https://www.europarl.europa.eu/doceo/document/CRE-9-2021-10-18-INT-1-057-0000_IT.html,"  Dino Giarrusso (NI).   – Signora Presidente, signora Commissaria, onorevoli colleghi, la strategia ""Farm to Fork"" è non solo utile, ma necessaria per rendere l'agricoltura europea sempre più di qualità e sostenibile.
Accorciare la filiera, valorizzare i prodotti locali, riconoscere e proteggere le eccellenze. Ma non basta, se non creiamo regole affinché il mercato e la grande distribuzione favoriscano finalmente i piccoli e medi produttori, che sono proprio quelli che coltivano l'eccellenza tutelando l'ambiente. 
Non basta, se continuiamo ad avere accordi commerciali con chi non rispetta le regole che noi imponiamo ai nostri produttori e dunque ci fa una concorrenza sleale che noi incredibilmente avalliamo e che inficia il lavoro fatto su sostenibilità e qualità.
Chiediamo quindi che, nella proposta della CE, ci siano strumenti per evitare il ricatto di ribassi estremi per i prodotti di qualità, biologici e di origine protetta, nonché l'intenzione di interrompere l'autolesionismo negli accordi con mercati extraeuropei. Serve un mercato interno più solido e integrato che valorizzi i prodotti IGP.
Bene la sintesi in questo INI, ma mi aspetto di più, anche a partire dall'etichettatura, che non può essere fuorviante per il consumatore, dunque va eliminato una volta per tutte il fraudolento e antiscientifico sistema del Nutri-Score a semaforo.
"
Dino GIARRUSSO,2021-09-15,IT,EU contribution to transforming global food systems to achieve the Sustainable Development Goals (debate),https://www.europarl.europa.eu/doceo/document/CRE-9-2021-09-15-INT-3-308-0000_IT.html,"  Dino Giarrusso (NI).   – Signora Presidente, onorevoli colleghi, il vertice ONU sui sistemi alimentari del 23 settembre è un'opportunità storica per guidare la ripresa dalla pandemia e raggiungere tutti i 17 obiettivi di sviluppo sostenibile (gli OSS) entro il 2030.
I sistemi alimentari, produzione, distribuzione e consumo sono fondamentali per raggiungere gli OSS e dunque vanno resi più sani, sostenibili ed equi. L'UE ha fatto degli OSS un principio guida delle proprie politiche, ma l'eliminazione della fame entro il 2030 è al momento una chimera e la pandemia ha evidenziato la fragilità dei sistemi e ha accentuato le diseguaglianze.
L'UE deve dunque assumere la guida dell'obiettivo ""fame zero"" e imporre una rapida transizione verso sistemi agroalimentari sostenibili, come il farm to fork, e questa interrogazione va nella giusta direzione, ma l'Europa deve anche stimolare i paesi partner e i loro agricoltori, pescatori e produttori locali a passare a pratiche sostenibili, favorendo solo accordi che premino il benessere animale, lo stop ai pesticidi, il rispetto dei diritti umani e la lotta alla resistenza antibiotica.
Dunque chiediamo di perseguire questi obiettivi, tanto ambiziosi quanto necessari, per avere un futuro migliore.
"
Dino GIARRUSSO,2021-07-05,IT,"European Maritime, Fisheries and Aquaculture Fund (debate)",https://www.europarl.europa.eu/doceo/document/CRE-9-2021-07-05-INT-1-096-0000_IT.html,"  Dino Giarrusso (NI).   – Signora Presidente, onorevoli colleghi, il Fondo europeo per la pesca deve andare agli operatori a cui era in origine indirizzato, se invece andiamo a concedere i fondi anche per imbarcazioni che arrivano a 24 metri, aiutiamo chi ne ha meno bisogno. 
Le piccole marinerie proteggono il mare da secoli poiché ne vivono i ritmi naturali preservandone la vita. In aree dove la pesca sta scomparendo, perché si lascia accesso anche ai giovani che sono proprietari solo del 33 % dell'imbarcazione? Gli aiuti devono essere mirati invece proprio verso quelle aziende o marinerie che incentivano la partecipazione autentica ed un ricambio generazionale del 100 %. 
Abbiamo sempre pensato che, proprio in quanto politica comune, quella della pesca debba essere molto attenta alle reali condizioni del settore per assicurare la conservazione della risorsa, l'aiuto ai piccoli e il ricambio generazionale, non quindi aiutare il dominio di grandi industrie che non hanno alcuna cura delle necessità fisiologiche di un ambiente molto sensibile come quello marino.
Non limitando i grandi sfruttatori si rischia di uccidere il mare e i marinai. L'Europa invece deve cambiare rotta senza indugi di sorta e sostenere le piccole marinerie evitando sussidi a chi nel mare vede soltanto un business, una miniera da sfruttare, spolpare fino all'esaurimento. 
"
Dino GIARRUSSO,2021-06-10,IT,European Citizens’ Initiative ‘End the cage age’’ (debate),https://www.europarl.europa.eu/doceo/document/CRE-9-2021-06-10-INT-4-018-0000_IT.html,"  Dino Giarrusso (NI).   – Signora Presidente, onorevoli colleghi, oggi siamo testimoni di come l'iniziativa dei cittadini europei possa essere strumento decisivo per migliorare il rapporto con le istituzioni e la vita stessa di tutti i cittadini, e in questo l'Europa è maestra di democrazia. 
La risoluzione ""End the cage age"" che nasce da iniziativa popolare ci dà l'opportunità di essere primi al mondo a vietare le gabbie e abbiamo il dovere di coglierla, anche alla luce di quanto è successo in era COVID negli allevamenti di visoni in Danimarca. Servono dunque riferimenti giuridici chiari e vincolanti, che tutelino allevatori e agricoltura rispettando in toto il benessere animale, come chiesto dai cittadini, e imponendolo ai partner commerciali europei. 
Ricordo che la direttiva Right2Water, anch'essa scaturita da una vastissima petizione popolare, non ha portato dopo sette anni ad alcun vincolo legislativo chiaro e cogente per gli Stati membri, e l'acqua pubblica rimane un sogno anziché un diritto.
Per lo stop degli animali in gabbia così come per l'acqua pubblica servono atti concreti. Dimostriamo che l'UE non si limita a parlare, ma è capace con coraggio di cambiare davvero il mondo e il futuro. 
"
Dino GIARRUSSO,2021-06-09,IT,Conclusions of the special meeting of the European Council on 24 and 25 May 2021 (debate),https://www.europarl.europa.eu/doceo/document/CRE-9-2021-06-09-INT-3-023-0000_IT.html,"  Dino Giarrusso (NI).   – Signor Presidente, onorevoli colleghi, signor Commissario, ancora una volta nell'ultimo Consiglio europeo l'Europa ha messo la testa sotto la sabbia, preferendo non affrontare il tema dei migranti. Grazie all'iniziativa dell'Italia, è stato inserito un punto all'ordine del giorno al prossimo Consiglio ed è bene che se ne parli, ma non basta, bisogna agire. Da decenni l'Europa discute, si interroga e si divide su come affrontare il tema del secolo e lo scandalo assoluto che ne segue. 
Migliaia di uomini, donne e bambini morti ogni anno nel Mar Mediterraneo, a pochi chilometri dalle bellissime coste della mia Sicilia. La soluzione c'è già e si chiama solidarietà ed è scritta nella Carta dei nostri trattati ma non nella realtà, diciamolo chiaramente. Il criterio del paese di primo ingresso è uno schiaffo al principio di solidarietà fra Stati e va tolto subito.
Non solo l'Italia ma tutti gli Stati membri devono affrontare insieme il fenomeno dell'immigrazione. Dunque più mezzi, più soldi, più uomini. Misure incisive contro il business del traffico di esseri umani e ricollocamento automatico e obbligatorio dei richiedenti asilo. 
Il prossimo Consiglio europeo non si trasformi nell'ennesima sterile tavola rotonda in cui tutti parlano ma nessuno decide niente. Servono fatti concreti, dimostriamo coi fatti che l'Europa può cambiare.
"
Dino GIARRUSSO,2021-06-08,IT,Climate-resilient EU fisheries and aquaculture (debate),https://www.europarl.europa.eu/doceo/document/CRE-9-2021-06-08-INT-2-349-0000_IT.html,"  Dino Giarrusso (NI).   – Signora Presidente, onorevoli colleghi, il 2050 è la data chiave del futuro nostro e dei nostri figli, perché entro il 2050 dovremo diventare così bravi da azzerare i danni del cambiamento climatico e tornare indietro riparando gli errori fatti. 
Pesca ed acquacoltura giocano un ruolo fondamentale perché la società nuova viva in armonia con il mare e dunque con il pianeta, dimostrandosi resiliente e volenterosa. Le nostre marinerie hanno subìto l'abbandono dei giovani poiché il settore è stato trascurato, peggiorando le cose dal punto di vista economico e ambientale, essendosi perduta la cultura della cura del mare. Inquinamento, pesca illegale e trasporto marittimo mal gestito hanno fatto il resto.
Nella Giornata degli oceani vi chiedo: quali sono le azioni concrete che la Commissione vorrà intraprendere? Quando manderà al Parlamento una proposta? Il 2050 non attende, è dietro l'angolo, e servono regole giuridicamente vincolanti, un approccio olistico riguardo al mare e agli attori che lo sfruttano, non solo a livello di pesca, e un contrasto concreto al depauperamento della risorsa ittica e al conseguente spopolamento delle comunità costiere locali. Salvare le marinerie e ringiovanirle è la più alta forma di tutela e resilienza possibile.
Dunque chiedo alla Commissione di non sbagliare poiché non possiamo più permettercelo e non avremo una seconda possibilità.
"
Dino GIARRUSSO,2021-04-26,IT,Multiannual management plan for bluefin tuna in the eastern Atlantic and the Mediterranean (debate),https://www.europarl.europa.eu/doceo/document/CRE-9-2021-04-26-INT-1-171-0000_IT.html,"  Dino Giarrusso (NI).   – Signor Presidente, onorevoli colleghi, faccio i complimenti al collega Ferrandino per l'ottimo lavoro svolto, appoggiato dalla delegazione. Ci sono due punti chiave da sottolineare ora. 
Il primo fondamentale è l'invito agli Stati membri a garantire che ci sia una quota davvero considerevole per le catture accessorie nella pesca tradizionale o artigianale, spesso tagliata fuori dalle quote per ragioni amministrative o di mancata rappresentanza nei tavoli decisionali, ma storicamente legate a questa pesca.
Il secondo è l'equa distribuzione fra i segmenti che posseggono già quote considerevoli e appunto la pesca artigianale, che rappresenta spesso intere comunità costiere; penso a Porticello di Santa Flavia, in Sicilia, per esempio. Seguiamo l'articolo 17 del regolamento base della politica comune della pesca, che invita gli Stati membri a considerare proprio l'artigianalità e la tradizione al momento dell'allocazione delle quote a livello nazionale delle varie spese.
Bene l'articolo 12 citato dal relatore, sull'equa distribuzione che potrebbe favorire il ritorno di tonnare storiche come quella di Favignana. Per questo invito la Commissione europea a farsi autenticamente garante dei principi che lei stessa propone in materia di una politica comune della pesca equa, così da non penalizzare e lasciare indietro pescatori e marinerie che vanno invece tutelati anche in fase di trilogo.
"
Dino GIARRUSSO,2021-03-09,FR,Fisheries control (debate),https://www.europarl.europa.eu/doceo/document/CRE-9-2021-03-09-INT-2-139-0000_FR.html,"  Frédérique Ries (Renew).   – Madame la Présidente, Madame la Commissaire, 5,1 milliards d’euros pour une Europe de la santé qui s’envole, on peut le dire comme ça, c’est le résultat extraordinaire auquel sont parvenus nos négociateurs. Je voudrais donc, en notre nom à tous, remercier notre rapporteur Christian Buşoi et notre Commissaire Mme Kyriakides.
Il est fini, définitivement fini, le temps où la santé était reléguée dans la deuxième division des politiques européennes. La pandémie de la COVID-19 a éclairé et de façon tragique les lacunes de nos systèmes de santé. EU4Health se donne pour ambition de changer la donne. Je vais essayer de ne pas répéter tout ce qui a été dit déjà. 20 % du budget dorénavant consacré à la prévention des maladies et à la promotion de la santé, avec en ligne de mire notamment les assuétudes: le tabac, la dépendance à l’alcool, sans non plus tomber dans la prohibition. On marque des points aussi sur la constitution de stocks européens de produits essentiels de crise, tout ce qui nous a manqué en réalité: les médicaments, les équipements, les dispositifs. Une demande forte, une demande répétée de notre Parlement depuis le début, 12,5% du budget, soit 637 millions d’euros leur seront dédiés.
Une crise, Madame la Commissaire, qui a montré, on l’a dit et redit, notre dépendance par rapport à la Chine, par rapport à l’Inde. L’Europe doit se réapproprier l’outil de production pour sortir de cette pénurie de médicaments largement antécédent, cela dit, aux événements de cette année.
L’Europe a su créer en 2008, l’Innovative Medicines Initiative (IMI), un des plus ambitieux partenariats privé-public au monde pour les médicaments innovants. Elle doit aujourd’hui tout simplement faire la même chose pour les médicaments anciens, souvent considérés comme pas assez rentables par certaines firmes pharmaceutiques, je ne vais pas citer de noms, mais les patients en attente se reconnaîtront.
Un dernier mot pour conclure, en référence au vieillissement démographique amorcé en Europe, les plus de 80 ans représentent 6 % de la population, l’Europe doit clairement miser sur la télémédecine pour que la santé en ligne parvienne chez nos anciens isolés et connectés. Agir pour nos seniors, c’est aussi l’Europe qui se projette.
"
Dino GIARRUSSO,2020-12-15,IT,Transitional provisions for support from the EAFRD and EAGF in the years 2021 and 2022 (debate),https://www.europarl.europa.eu/doceo/document/CRE-9-2020-12-15-INT-2-059-0000_IT.html,"  Dino Giarrusso (NI).   – Signor Presidente, onorevoli colleghi, è importante sottolineare oggi l'impegno europeo per continuare ad aiutare gli agricoltori nel 2021 e 2022, dando loro certezza giuridica. 
Grazie al regolamento transitorio permetteremo ai beneficiari di avere una transizione graduale ai programmi delineati dalla nuova PAC e garantiremo il rispetto del Green Deal, dunque transizione al biologico, phasing out ai pesticidi e maggiore attenzione all'ambiente. La tutela degli agricoltori e dell'ambiente sarà centrale, gli Stati membri dovranno spendere il 37 % dei fondi aggiuntivi su misure greening o sulla tutela del benessere animale e il 55 % su misure destinate alla trasformazione digitale e sociale. Si potranno continuare a utilizzare le misure di crisi introdotte con il Covid per ulteriori sei mesi dall'entrata in vigore dal regolamento transitorio – un aiuto importante.
Infine accogliamo con favore l'accordo che permetterà di inserire misure di aiuto per lo stoccaggio e la vendita di olio di oliva. Serve migliorare e stabilizzare il funzionamento del mercato comune degli oli di oliva e delle olive da cui sono ottenuti. Ci auguriamo questo sia un primo passo verso una maggiore tutela degli oli europei di qualità e un freno a importazioni selvagge e mal regolamentate, che danneggiano gli olivicoltori e i consumatori.
"
