MP,Date,Language,Title,Url,Content
Fulvio MARTUSCIELLO,2020-11-25,IT,Preparation of the European Council meeting of 10-11 December 2020 (debate),https://www.europarl.europa.eu/doceo/document/CRE-9-2020-11-25-INT-3-098-0000_IT.html,"  Fulvio Martusciello (PPE).   – Signora Presidente, onorevoli colleghi, in preparazione della riunione del Consiglio europeo, l'Unione europea, ritengo, deve rafforzare il controllo sulle tecnologie sensibili.
Una recente relazione del Tactics Institute for Security and Counter Terrorism, l'organizzazione di ricerca con sede nel Regno Unito, presenta pubblicamente fatti preoccupanti: transazioni tecnologiche di know how fra l'Occidente e paesi terzi, che le utilizzano contro i propri oppositori per sovvertire la democrazia.
Tra i singoli esempi leggiamo il programma di infrastrutture e di sorveglianza interna degli Emirati Arabi, DREAD, che è stato utilizzato per la sorveglianza di attivisti per i diritti delle donne saudite, di diplomatici delle Nazioni Unite, del personale della FIFA e di attivisti politici e per i diritti umani.
Altri esempi sono il project Travel e il project Karma. Il primo ha aiutato gli Emirati Arabi Uniti a identificare l'opposizione politica alla monarchia; il secondo ha sviluppato funzionalità di violazione degli IPhone. Attivisti, diplomatici e leader stranieri rivali del Medi Oriente sono stati presi di mira con malware diffusi tramite telefonini, o mail o in remoto.
Dobbiamo riconoscere che molti regimi totalitari usano queste armi. Alcuni preferiscono far parte dell'ecosistema internet occidentale, impegnandosi direttamente o per procura a minare trasparenza e privacy, per delineare la loro sovranità digitale mantenendo i vantaggi economici della connettività.
I regimi autoritari possono diventare così efficienti e sofisticati nel reprimere l'opposizione con le tecnologie informatiche da non dover ricorrere a una brutale coercizione. Possono persino apparire benigni agli occhi dell'opinione pubblica mondiale.
L'Unione europea dovrebbe occuparsi allora dell'esportazione di conoscenza e tecnologia, con rigide restrizioni, così come dell'esportazione di armi convenzionali. L'Unione europea potrebbe stabilire un parametro di riferimento e dei parametri normativi che possono essere imposti ad altri. Ciò può essere fatto attraverso una pianificazione strategica e in un quadro di cooperazione.
"
Fulvio MARTUSCIELLO,2020-05-14,IT,Vaccines and therapeutics in the context of Covid-19 (debate),https://www.europarl.europa.eu/doceo/document/CRE-9-2020-05-14-INT-2-169-0000_IT.html,"  Fulvio Martusciello (PPE).   – Signora Presidente, onorevoli colleghi, tutto il mondo aspetta il vaccino: ma pensiamo a quello che è accaduto per l'AIDS, ai tempi che ci sono voluti per tentare di averlo, e ancora non l'abbiamo. E allora dobbiamo imparare dagli errori, dobbiamo imparare da quello che è accaduto.
L'Europa si è trovata totalmente impreparata ad affrontare questa pandemia. Mentre avanzava in Cina, l'Europa ha scoperto di non avere fabbriche che producevano mascherine, perché il lavoro attorno a quelle mascherine non era remunerativo e conveniva produrle in Cina, e poi ha scoperto di non avere i guanti, che si producono solo a Taiwan o in Malesia. E ancora ha scoperto che la produzione dell'alcol era contingentata. Una serie di errori che ci ha fatto trovare totalmente scoperti.
Questo virus è stato terribile, ha squarciato completamente le nostre vite. Vedete, per chi è cristiano e cattolico, come me, è un'esperienza terribile non poter dire addio a un proprio caro personalmente, ma doverlo dire in videoconferenza.
E allora ci rendiamo conto che questo virus va combattuto, e va combattuto con la solidarietà che l'Europa deve ritrovare e soprattutto capendo che non ci può essere né nord né sud, ma l'Europa deve essere unita e solidale.
"
Fulvio MARTUSCIELLO,2019-09-17,IT,Situation in Kashmir (debate),https://www.europarl.europa.eu/doceo/document/CRE-9-2019-09-17-INT-2-341-0000_IT.html,"  Fulvio Martusciello (PPE),  domanda ""cartellino blu"". – Onorevole Van Orden, io sono d'accordo con il Suo intervento e Le voglio chiedere se ha letto la minaccia che è stata fatta dal Pakistan di usare le armi nucleari, perché questo è il vero tema di cui dovrebbe occuparsi il Parlamento europeo: l'utilizzo delle armi nucleari da parte del Pakistan e soprattutto il fatto che il Pakistan è un territorio che ha allevato – e la storia lo dice – nel corso di tutti questi anni numerosi terroristi, che hanno compiuto sanguinosi attentati in Europa, per non parlare poi di tutti i diritti umani violati in Pakistan.
"
