MP,Date,Language,Title,Url,Content
Jan-Christoph OETJEN,2021-10-07,DE,European Union Agency for Asylum (debate),https://www.europarl.europa.eu/doceo/document/CRE-9-2021-10-07-INT-4-023-0000_DE.html,"  Jan-Christoph Oetjen (Renew).   – Herr Präsident, verehrte Kolleginnen und Kollegen! Heute kommen wir ein Stück voran, und wir zeigen, dass wir das können, dass wir Kompromisse bilden können in Fragen von Migrationspolitik, und das ist ein gutes Zeichen. Ich finde, dass wir uns hier in diesem Hause nicht beeindrucken lassen sollten von den Hassreden von Rechtsextremen und Ultrakonservativen, sondern wir sollten versuchen, gemeinsame Kompromisse zu bilden, die den Werten dieses Kontinents entsprechen. Und das tun wir heute: Mit dem Beschluss über die EASO, die Europäische Asylagentur, gehen wir einen Schritt weiter und stärken diese Asylagentur in ihrer wichtigen Aufgabe, die Grundrechte, die fundamentalen Rechte der Menschen in Europa, zu unterstützen.
Und wir haben da Probleme in Europa, und die dürfen wir auch nicht kleinreden. Wir haben Probleme damit, wie Menschen, die nach Europa kommen, die Zuflucht suchen, die aus ihrem Land fliehen, weil dort Krieg herrscht oder weil sie dort verfolgt werden, in Europa behandelt werden. Diese Asylagentur hat die Aufgabe, die Mitgliedstaaten in ihrer Arbeit zu unterstützen. Uns allen hier ist bewusst, dass gerade in den Mitgliedstaaten, die an der europäischen Außengrenze liegen, die im Süden liegen, am Mittelmeer liegen, Flüchtlinge ankommen und dass sie für uns Europäer eine Aufgabe übernehmen. Und deswegen müssen wir klarmachen: Wir unterstützen diese Mitgliedstaaten bei der Wahrnehmung dieser Aufgabe. 
Deswegen ist die Überarbeitung dieses Mandats so wichtig. Deswegen ist es so wichtig, dass wir die Europäische Asylagentur ausbauen, stärken, unterstützen, besser mit Personal verstärken, damit eben die Mitgliedstaaten von der europäischen Ebene diese Unterstützung erhalten können. Das ist ein Zeichen europäischer Solidarität mit den Mitgliedstaaten im Süden und mit Flüchtlingen gleichermaßen.
"
Jan-Christoph OETJEN,2021-10-05,DE,Humanitarian situation in Tigray (debate),https://www.europarl.europa.eu/doceo/document/CRE-9-2021-10-05-INT-2-288-0000_DE.html,"  Jan-Christoph Oetjen,  im Namen der Renew-Fraktion. – Frau Präsidentin, verehrte Kolleginnen und Kollegen! Zunächst mal möchte ich mich bei den Fraktionen bedanken, denn wir haben heute Nachmittag schon sehr intensiv an einer Entschließung gearbeitet, die wir hier in diesem Plenum beschließen wollen. Alle Fraktionen haben sich an der Stelle sehr konstruktiv eingebracht. Alle Fraktionen? Nein. Eine Fraktion, die sich hier insbesondere als Verteidiger des Christentums aufspielt, hat sich gar nicht eingebracht. Aber das ist dann so.
Als Parlament rufen wir vor allen Dingen dazu auf, dass als Erstes alle Kampfhandlungen eingestellt werden müssen. Das ist die Grundvoraussetzung dafür, dass wir es schaffen, wieder Zugang für humanitäre Organisationen in Tigray zu schaffen. Die Kommissarin hat gerade sehr richtig dargestellt, wie die Situation ist und dass Menschen darunter leiden. Millionen von Menschen leiden an Hunger, und diese Grundvoraussetzung muss als Erstes geschaffen werden.
Wir hatten ja schon einmal diese Situation, dass es einen Waffenstillstand gab, der angekündigt wurde, aber der wurde halt nicht eingehalten. Deswegen bin ich davon überzeugt, dass wir einen unabhängigen Monitoring-Mechanismus brauchen, der eben dafür sorgt, dass eine Waffenruhe am Ende auch eingehalten wird. Denn ich glaube, wir sind uns alle einig, dass, wenn die Kampfhandlung weitergeht und diese Überzeugung herrscht, dass man es über Krieg schaffen kann, ein Problem zu lösen, dann werden wir keine Ruhe in dieses Land bekommen.
Aber über Krieg schafft man keine Lösungen, verehrte Kolleginnen und Kollegen! Krieg schafft Probleme, und deswegen lassen Sie uns dafür kämpfen, dass dieser Krieg aufhört.
Wir brauchen dann in der Folge ein Ende der Blockade für die humanitären Organisationen. Wir brauchen eine Sicherheitsgarantie für die Nichtregierungsorganisationen, die dort vor Ort helfen, die notwendige Unterstützung für die Menschen bringen, insbesondere auch Medikamente – und das eben nicht nur in Tigray, sondern auch in den Nachbarregionen Amhara und Afar.
Das ist schockierend, und ich schließe mich der Kollegin Arena hier an dieser Stelle an: Es gibt unerklärliche Kriegsverbrechen, die man kaum beim Namen nennen kann, so abscheulich sind die, es gibt Massenvergewaltigungen, es gibt systematische Tötungen in Äthiopien, und für mich ist klar, dass wir als Europäische Union auch dafür kämpfen müssen, dass die Verursacher dieser Verbrechen zur Rechenschaft gezogen werden. Solche Verbrechen, meine Damen und Herren, dürfen nicht ungesühnt bleiben.
Deswegen ist es wichtig, dass wir an dieser Stelle auch ein klares Signal aussenden, dass wir den Europäischen Sanktionsmechanismus nutzen müssen, um auf diejenigen zu zielen, die diese Kriegsverbrechen verursachen, die sie zu verantworten haben oder die eben diejenigen, die diese Kriegsverbrechen verursachen, decken.
Die Vereinigten Staaten sind jetzt an dieser Stelle vorangegangen. Wir als Europäische Union sollten hier folgen, ein klares Signal geben: Kriegsverbrechen werden verfolgt, und diejenigen, die sie decken, werden mit Sanktionen belegt. Denn die Europäische Union ist eine Wertegemeinschaft. Und diese Werte müssen wir mit aller Kraft durchsetzen.
"
Jan-Christoph OETJEN,2021-09-16,DE,The situation in Kakuma refugee camp in Kenya,https://www.europarl.europa.eu/doceo/document/CRE-9-2021-09-16-INT-4-102-0000_DE.html,"  Jan-Christoph Oetjen,  im Namen der Renew-Fraktion. – Frau Präsidentin, Frau Kommissarin, verehrte Kolleginnen und Kollegen! Wir sprechen heute über das Flüchtlingscamp Kakuma. Das ist im Nordwesten Kenias, in der Grenzregion zu Uganda, Äthiopien und dem Südsudan. Dieses Flüchtlingscamp gibt es seit 1992, und in der Region leben insgesamt über 500 000 Flüchtlinge, 100 000 davon etwa in diesem Flüchtlingscamp. Davon auch in dem Flüchtlingscamp 300, in Kenia insgesamt 1 000 Menschen aus der LGBTIQ-Szene, wie wir hier sagen. Und Kenia ist das einzige Land in Afrika und in der Region, das diesen Menschen Asyl gewährt.
Und ich möchte mich ausdrücklich dem Dank anschließen, der hier schon geäußert wurde, weil es wichtig ist, dass Menschen, die aufgrund ihrer sexuellen Orientierung verfolgt werden, einen Ort haben, an dem sie Zuflucht bekommen können, an dem Asyl gewährt wird. Deswegen bedanke ich mich bei der kenianischen Regierung, dass sie das als Asylgrund anerkennt und dass sie so viele Flüchtlinge aufnimmt.
Aber am 16. August dieses Jahres gab es in diesem Flüchtlingscamp Feuer, Schüsse, Angriffe auf Menschen mit gleichgeschlechtlicher sexueller Orientierung. Und wir müssen hier klar sagen, dass die Regierung Kenias, wenn sie diese Menschen akzeptiert in ihrem Land, eben auch dafür sorgen muss, dass diese in Sicherheit leben können.
Und es ist wichtig, dass wir als Europäische Union alles daransetzen, dass Menschenrechte für alle gelten, für Flüchtlinge, aber eben auch für Menschen aus Minderheiten und für Menschen, die homosexuell sind. Und dafür sollten wir als Europäische Union alles tun und alle unsere Mittel einsetzen, um diese Menschen zu unterstützen und die Menschenrechte aufrechtzuhalten.
"
Jan-Christoph OETJEN,2021-09-14,DE,Situation in Afghanistan (debate),https://www.europarl.europa.eu/doceo/document/CRE-9-2021-09-14-INT-2-213-0000_DE.html,"  Jan-Christoph Oetjen (Renew).   – Frau Präsidentin, sehr geehrter Hoher Vertreter, verehrte Kolleginnen und Kollegen! Ich höre Staats- und Regierungschefs und auch Kollegen, hier im Saal übrigens, sagen, dass man Europa vor Flüchtlingen schützen müsse. Verehrte Kolleginnen und Kollegen, was wir schützen müssen, sind europäische Werte. Und europäische Werte schützen wir, indem wir Menschen, die an unserer Seite für Demokratie und Menschenrechte in Afghanistan gekämpft haben, humanitäre Korridore zur Verfügung stellen, sie da rausholen aus diesem Land und zu uns nach Europa holen. Das ist unsere europäische Verantwortung, verehrte Kolleginnen und Kollegen. 
Und wir brauchen Resettlement für Flüchtlinge, die jetzt in anderen Ländern gestrandet sind – ich bin dankbar für das, was der Kollege Karas gerade gesagt hat. Die Staats- und Regierungschefs der europäischen Länder müssen deutlich machen, dass sie bereit sind, Flüchtlinge aufzunehmen. Und wir müssen die Temporary-Protection-Directive endlich aktivieren. 
Afghanistan hat aber auch gezeigt, dass wir als Europäer in der Verteidigungspolitik nicht handlungsfähig sind. Und ich glaube deswegen, dass wir uns darüber Gedanken machen müssen, wie wir die Europäische Verteidigungsunion schneller auf den Weg bringen und wie wir sie vertiefen können. Und, Herr Kollege Bullmann, das hat erst mal nichts mit Säbelrasseln zu tun, sondern es hat damit zu tun, dass wir als Europäer Einsatzfähigkeit zeigen und dass wir in militärischen Fragen von den USA unabhängig sind. 
"
Jan-Christoph OETJEN,2021-09-14,DE,Situation in Lebanon (debate),https://www.europarl.europa.eu/doceo/document/CRE-9-2021-09-14-INT-2-234-0000_DE.html,"  Jan-Christoph Oetjen (Renew).   – Frau Präsidentin, geehrter Hoher Vertreter! Wir haben vor einem Jahr hier das letzte Mal debattiert, das war kurz nach der Explosion im Hafen von Beirut. Seitdem hat sich die Situation nur verschlechtert, um es ganz klar zu sagen. Ich glaube, dass wir aber jetzt eine Chance haben. Ich habe zumindest Hoffnung. Als ich gehört habe, dass sich eine neue Regierung bildet im Libanon, habe ich gesagt: Okay, diese Chance müssen wir jetzt nutzen.
Diese Chance muss aber vor allen Dingen diese neue libanesische Regierung nutzen. Denn in einer Situation, wo wir eine galoppierende Inflation haben, Nahrungsmittelknappheit, keinen Treibstoff, hohe Arbeitslosigkeit, eine wirtschaftliche Krise, die sich zur sozialen Krise auswächst, muss diese neue Regierung jetzt Vertrauen zurückgewinnen bei ihrer Bevölkerung.
Ich glaube, dass wir als Europäische Union diese Regierung dabei unterstützen müssen, die notwendigen Reformen im Libanon auf den Weg zu bringen. Und gleichzeitig müssen wir für die Bevölkerung humanitäre Hilfe leisten. Denn das libanesische Volk ist ein Volk, das nicht nur stolz ist und viel leistet, sondern das vor allen Dingen unseren Respekt und unsere Unterstützung braucht.
"
Jan-Christoph OETJEN,2021-07-08,DE,"The death penalty in Saudi Arabia, notably the cases of Mustafa Hashem al-Darwish and Abdullah al-Howaiti",https://www.europarl.europa.eu/doceo/document/CRE-9-2021-07-08-INT-4-136-0000_DE.html,"  Jan-Christoph Oetjen,  im Namen der Renew-Fraktion. – Herr Präsident, Frau Kommissarin! Wir wissen alle, dass Saudi-Arabien kein freies und tolerantes Land ist. Bei der Gelegenheit erinnere ich daran, dass der Sacharow-Preisträger von 2015, Raif Badawi, noch immer in Haft ist.
Besonders abscheulich ist allerdings, dass in Saudi—Arabien Minderjährige hingerichtet werden. Der 17-jährige Mustafa al-Darwish hat seine Teilnahme an Protesten vor etwas mehr als drei Wochen, nämlich am 15. Juni, mit seinem Leben bezahlt – hingerichtet, nachdem ihm unter Folter ein Geständnis erpresst wurde, ohne Verteidigung, ohne fairen Prozess.
Heute noch sind neun Kinder in Saudi-Arabien zu Tode verurteilt und warten auf ihre Hinrichtung. Einer von ihnen ist Abdullah al-Huwaiti. Er war 14, als er verhaftet wurde. Er wurde gefoltert, um ein Geständnis zu erpressen, und in einem dubiosen Prozess wurde er im Oktober 2019 zum Tode verurteilt. Im ersten Halbjahr wurden in Saudi—Arabien 31 Todesurteile vollstreckt, unter anderem an acht minderjährigen Straftätern.
Wir verurteilen diese Praxis, wir erwarten faire Prozesse. Die Todesstrafe, insbesondere für Minderjährige, gehört abgeschafft. Es gibt keine Begründung für eine solche unmenschliche Praxis.
"
Jan-Christoph OETJEN,2021-07-06,DE,Connecting Europe Facility - Streamlining measures for the realisation of the TEN-T - Railway safety and signalling: Assessing the state of play of the ERTMS deployment (debate),https://www.europarl.europa.eu/doceo/document/CRE-9-2021-07-06-INT-2-074-0000_DE.html,"  Jan-Christoph Oetjen (Renew).   – Herr Präsident, verehrte Kolleginnen und Kollegen! Wir stimmen heute über die Fazilität „Connecting Europe“ ab, und ich möchte mich ganz herzlich bei unseren Verhandlern hier im Europäischen Parlament bedanken, denn wir haben ein wirklich gutes Ergebnis. Ein gutes Ergebnis nicht nur deswegen, weil 33,7 Milliarden Euro in den nächsten Jahren von 2021 bis 2027 in Europa ausgegeben werden, um grenzüberschreitende Projekte zu stärken, sondern weil wir im grenzüberschreitenden Verkehr heute auch noch unheimlich viel zu tun haben.
Wir haben auch heute noch Bottlenecks zwischen Staaten. Wir haben übergreifende Probleme, die nicht gelöst sind. Und dafür ist es wichtig, dass wir einen europäischen einheitlichen Rahmen setzen und diese Projekte auf den Weg bringen. Aber auch auf den zentralen transeuropäischen Verkehrskorridoren haben wir noch viel zu tun. In meiner Heimatregion ist das beispielsweise die Elektrifizierung der Strecke von Oldenburg nach Wilhelmshaven.
Europa investiert also Geld, damit die ökologische Transformation unserer Wirtschaft Wirklichkeit werden kann, damit wir grenzüberschreitende Verkehre im Wettbewerb in Europa wahr machen können. Deswegen stimme ich gerne zu. Und deswegen haben wir ein gutes Ergebnis hier für die Europäische Union und für die Bürger.
"
Jan-Christoph OETJEN,2021-07-06,EN,"Situation in Tigray, Ethiopia (continuation of debate)",https://www.europarl.europa.eu/doceo/document/CRE-9-2021-07-06-INT-2-264-0000_EN.html,"  Jan-Christoph Oetjen (Renew).   – Mr President, the situation in Tigray is dramatic, all colleagues said this already and despite the fact that the ceasefire from 28 June is a good step, we need a permanent ceasefire and we need the withdrawal of the foreign troops from the region.
Our solidarity is with the people of Tigray in Ethiopia. We condemn the destruction of infrastructure, this is something very horrible. I mean, people are starving already, people get raped and there are others that destroy infrastructure that is urgently needed in this situation. This has to be stopped immediately. And we urge a cessation of human rights violations in the region and seek secure access for humanitarian aid.
I ask the Commission to step up the pressure on the authorities because this situation can no longer be accepted. We have to help the people in the region. And so I ask you: urge them to move and to change.
"
Jan-Christoph OETJEN,2021-07-06,DE,"Asylum, Migration and Integration Fund 2021-2027 - Integrated Border Management Fund: Instrument for Financial Support for Border Management and Visa Policy 2021-2027 (debate)",https://www.europarl.europa.eu/doceo/document/CRE-9-2021-07-06-INT-2-303-0000_DE.html,"  Jan-Christoph Oetjen,  im Namen der Renew-Fraktion. – Frau Präsidentin, liebe Tanja Fajon, liebe Frau Kommissarin! Wir bringen heute zwei Fonds zur Unterstützung der Mitgliedstaaten in der Migrationspolitik auf den Weg. 
Ich sage das bewusst so, dass wir das zur Unterstützung der Mitgliedstaaten tun, weil wir mit diesen Fonds auch die Lehren aus der Migrationskrise von 2015/16 ziehen. Wir haben – das hat die Kommissarin gerade schon gesagt – die Instrumente, die damals ad hoc eingesetzt wurden, jetzt verstetigt, und die Mitgliedstaaten genießen gleichzeitig Flexibilität bei der Nutzung dieser Fonds, was sehr wichtig ist. Wir stärken auch gerade die Staaten, die besonders viele Migranten erreichen, indem wir ihnen im Endeffekt höhere Zuwendungen ermöglichen. 
Mit den Fonds unterstützen wir auf der einen Seite Integration derer, die kommen. Wir unterstützen das resettlement, das heißt, dass wir für diejenigen mit der größten Vulnerabilität legale Wege zu uns nach Europa schaffen. Aber gleichzeitig ermöglichen wir natürlich auch, durch den Fonds Rückführungen zu fördern. Insofern glaube ich, dass wir bei den Möglichkeiten, über die die Mitgliedstaaten verfügen, eine gute balance haben.
Der zweite Fonds stärkt den Grenzschutz. Und es ist mir besonders wichtig, noch einmal deutlich zu sagen, dass es jetzt darum geht, dass die Mitgliedstaaten diese Mittel abrufen und auch nutzen. Denn das Ziel ist doch, dass wir in der Europäischen Union natürlich einen guten Außengrenzschutz haben, im Inneren der Europäischen Union aber eben über alle Freiheiten verfügen und keine Grenzen mehr haben. Insofern erwarte ich von den Mitgliedstaaten auch, dass sie die Mittel abrufen und dass sie dann aufhören, vom Schengen-Acquis abzuweichen, und auch alle bisherigen Grenzkontrollen innerhalb der Europäischen Union abbauen. 
Und am Ende mein Appell an die Mitgliedstaaten: Hören Sie auf, in der Migrations- und Asylpolitik zu blockieren! Begeben Sie sich auf den Weg, dass Sie endlich konstruktiv mit uns daran arbeiten, dass wir ein gemeinsames europäisches funktionierendes Asyl- und Migrationssystem haben, das auf den Werten von Rechtsstaatlichkeit und Humanität basiert und das Solidarität mit allen Mitgliedstaaten beinhaltet, in denen viele Flüchtlinge ankommen.
"
Jan-Christoph OETJEN,2021-06-23,DE,Preparation of the European Council meeting of 24-25 June 2021 – Relaunch of the Malta Declaration and the use of an effective solidarity mechanism (debate),https://www.europarl.europa.eu/doceo/document/CRE-9-2021-06-23-INT-1-052-0000_DE.html,"  Jan-Christoph Oetjen (Renew).   – Herr Präsident, Kolleginnen und Kollegen! Die Pandemie geht zurück, der Sommer kommt, und wie jedes Jahr im Sommer steigen auch wieder die Zahlen der Menschen, die die gefährliche Reise über das Mittelmeer angehen und nach Europa kommen wollen. Menschen, die ein besseres Leben suchen.
Und wir sind uns, glaube ich, alle einig, dass wir natürlich eine ganzheitliche Lösung für die Asyl— und Migrationspolitik brauchen. Eine ganzheitliche Lösung heißt für mich, dass wir klare Regeln auch für legale Einwanderung nach Europa brauchen. Und eine ganzheitliche Lösung heißt auch, dass wir Solidarität mit den südlichen Mitgliedstaaten brauchen.
Solange wir diese Lösung aber nicht haben – und verehrte Kolleginnen und Kollegen, solange der Rat blockiert, haben wir die nicht –, solange wir diese nicht haben, brauchen wir eine Wiederbelebung der Deklaration von Valletta. Denn die hilft uns in solchen Situationen – in denen Schiffe auf dem Mittelmeer darauf warten, dass aus Seenot Gerettete irgendwo abgeladen, hingebracht werden können –, dass in solchen Momenten eben nicht blockiert wird, wie das der Fall war bei der Maersk Etienne, die 38 Tage darauf gewartet hat, dass ein Hafen aufmacht, um Flüchtlinge abzugeben. Wir brauchen eine andere Lösung, bei der die Mitgliedstaaten eben auch helfen müssen – und Malta helfen müssen und Italien helfen müssen. Und ich erwarte, dass der Rat hier in Bewegung kommt und diese Malta—Erklärung wiederbelebt.
"
Jan-Christoph OETJEN,2021-06-10,DE,Breach of the UN Convention of the Rights of the Child and the use of minors by the Moroccan authorities in the migratory crisis in Ceuta,https://www.europarl.europa.eu/doceo/document/CRE-9-2021-06-10-INT-4-109-0000_DE.html,"  Jan-Christoph Oetjen (Renew).   – Frau Präsidentin, verehrte Kolleginnen und Kollegen! Unsere Solidarität gilt den Bürgern von Ceuta, und unsere Unterstützung an dieser Stelle muss den Kindern gelten, die für politische Zwecke missbraucht werden. In Ceuta sehen wir heute die Probleme, die entstehen, weil wir keine funktionierende EU-Migrationspolitik haben.
Dabei haben die EU und Marokko eigentlich die gleichen Interessen. Und ich bin sicher, dass wir mit Handel, wirtschaftlicher Zusammenarbeit und vor allen Dingen einer Kooperation im Bereich der Arbeitsmigration eine Win-Win-Situation entwickeln können – für die EU und für Marokko.
Und ich erwarte an dieser Stelle auch mehr Vorschläge von der Kommission, wie sie das Thema Arbeitsmigration in den Mittelpunkt stellen kann. Denn wenn wir die Arbeitsmigration nicht mitdenken, werden wir die Probleme im Bereich der Migration nicht lösen.
Für mich ist aber klar, dass die Missachtung von Kinderrechten und Menschenrechten keine Grundlage für eine gute Kooperation sein kann, und ich wünsche mir, dass die Spannungen, die entstanden sind zwischen Spanien und Marokko, bald beigelegt werden und wir wieder zu einer diplomatischen Zusammenarbeit kommen, denn Marokko ist und bleibt für uns ein strategischer Partner.
"
Jan-Christoph OETJEN,2021-06-08,DE,EU Digital COVID Certificate - Union citizens – EU Digital COVID Certificate - third-country nationals (debate),https://www.europarl.europa.eu/doceo/document/CRE-9-2021-06-08-INT-2-053-0000_DE.html,"  Jan-Christoph Oetjen (Renew).   – Herr Präsident! Nun ist es da, das digitale COVID-Zertifikat. Wir haben unsere Arbeit gemacht und es schnell auf den Weg gebracht. Aber jetzt geht es darum, dass die Mitgliedstaaten es auch schnell umsetzen und es schnell den Bürgerinnen und Bürgern zur Verfügung stellen – unbürokratisch, kostenfrei, damit die Bürgerinnen und Bürger tatsächlich ihre Reisefreiheit, diese Möglichkeiten im Schengen-Raum, wieder ausleben können.
Und ich möchte hier auch nochmal klar sagen, dass dieses Zertifikat eben kein Impfzwang ist, wie es hier von einigen immer wieder dargestellt wird, sondern mit dem Zertifikat ist es möglich, eine Impfung nachzuweisen, aber eben auch einen negativen Test. Und von daher schränkt dieses Zertifikat auch die Reisefreiheit nicht ein. Im Gegenteil: Es ermöglicht den Bürgerinnen und Bürgern, ihre Freiheiten wieder auszuleben, auszuüben, und zwar für Urlaubsreisen und für Dienstreisen, für grenzüberschreitende Dienstleistungen, für Familientreffen, für Saisonarbeitskräfte. Insofern ist das ein guter Schritt.
Für mich ist aber auch klar: Am Ende der Pandemie, wenn wir das COVID-Zertifikat nicht mehr brauchen, muss das Reisen auch wieder ohne dieses Zertifikat möglich sein.
"
Jan-Christoph OETJEN,2021-05-20,FR,The situation in Chad,https://www.europarl.europa.eu/doceo/document/CRE-9-2021-05-20-INT-4-117-0000_FR.html,"  Jan-Christoph Oetjen,  auteur. – Madame la Présidente, chers collègues, le Tchad est un partenaire important pour l’Union européenne dans la lutte contre le terrorisme, cela a déjà été dit par plusieurs collègues. Il faut également mentionner que le Tchad a beaucoup souffert, depuis 2015, des attaques et des activités de Boko Haram.
Cette résolution n’est pas faite pour pointer quelqu’un du doigt; elle est faite pour montrer le chemin, parce qu’après le décès du président Idriss Déby, la situation est devenue instable. Je suis convaincu que ce ne sont pas des armes qui vont résoudre les problèmes actuels au sein de la société du Tchad, mais le dialogue, chers collègues. Dans ce sens, c’est un signal encourageant qu’un gouvernement de transition ait été nommé avec la participation de membres de l’opposition et de la société civile. Je suis convaincu que seul un chemin démocratique peut être un avenir stable pour le peuple tchadien.
Le Tchad doit rester un partenaire important pour l’Union européenne. Nous invitons la communauté internationale à soutenir le Tchad sur son chemin vers la démocratie et la stabilité pour la région.
"
Jan-Christoph OETJEN,2021-05-19,DE,New avenues for legal labour migration (debate),https://www.europarl.europa.eu/doceo/document/CRE-9-2021-05-19-INT-3-184-0000_DE.html,"  Jan-Christoph Oetjen (Renew).   – Frau Präsidentin, verehrte Kolleginnen und Kollegen! Migration gab es schon immer: Früher sind meine Vorfahren nach Amerika ausgewandert, wie Millionen anderer Europäer, heute wandern Menschen nach Europa ein. Und ehrlicherweise können wir froh sein, dass Europa heute ein Einwanderungsland ist und es nicht mehr andersrum ist. Das zeigt unseren Wohlstand.
Aber um diesen Wohlstand zu erhalten, liebe Kolleginnen und Kollegen, müssen wir Arbeitsmigration besser organisieren als bisher. Es gibt nämlich eigentlich keine organisierte Zuwanderung in unseren Arbeitsmarkt. Deswegen kommen so viele Menschen, die als Arbeitsmigranten bezeichnet werden, und beantragen Asyl, obwohl es eigentlich gar keinen Asylgrund für diese Menschen gibt. Wir müssen diese Ströme besser kanalisieren und besser trennen, um denjenigen, die unsere Hilfe brauchen – die hier einen Asylgrund haben –, tatsächlich zu helfen, damit wir denjenigen, die vor Krieg flüchten, helfen können und damit wir besser aussuchen können, wen wir zu uns nach Europa auf den Arbeitsmarkt einladen. Dafür brauchen wir aus meiner Sicht europäische Regelungen.
Wir haben als Renew einen talent pool vorgeschlagen, wo Mitgliedstaaten sagen können „Jawohl, wir möchten Menschen aufnehmen“ und andere Mitgliedstaaten sagen können „Nein, wir möchten keine Menschen aufnehmen“. Ich möchte hier klar sagen: Das soll nicht nur für die Höchstqualifizierten gelten, denn da haben wir in der Tat – das haben viele hier angesprochen – ein Problem. Aber wir haben heute auch schon ein Problem in vielen Handwerksberufen, in vielen anderen Arbeitsbereichen. Und dafür müssen wir eine europäische Möglichkeit schaffen, dass sich Menschen gar nicht erst auf den gefährlichen Weg nach Europa begeben müssen, sondern sich bereits in ihrem Heimatland für einen solchen talent pool bewerben können oder auch in ihrem Heimatland Asyl beantragen können. Das würde die Migrationssituation in Europa wesentlich entspannen.
"
