MP,Date,Language,Title,Url,Content
Kathleen VAN BREMPT,2021-12-14,NL,Implementation of the Kimberley Process Certification scheme (debate),https://www.europarl.europa.eu/doceo/document/CRE-9-2021-12-14-INT-2-282-0000_NL.html,"  Kathleen Van Brempt,  namens de S&D-Fractie. – Voorzitter, mevrouw de commissaris, niemand wil een diamant aan zijn of haar vinger waar bloed aan hangt. De ontginning van diamanten wordt vandaag de dag nog al te vaak gelinkt aan de financiering van rebellengroepen en burgeroorlogen in Afrika. Het Kimberley Process Certification Scheme werd in 2003 opgericht om die handel in conflictdiamanten te stoppen. En met succes, want vandaag wordt minder dan 1 % van de handel in ruwe diamanten als een conflictdiamant beschouwd. Dat is – dat moeten we echt wel zeggen – een belangrijke verdienste.
Echter, de resolutie spreekt ook zeer terecht, zoals vermeld, over de tekortkomingen van het Kimberley-proces en de absolute verbeteringen die nodig zijn. Het probleem van de diamanten is dan wel sterk verminderd, het is zeker en vast nog helemaal niet opgelost.
Eerst en vooral, en het is genoemd, moet het toepassingsgebied vergroot worden. De huidige definitie is te eng. Enkel ruwe diamanten die door rebellen gebruikt worden om hun strijd tegen legitieme overheden te financieren, worden beschouwd als conflictdiamant. Alle schendingen van mensenrechten, ongeacht of ze begaan zijn door rebellen, door het leger, door toezichthouders in de mijnen of door overheden, zouden gevat moeten worden. Dus ook dwangarbeid en kinderarbeid.
Ten tweede, op het vlak van onafhankelijke monitoring en afdwingbaarheid zijn verbeteringen nodig. Inzetten op digitalisering kan en zal een oplossing bieden. En ngo’s zijn een essentiële partner in het Kimberleyproces. Ze moeten beter ondersteund worden.
Verder is er een reëel gevaar van het verschuiven van de handel in diamanten naar een hub zoals Dubai, die het toch niet zo nauw neemt met de voorschriften. Dit zorgt voor een groot gat, een loophole, in het internationale systeem en moet gecounterd worden.
Echter, en dat is natuurlijk het hele probleem in het multilaterale systeem, er moet bij consensus gewerkt worden en die 56 leden zien helemaal niet allemaal dezelfde noodzaak in van grondige hervormingen. De druk om te hervormen, ontbreekt vandaag de dag en daardoor ook het gebrek aan het grote succesverhaal dat het proces zou kunnen zijn. Hervormingen zijn dus niet eenvoudig en ik reken op de Commissie om zich te blijven inzetten om verbeteringen mogelijk te maken.
Dit brengt me bij wat de EU zelf zou kunnen doen, want we mogen ons toch niet verschuilen achter die unanimiteit. Er zijn dingen die we zelf in gang kunnen zetten en dat is de essentie van het due diligence-verhaal, van verantwoordelijkheid nemen in de aanvoerketen van diamanten en onze ogen niet sluiten voor de schendingen van de mensenrechten. Consumenten eisen dat ook vandaag de dag. Ze willen weten dat er aan een diamant geen bloed kleeft, dat die een ethische oorsprong heeft, dat die niet gelinkt is aan milieurampen en dat die dus niet gemaakt is met dwangarbeid of kinderarbeid. Los van wie dat deed, rebellen of anderen, in dit hele productieproces van ontginnen tot polijsten, slijpen en zetten, moeten die rechten gegarandeerd worden.
Een zorgvuldigheidsplicht in die hele aanvoerketen moet ervoor zorgen dat schendingen van mensenrechten tot het verleden behoren. Ik kan niet genoeg benadrukken dat dus een breed voorstel van due diligence er moet komen, en snel. Het is echt onaanvaardbaar dat het opnieuw is uitgesteld, mevrouw de commissaris, en ik vraag u echt met aandrang om daarnaar te kijken. Naar het schijnt bestaat er zoiets als een Regular Scrutiny Board die dat heeft tegengehouden. Ik vraag me eigenlijk persoonlijk af waar de democratie in dit verhaal nog zit. Dus ik verwacht openheid van de Europese Commissie en ik verwacht heel snel een voorstel. Hetzelfde geldt, want dat is ook aan elkaar gelinkt, voor een voorstel rond “forced labour”. Vanuit de Commissie internationale handel kunnen we niet genoeg benadrukken dat er ook een systeem moet komen van een ban van producten op onze markt rond “forced labour”. Hiermee kunnen het Kimberley-proces en het bannen van conflictdiamanten worden versterkt.
"
Kathleen VAN BREMPT,2021-11-24,NL,Outcome of the COP26 in Glasgow (debate),https://www.europarl.europa.eu/doceo/document/CRE-9-2021-11-24-INT-3-080-0000_NL.html,"  Kathleen Van Brempt (S&D).   – Voorzitter, het klopt. Na de COP in Glasgow kunnen we zeggen dat de anderhalve graad boven water gehouden is en nog steeds de wereldwijde ambitie is. Maar tegelijkertijd moeten we toegeven dat we nog heel veel werk hebben wat betreft de toezeggingen, de maatregelen en het doortastend beleid dat er zou moeten zijn afgesproken.
Dat betekent – en dat is een belangrijke boodschap die ik vandaag wil geven – dat we meer dan ooit onze eigen verantwoordelijkheid moeten opnemen en dat het “Fit for 55”-pakket niet alleen boven water moet blijven, maar vooral ook nog ambitieuzer moet worden. Ik hoor al te vaak, ook in dit Parlement, al vraagtekens rond dit pakket. Ik denk dat we ons dat niet kunnen veroorloven. 
Solidariteit moet voor onze fractie centraal staan in het beleid en dat betekent ook solidariteit op het internationale vlak in ons handelsbeleid en niet alleen het goede voorbeeld geven, maar bijvoorbeeld ook onze technologie delen en ervoor zorgen dat er internationaal voldoende financiering is om dat beleid ook waar te maken. Dat is denk ik een heel belangrijke opdracht die nog voor ons ligt. 
"
Kathleen VAN BREMPT,2021-11-24,NL,The EU's role in combating the COVID-19 pandemic: how to vaccinate the world (topical debate),https://www.europarl.europa.eu/doceo/document/CRE-9-2021-11-24-INT-3-139-0000_NL.html,"  Kathleen Van Brempt (S&D).   – Voorzitter, commissaris, de rijke landen hebben momenteel al meer inwoners een derde prik gegeven dan de arme landen een eerste. Dat is niet alleen onrechtvaardig, maar ook bijzonder dom want dat betekent inderdaad dat we, zoals Mohammed zei, gewoon moeten wachten op de volgende variant. 
Daaronder ligt eigenlijk nog een extra onrechtvaardigheid. Het vaccin dat vandaag in de wereld het beste werkt, berust op Amerikaanse en Europese mRNA-technologie. Daar mogen we best wel trots op zijn. Maar wat zien we? Dat de bedrijven die deze technologie bezitten, niet erg geïnteresseerd zijn om aan arme landen te verkopen, te doneren of met hen samen te werken, maar hun producten liever aan de rijke landen verkopen. En dus moeten die arme landen het stellen met veel minder efficiënte Chinese en andere vaccins. Dat is onaanvaardbaar. 
Het is dus evident wat we moeten doen. Zoals een aantal collega's al hebben gezegd, hebben we hierover een resolutie opgesteld en al lang geleden gevraagd om daar wat aan te doen. Naast het doneren van onze overschotten aan vaccins, is het noodzakelijk dat de mRNA-technologie, de gegevens en de patenten gedeeld worden met de Wereldhandelsorganisatie – die wij toch vertrouwen, mag ik hopen – om de productie eindelijk op te drijven zoals nodig om deze pandemie ten gronde aan te pakken. 
"
Kathleen VAN BREMPT,2021-11-23,NL,"Multilateral negotiations in view of the 12th WTO Ministerial Conference in Geneva, 30 November to 3 December 2021 (debate)",https://www.europarl.europa.eu/doceo/document/CRE-9-2021-11-23-INT-2-256-0000_NL.html,"  Kathleen Van Brempt (S&D).   – Voorzitter, we weten allemaal dat het multilateralisme in moeilijke papieren zit. We hebben dat trouwens ook bij de COP in Glasgow gezien. Het is moeilijk om multilaterale akkoorden te maken en dus hebben we succes nodig. Succes op het vlak van duurzaamheid door het visserijakkoord, en succes op het vlak van gezondheid.
Ik heb goed naar mijnheer Simon geluisterd. Vorige week is bekendgemaakt dat Pfizer, BioNTech en Moderna samen 34 miljard dollar winst gemaakt hebben. Dat is ongeveer 93 miljoen per dag of duizend dollar per seconde. Dan is mijn vraag aan u, commissaris, maar ook aan de EVP-Fractie heel simpel: wie beschermen we eigenlijk als we niet voor een tijdelijke opheffing van intellectuele eigendomsrechten kunnen zijn? Wie beschermen we dan? De grote winsten van de farmaceutische industrie of de belangen van de wereldbevolking? Dat is de essentie van dit vraagstuk.
"
Kathleen VAN BREMPT,2021-11-11,NL,The outcome of the EU-US Trade and Technology Council (TTC) (debate),https://www.europarl.europa.eu/doceo/document/CRE-9-2021-11-11-INT-2-027-0000_NL.html,"  Kathleen Van Brempt (S&D).   – Voorzitter, ik denk dat we het er allemaal over eens zijn dat we na Trump met de huidige regering-Biden moeten werken aan een positieve agenda voor de toekomst. Dit betekent niet alleen dat we problemen moeten oplossen, bijvoorbeeld op het gebied van staal en aluminium, maar ook dat we een positieve agenda moeten opstellen met kwesties die van belang zijn voor onze toekomst. De Handels- en Technologieraad EU-VS is daarom zeer belangrijk.
We weten allemaal dat technologie zoals artificiële intelligentie kan worden ingezet met het oog op het welslagen van onze toekomst en het welzijn van onze bevolking. Deze technologie kan echter ook voor een groot aantal andere doelstellingen worden gebruikt. Het is daarom van essentieel belang dat democratische samenlevingen zoals de Verenigde Staten en Europa op dit gebied samenwerken en dit niet overlaten aan samenlevingen die de desbetreffende technologie gebruiken voor spionage of grootschalig toezicht op hun bevolking.
Deze democratische controle moet ook vanuit het Europees Parlement kunnen plaatsvinden. Dit is van groot belang om het draagvlak verder te versterken.
"
Kathleen VAN BREMPT,2021-10-07,EN,The case of Paul Rusesabagina in Rwanda,https://www.europarl.europa.eu/doceo/document/CRE-9-2021-10-07-INT-4-087-0000_EN.html,"  Kathleen Van Brempt,  author. – Mr President, today we are voting, for the second time in less than a year, on a resolution on the case of Paul Rusesabagina. In the first resolution, last February, the European Parliament denounced his abduction and subsequent torture. We called for an international investigation into his transfer and arrest and for Rwanda to guarantee that Mr Rusesabagina would receive a fair trial.
Well colleagues, today we stand here again because he didn’t receive that fair trial. This was confirmed by the Belgian Foreign Ministry, the US State Department and numerous organisations that monitored this trial. Paul Rusesabagina was forced to make confessions under torture and isolation without the presence of a lawyer, and he only received access to his court documents three days before the start of the trial, a document of more than 3 000 pages. His lawyers and family were intimidated and his co—defendants were put under pressure to testify against him. Key witnesses were not cross-examined or put under oath, even though they gave conflicting statements.
Therefore, we, the European Parliament, ask for the humanitarian release and repatriation of Paul Rusesabagina. The prison sentence of more than 25 years de facto is a death sentence. Mr Rusesabagina is 62 years old and a cancer survivor, and he needs care. Finally, and maybe most importantly, he’s a Belgian – a European citizen – and a US resident. This means that we are responsible for his fundamental human rights, and we have seen that these rights are being firmly violated by Rwanda. Therefore, we ask the EEAS and the Member States to do everything within their power to get Paul Rusesabagina to safety.
"
Kathleen VAN BREMPT,2021-09-14,NL,Presentation of the Fit for 55 package after the publication of the IPCC report (debate),https://www.europarl.europa.eu/doceo/document/CRE-9-2021-09-14-INT-2-045-0000_NL.html,"  Kathleen Van Brempt (S&D).   – Voorzitter, het “Klaar voor 55”-pakket is het eerste, daadwerkelijk concrete voorstel dat naar aanleiding van de Green Deal en de klimaatwet tot stand is gekomen. In dit voorstel wordt een duidelijk, samenhangend pakket voorgesteld met het oog op de verwezenlijking van de doelstelling. Ik wil de Commissie hier dan ook uitdrukkelijk voor bedanken.
Voorts wil ik beklemtonen dat het Parlement een verpletterende verantwoordelijkheid heeft om dit pakket te steunen, waar mogelijk te versterken en vooral het daarin aanwezige evenwicht tussen de verschillende sectoren en de rechtvaardige verdeling ervan te waarborgen. Ik zal dan ook met ontzettend veel enthousiasme aan dit pakket meewerken.
Eén van de uitdagingen is dat de regels voor onze producten voor alle producten moeten gelden, of deze nu op onze markt gemaakt zijn of geïmporteerd worden. Daarom zijn de uitbreidingen in verband met het ETS, het maritieme verhaal en uiteraard het mechanisme voor koolstofgrenscorrectie cruciaal.
Hierbij moeten we ook onze internationale verantwoordelijkheid in acht nemen. We moeten extra aandacht schenken aan onze kwetsbare partners, zoals Afrika, en zullen op dat gebied meer inspanningen moeten leveren.
"
Kathleen VAN BREMPT,2021-09-14,NL,A new EU-China strategy (debate),https://www.europarl.europa.eu/doceo/document/CRE-9-2021-09-14-INT-2-320-0000_NL.html,"  Kathleen Van Brempt (S&D).   – Voorzitter, eerst en vooral een dikke proficiat aan Hilde voor dit verslag. Ze is erin geslaagd een duidelijk standpunt te verwoorden met een kamerbrede meerderheid. Dat is fantastisch. Tegelijkertijd moeten we ook toegeven dat we misschien een beetje te laat zijn met dit duidelijke standpunt. Veel te lang zijn we gewoon heel erg naïef geweest. We hebben lang gedacht dat China wel zou democratiseren en volgens de regels zou spelen. Niets is minder waar.
Daarom, mevrouw de commissaris, wil ik vandaag de nadruk leggen op onze eigen initiatieven en alles wat we doen rond handelsbescherming, buitenlandse investeringen en buitenlandse subsidies. We moeten oneerlijke praktijken heel hard aanpakken en tegelijkertijd de link leggen met de mensenrechten, de Oeigoeren en dwangarbeid. Het moet mij van het hart, mevrouw de commissaris, dat het initiatief inzake zorgvuldigheid te lang op zich laat wachten. We moeten er nu aan beginnen.
Ten slotte is het ook tijd dat we aan Taiwan een duidelijk signaal geven dat we achter hen staan en dat we willen beginnen met de onderhandelingen over de investeringsovereenkomst.
"
Kathleen VAN BREMPT,2021-07-08,NL,Labour rights in Bangladesh (debate),https://www.europarl.europa.eu/doceo/document/CRE-9-2021-07-08-INT-4-026-0000_NL.html,"  Kathleen Van Brempt (S&D).   – Voorzitter, mevrouw de commissaris, het zal u niet verbazen dat het respecteren van arbeidsrechten én IAO-verdragen voor mijn fractie van essentieel belang zijn. Het is al door heel velen aangehaald: er is nog ontzettend veel werk in Bangladesh.
Er wordt samengewerkt met de IAO en met de Europese Commissie. Mevrouw de commissaris, u hebt al een aantal dingen gezegd rond het nationale actieplan. Maar ik denk dat het duidelijk moet zijn voor dit Parlement – dat hoor je ook bij alle tussenkomsten – dat wij echte garanties willen voor de uitroeiing van kinderarbeid, dat de vrijheid van vereniging wordt gerespecteerd, dat niet alleen arbeidsrecht maar ook veiligheidsvoorschriften echt worden geïmplementeerd. En wat dat betreft, zitten we nog een beetje op onze honger en wachten we op echte engagementen. Het is heel belangrijk dat het Parlement daar een goede evaluatie van kan maken.
Als we kijken naar het akkoord, hebben we reden tot grote ongerustheid. Het loopt af en we hebben geen zicht op een permanent en bindend alternatief. En laat het duidelijk zijn, terugkeren naar een systeem van zelfmonitoring is uit den boze. Dat heeft ook niet gewerkt. De reden waarom dat drama heeft kunnen plaatsvinden, is omdat men gewerkt heeft met zelfmonitoring.
Tot slot – en dat wil ik heel erg benadrukken – moeten we ook naar onszelf en onze eigen verantwoordelijkheid kijken. We hebben toch gezien dat in volle covidtijd westerse bedrijven heel wat bestellingen geannuleerd hebben van producten die al gemaakt waren door al die mensen. En dat heeft ontzettend negatieve effecten gehad. Echte, bindende zorgvuldigheidswetgeving zal straks dus essentieel zijn om onze eigen verantwoordelijkheid te nemen.
"
Kathleen VAN BREMPT,2021-07-08,NL,The case of Ahmadreza Djalali in Iran,https://www.europarl.europa.eu/doceo/document/CRE-9-2021-07-08-INT-4-077-0000_NL.html,"  Kathleen Van Brempt,  namens de S&D-Fractie. – Voorzitter, mevrouw de commissaris, de harde waarheid is dat als we niets doen, dr. Djalali zal sterven, hetzij door onophoudelijke martelingen, honger, ontbering, hetzij door executie door het Iraanse regime. En dat is onaanvaardbaar!
De heer Djalali is een burger van de Europese Unie. Hij is verbonden met de Belgische, de Zweedse en de Italiaanse samenleving, hij is professor aan de Vrije Universiteit Brussel, en zijn veiligheid is onze verantwoordelijkheid. En dat moeten we heel duidelijk laten voelen aan het Iraanse regime. Niet enkel met een telefoontje hier of daar. Als de heer Djalali niet wordt overgebracht naar zijn familie in Europa, dan moeten er repercussies komen. Doen we dat niet, dan zeggen we eigenlijk dat het oké is om Europese burgers ter dood te veroordelen. Het Europees Parlement verwacht daarom kordate actie van de Commissie en de Raad. 
En zoals mijn fijne collega Hilde zei: “Free Djalali!”
"
Kathleen VAN BREMPT,2021-07-08,NL,"Hong Kong, notably the case of Apple Daily",https://www.europarl.europa.eu/doceo/document/CRE-9-2021-07-08-INT-4-115-0000_NL.html,"  Kathleen Van Brempt (S&D).   – Voorzitter, ik denk dat we allemaal met grote afschuw kijken naar wat er zich in Hongkong afspeelt. Van het democratische regime dat Hongkong ooit was, schiet niets meer over. Onder het mom van nationale veiligheid worden de rechten van de bevolking alsmaar meer ingeperkt, met het de facto opheffen van de persvrijheid als het absolute, trieste dieptepunt. Geen democratie meer. En wij in de EU hebben dat wel laten gebeuren.
We stood by, we watched and we did nothing.
We hebben met andere woorden de bevolking van Hongkong in de steek gelaten.
We weten allemaal dat het regime in China nu naar Taiwan kijkt. Gaan we hetzelfde doen? Gaan we woorden gebruiken, opkomen voor de democratie en de mensenrechten, en vervolgens niets doen? Ik stel voor dat de Commissie het geweer van schouder verandert en bijvoorbeeld met Taiwan begint te onderhandelen over een investeringsakkoord, om duidelijk te maken aan de wereld dat we niet ook de Taiwanezen in de steek gaan laten.
"
Kathleen VAN BREMPT,2021-07-07,NL,Conclusions of the European Council meeting of 24-25 June 2021 (debate),https://www.europarl.europa.eu/doceo/document/CRE-9-2021-07-07-INT-3-061-0000_NL.html,"  Kathleen Van Brempt (S&D).   – Voorzitter, we zijn het er hopelijk allemaal over eens dat samenwerking en solidariteit de basis van het Europese project vormen. Dit zijn dan ook precies de waarden die we nodig hebben om de pandemie wereldwijd aan te pakken. We zullen pas veilig zijn als iedereen veilig is. Hoeveel collega’s hebben dat al niet gezegd?
De Commissie en de Raad lijken op dit vlak echter geen actie te ondernemen en ook in de conclusies van de Raad lijken de nodige maatregelen te ontbreken. De kwestie is in de inleiding van voorzitter Michel niet eens ter sprake gekomen.
Er wordt momenteel maar een fractie geproduceerd van de vaccins die we nodig hebben om de pandemie wereldwijd aan te pakken. Het IMF en de Wereldbank hebben een voorstel gedaan om een investeringsmechanisme in het leven te roepen waarmee de wereldwijde productie daadwerkelijk kan worden opgevoerd. Ook hierover heeft de Raad echter niet veel te zeggen.
Bijna alle landen in de wereld staan achter de opheffing van de intellectuele-eigendomsrechten om ervoor te zorgen dat er genoeg vaccins kunnen worden geproduceerd. De Commissie blokkeert op dit moment echter de onderhandelingen hierover in de Wereldhandelsorganisatie en speelt daarmee geen goede rol.
We hebben meer samenwerking en minder blokkering nodig om de pandemie wereldwijd aan te pakken.
"
Kathleen VAN BREMPT,2021-07-05,EN,Trade-related aspects and implications of COVID-19 (short presentation),https://www.europarl.europa.eu/doceo/document/CRE-9-2021-07-05-INT-1-141-0000_EN.html,"  Kathleen Van Brempt, rapporteur. – Madam President, when the world recovered in the last century from two world wars it became clear that international trade policy would become the centre of recovery and it brought us a full century of prosperity. Today, we are recovering from a pandemic and are heading towards the same direction, putting trade at the centre of recovery. But we have to take care that we do it in a different way, that we make sure that the 21st century recovery and stability put sustainability at the centre, and that is why European trade policy should change.
With this pandemic, we saw the face of biodiversity degradation and what will increasingly happen if we do not make sure that our economy becomes climate neutral. Our global actions cannot be limited to statements and non-binding commitments on big conferences. International trade policy in Europe needs to walk the talk of the Green Deal. This means for instance that we need to bring an end to fossil fuels, that green goods need to receive preferential treatment over brown goods and it means that the trade and sustainable development (TSD) chapters become really sanction-based.
During the crisis we also saw the decline of multilateralism. While our healthcare workers around the world had to combat a dangerous virus, governments struggled to buy personal protective equipment and basic medicines. Prices surged and there was no transparency on available stocks and production capacity. Weakened already by the Trump Presidency, the World Trade Organization and the World Health Organization struggled to come up with real answers and instead national responses took over, with dramatic export bans and disrupted supply chains.
Next time when the world faces a new pandemic, cooperation should be the first answer, not the last one, with strong international bodies to take on leadership. In this report, the European Parliament asks for strong support for an international pandemic treaty with a real and very robust trade pillar. We ask to establish a trade and health committee in the Twelfth Ministerial Conference (MC12). 
More than ever, we also faced global inequalities. While the West was in lockdown, workers in the East were working around the clock to make our face masks – unprotected and with hunger wages for their services to the world. And while the economic figures are arriving in Europe, we see that women in Africa are struggling to make a living in their micro-businesses, with debt and inflation just around the corner. That’s why we need mandatory due diligence across the supply chain, and fair and ethical trade schemes.
While the EU is a producer of the most vaccines in the world and an exporter, we see that the bulk of these productions go to G20 countries. Europe’s global vaccination strategy is not guided by political leadership, but by companies. At a time of crisis the rest of the world needs to know that they can count on Europe. 
This is a staunch warning not to isolate ourselves in the current discussion on intellectual property rights. Go and set yourselves at the right side of history. Of course at the same time we need to be assertive towards countries which undermine human rights and rule-based trade and democracy. A ban on products made with forced labour, an upgraded trade defence toolbox, effective sanction mechanisms on human rights need to be in place before the European Parliament even can think of starting the ratification of the investment agreement with China. 
Dear colleagues, trade policy is the most powerful and the most important tool the EU has on the international stage. It is the lever which can unlock the Green Deal and Europe’s industrial strategy for a climate-neutral continent. It is the key to unlocking the economic potential of developing partners and bringing stability to our neighbourhoods. It is the vehicle with which Europe can forge alliances and use its economic power to tackle global changes and global challenges such as pandemics. We need to do that together.
"
Kathleen VAN BREMPT,2021-06-09,NL,Conclusions of the special meeting of the European Council on 24 and 25 May 2021 (debate),https://www.europarl.europa.eu/doceo/document/CRE-9-2021-06-09-INT-3-032-0000_NL.html,"  Kathleen Van Brempt (S&D).   – Voorzitter, mevrouw de voorzitter van de Commissie, meneer de voorzitter van de Raad. Mevrouw Von der Leyen, ik ga me toch onmiddellijk rechtstreeks tot u richten. U hebt in uw speech vandaag veel aandacht besteed aan de verantwoordelijkheid die de Europese Commissie wil en zal opnemen op het internationale toneel om ervoor te zorgen dat iedereen toegang heeft tot vaccins.
Helaas is de manier waarop de Commissie zich gedraagt in de wereldhandelsorganisaties door de onderhandelingen rond het opheffen van de patenten te boycotten, eigenlijk een manier om zich slecht te gedragen op het internationale toneel. Ik vind dat eigenlijk bijzonder erg. Uiteraard is de TRIPS waiver maar een van de elementen, maar het is wel een belangrijk element. We hebben vandaag een belangrijke stemming daarover. In het hart van de Europese democratie zal er gestemd worden over het tijdelijk opheffen van die TRIPS waiver. Ik zal me neerleggen bij die uitslag. Ik ga ervan uit dat de Commissie óók zal handelen naar de uitslag van die stemming vandaag.
"
