MP,Date,Language,Title,Url,Content
Martin HÄUSLING,2019-12-18,DE,Compatibility between the current EU - Mercosur Free Trade Agreement and the Commission's proposal for a European Green Deal (topical debate),https://www.europarl.europa.eu/doceo/document/CRE-9-2019-12-18-INT-3-373-0000_DE.html,"  Martin Häusling (Verts/ALE).   – Frau Präsidentin! Wenn wir einen Green Deal wollen, dann können wir dieses Abkommen nicht abschließen – das geht nicht.
Das Mandat kommt aus dem letzten Jahrhundert, das passt alles nicht mehr in die Zeit. Im Grunde genommen ist es das alte Abkommen: Rindfleisch, Soja gegen Maschinen, Autos und jetzt noch Dienstleistungen. Also müssten wir doch zumindest anfangen, neu zu verhandeln. Dann hat man jetzt obendrauf gesetzt: wunderbare Nachhaltigkeitskapitel und Kapitel zum Umweltschutz. Aber wenn das alles nicht sanktionsbewehrt ist, taugt das alles nichts.
Wir sehen doch, was Herr Bolsonaro für ein Politiker ist. Wir machen diesen Neofaschisten mit diesem Abkommen hoffähig. Er macht doch keinen Hehl daraus, dass er den Amazonas bald am liebsten abroden würde. Er macht doch keinen Hehl daraus, dass er das Klimaabkommen von Paris am liebsten in die Tonne schmeißen würde, und mit dem machen wir solche Deals? Da muss man sich doch fragen, ob sich die Europäische Union eigentlich mit ihren Menschenrechtsansätzen überhaupt noch ernst nimmt. 
Herr Kommissar, Sie haben mal gesagt: gleiche Standards. Wir können keine gleichen Standards haben, wenn wir unseren Bauern Auflagen machen – zu Recht mehr Auflagen machen – und gleichzeitig aus einem Land importieren, wo Umweltstandards gerade im landwirtschaftlichen Bereich überhaupt nichts taugen. 150 Pestizide sind da zugelassen, die europäischen Bauern verboten sind. Das ist kein Deal auf Augenhöhe mit unseren Bauern.
"
Martin HÄUSLING,2019-12-17,DE,EU Pollinators Initiative (debate),https://www.europarl.europa.eu/doceo/document/CRE-9-2019-12-17-INT-2-397-0000_DE.html,"  Martin Häusling,  im Namen der Verts/ALE-Fraktion. – Herr Präsident! Ich glaube, bei der Analyse sind wir uns einig: Wir haben es draußen mit einer stillen Katastrophe zu tun – 75 % der Insekten sind den letzten 20 Jahren verschwunden. Aber die Frage ist: Was folgt daraus?
Ich wundere mich immer auch beim Green Deal, dass gesagt wird: Wir wollen die Ziele erreichen, wollen aber in der Agrarpolitik nichts ändern. Das wird nicht funktionieren. Wir müssen diese Gemeinsame Agrarpolitik ändern. Wir brauchen wieder mehr Vielfalt auf dem Acker, wir müssen mehr für den Ökolandbau tun, wir müssen weniger Pestizide einsetzen, aber auch weniger Stickstoff. All das ist notwendig, und deshalb ärgert es mich, dass beim Green Deal ein klares Ziel für den Abbau oder die Einschränkung von Pestiziden verschwunden ist. 
Und deshalb ist es auch für mich unverständlich, warum immer noch mehrere Neonikotinoide zugelassen sind, warum wir jetzt wieder eine neue Diskussion um Glyphosat bekommen. All das gehört nicht mehr in die landwirtschaftliche Praxis. Das sind Sachen von gestern, mit denen können wir in Zukunft nicht mehr arbeiten, wenn wir wirklich etwas erreichen wollen. 
Mich ärgert auch, dass wir auf der einen Seite Neonikotinoide verbieten und Mitgliedsstaaten Ausnahmegenehmigungen machen, wie gestern Belgien angekündigt hat, Neonikotinoide bei Zuckerrüben zuzulassen. Auch das können wir uns in Zukunft nicht mehr leisten.
Wir müssen auch darüber nachdenken, dass wir ein schärferes Zulassungsregime für Pestizide haben. Auch da muss sich einiges ändern, damit wir nicht Fehler machen wie bei vielen anderen Sachen, dass wir Pestizide nach Jahren vom Markt nehmen, die eigentlich nie hätten auf den Markt kommen dürfen.
"
Martin HÄUSLING,2019-12-17,DE,Animal welfare conditions during transport to third countries (debate),https://www.europarl.europa.eu/doceo/document/CRE-9-2019-12-17-INT-2-465-0000_DE.html,"  Martin Häusling (Verts/ALE).   – Frau Präsidentin! Das, was jetzt mit den 14 000 Schafen passiert ist, ist der Höhepunkt eines dauerhaften Skandals. Wir sehen jedes Jahr die Berichte von der bulgarisch-türkischen Grenze. Wir wissen sozusagen, was mit den Tiertransporten durch Europa passiert, weil man einen billigen Schlachthof irgendwo ansteuert. Das ist alles nicht neu. Mich ärgert, dass wir jedes Jahr hier die Debatte führen, dass wir letztes Jahr einen Bericht verabschiedet haben, aber scheinbar passiert überhaupt nichts.
Ich fürchte, auch jetzt wird wieder nichts passieren, weil einfach die Mitgliedstaaten keine Kontrollen durchführen. Die Mitgliedsländer schauen gezielt weg. Und ich muss auch sagen: Leider schaut auch die Kommission nicht genau hin. Wie kann denn das passieren, dass wir Gesetze haben, die systematisch nicht eingehalten werden, dass wir im Parlament Verschärfungen fordern, die aber vom Rat auch scheinbar völlig ignoriert werden? Das darf nicht mehr passieren. Es liegt aber auch an einem System von Landwirtschaft, das exportorientiert ist, wo man Überschüsse an Tieren exportiert, nur damit wir sie irgendwo billig verkaufen können. Auch das ist eine Ursache des Skandals.
"
Martin HÄUSLING,2019-11-13,DE,Situation in Chile (debate),https://www.europarl.europa.eu/doceo/document/CRE-9-2019-11-13-INT-1-226-0000_DE.html,"  Martin Häusling,  im Namen der Verts/ALE-Fraktion. – Frau Präsidentin! Zum ersten Mal seit der Pinochet-Diktatur stehen wieder Militärs in den Straßen von Santiago, und der Präsident ist scheinbar hoffnungslos überfordert, einen Dialog zu starten, weil er sich weigert, die wahren Ursachen dieser Krise auch wirklich in Angriff zu nehmen. Es ist nicht nur die Verfassungsfrage, es ist die Frage von extremer sozialer Ungleichheit in diesem Land. Ich selber bin seit zehn Jahren Mitglied der Delegation im Gemischten Parlamentarischen Ausschuss EU-Chile und habe das selber gesehen. Diese Unterschiede in der Gesellschaft sind so gravierend, dass 50 % der Bevölkerung nur 2,1 % des Volksvermögens besitzen. Das führt zu Ungleichheit, und das führt zu Rebellion. Das andere ist: Kein Land hat so viel privatisiert wie Chile – vom Wasser über Bildung, über Rente bis zum Gesundheitswesen. All das trifft die Armen in dieser Gesellschaft. Auch da muss Chile einen anderen Weg gehen.
Die Europäische Union hat immer gute Handelsbeziehungen gepflegt. Aber vielleicht sollten wir uns auch mal um die Menschenrechtssituation kümmern. Vielleicht sollten wir uns auch mal Konflikten wie mit den Mapuche widmen, um wirklich auch ernst genommen zu werden in einem Land, wo tatsächlich diese soziale Geschichte der größte Faktor von Unruhe ist. Wir können jetzt nicht weitermachen wie bisher und Abkommen verhandeln, sondern Europa muss die Rolle des Mittlers einnehmen. Das ist der Appell an Sie, Frau Mogherini.
"
Martin HÄUSLING,2019-09-16,DE,Patentability of plants and essential biological processes (debate),https://www.europarl.europa.eu/doceo/document/CRE-9-2019-09-16-INT-1-122-0000_DE.html,"  Martin Häusling,  im Namen der Verts/ALE-Fraktion. – Herr Präsident, liebe Kollegen! Es ist eigentlich sehr ärgerlich, dass wir uns hier jetzt schon zum dritten Mal damit auseinandersetzen müssen: Wir hatten 2012 eine Entschließung, 2015 und jetzt wieder, weil das Europäische Patentamt eigentlich das ignoriert, was wir politisch wollen, nämlich kein Patent auf Leben, kein Patent auf biologische Verfahren. Das Europäische Patentamt hat natürlich ein Interesse daran, Patente zu erteilen – das ist ja völlig klar –, ein wirtschaftliches Interesse. Aber hier muss die Politik, hier müssen wir sozusagen ins Rad greifen, und die Europäische Kommission muss jetzt wirklich sehr energisch Druck machen, denn es kann nicht sein, dass eine Institution die Beschlüsse des Gesetzgebers weitgehend ignoriert.
Wir haben jetzt wieder über Brokkoli und Tomaten zu entscheiden, aber das ist eine grundsätzliche Entscheidung: Wenn wir jetzt nicht den Bauern und den Kleinzüchtern das Recht geben, ihre Sorten zu nutzen, dann, und das müssen wir langfristig halt sehen, werden immer mehr Konzerne versuchen, ihre Patente anzumelden, ihre Rechte darauf zu sichern, und diejenigen, die es eigentlich am meisten brauchen, nämlich die Bauern und die Kleinzüchter, die verlieren dann ihre Rechte. Deshalb, liebe Kolleginnen und Kollegen, ist es jetzt wirklich entscheidend, an dieser Stelle klar zu sagen: Stopp, Europäisches Patentamt!
"
