MP,Date,Language,Title,Url,Content
Monika HOHLMEIER,2022-03-23,DE,"MFF 2021-2027: fight against oligarch structures, protection of EU funds from fraud and conflict of interest (debate)",https://www.europarl.europa.eu/doceo/document/CRE-9-2022-03-23-INT-1-280-0000_DE.html,"  Monika Hohlmeier,  stellvertretende Berichterstatterin. – Frau Präsidentin, liebe Kolleginnen und Kollegen, Herr Kommissar! Ich begrüße alle, die noch zu so später Zeit hiergeblieben sind, und freue mich, dass wir, wenn auch zu später Zeit, doch diesen sehr wichtigen Initiativbericht miteinander diskutieren. Wir finden innerhalb der Europäischen Union zunehmend oligarchische Strukturen, und auch außerhalb der Europäischen Union, an unseren Grenzen, existieren sehr gefährliche oligarchische Strukturen. Wir sind dafür nicht ausreichend gerüstet. Vielleicht deshalb, weil wir meistens glauben, mit gutem Willen zu arbeiten. Vielleicht auch deshalb, weil wir uns eher mit den positiven Dingen, der Förderung und der Unterstützung, befassen und weil wir auch Vertrauen haben in die nationalen Behörden – und weil wir manchmal dabei Faktoren übersehen, die doch ziemlich gefährlich sind.
Unter Oligarchentum verstehe ich oder versteht man landläufig die kriminelle Verquickung von Geschäftsleuten mit hochrangigen Politikern zur gegenseitigen illegitimen Bereicherung – und auch um gemeinsam Macht auszuüben in illegitimer Form. Dabei werden Binnenmarktregeln außer Kraft gesetzt, dabei werden Wettbewerber kriminell verdrängt und mit kriminellen Methoden bedrängt und aus dem Markt gebracht. Dabei gibt es einen systemischen Betrug bei Ausschreibungen. Man findet eine bemerkenswerte Konzentration von Fördermitteln bei bestimmten Einzelpersonen.
Und wir haben nicht einmal die Möglichkeit, digital relativ rasch zurückverfolgen zu können, an welche Wirtschaftsberechtigten Geld oder Förderungen gegangen sind, welche Wirtschaftsberechtigte hinter entsprechenden Förderungen stehen. Wir haben bedauerlicherweise auch in etlichen unserer Fonds, im Besonderen auch im landwirtschaftlichen Bereich, teilweise noch Möglichkeiten, dass es keinerlei Obergrenzen für die Förderungen gibt, auch nicht für die dauerhaften Förderungen. Das ist etwas, wo der Haushaltskontrollausschuss sich vehement dafür eingesetzt hat, dass wir solche Obergrenzen bilden. Denn das Geld soll an die Breite und zum Vorteil der Breite der Bevölkerung gehen. Der Steuerzahler muss wissen, an wen das Geld geht, wofür an jemand das Geld geht, welche Projekte gefördert werden, und das muss lückenlos rückverfolgbar sein.
Wir brauchen also endlich das, was wir miteinander diskutiert haben. Die Kommission nähert sich schrittweise, aber alle Schritte sind bis jetzt freiwillig. Es gibt keine verpflichtende interoperable Datenbank, in der man einfach – ich sage jetzt mal, auf Knopfdruck – zurückverfolgen könnte, wer hat wie viel wofür bekommen? Wer steht hinter einer Firma? Wie setzen sich Firmen zusammen?
Es gibt nach wie vor intransparente Firmenkonstrukte, die kaum nachverfolgbar sind. Es gibt Strohmänner und Strohfrauen, die entsprechend versuchen, sich auch über europäisches Geld herzumachen oder insgesamt über Geld europäischer Steuerzahlerinnen und Steuerzahler. Und deshalb, lieber Herr Kommissar, ist es auch wichtig, dass wir den Konditionalitätsmechanismus, wenn wir solche Strukturen entdecken, entsprechend auch anwenden – und zwar mit Konsequenz anwenden. Dass wir dort, wo wir erleben, dass Oligarchen, Politiker auch mit organisierter Kriminalität gemeinsame Sachen machen, konsequentest und härtest einschreiten und die Europäische Staatsanwaltschaft entsprechend ausstatten. Dass wir aber auch mit großer Konsequenz endlich die Möglichkeit haben, digital zurückzuverfolgen, wer bekommt warum wie viel Geld?
So viel ist das doch eigentlich gar nicht verlangt. Wenn wir digital an der Spitze der Welt stehen wollen, dann muss es doch wenigstens möglich sein, unsere Fördergelder bis zu den Wirtschaftsberechtigten endlich mal zurückverfolgen zu können. Das sollte nicht an nationalen Stellen scheitern, und wir müssen auch wissen, ob nationale Stellen überhaupt legitim und ordnungsgemäß ausgestattet sind, geschweige denn, ordnungsgemäß arbeiten wollen. Ich bedanke mich bei Petri Sarvamaa für den hervorragenden Bericht und bei der Frau Präsidentin, dass sie mich nicht gleich gestoppt hat.
"
Monika HOHLMEIER,2022-03-23,DE,"MFF 2021-2027: fight against oligarch structures, protection of EU funds from fraud and conflict of interest (debate)",https://www.europarl.europa.eu/doceo/document/CRE-9-2022-03-23-INT-1-300-0000_DE.html,"  Monika Hohlmeier,  stellvertretende Berichterstatterin. – Frau Präsidentin, Herr Kommissar! Liebe Kolleginnen und Kollegen, die ihr jetzt noch zu später Stunde verblieben seid! Vielen herzlichen Dank dafür.
Oligarchische Strukturen sind ein strukturelles Problem. Das kann man nicht durch irgendwelche öffentlichen Anklagen nur gegen Einzelpersonen klären, sondern man muss die Strukturen verändern. Oligarchische Strukturen werden verhindert, indem man mehr Transparenz schafft in bestimmten Bereichen. Die Transparenz bei der Beobachtung, wo welche Gelder der Europäischen Union hingehen, ist schlicht und einfach aufgrund nationalen Widerstands und Widerstands der Mitgliedstaaten bis heute leider nicht vollständig gegeben. Wir müssen uns vielfach auf nationale Behörden verlassen, und wenn die nationalen Behörden nicht richtig funktionieren bzw. vielleicht auch historische korruptive Zustände vorherrschen, dann sind wir derzeit nicht in der Lage, diese Strukturen frühzeitig und rasch genug zu durchblicken und zu verhindern, dass es zum Beispiel zu einer unmäßigen Zusammenballung und Bevorzugung, zu Unterbrechungen, zum Beispiel bei Ausschreibungen kommt – dass immer wieder dieselben auftauchen, die sich dann entsprechend bereichern können, dass Ausschreibungsverfahren unterlaufen werden, dass es dabei zum Beispiel systemischen Betrug gibt. Wir müssen uns tatsächlich besser aufstellen.
Ich möchte aber auch gerade an die Adresse derjenigen, die hier gerade von links gesprochen haben, sagen, es würde auch dazu beitragen, wenn man die Wahrheit sagt. Man muss nüchtern sagen: Die Verhaftung von Bojko Borissow war nicht rechtsstaatlich. Sie wurde ohne Richter, sie wurde ohne Staatsanwälte vorgenommen – und dann stelle man sich einmal vor, Bojko Borissow hätte in seiner Zeit einfach durch die Polizei den sozialistischen Oppositionsführer verhaften lassen. Da wäre aber was los gewesen, da hätten Sie sich hingestellt und hätten wüst geschimpft.
Wenn man den Rechtsstaat erhalten will und Korruption bekämpfen will, muss man sich selber an Regeln und Gesetze halten – Punkt. Und egal, wen man anklagt, da ist der Bürger und der Regierungschef gleich: Wir brauchen die Beweise, wir brauchen Ermittlungen, wir brauchen den Rückhalt für die Europäische Staatsanwaltschaft, ihre Arbeit zu machen. Und diese Verhaftungen – um es auch noch einmal deutlich zu sagen – standen nicht in Zusammenhang mit den 120 Fällen. Das hat das Innenministerium inzwischen eingeräumt, das ist definitiv falsch. Aber lasst doch mal endlich die europäische Staatsanwältin ihre Arbeit machen. Wir brauchen sie, sie braucht Personal, sie braucht Unterstützung. Und danke, Herr Kommissar, dass sie das endlich bekommt.
"
Monika HOHLMEIER,2021-12-13,DE,The impact of organised crime on own resources of the EU and on the misuse of EU funds (short presentation),https://www.europarl.europa.eu/doceo/document/CRE-9-2021-12-13-INT-1-138-0000_DE.html,"  Monika Hohlmeier,  in Vertretung des Berichterstatters. – Frau Präsidentin, Frau Kommissarin, liebe Kolleginnen und Kollegen! Im Namen von Tomáš Zdechovský darf ich heute sozusagen die Einleitung zu einem wichtigen Initiativbericht geben, der sich damit befasst, wie EU-Fonds, im Besonderen im Bereich der geteilten Mittelverwaltung, von der organisierten Kriminalität genutzt und für ihre Zwecke eingesetzt werden. Denn überall dort, wo es Geld gibt, gibt es natürlich auch Interessen der organisierten Kriminalität. 
Man möchte gar nicht denken, in welchen Bereichen die organisierte Kriminalität alles tätig ist. Der Haushaltskontrollausschuss hat diesbezüglich vielfältige Aktivitäten identifizieren und mit den zuständigen Behörden diskutieren können. Es beginnt bei den Landwirtschaftsfonds, geht weiter über die Kohäsionsfonds und betrifft Förderungen unterschiedlichster Art. Es betrifft vor allem Ausschreibungen, in denen zum Teil nur ein Bieter oder gar kein Bieter zu finden ist und trotzdem dann entsprechende Vergaben getätigt werden. Es betrifft zum Teil Verbindungen in politische Bereiche hinein. 
Dann hat es – liebe Frau Kommissarin, Sie wissen das sehr gut – sowohl beim Verkauf von Fake-Impfstoffen als auch beim Verkauf von Fake-Schutzmaterial vielfältige Versuche in Milliardenhöhe gegeben, um hier die Notlage sowohl medizinischer als auch menschlicher Art in den verschiedenen Mitgliedstaaten entsprechend auszunutzen. 
Insofern ist organisierte Kriminalität bedauerlicherweise zu einem ständigen Bestandteil der Arbeit des Haushaltskontrollausschusses geworden, weil überall dort, wo potenziell Geld vergeben wird, natürlich ein entsprechendes Interesse vorhanden ist. Aus diesem Grund liegen dem Haushaltskontrollausschuss mehrere Maßnahmen außerordentlich am Herzen. 
Erstens: Die Europäische Staatsanwaltschaft muss durch die Mitgliedstaaten so unterstützt werden, dass sie effektiv grenzüberschreitend arbeiten kann, um die grenzüberschreitenden Aktivitäten organisierter Kriminalität aufzudecken, zu ahnden bzw. entsprechende Ermittlungen starten und effektiv durchführen zu können. Es braucht eine effektive Umsetzung der PIF-Richtlinie durch die Mitgliedstaaten, um entsprechend auch Betrug bzw. Ausnutzung durch organisierte Kriminalität frühzeitig zu vermeiden. 
Wir brauchen endlich ein digitales System zur Rückverfolgung von europäischen Geldern bis hin zum Wirtschaftsberechtigten, damit wir wissen, wo fließt das Geld hin, wer erhält das Geld und welche Personen stecken konkret hinter Organisationen bzw. auch Firmen. Das sind zum größten Teil ganz normale Firmen, aber es gibt auch Tarnfirmen. Erst kürzlich haben wir wieder eine Tarnfirma identifiziert, die für terroristische Zwecke, also auch für organisierte Kriminalität gearbeitet hat und entsprechend europäische Mittel erlangt hat bzw. sich europäische Mittel zunutze gemacht hat. 
Wir haben inzwischen auch ein sogenanntes risk scoring tool, das Arachne-System, eine IT-Plattform, die alle Mitgliedstaaten nutzen könnten. Und es sollte verpflichtend werden, dass alle Daten entsprechend eingetragen bzw. von dieser Plattform automatisch in den Mitgliedstaaten abgegriffen werden können, damit Auditoren und Kontrolleure sofort und unmittelbar wissen, wo Gelder der Europäischen Union hingegangen sind, und Prüfungen deutlich schneller und effizienter durchgeführt werden können, als das bisher der Fall ist. 
Die Antibetrugsbehörde OLAF ist eine hervorragende Einrichtung. Sie leistet exzellente Arbeit. Sie muss von den Mitgliedstaaten besser und schneller unterstützt werden, und die Beweismittel müssen vor Gericht nutzbar sein. Des Weiteren ist es erforderlich, dass es zu einem Abgleich mit z. B. sogenannten Antimafialisten kommt und dass die Koordination und Kooperation zwischen den Ämtern deutlich besser werden, um rascher und präziser zu identifizieren, wenn Verbrecher versuchen, sich Staatsgelder oder europäische Gelder zunutze zu machen. 
Mit diesem Bericht versucht Tomáš Zdechovský gemeinsam mit dem Haushaltskontrollausschuss, einen Bericht vorzulegen, der uns in dieser Arbeit, im Kampf gegen organisierte Kriminalität, die Betrug gegen europäische Mittel begeht, voranbringt.
"
Monika HOHLMEIER,2021-11-24,DE,"Fundamental rights and the rule of law in Slovenia, in particular the delayed nomination of EPPO prosecutors (debate)",https://www.europarl.europa.eu/doceo/document/CRE-9-2021-11-24-INT-3-271-0000_DE.html,"  Monika Hohlmeier (PPE).   – Lieber Herr Präsident, Herr Kommissar, sehr geehrter Herr Minister, liebe Kolleginnen und Kollegen! Ich probier's mal nicht mit Schimpfen und Beklagen, sondern einfach damit, dass wir in Bezug auf die Europäische Staatsanwaltschaft überzeugen. 
Erst seit fünf Monaten ist sie operativ tätig, Herr Kommissar, und sie hat bereits 400 Ermittlungsverfahren eingeleitet, und die Fälle entsprechen einem Schaden in einer Größenordnung von 5 Milliarden Euro. Slowenien ist der Staatsanwaltschaft beigetreten, andere Länder sind dies nicht. Das Benennungsverfahren war vielleicht nicht glücklich und war auch nicht richtig. Ich hoffe, dass die Staatsanwälte, die jetzt benannt sind, tatsächlich die dauerhaften Partner sind und damit die Frage erledigt ist. 
Das, was mich aber nach wie vor ärgert, ist, dass es einige gibt, die nicht daran teilnehmen und darunter auch Länder wie z. B. Schweden, die nicht dabei sind. Wir müssen aufpassen, dass wir die Diskussion nicht zu sehr verschieben: genauso Länder wie Ungarn, genauso Länder wie Polen, die schlicht und einfach ihre Option wahrnehmen – aber ich halte es nicht für klug. 
Denn wenn ich mir anschaue, dass wir alleine in fünf Monaten grenzüberschreitende Ermittlungen zu 5 Milliarden Euro Schaden tätigen können, fordere ich alle Länder auf, dem EPPO beizutreten. Ich fordere alle auf, schnell ihre Staatsanwälte zu benennen. Ich fordere die nationalen Staatsanwaltschaften auf, eng zu kooperieren. Denn das, was der EPPO in kurzer Zeit bereits angegangen hat, bedeutet, dass der EPPO viel mehr, als er jemals kostet oder als wir mit nationalen Staatsanwaltschaften reinbekommen können, am Ende tatsächlich bereits heute angeht. Das ist das, worum es eigentlich geht. 
Wir müssen gemeinsam die Europäische Staatsanwaltschaft vorantreiben. Slowenien tut es mittlerweile auch. Wie gesagt, das Verfahren empfand ich als äußerst unglücklich. Aber ich hoffe, dass wir jetzt auf einem guten Weg sind. Und jetzt muss es darum gehen, dass alle anderen auch noch teilnehmen, die dies derzeit nicht tun. 
"
Monika HOHLMEIER,2021-11-24,DE,Presentation of the Court of Auditors' annual report 2020 (debate),https://www.europarl.europa.eu/doceo/document/CRE-9-2021-11-24-INT-3-328-0000_DE.html,"  Monika Hohlmeier (PPE).   – Frau Präsidentin! Lieber Präsident des Europäischen Rechnungshofes, lieber Klaus—Heiner Lehne, aber auch ECA-Mitglied Tony Murphy, die gleich beide heute Abend zu uns gekommen sind, liebe Frau Kommissarin, liebe Kolleginnen und Kollegen! Wir diskutieren hier öfter über die ganzen Fehlerraten und Fehlerquoten. Ich möchte zunächst einmal ein herzliches Dankeschön an den Rechnungshof aussprechen, dass er wieder sehr klar formuliert hat, wo die Kernprobleme liegen, die wir in unserem Haushalt haben. 
Wenn ich mir den ersten Bereich des sogenannten shared management ansehe, dann treffen wir wiederholt auf das Problem, dass nationale Behörden in Teilbereichen und in Teilen unserer Mitgliedstaaten schlicht und einfach nicht zuverlässig sind und dass wir uns nicht darauf verlassen können. Das wiederholen wir fast jedes Jahr. Deshalb geht meine dringende Bitte an die Kommission, hier endlich ein nachhaltiges Modell zu schaffen. Kurzfristige Task Forces oder kurzfristige Beratungsfirmen helfen schlicht und einfach nicht, weil die Probleme immer wieder auftreten.
Und wenn es dann, wie zum Beispiel im Donaudelta oder auch in Bulgarien, bei den Gästehäusern oder in ein paar anderen Bereichen zu Fehlerquoten von nicht gerade 4 %, sondern bis zu 80 %, 90 % kommt, dann wird mir schlicht und einfach schlecht. Und wenn das Ganze dann noch perpetuiert stattfindet, dann wird mir noch schlechter. 
Andere Bereiche hingegen funktionieren wunderbar und funktionieren gut, und darauf muss man auch ausdrücklich hinweisen.
Was mir noch Sorgen macht, ist der Bereich von kleinen und mittleren Unternehmen im Bereich der Wettbewerbsfähigkeit, die zum Teil überfordert sind mit den komplexen Regeln und die nachdrückliche Unterstützung brauchen. Gerade Start-ups können sich meistens komplizierte Rechtsfirmen nicht leisten, um die ganzen Konstruktionen zu durchdringen, die sie auszufüllen haben, und damit sie entsprechend das Geld bekommen. 
Und letzter Punkt: An die gut funktionierenden Mitgliedstaaten würde ich doch einmal die Empfehlung richten, ob gold-plating heutzutage wirklich noch angesagt ist oder ob man vielleicht die Zugänglichkeit für die entsprechenden Unternehmen oder auch für Universitäten und Ähnliches so gestaltet, dass nicht jeder erschrickt vor europäischen Regeln. 
"
Monika HOHLMEIER,2021-11-22,DE,The revision of the Financial Regulation in view of the entry into force of the 2021-2027 multiannual financial framework (debate),https://www.europarl.europa.eu/doceo/document/CRE-9-2021-11-22-INT-1-095-0000_DE.html,"  Monika Hohlmeier,  Berichterstatterin. – Herr Präsident, Herr Kommissar, liebe Kolleginnen und Kollegen! Ganz zu Beginn darf ich einen ganz herzlichen Dank an meinen Mitberichterstatter – an Dich, lieber Nils – aussprechen für die hervorragende Zusammenarbeit und sehr, sehr gute Kooperation, aber genauso an alle Schattenberichterstatter, die heute auch alle da sind. Ich freue mich, dass wir miteinander einen sehr guten Text ausgearbeitet haben und versucht haben, uns auf wichtige Schwerpunkte zu verständigen. 
Die Überarbeitung der Haushaltsordnung bietet die Möglichkeit, unsere Spielregeln für die Aufstellung, Verausgabung und Kontrolle des EU-Haushalts zu modernisieren und an neue Herausforderungen und Erkenntnisse anzupassen. Vor dem Hintergrund von 750 Milliarden an zusätzlichen Mitteln durch die Corona-Wiederaufbaufonds wie auch durch NextGenerationEU sind die Anforderungen an Transparenz und Überprüfbarkeit der Ausgaben stark gestiegen, zumal es sich in dem Bereich um eine Art Budget Support innerhalb der Europäischen Union handelt. 
Das heißt, das Geld geht in die Haushalte der Mitgliedstaaten, und der unmittelbare Einblick, was mit den Mitteln geschieht – das ist jetzt die Herausforderung, die vor uns liegt. 
Wir müssen uns dabei in Erinnerung rufen, dass das Europäische Parlament nicht immer in die Entscheidungsfindung eingebunden ist bzw. war, wie das Zustandekommen der Corona-Wiederaufbaufonds bzw. von NGEU zeigt. Dabei muss klar sein: Sobald der EU-Haushalt getroffen ist, muss das Parlament das volle Recht der Überprüfung von Ausgaben haben, sollte aber auch ein Gestaltungsrecht besitzen, wie das Geld ausgegeben wird, wie wir es neulich mit dem Haushaltsausschuss diskutiert haben.
Die überarbeitete Haushaltsordnung muss das widerspiegeln. Wir fordern deshalb die volle rechtliche Einbindung der externen zweckgebundenen Einnahmen in die Haushaltsordnung, welche jetzt in Form von NGEU massiv den EU-Haushalt erhöhen. Ein entscheidender Punkt aus Sicht der Haushaltskontrolle ist hier das Thema Digitalisierung und die bessere Rückverfolgbarkeit von EU-Mitteln. 
Lieber Herr Kommissar, ich weiß Sie – oder Dich – hinter uns in dieser Frage. Aber die Mitgliedstaaten, erstaunlichermaßen, die ständig von Digitalisierung reden, haben dann plötzlich Bedenken, wenn wir mal nachschauen wollen: Wo ist eigentlich das ganze Geld hingegangen? Es ist derzeit nämlich nicht möglich, einfach und schnell zu sehen, welcher Endbegünstigte insgesamt wieviel aus dem Fonds erhält – zum einen, weil es die Regeln aktuell nicht erfordern, dass die Endbegünstigten und deren Wirtschaftsberechtigte – und hier meine ich die natürlichen Personen, die hinter Firmen und Konglomeraten stehen und von deren Förderung profitieren – einheitlich erfasst werden. Wir wollen sehen können, ob jemand hinter 20 Firmen steht oder ob einfach ein kleines KMU tatsächlich die ihm real notwendige Hilfe erhält. 
Zum anderen ist es nicht möglich, einzelne Beträge unterschiedlicher Art, die dem gleichen oder einem Verwandten eines Wirtschaftsberechtigten zuzuordnen sind, zu einer Gesamtsumme zu aggregieren – zum Beispiel, wenn einzelne Personen oder Firmen Gelder aus unterschiedlichen Fonds erhalten, oder wenn mehrere Einzelzahlungen an Firmen, die zum gleichen Konglomerat oder zum selben Wirtschaftsberechtigten gehören, dann entsprechend nachzuverfolgen sind. 
Hier müssen wir dringend nachbessern. Daher fordern wir die Kommission auf, einen Vorschlag für ein interoperables IT-System vorzulegen, welches genau dies ermöglicht: per Knopfdruck zu zeigen, welche Endbegünstigten und deren Wirtschaftsberechtigte wieviel Geld aus dem EU-Haushalt tatsächlich erhalten. Denn dann ist es uns auch als Gesetzgeber möglich, bei neuen Richtlinien, bei neuen Gesetzen, zu überprüfen: Wie erfolgreich waren wir, wo gab es Probleme, wo gab es Schwierigkeiten, was war besonders gut gelungen, und dann die entsprechenden politischen Entscheidungen zu treffen. 
Die wichtigsten Daten, zum Beispiel Listen der größten Empfänger in jedem Mitgliedstaat, sollten auch der Öffentlichkeit zugänglich gemacht werden. Natürlich respektieren wir dabei die volle Rechtsprechung und die Wahrung des Datenschutzes entsprechend dem, was der EuGH bzw. die Gesetzgebung von uns verlangt. Dies würde es dann aber auch Journalisten, NGO und interessierten Bürgerinnen und Bürgern ermöglichen, nachzuverfolgen, wofür ihr Steuergeld ausgegeben wird, und Missstände leichter und klarer sichtbar machen. 
Eine starke Konzentration von EU-Fördermitteln in der Hand einiger weniger Oligarchen in manchen Mitgliedstaaten und/oder nepotistische Begünstigungen, Interessenkonflikte hochrangiger Entscheidungsträger und/oder gar Regierungsmitglieder, das sind die Dinge, die wir dringendst vermeiden müssen und wo wir frühzeitig für Transparenz sorgen müssen. 
Das ist aber auch nicht nur eine Frage der Transparenz; das sind wir einfach denjenigen schuldig, die die Steuern zahlen. Das sind nämlich nicht unbedingt immer nur reiche Menschen, die Steuern zahlen, sondern ganz normale Bürgerinnen und Bürger, die monatlich ihr Geld vorsichtig verdienen müssen und dann entsprechende Steuern zu bezahlen haben. Die lesen es nicht gerne, wenn dann Millionenbeträge an einzelne Begünstigte gehen. 
Ich glaube, wir haben hier mit der Haushaltsordnung einen wichtigen Auftrag vor uns: dafür Sorge zu tragen, dass die Gelder richtig ausgegeben werden und vernünftig ausgegeben werden.
"
Monika HOHLMEIER,2021-10-06,DE,"Pandora Papers: implications on the efforts to combat money laundering, tax evasion and avoidance (debate)",https://www.europarl.europa.eu/doceo/document/CRE-9-2021-10-06-INT-3-166-0000_DE.html,"  Monika Hohlmeier (PPE).   – Frau Präsidentin, Herr Kommissar, liebe Kolleginnen und Kollegen! Vor zwei Wochen hat die Kommission frische Zahlen für 2020 veröffentlicht, im sogenannten PIF-Bericht. Die Mehrwertsteuerlücke, und zwar die Differenz zwischen erwarteten Umsatzsteuereinnahmen und tatsächlich erhobener Umsatzsteuer, wirkt sich erheblich auf die finanziellen Interessen der Europäischen Union aus. Sie liegt für 2019 bei sage und schreibe 130 Milliarden. Europol schätzt die jährlichen Verluste allein durch grenzüberschreitenden Mehrwertsteuerbetrug auf 40 bis 60 Milliarden Euro.
Wir diskutieren hier zum zigsten Male. Wir haben Einkommensteuerbetrug, wir haben Körperschaftsteuerbetrug, wir kämpfen darum, dass wir in den zuständigen Agenturen ausreichend Personal bekommen. Da raufen wir uns dann um 20 Stellen, 30 Stellen, 40 Stellen, währenddessen sozusagen die Großen mit zig Milliarden davonkommen. Ich habe nicht gewusst, warum ein tschechischer Premier für ein französisches Haus oder ein Haus in Frankreich eine Offshore-Firma benötigt. Es scheint nicht unbedingt gerade der übliche Stil zu sein. Der Herr ist uns schon öfter aufgefallen in der Art und Weise, wie er sich europäische Mittel zunutze macht.
Lieber Herr Kommissar, wie wäre es, wenn wir endlich einmal erstens eine ausreichende Ausstattung für die Europäische Staatsanwaltschaft, für Europol und für Eurojust bekommen, sodass diese ihren Aufgaben auch in diesem Sektor besser nachkommen können? Wie wäre es damit, wenn endlich die Mitgliedstaaten, wenn ihre Financial Investigation Units nicht ihren Aufgaben nachkommen, auch mit äußerster Dringlichkeit von der Kommission zur Rechenschaft gezogen werden? Es müssen endlich Konsequenzen folgen, denn ansonsten denken die Leute: Die Kleinen werden aufgehängt, die Großen lässt man laufen.
"
