MP,Date,Language,Title,Url,Content
Monika HOHLMEIER,2020-12-16,DE,"Conclusions of the European Council meeting of 10-11 December 2020 – MFF, Rule of Law Conditionality and Own Resources – Council regulation laying down the multiannual financial framework for the years 2021 to 2027 – Proposal for an Interinstitutional Agreement between the European Parliament, the Council and the Commission on budgetary discipline, on cooperation in budgetary matters and on sound financial management, as well as on new own resources, including a roadmap towards the introduction of new own resources – Regulation on the protection of the Union’s budget in case of generalised deficiencies as regards the rule of law in the Member States (debate)",https://www.europarl.europa.eu/doceo/document/CRE-9-2020-12-16-INT-3-073-0000_DE.html,"  Monika Hohlmeier (PPE).   – Frau Präsidentin, Frau Kommissionspräsidentin, Herr Präsident, lieber Staatsminister Michael Roth, liebe Kolleginnen und Kollegen! Der Konditionalitätsmechanismus zum Schutz unserer finanziellen Mittel, aber letztendlich zum Schutz unserer Rechtsstaatlichkeit, ist ein historischer Schritt, und er ist ein riesiger politischer Erfolg für dieses Parlament. 
Ohne uns gäbe es diesen Konditionalitätsmechanismus nämlich nicht. Ich verlasse mich wirklich auf die Kommission, dass er direkt angewandt wird, und ich glaube auch daran, dass das so sein wird. Ich bitte den Rat, insgesamt mal in sich zu gehen, ob man solche Entwicklungen so lange anschaut, so lange beobachtet und so lange laufen lässt, wie das eigentlich bisher der Fall gewesen ist. Aber ich möchte heute klar sagen: Es ist ein großartiger Schritt, und es ist ein richtiger Schritt. Ich gehe davon aus, dass der EuGH wie beim Brexit rasch urteilen wird, sodass wir das Ganze sofort in die Umsetzung bringen können.
Ich möchte aber etwas hinzufügen: Die Kommission muss zurückverfolgen können, wie Mittel verwendet werden, in welcher Art und Weise sie verwendet werden, wo es Probleme gibt, wo vielleicht unter Umständen Menschen keinen Schutz von Rechtsstaatlichkeit haben, wo einseitig entschieden wird, wo Geld missbraucht wird, wo Menschen keine neutrale Staatsverwaltung finden, keine unabhängigen Richter finden, keine Klagemöglichkeiten usw. haben. In diesen Fällen brauchen wir endlich das digitale Zeitalter und müssen rauskommen aus dem Postkutschenzeitalter. Wir brauchen endlich ein digitales Monitoring-Reporting und ein entsprechendes IT-System beziehungsweise eine digitale Möglichkeit der Rückverfolgung von Geldern für die Kommission, damit wir endlich wissen, wer missbraucht, wer betrügt, damit wir auch künstliche Intelligenz einsetzen können und damit wir auch wissen, wer tatsächlich die Wirtschaftsberechtigten sind, wer die Gelder tatsächlich bekommt, welche Konzentrationen da ablaufen, wo etwas eventuell missbräuchlich stattfindet.
Wir wissen, dass es Milliardensummen sind, die da zum Teil missbraucht werden. Ich bitte den Rat, in sich zu gehen und endlich wegzukommen vom Postkutschenzeitalter. Sie lehnen derzeit noch das digitale System beziehungsweise eine Digitalisierung an sich ab. Das ist völlig anachronistisch. Ich bitte, dass der Rat unseren Vorschlägen entsprechend endlich zustimmt.
"
Monika HOHLMEIER,2020-07-09,DE,State of play of Council negotiations on the Regulation on the protection of the Union’s budget in case of generalised deficiencies as regards the rule of law in the Member States (debate),https://www.europarl.europa.eu/doceo/document/CRE-9-2020-07-09-INT-2-168-0000_DE.html,"  Monika Hohlmeier (PPE).   – Frau Präsidentin, lieber Herr Kommissar, liebe Kolleginnen und Kollegen! Was mir hier derzeit auffällt, ist, dass sich jeder ein Land herausnimmt, das ihm besonders missfällt. Das wäre aber ein grundlegendes Missverständnis von Rechtsstaatlichkeit. 
Rechtsstaatlichkeit bedeutet für mich, dass wir grundlegende Standards haben und dann, wenn diese Standards nicht eingehalten werden, auch die Möglichkeit erhalten, lieber Herr Kommissar, ohne Anschauen der Partei, der Person und des Landes konsequent Strafen aussprechen und Maßnahmen ergreifen zu können. Es ist mir völlig egal, ob es Herr Muscat ist, ob es Herr Orbán ist, ob es Herr Babiš ist – wir haben einige Problemfälle in unterschiedlichen Parteienfamilien. Wir haben unterschiedliche Probleme innerhalb der Rechtsstaatlichkeit.
Das, was wir zum Beispiel tun müssen – und ich möchte das sehr deutlich sagen –, ist: Wir müssen systemische Kontrollen durchführen, indem wir tatsächlich systematisch überprüfen, wie bestimmte Rechtsstaatlichkeitsmechanismen funktionieren, systemisch überprüfen, wie z. B. Ausschreibungen stattfinden und ob sie zugunsten von bestimmten Unternehmungen in bestimmten Umgebungen stattfinden. Wir müssen eine Offenlegung der Wirtschaftsberechtigten haben und mit einem Echtzeit-Informationssystem verbinden können, in dem es ernsthaft Sinn macht, tatsächlich alles nachprüfen zu können, nachschauen zu können und nicht mehr monatelang suchen zu müssen. 
Ich würde uns bitten, nicht parteipolitisch vorzugehen, sondern schlicht und einfach nach Standards und nach Maßnahmen. Dann sind wir glaubwürdig.
"
Monika HOHLMEIER,2020-07-08,DE,Conclusions of the European Council meeting of 19 June 2020 - Preparation of the European Council meeting of 17-18 July 2020 (debate),https://www.europarl.europa.eu/doceo/document/CRE-9-2020-07-08-INT-1-110-0000_DE.html,"  Monika Hohlmeier (PPE).   – Frau Präsidentin, Herr Vizepräsident der Kommission, liebe Kolleginnen und Kollegen! Nachdem wir ein Riesenpaket finanzieller Art vor uns haben, möchte ich auch sehr deutlich zum Ausdruck bringen, dass das Europäische Semester dafür nicht geeignet ist. Wir sehen derzeit bei der Rechtsstaatlichkeit, wie Mitgliedsstaaten teilweise mit Empfehlungen der Kommission umgehen. 
Wir brauchen konkrete Möglichkeiten, um auch als Europäisches Parlament die jeweiligen Zahlungsflüsse, die Art der Projekte, diejenigen, die das Geld bekommen, identifizieren und auch überprüfen zu können – ob das die Fachausschüsse aus fachlicher Sicht sind oder ob wir das im Haushaltskontrollausschuss aus finanzieller Sicht heraus sind.
Wir müssen herauskommen aus einer Art Postkutschenzeitalter im Bereich der Übermittlung von Daten, die den Finanz- und Haushaltsbereich anbelangen. Wir brauchen ein digitales Informationssystem, das in Echtzeit alle notwendigen Daten übermittelt und das im Besonderen auch die Wirtschaftsberechtigten öffentlich macht bzw. einsehbar macht, damit man nicht mehr, wie es bis heute der Fall ist, monatelang auf Informationen warten muss, regelrechte Rechercheaktionen starten muss, um adäquate Informationen über Projekte und deren Finanzierungen zu erhalten.
"
Monika HOHLMEIER,2020-07-08,DE,A comprehensive Union policy on preventing money laundering and terrorist financing – Commission's Action plan and other recent developments (debate),https://www.europarl.europa.eu/doceo/document/CRE-9-2020-07-08-INT-1-134-0000_DE.html,"  Monika Hohlmeier (PPE).   – Herr Präsident, Herr Kommissar, liebe deutsche Ratspräsidentschaft! Ich sehe mit einer gewissen Besorgnis, dass wir über Jahre hinweg vonseiten der Europäischen Kommission eine gewisse – sagen wir mal – Freundlichkeit gegenüber den Mitgliedstaaten gehabt haben, die sich daran gewöhnt hatten, Geldwäscherichtlinien nicht umzusetzen.
Bei der Geldwäscherichtlinie 3 hat es überhaupt keine Vertragsverletzungsverfahren gegeben. Bei der Geldwäscherichtlinie Nummer 4 sind eine ganz erkleckliche Menge von Mitgliedstaaten in den Standards hinter dem zurückgeblieben, was in der Geldwäscherichtlinie gefordert war. Bei der Nummer 5 melden vier immerhin überhaupt keine Umsetzung, und ein erheblicher Teil anderer meldet auch keine Umsetzung, nicht einmal die Hälfte der Mitgliedstaaten hat eine Umsetzung gemeldet.
Wir müssen einmal sehr strikt darangehen, dass die notwendige Transparenz, die notwendige Öffentlichkeit herrscht bzw. dass die Übermittlung an Behörden und von denjenigen, die wirtschaftlich berechtigt sind, erfolgt, dass wir auch Netzwerke nur dann aufdecken können, wenn wir wirklich die vollständige Umsetzung der Maßnahmen erreichen, die wir uns vorgenommen haben.
Liebe Kommission, ich bitte ganz herzlich darum, dass wir wirklich strikteste Nachverfolgung durchführen und kein Nachsehen mehr mit Mitgliedstaaten haben, die dem nicht nachkommen.
"
Monika HOHLMEIER,2020-06-18,DE,Announcement of voting results,https://www.europarl.europa.eu/doceo/document/CRE-9-2020-06-18-INT-2-186-0000_DE.html,"  Monika Hohlmeier (PPE).   – Herr Präsident, liebe Kolleginnen und Kollegen! Gleich werden wir über den Entschließungsantrag zur Wiederaufnahme der Ermittlungen gegen den Ministerpräsidenten der Tschechischen Republik aufgrund der missbräuchlichen Verwendung von EU-Mitteln und potenzieller Interessenkonflikte abstimmen.
Dieser Antrag wurde fraktionsübergreifend erarbeitet und stützt sich unter anderem auf Erkenntnisse der CONT-Dienstreise nach Tschechien. Dort haben sich unsere Sorgen erhärtet, dass in Tschechien kein funktionierendes System zur Vermeidung und Aufdeckung von Interessenkonflikten besteht. Systematische oder systemische Intransparenz und eine weitverzweigte Aufteilung an Zuständigkeiten erschweren eine effektive Kontrolle und Vermeidung von Interessenkonflikten enorm. 
Zudem scheint die höchste Prüfbehörde in ihrer Arbeit stark eingeschränkt zu sein. Die Freiheit der Medien wird zunehmend problematischer, und auf Beamte wird Druck ausgeübt. Die Kernbotschaft des Entschließungsantrags lautet: Sollte ein schwerwiegender Interessenkonflikt bestätigt werden, muss er umgehend gelöst werden. 
Hierzu bestehen im Grunde drei Möglichkeiten: Beseitigung des wirtschaftlichen Interesses, Ende des Bezugs von Subventionen oder Enthaltung bei Entscheidungen, die in irgendeiner Weise den Interessenkonflikt befördern können. Sollte dies nicht möglich sein, bleibt in der Konsequenz nur noch ein Rücktritt vom Amt. 
Ich empfehle daher, bei allen getrennten und gesonderten Abstimmungen mit „Plus“ abzustimmen, um die klare Botschaft des Antrags nicht zu schwächen. EU-Subventionen sollen der breiten Mehrheit der Bevölkerung zugutekommen, nicht einzelne Oligarchen bereichern.
"
Monika HOHLMEIER,2020-02-12,DE,Preparation of the Extraordinary European Council Meeting of 20 February 2020 on the Multiannual Financial Framework (debate),https://www.europarl.europa.eu/doceo/document/CRE-9-2020-02-12-INT-3-054-0000_DE.html,"  Monika Hohlmeier (PPE).   – Frau Präsidentin, lieber Herr Kommissar, liebe Ratspräsidentschaft, liebe Kolleginnen und Kollegen! Die Art und Weise, wie derzeit der Rat mit dem mehrjährigen Finanzrahmen umgeht, ist außerordentlich problematisch. Ein bisschen Kohäsion, ein bisschen Landwirtschaft, kein Ehrgeiz für Wissenschaft und Forschung, am liebsten weniger Erasmus, 1,0 ist das Maximum, möglichst viele Programme, aber möglichst viel unterfinanzieren – das ist das Motto. Jeder für sich, nur ich für mich. Das reicht nicht!
Die EU müssen wir aufgabenbezogen angehen. Das bedeutet: Wir müssen mehr in Wissenschaft und Forschung investieren, wir müssen auch die Kohäsionsländer dazu bringen, mehr in Wissenschaft und Forschung zu investieren, ihnen dabei helfen, dass sie mehr in Wissenschaft und Forschung investieren. Denn wenn wir in den Sektor nicht investieren, dann – ganz trocken und nüchtern – werden wir nicht mehr wettbewerbsfähig sein gegenüber China, dann werden wir auch nicht wettbewerbsfähig sein gegenüber den USA, dann werden wir auch unsere Aufgaben nicht angehen können. Wir müssen eine aufgabenbezogene Betrachtung haben. Wenn wir uns Aufgaben wie Außengrenzschutz vornehmen, dann muss das ordentlich finanziert und auch mit ordentlichen Kompetenzen versehen werden.
Wenn sie weniger bezahlen wollen, dann soll der Rat doch bitte auch mal sagen, welche Aufgaben er denn streichen möchte, welche Agentur er nicht mehr haben möchte, welche Aufgaben er nicht mehr beansprucht von der Europäischen Union. Aber mehr Aufgaben zu geben und anschließend eine geringere Finanzierung – das kann nicht funktionieren. Den Klimawandel bewältigen wollen, aber gleichzeitig nicht in Wissenschaft und Forschung hineingehen, kann auch nicht funktionieren. Der Just Transition Fund kann nicht alles lösen. Ich bitte die Mitgliedstaaten, endlich wegzugehen von der nationalen Brille und sich klar mit den europäischen Perspektiven auseinanderzusetzen und mit den Aufgaben, die vor uns stehen.
"
Monika HOHLMEIER,2020-01-15,DE,The reopening of the prosecution against the Prime Minister of the Czech Republic on the misuse of EU funds and potential conflicts of interest (debate),https://www.europarl.europa.eu/doceo/document/CRE-9-2020-01-15-INT-3-579-0000_DE.html,"  Monika Hohlmeier (PPE).   – Herr Präsident, Herr Kommissar, liebe Ratspräsidentschaft, liebe Kolleginnen und Kollegen! Zunächst einmal ist diese Diskussion, liebe Kollegin Charanzová, keine intern tschechische Diskussion, und das wird, glaube ich, meinen Wortbeitrag neben dem von der Kollegin Von Cramon-Taubadel auch erklären. 
Mir geht es nicht um die Frage, wie die Justiz innerhalb Tschechiens im Detail vorgeht. Wir bestreiten keine Ermittlungen und keine Justizverfahren, aber ich habe zwei Fragen, und da bitte ich die Kommission und den Rat um Unterstützung.
Erster Punkt ist: Europäische Fördergelder dürfen keine oligarchischen Strukturen fördern, das heißt, wir müssen sowohl das Thema „Interessenkonflikt“, den Artikel 61, als auch eine – ich nenne es jetzt mal so – „Antioligarchen-Gesetzgebung“ innerhalb unserer europäischen Institutionen fördern und klarstellen.
Und das Zweite, was wir klären müssen, ist: Wie viele europäische Fördermittel darf eine einzige Person innerhalb eines Jahres und innerhalb eines MFR erhalten? Denn wir werden sonst unglaubwürdig, wenn eine Person 100, 200, 300, 400 Millionen bekommt und andere Personen vielleicht gerade mal 5 000. Dann ist das Ungleichgewicht zu groß.
"
Monika HOHLMEIER,2019-12-17,DE,Conflict of interest and corruption affecting the protection of EU's financial interests in Member States (debate),https://www.europarl.europa.eu/doceo/document/CRE-9-2019-12-17-INT-2-217-0000_DE.html,"  Monika Hohlmeier, Verfasserin. – Frau Präsidentin, Herr Kommissar, liebe Kolleginnen und Kollegen! Zunächst einmal ein herzliches Grüßgott.
Madam President, the Committee on Budgetary Control (CONT) has posed five questions to the Commission regarding measures against the misuse of EU funds in cases of conflict of interest and corruption affecting the protection of the EU’s financial interests in Member States. 
Let me start by providing some context to the questions that we have posed to the Commission. In certain Member States, the systemic risk of semi—legal systems enabling conflicts of interest, irregularities, misuse of funds and fraud is widely present in important policy areas such as agriculture and cohesion. We have cases where politicians allegedly systematically use their power and the influence they have over the implementation of EU programmes in their countries to enrich their companies, friends, family, or themselves.
Conflict of interest constitutes in itself a serious threat. We see cases of single bidding in public procurement companies building up monopolies because other companies are thrown out of the competition. We are now facing problems that are beyond project level, so we need to go above this level to tackle them. We need to establish a clear definition of what constitutes a systemic risk and conflict of interest. We need the same legal definition and uniform interpretation of conflict of interest and systemic risk at European and Member State level.
These cases threaten to undermine citizens’ trust in the EU institutions and have a negative impact on the implementation of policies. Therefore, our credibility is at stake. European funds must benefit European citizens at large. Audit procedures concerning conflict of interest and other cases of corruption, fraud or systemic failures must be accelerated so that punishment follows swiftly. Additionally, preventive measures must be reinforced.
Currently, there is a lack of preventive measures that are effective and in place. If national management and control systems fail, the Commission must receive the possibility to assume decision—making and impose corrections immediately. The CONT Committee has actively monitored the situation since its fact-finding delegation of April 2014 and has been expressing its serious concern about cases of conflict of interest. CONT repeatedly requested in its discharge resolutions and other oral questions, most recently in December 2018, that the Commission take action regarding cases containing risk of irregular use of EU funds in several Member States. 
We welcome the fact that the Commission has carried out comprehensive audits regarding the application of EU law. We are alarmed that the auditors detected serious deficiencies in the functioning of the management and control systems and severe cases of conflict of interest. The audits carried out by the Commission confirmed Parliament’s position, laid out in its resolution on conflicts of interest and the protection of the EU budget in the Czech Republic in 2018. They welcome the fact that, since 2018, no payments from the EU budget and the European Structural and Investment Funds have been made to companies directly or indirectly owned by Prime Minister Babiš, following the alleged conflict of interest revealed by the Commission’s auditors. They found that Mr Babis is the beneficiary of funds received by the huge industrial conglomerate.
Yes, I would like to underline that there are still open questions about subsidies in the area of agriculture. Furthermore, we cannot accept the fact that projects affected by serious, sometimes fraudulent, irregularities are simply withdrawn from EU funding. Yes, the EU budget is no longer directly affected, but the core problem has not been solved. The local taxpayer has to foot the bill when contributing to the national budget. EU funds meant to help citizens should go where they are most needed and not into the pockets of oligarchs. CAP money belongs to those who farm the land. In the case of land grabs, when land is taken by force, there is clearly a rule of law issue. 
Therefore, we attach great importance to the rule of law conditionality. Rule of law is the basis for shared management. All Member States signed the Copenhagen Criteria, and they must be dedicated to the rule of law. Threats to the independence of the judiciary system, arbitrary or unlawful decisions by public authorities, limited availability and effectiveness of legal remedies, and failure to implement judgment or limitations on effective investigation and prosecution should lead to the reduction or suspension of EU funding. 
We call on the Commission to take all appropriate measures at its disposal to protect the EU budget, including the revision of current procedures to increase transparency and to be more effective. We urge the Commission to recover all funds that have been paid out illegally. We insist that the Commission should propose a specific mechanism to support farmers confronted with land—grabbing malpractices, giving them the opportunity to lodge a complaint with the Commission.
In the context of the negotiation on the next Multiannual Financial Framework, we call on the Council to take all necessary and appropriate measures to prevent conflict of interest effectively. We call on the Commission and the Member States to fight all forms of conflict of interest and to evaluate the preventive measures taken by the Member States to avoid such a situation. We need to clearly define the minimum standards of the rule of law. Please let’s start to work on these serious issues. 
"
Monika HOHLMEIER,2019-12-17,DE,Conflict of interest and corruption affecting the protection of EU's financial interests in Member States (debate),https://www.europarl.europa.eu/doceo/document/CRE-9-2019-12-17-INT-2-247-0000_DE.html,"  Monika Hohlmeier (PPE),  Frage nach dem Verfahren der „blauen Karte“. – Frau Präsidentin, Herr Kommissar, liebe Kolleginnen und Kollegen! Herr Fest, wissen Sie, dass in vielen Budgetbereichen 98 % des Geldes ordnungsgemäß ausgegeben werden und von den entsprechenden Verwendern ordnungsgemäß verwendet werden?
Wissen Sie, dass auch im Bereich von Kohäsion und von Landwirtschaft 95 % der Gelder ordnungsgemäß ausgegeben werden? Wogegen wir uns hier und heute wenden, ist, dass es einige wenige gibt, die versuchen, in großem Ausmaß Missbrauch mit EU-Fonds zu betreiben. Gegen das wenden wir uns ganz konkret und dafür werden wir weitere und zusätzliche Maßnahmen ergreifen und sind bisher – Jahr für Jahr – immer ein Stückchen besser geworden. 
Also für pauschale Verunglimpfungen bitte ich Sie: Würden Sie dann mal einfach die Frage beantworten, ob Sie es überhaupt wissen?
"
Monika HOHLMEIER,2019-11-26,DE,2020 budgetary procedure: joint text (debate),https://www.europarl.europa.eu/doceo/document/CRE-9-2019-11-26-INT-2-190-0000_DE.html,"  Monika Hohlmeier,  Berichterstatterin. – Herr Präsident, lieber Herr Kommissar, liebe finnischer Ratsvorsitz, lieber Kimmo Tiilikainen, liebe Kolleginnen und Kollegen! An den Anfang möchte ich ein Dankeschön stellen.
Ein Dankeschön – man verzeihe es mir am Anfang – an meine Kolleginnen und Kollegen im Verhandlungsteam, im Besonderen an Johan Van Overtveldt, an Eider Gardiazabal Rubial, die mit mir gemeinsam die direkten Verhandlungen führen durften, aber auch an meine Schattenberichterstatter und an die Koordinatoren – Clotilde schaut mich gerade an, du, lieber Kollege Andresen, schaust mich auch gerade an. Wir haben wirklich versucht, miteinander zu arbeiten, uns hier miteinander zu verständigen. Wir haben uns auf gemeinsame Positionen verständigt.
Ich bedanke mich bei Kimmo Tiilikainen dafür, dass er, nachdem wir anfänglich heftig miteinander gekämpft haben, dann aber doch versucht hat, fair mit uns zu verhandeln und wir gemeinsame Prioritäten miteinander hatten und diese gemeinsamen Prioritäten jetzt auch finanziell versehen. Dass das Parlament gern noch mehr gehabt hätte, ist klar. Dass im Rat einige gern weniger gehabt hätten, ist auch klar. Aber ich glaube, dass wir gute Kompromisse erzielt haben.
850 Millionen EUR mehr für Klimaschutzausgaben im Bereich Forschung und Innovation, damit auch für Arbeitsplätze und für Wettbewerbsfähigkeit, für Jugend und für Digitalisierung: Das ist doch eine ganze Menge, was wir miteinander erreichen konnten. Wir konnten die Haushaltslinien, die sich mit dem Klimaschutz befassen, insgesamt um 504 Millionen EUR erhöhen. Über 21 % der Ausgaben sind damit klimabezogen, und wir übertreffen sehr klar das 20%-Ziel, haben aber noch viel zu tun, um auf die 25 % oder gar noch höher zu kommen.
Horizont 2020 erfährt eine Steigerung um 8,8 %. Ich muss ganz ehrlich sagen, dass ich etwas fassungslos die unilaterale Erklärung der Länder, die dagegen gestimmt haben – im Besonderen Dänemark, Niederlande, Österreich und Schweden – gelesen habe, in der drinsteht, dass es erstens nicht genügend Margen gäbe und es zweitens weit über dem sei, was erforderlich sei.
Ich muss nüchtern feststellen, dass Horizont 2020 so viele Programme hat, die völlig überzeichnet sind, wo wir zum Teil nur 7 oder 8 % der Programme überhaupt fördern können. Deshalb kann ich eine solche Erklärung schlicht und einfach nicht verstehen und bin all den Mitgliedstaaten dankbar, die diesen Kompromiss mit uns gemeinsam tragen. Dass es keine Margen mehr gibt, ist einfach falsch. Wir haben 1,5 Milliarden EUR Marge allein für 2020 und aus den vergangenen zwei Jahren noch Instrumente bis zur Höhe von 4,2 Milliarden EUR.
Ich glaube, dass wir wirklich auch in dieser Hinsicht dem Rat entgegengekommen sind. Aber es war uns wichtig, auch das Thema des Klimaschutzes im Bereich CEF Energy mit 96 Millionen EUR, CEF Verkehr mit 37 Millionen EUR, die europäischen Satellitensysteme, die auch wesentlich sind in Fragen der Klimaforschung, Erasmus – Jugendaustausch – mit 50 Millionen EUR mehr und damit insgesamt 2,9 Milliarden EUR und einem Plus von 3,6 %, die Jugendbeschäftigungsinitiative mit 28,3 Millionen EUR und falls erforderlich noch mit weiteren 50 Millionen EUR ab Juni zu fördern. Wir konnten Life aufstocken, zwar nicht so sehr, wie wir es gerne gehabt hätten, aber doch immerhin. Wir haben aber auch Fragestellungen der Sicherheit nicht ausgelassen – das Thema EPPO, ein Stück weit mehr Europol –, das heißt, wir haben das Geld dort hingegeben, wo es notwendig ist. Wir haben es in den Media-Bereich gegeben, in Kohleregionen im Übergang, um dort auch wesentliche Fragen des Klimaschutzes zu beantworten.
Ich glaube, dass wir ein rundum solides Paket geschnürt haben. Ich bedanke mich ganz herzlich bei den Kolleginnen und Kollegen, dass sie mich so sehr unterstützt haben, und bei der Ratspräsidentschaft und der Kommission gemeinsam, dass wir erfolgreich die Verhandlungen beenden beziehungsweise beschließen konnten.
"
