MP,Date,Language,Title,Url,Content
Paolo DE CASTRO,2021-05-20,IT,The severe impact of the recent spring frost on fruit and wine growers (debate),https://www.europarl.europa.eu/doceo/document/CRE-9-2021-05-20-INT-4-150-0000_IT.html,"  Paolo De Castro,  a nome del gruppo S&D. – Signor Presidente, signor Commissario, onorevoli colleghi, le immagini dei nostri agricoltori, impegnati giorno e notte con candele e bracieri per difendere i propri vigneti o i propri frutteti dall'eccezionale ondata di gelate dello scorso aprile, non possono lasciarci ancora una volta indifferenti.
Settori produttivi fondamentali, non solo a garantire la nostra sicurezza alimentare ma anche per il numero di occupati che generano, hanno subito perdite che sfiorano la totalità della loro produzione. Una situazione che va a sommarsi agli effetti drammatici dovuti alla pandemia del COVID-19 e che mette a serio rischio la sostenibilità sociale ed economica delle aree rurali europee.
Non possiamo più permettere che eventi catastrofici di questo genere, sempre più frequenti e direttamente collegati al cambiamento climatico, vengano fronteggiati solamente dall'impegno e dallo spirito di sacrificio dei nostri produttori.
Per questo, caro Commissario, chiediamo un suo intervento tempestivo, al fine di attivare le misure eccezionali per contrastare tali situazioni, previste dall'articolo 219 del regolamento sull'organizzazione comune dei mercati (OCM). Misure che sono già state utilizzate per situazioni simili negli ultimi anni, offrendo un parziale ma vitale ristoro ai produttori delle aree colpite.
Ma al di là della gestione dell'emergenza serve una visione di più lungo termine su come l'Unione europea intenda dimostrarsi al fianco dei propri produttori agricoli per affrontare efficacemente questa sfida globale, con un approccio comune e fortemente coordinato.
In questo senso, come lei ha detto Commissario, la riforma della politica agricola comune che ci apprestiamo a concludere offre un'occasione imperdibile per un sostanziale miglioramento degli strumenti a disposizione degli agricoltori europei per la gestione e la mitigazione dei rischi intrinsechi all'attività agricola.
Nonostante i passi avanti effettuati negli ultimi anni, infatti, ci rendiamo sempre più conto di come gli strumenti esistenti non siano adeguati alle mutate condizioni climatiche dei nostri territori. Una inadeguatezza che potrebbe essere colmata grazie al rafforzamento, come proposto da questo Parlamento, delle misure eccezionali per fronteggiare le turbative di mercato previste dal regolamento OCM.
Non solo, chiediamo con forza che una parte, seppur limitata, dei fondi destinati ai segmenti diretti della PAC possa andare a finanziare una rete di sicurezza che protegga tutti i produttori europei dagli eventi catastrofici, come quelli che hanno colpito svariate regioni lo scorso aprile.
Presidente, Commissario, i nostri agricoltori e i nostri lavoratori agricoli hanno ripetutamente dato prova del loro spirito di abnegazione, non da ultimo durante la pandemia, quando hanno garantito che il cibo continuasse a giungere sulle nostre tavole, mettendo a rischio la propria salute. Ora è arrivato il momento di dimostrare la solidarietà dell'Unione europea, ponendoci al loro fianco nel fronteggiare le future sfide del settore.
"
Paolo DE CASTRO,2021-04-27,IT,The EU-UK Trade and Cooperation Agreement - The outcome of EU-UK negotiations (debate),https://www.europarl.europa.eu/doceo/document/CRE-9-2021-04-27-INT-2-050-0000_IT.html,"  Paolo De Castro (S&D).   – Signora Presidente, onorevoli colleghi, caro Commissario, la ferita lasciata dalla Brexit è ancora aperta per quelli che hanno sempre creduto nel progetto europeo.
Nonostante questa ferita, l'Unione ha dimostrato di saper ripartire con uno slancio nuovo che, con la risposta alla crisi pandemica, getta le basi per un'Europa più moderna e sostenibile, capace di andare al di là di questi interessi nazionali che hanno tanto pesato negli ultimi anni. La Brexit e il successivo atteggiamento delle autorità britanniche ne sono un esempio. Per questo voglio ringraziare il nostro capo negoziatore, Michel Barnier, e tutto il team negoziale della Commissione per l'estenuante lavoro svolto.
Come Parlamento, abbiamo voluto analizzare questo lavoro in modo responsabile, pretendendo e ottenendo tempi ragionevoli per esercitare le nostre prerogative, nonostante la conclusione dei negoziati all'ultimo minuto avesse messo a serio rischio la democraticità dell'intero processo. 
Un rischio che adesso possiamo dire sia valsa la pena correre: il testo che ci apprestiamo a votare rappresenta infatti un accordo ambizioso con elementi innovativi che dovranno essere alla base della futura politica commerciale dell'Unione, a partire da un level playing field fondato sulla clausola di non regressione degli standard produttivi, sociali, ambientali ed economici. 
Una base solida resa vincolante dalla possibilità di mettere in campo misure unilaterali di ribaltamento della concorrenza. Su questa base bisogna continuare a costruire. L'accordo non può, infatti, rappresentare un punto di arrivo, ma è un punto di partenza in vista di relazioni future capace di promuovere gli interessi dei nostri cittadini e delle nostre imprese e di superare le barriere amministrative e burocratiche, che continuano a rallentare il flusso di merci tra le due sponde della Manica.
In questa partita, giocherà un ruolo cruciale la creazione dell'Assemblea interparlamentare, a condizione che a questa venga attribuito non soltanto il diritto di individuare le aree che necessitano di maggiore collaborazione, ma soprattutto di esprimere raccomandazioni vincolanti al Consiglio di partenariato, coinvolgendo le parti sociali.
Presidente, l'errore storico della Brexit, così come la mancata visione più volte dimostrata dal governo britannico non possono portarci a pensare che i futuri rapporti tra l'Unione e Regno Unito si limitino al campo commerciale. Abbiamo enormi interessi strategici comuni: sta a noi continuare a lavorare con l'obiettivo di ridurre le distanze che al momento appaiono incolmabili.
"
Paolo DE CASTRO,2020-12-15,IT,Transitional provisions for support from the EAFRD and EAGF in the years 2021 and 2022 (debate),https://www.europarl.europa.eu/doceo/document/CRE-9-2020-12-15-INT-2-053-0000_IT.html,"  Paolo De Castro,  a nome del gruppo S&D. – Signor Presidente, onorevoli colleghi, Commissario, dopo settimane di attesa, il difficoltoso accordo raggiunto dal Consiglio europeo la settimana scorsa ci dà finalmente la possibilità di mantenere gli impegni presi con i nostri agricoltori, i nostri produttori e le nostre aree rurali. Non solo certezza giuridica e possibilità di meglio programmare le proprie scelte aziendali grazie all'estensione di due anni dell'attuale politica agricola, ma anche e soprattutto un'iniezione di liquidità senza precedenti per far fronte alle conseguenze devastanti della pandemia.
Grazie allo strumento europeo per la ripresa, siamo infatti pronti a sbloccare oltre 8 miliardi di euro per lo sviluppo rurale già a partire dal gennaio 2021. Un pacchetto di sostegno che dovrà essere reso disponibile il prima possibile dagli Stati membri, affinché possa davvero aprire la strada alla ripresa economica nel nome della resilienza, della sostenibilità e della digitalizzazione, e in linea con gli obiettivi delineati dal Green Deal.
Ed è grazie all'ambiziosa posizione supportata da tutti i gruppi della commissione agricoltura di questo Parlamento che siamo riusciti ad evitare che questi fondi finanziassero il business as usual. Per questo, almeno il 55 % degli oltre 8 miliardi verrà destinato ai giovani, ai piccoli agricoltori, e soprattutto a investimenti che promuovano lo sviluppo sociale ed economico delle aree rurali, perseguendo obiettivi imprescindibili per un'agricoltura sempre più sostenibile, quali la digitalizzazione e la modernizzazione degli strumenti produttivi, migliori condizioni di sicurezza sul lavoro, filiere corte, energie rinnovabili ed economia circolare.
Ma, affinché la ripresa del settore possa contemperare concretamente sostenibilità ambientale, sociale ed economica, almeno il 37 % dei fondi sarà destinato a misure ad alto valore aggiunto ambientale, quali l'agricoltura biologica, la riduzione delle emissioni agricole di gas serra, la conservazione dei suoli, il miglioramento della gestione idrica e il benessere animale.
Ancora una volta, il Parlamento europeo ha dimostrato di essere motore del processo legislativo, per questo, lasciatemi ringraziare tutto il team negoziale, i relatori ombra che hanno lavorato nelle scorse settimane per raggiungere un accordo su Next Generation EU per lo sviluppo rurale.
Quando le tre istituzioni, Commissario, decidono di lavorare fianco a fianco con lo stesso obiettivo, possono essere raggiunti risultati fondamentali, soprattutto per un settore che, anche nei momenti più difficili della pandemia, non si è mai tirato indietro, continuando a garantire il cibo che arriva ogni giorno sulle nostre tavole. 
"
Paolo DE CASTRO,2020-10-20,IT,"Common agricultural policy - support for strategic plans to be drawn up by Member States and financed by the EAGF and by the EAFRD - Common agricultural policy: financing, management and monitoring - Common agricultural policy – amendment of the CMO and other Regulations (debate)",https://www.europarl.europa.eu/doceo/document/CRE-9-2020-10-20-INT-2-052-0000_IT.html,"  Paolo De Castro (S&D).   – Signor Presidente, signor Commissario, onorevoli colleghi, di fronte a una vera emergenza globale che si manifesta nelle sempre più frequenti catastrofi climatiche che affliggono le nostre aree rurali e i nostri agricoltori, la richiesta per un cambiamento radicale non può rimanere inascoltata.
Per affrontare efficacemente questa emergenza serve un approccio comune e coordinato, affinché i nostri agricoltori possano fare un ulteriore salto di qualità nell'erogazione di servizi ambientali a beneficio dell'intera collettività. Al contrario, la proposta di riforma della PAC presentata nel 2018 delega agli Stati membri enormi responsabilità, di fatto una rinazionalizzazione dell'intervento europeo per il settore agricolo e per le aree rurali. Per questo, come gruppo socialista abbiamo preteso di riaprire la discussione su tutti e tre i dossier, nonostante il voto della commissione agricoltura. Una scelta che oggi rivendichiamo come un successo, visti i passi in avanti cruciali che abbiamo ottenuto. 
Lasciatemi quindi ringraziare tutto il nostro team negoziale per l'incredibile lavoro svolto a partire dal dossier dell'OCM, con il rafforzamento delle misure di gestione delle crisi di mercato e la maggiore trasparenza lungo la filiera a questo sul regolamento orizzontale, tramite il quale vogliamo salvaguardare la dimensione comune della PAC fino ai piani strategici.
E proprio in merito ai piani strategici mi sorprendono le campagne lanciate negli ultimi giorni da alcuni portatori di interesse contro i risultati raggiunti grazie all'incessante lavoro del nostro team negoziale, passi in avanti inimmaginabili fino a qualche mese fa, voglio citarne solo alcuni.
Chiediamo di dedicare almeno il 30 % dei fondi del primo pilastro agli ecoschemi, la misura definita a livello europeo che dovrà accompagnare e guidare i nostri agricoltori verso metodi produttivi sempre più sostenibili. Vogliamo poi innalzare al 35 % le spese per le misure agroambientali nel secondo pilastro, aggiungendo una soglia minima del 30 % per gli investimenti sostenibili, in linea con gli obiettivi del Green Deal e proprio per allineare la PAC a questi obiettivi, chiediamo anche una revisione entro il 2025 dei piani strategici, che tenga conto delle normative derivanti dall'implementazione del Green Deal, il tutto senza mettere in secondo piano la dimensione economica della PAC, che secondo il trattato deve migliorare la produttività e sostenere il reddito degli agricoltori. 
Vogliamo infatti un'agricoltura ancora più forte e competitiva e non possiamo dimenticarci di quanto i nostri agricoltori e lavoratori agricoli hanno fatto durante l'emergenza Covid, mettendo a repentaglio la propria salute pur di garantire la disponibilità di cibo arrivato ogni giorno sulle nostre tavole. 
Per questo abbiamo lavorato a un compromesso ambizioso in grado di salvaguardare la sostenibilità sociale, economica e ambientale del settore. Siamo infatti più che mai pronti a raccogliere le sfide lanciate con le strategie Farm2Fork e Biodiversità, che però non devono sostituirsi alla PAC, ma devono affiancare la PAC nel guidare gli 11 milioni di agricoltori europei verso la realizzazione di obiettivi comuni. 
Per questo, caro Commissario, ci aspettiamo un'assunzione di responsabilità da parte della Commissione affinché metta sul tavolo proposte legislative concrete, basate su rigorose analisi di impatto e che noi come colegislatori valuteremo e cercheremo di migliorare nell'interesse dei nostri agricoltori, produttori agroalimentari e di tutti i cittadini dell'Unione. 
"
Paolo DE CASTRO,2020-10-06,IT,The European Forest Strategy - The Way Forward (debate),https://www.europarl.europa.eu/doceo/document/CRE-9-2020-10-06-INT-2-092-0000_IT.html,"  Paolo De Castro (S&D).   – Signor Presidente, onorevoli colleghi, signor Commissario, la situazione delle nostre foreste rappresenta uno dei più importanti risultati raggiunti dall'Unione, anche e soprattutto grazie alla politica agricola comune.
In controtendenza rispetto ai trend globali, negli ultimi vent'anni abbiamo infatti assistito a un incremento della nostra superficie forestale pari alla dimensione del Portogallo, con impatti sociali sostanziosi per un settore della bioeconomia che rappresenta quasi il 10 % dell'occupazione europea. Segno di una strategia europea che, seppur migliorabile, ha portato a risultati importanti.
Non possiamo fermarci, caro Commissario. Serve mettere a disposizione dei nostri agricoltori e silvicoltori strumenti di gestione dei rischi e delle catastrofi che, insieme a una maggiore innovazione e digitalizzazione del settore, tutelino un sistema tanto fondamentale quanto fragile. In questo senso, come non ricordare le immagini delle decine di migliaia di ettari di bosco distrutti nel mio paese dal maltempo del 2018.
I nostri agricoltori e silvicoltori devono diventare i veri protagonisti della sfida per raggiungere la neutralità climatica entro il 2050. Per questo la strategia... 
(Il Presidente toglie la parola all'oratore)
"
Paolo DE CASTRO,2020-02-13,IT,Farm to Fork Strategy - the key role of farmers and rural areas (debate),https://www.europarl.europa.eu/doceo/document/CRE-9-2020-02-13-INT-4-011-0000_IT.html,"  Paolo De Castro,  a nome del gruppo S&D. – Signora Presidente, onorevoli colleghi, caro Commissario, senza la partecipazione convinta dei nostri agricoltori, qualsiasi prospettiva di mitigazione dei cambiamenti climatici diventa irrealizzabile.
Per questo oggi è necessario un approccio fortemente comune nel definire la futura politica agricola, che deve rimanere europea. E questo Parlamento, caro Commissario, non può perdere l'occasione di integrare elementi fondamentali della strategia ""Farm to Fork"" in una PAC che indicherà la direzione dell'agricoltura europea nel prossimo decennio.
Il settore agroalimentare è pronto a mettersi in gioco per fornire ancora più servizi ambientali, raggiungendo la neutralità delle emissioni di carbonio a beneficio di tutti i cittadini europei. Ma a questi sforzi dovranno tuttavia corrispondere non solo incentivi tramite una PAC adeguatamente finanziata, ma soprattutto la disponibilità di tecniche di produzione innovative, tra cui quelle del miglioramento varietale che sono capaci di sostituire la chimica nel proteggere la salute delle piante. Non esiste infatti, caro Commissario, una sostenibilità ambientale senza la sostenibilità economica e sociale del settore. Abbiamo davanti a noi una sfida enorme, che possiamo vincere solo grazie a un rinnovato protagonismo dell'Unione europea.
"
Paolo DE CASTRO,2020-02-11,IT,Proposed mandate for negotiations for a new partnership with the United Kingdom of Great Britain and Northern Ireland (debate),https://www.europarl.europa.eu/doceo/document/CRE-9-2020-02-11-INT-2-036-0000_IT.html,"  Paolo De Castro (S&D).   – Signora Presidente, onorevoli colleghi, capo negoziatore Barnier, dopo una delle pagine più buie della storia dell'Unione, abbiamo l'obbligo di fare oggi tutto il possibile per garantire ai nostri cittadini i risultati ottenuti in 45 anni di integrazione europea, salvaguardando i nostri rapporti con il Regno Unito e basandoli sul principio dell'equità sociale e ambientale e della equa concorrenza.
Serve un accordo ambizioso, che impegni il Regno Unito a mantenere i nostri standard produttivi e di sicurezza alimentare e scongiuri il rischio che l'accesso al mercato unico dei prodotti d'oltremanica rappresenti un cavallo di Troia per prodotti che metterebbero a rischio la salute dei nostri consumatori e la sostenibilità economica delle nostre aziende.
Le relazioni future non possono prescindere dalla condivisione di un patrimonio culturale comune, che include anche le produzioni agroalimentari di qualità. Per questo tutte le nostre eccellenze dovranno vedersi garantito l'attuale livello di tutela.
Proprio su questi principi si fonda la nostra convinzione che dopo la Brexit non ci sarà il vuoto, ma un'Europa sempre più forte e sostenibile, pronta a difendere i suoi cittadini.
"
Paolo DE CASTRO,2019-12-18,IT,Compatibility between the current EU - Mercosur Free Trade Agreement and the Commission's proposal for a European Green Deal (topical debate),https://www.europarl.europa.eu/doceo/document/CRE-9-2019-12-18-INT-3-356-0000_IT.html,"  Paolo De Castro (S&D).   – Signora Presidente, signor Commissario Hogan, onorevoli colleghi, con il Green Deal, l'Unione europea vuole stringere un nuovo patto con i suoi cittadini e i suoi consumatori. Un patto che, grazie alla strategia “dal campo alla tavola”, potrà essere ulteriormente rafforzato e indirizzato verso la qualità del cibo, intesa sia come qualità del prodotto, nutriente e salubre, che dal processo di produzione, equo, sostenibile e trasparente.
Gli agricoltori e i produttori europei sono pronti a raccogliere questa sfida, rafforzando ulteriormente i nostri standard produttivi, già tra i più avanzati a livello globale. Non possiamo permetterci di lasciarli soli: dobbiamo invece valorizzare i loro sforzi e proteggerli da tutte le situazioni di concorrenza sleale rispetto a produttori di paesi terzi. 
Si tratta di un obiettivo non più rimandabile, signor Commissario, ma che non può essere limitato al solo accordo con il patto dei paesi Mercosur. Infatti, solo attraverso una nuova e ambiziosa diplomazia del cibo europeo, che si basi sulla reciprocità degli standard produttivi tra l'Unione e tutti i nostri partner commerciali, potremo diventare veri punti di riferimento a livello globale nella definizione delle norme produttive agricole e alimentari.
"
Paolo DE CASTRO,2019-12-17,IT,Conflict of interest and corruption affecting the protection of EU's financial interests in Member States (debate),https://www.europarl.europa.eu/doceo/document/CRE-9-2019-12-17-INT-2-251-0000_IT.html,"  Paolo De Castro (S&D).   – Signor Presidente, signor Commissario, onorevoli colleghi, nelle ultime settimane molto si è discusso di situazioni sconcertanti in merito alla concentrazione fondiaria in alcuni Stati membri, ma il malcostume nulla ha a che vedere con la politica agricola comune.
Negli ultimi anni abbiamo fatto sforzi importanti per ridurre le distorsioni che a livello nazionale si possono creare in una politica complessa che si estende su 28 paesi e coinvolge milioni di beneficiari. Ma tanto resta ancora da fare e per questo il Parlamento ha già preso una posizione chiara nella nostra relazione sulla concentrazione dei terreni agricoli dell'Unione. Posizione che purtroppo però non trova riscontro nell'attuale proposta di riforma della PAC. Al contrario un eccesso di flessibilità garantita agli Stati membri accrescerebbe il rischio che certi comportamenti possano essere favoriti ancora di più da scelte nazionali. 
Oggi più che mai, caro Commissario, c'è bisogno di un forte ancoraggio a obiettivi e strumenti comuni, capaci di sventare ogni apertura all'individualismo politico che farebbe della PAC un mero contenitore di risorse senza salvaguardare la strategicità sociale, economica e ambientale. 
"
Paolo DE CASTRO,2019-12-17,IT,EU Pollinators Initiative (debate),https://www.europarl.europa.eu/doceo/document/CRE-9-2019-12-17-INT-2-410-0000_IT.html,"  Paolo De Castro (S&D).   – Signor Presidente, Commissario Kyriakides, onorevoli colleghi, lo stato di salute delle api è uno dei campanelli d'allarme più urgenti, di fronte a cui l'Unione deve dimostrarsi in prima linea per affrontare le cause della riduzione degli impollinatori. 
Senza le api, oltre tre quarti del cibo che arriva sulle nostre tavole non esisterebbe, basterebbe questo a dare l'idea di come siano necessarie scelte ambiziose e non più rinviabili da parte nostra e di tutti gli Stati membri, in linea con gli orientamenti della European Food Safety Authority sulle api del 2013.
Le api sono i primi alleati degli agricoltori, e gli agricoltori europei riconoscono questo ruolo fondamentale. Negli ultimi decenni abbiamo assistito infatti a un crollo nell'utilizzo dei pesticidi a più alto rischio, e grazie alle misure di inverdimento della PAC, che sono state, tra l'altro, recentemente rafforzate nel regolamento Omnibus, abbiamo promosso l'utilizzo di piante mellifere e oggi nell'Unione oltre il 10 % della superficie arabile è dedicata alla protezione della biodiversità.
Ma non possiamo fermarci qui: gli agricoltori europei devono essere incentivati a fare un ulteriore salto di qualità nell'erogazione di servizi ambientali che tutelino la salute degli impollinatori, a beneficio dell'intera collettività.
Serve un'iniziativa coordinata, adeguatamente finanziata, che punti sulla ricerca e l'innovazione, restituendo all'Europa il protagonismo che le compete in questa sfida. Il rischio, altrimenti, è di ritrovarsi di fronte a un puzzle disordinato di interventi nazionali.
Questo Parlamento, Commissario, non ha voluto e non vuole correre questo rischio, ma dimostrarsi all'altezza delle ambizioni del Green Deal europeo.
"
Paolo DE CASTRO,2019-12-17,IT,Animal welfare conditions during transport to third countries (debate),https://www.europarl.europa.eu/doceo/document/CRE-9-2019-12-17-INT-2-447-0000_IT.html,"  Paolo De Castro,  a nome del gruppo S&D. – Signor Presidente, signora Commissario, onorevoli colleghi, nonostante gli standard europei in materia di salute e benessere animale siano tra i più avanzati a livello globale, ancora oggi ci troviamo a discutere di incidenti non più ammissibili durante il trasporto degli animali.
È evidente che gli sforzi di questo Parlamento per raggiungere obiettivi ambiziosi, di cui dobbiamo essere fieri e che dobbiamo difendere, spesso vengano vanificati.
C’è bisogno, Commissario, di un'attenta analisi in merito a quali azioni siano necessarie per una piena e uniforme applicazione dei nostri standard per il benessere animale in tutti gli Stati membri.
Come commissione agricoltura, abbiamo già deciso di imboccare questa strada, anche per ridurre gli impatti distorsivi derivanti dalla possibilità che i produttori all'interno dell'Unione possano tradurre la mancata applicazione delle norme in vantaggi competitivi.
I nostri allevatori, nell'adeguarsi alle norme europee, sostengono costi di produzione molto più elevati rispetto ai propri concorrenti al di fuori dell'Unione, ritrovandosi vittime di una concorrenza sleale. Non possiamo più accettare che ciò avvenga anche all'interno del mercato unico. 
"
Paolo DE CASTRO,2019-12-11,IT,The European Green Deal (debate),https://www.europarl.europa.eu/doceo/document/CRE-9-2019-12-11-INT-1-077-0000_IT.html,"  Paolo De Castro (S&D).   – Signora Presidente, onorevoli colleghi, signor Vicepresidente Timmermans, caro Frans, siamo di fronte a un'emergenza globale che si manifesta nelle sempre più frequenti catastrofi climatiche che affliggono i nostri cittadini e i nostri agricoltori.
C'è bisogno di un approccio comune e fortemente coordinato per affrontare questa sfida e l'ambizioso patto oggi presentato tra l'Unione e i suoi cittadini rappresenta senz'altro un incoraggiante assunzione di questa responsabilità.
Tuttavia, senza una partecipazione convinta dei nostri agricoltori, qualsiasi prospettiva di mitigazione dei cambiamenti climatici diventa irrealizzabile. Gli agricoltori europei devono essere guidati e adeguatamente incentivati a fare un ulteriore salto di qualità nell'erogazione di servizi ambientali di cui possa beneficiare l'intera collettività.
Invece, caro Frans, la proposta di riforma della PAC su cui stiamo lavorando delega agli Stati membri la pianificazione di una strategia che contrasti questa sfida epocale, di fatto una rinazionalizzazione dell'intervento europeo per le aree rurali. Per questo, caro Frans, serve una politica agricola più comune e più forte, perché questa possa essere davvero la chiave di volta per i cambiamenti climatici... (La Presidente interrompe l'oratore)
"
