MP,Date,Language,Title,Url,Content
Paolo DE CASTRO,2023-11-21,IT,Sustainable use of plant protection products (debate),https://www.europarl.europa.eu/doceo/document/CRE-9-2023-11-21-INT-2-051-0000_IT.html,"  Paolo De Castro (S&D).   – Signora Presidente, onorevoli colleghi, senza una partecipazione convinta dei nostri agricoltori, qualsiasi prospettiva di mitigazione dei cambiamenti climatici diventa irrealizzabile. Per questo il lavoro della commissione Agricoltura e della nostra relatrice, Clara Aguilera, che ringrazio, si è concentrato per trovare l'equilibrio più ambizioso tra gli imprescindibili obiettivi di sostenibilità che ci siamo posti come Unione europea e la necessità, altrettanto imprescindibile, che i nostri agricoltori siano accompagnati in questa transizione. 
Un lavoro che è riuscito a superare posizioni ideologiche, raggiungendo risultati pragmatici che rendono realistico l'obiettivo di riduzione del 50% dei fitofarmaci, ma solo se questo percorso verrà accompagnato da un importante sforzo di innovazione, con alternative concrete per contrastare le fitopatie, a partire dalle nuove biotecnologie sostenibili. 
Colleghi, il voto di domani ci pone davanti a una scelta: lasciamo da parte le forzature politiche e le polarizzazioni per raggiungere un testo finale davvero a supporto della sostenibilità ambientale, sociale ed economica del settore agricolo e delle nostre aree rurali. 
"
Paolo DE CASTRO,2023-09-13,IT,Reviewing the protection status of wolves and other large carnivores in the EU (topical debate),https://www.europarl.europa.eu/doceo/document/CRE-9-2023-09-13-INT-3-190-0000_IT.html,"  Paolo De Castro (S&D).   – Signora Presidente, Commissaria, onorevoli colleghi, poche ore fa, in quest'Aula, la Presidente von der Leyen ha sottolineato come la natura e l'agricoltura debbano andare di pari passo. 
La situazione dei lupi e dei grandi carnivori rappresenta un tema centrale per questo equilibrio, che tocca da vicino gli allevatori, alle prese con centinaia di attacchi ai propri animali, soprattutto quelli delle aree remote e di montagna. 
La Presidente ha ragione: agricoltura e natura devono tornare ad andare di pari passo, ma la relazione tra uomo e ecosistemi evolve nel tempo e gli equilibri vanno governati attentamente, secondo le esigenze dei diversi territori. Per questo, cara Commissaria, la ringraziamo dell'annuncio di una revisione dello status di protezione del lupo. 
Ora però devono seguire azioni concrete, non ideologiche, per garantire la flessibilità necessaria a far fronte a una sovrappopolazione che sta mettendo a repentaglio non solo gli equilibri ecosistemici, ma anche decenni di impegno da parte dell'Unione per la tutela della salute e del benessere degli animali da allevamento. 
"
Paolo DE CASTRO,2023-09-12,IT,Ukrainian grain exports after Russia’s exit from the Black Sea Grain Initiative (debate),https://www.europarl.europa.eu/doceo/document/CRE-9-2023-09-12-INT-2-422-0000_IT.html,"  Paolo De Castro (S&D).   – Signor Presidente, caro Commissario, onorevoli colleghi, con l'uscita dall'iniziativa del Mar Nero, la Russia vuole ridisegnare la geografia politica globale, approfittando della forza del proprio settore agricolo e del non rispetto di alcuna regola di mercato. 
Il già elevato numero di paesi dipendenti dalle esportazioni cerealicole russe rischia infatti di espandersi a macchia d'olio, generando aree di influenza dagli effetti geopolitici preoccupanti. Servono quindi tutti gli strumenti possibili affinché i cereali ucraini continuino ad arrivare in Africa e non siano oggetto di meccanismi speculativi che negli ultimi mesi hanno portato a un crollo dei prezzi dei paesi europei, nonostante costi e standard di produzione sempre più elevati per i nostri agricoltori. 
Per questo, nell'attesa che gli sforzi diplomatici portino alla riattivazione dell'accordo del Mar Nero, dobbiamo mettere in campo infrastrutture adeguate al transito dei prodotti ucraini, senza lasciare che il supporto a Kyiv impatti in modo sproporzionato su alcuni settori europei come quello agroalimentare. 
"
Paolo DE CASTRO,2023-07-10,IT,Industrial Emissions Directive - Industrial Emissions Portal - Deployment of alternative fuels infrastructure - Sustainable maritime fuels (FuelEU Maritime Initiative) - Energy efficiency (recast) (joint debate - Fit for 55 and Industrial Emissions),https://www.europarl.europa.eu/doceo/document/CRE-9-2023-07-10-INT-1-084-0000_IT.html,"  Paolo De Castro (S&D).   – Signora Presidente, signor Commissario, onorevoli colleghi, oggi si apre una plenaria decisiva per le ambizioni che l'Unione si è posta con il green deal.
È quindi necessaria un'ampia condivisione politica della strategia che intendiamo seguire, piuttosto che spaccature all'interno del Parlamento che non ci consentiranno di avanzare in modo equilibrato.
In questo senso, per raggiungere efficacemente gli obiettivi di riduzione dell'inquinamento previsti dalla direttiva sulle emissioni industriali, occorre un approccio che contempli non solo i tre livelli di sostenibilità, ma anche le specificità di ciascun settore, a partire da quello dell'allevamento.
Il principio ""one size fits all"" ha infatti ampiamente dimostrato i suoi limiti e, come commissione AGRI, riteniamo quindi sia un errore paragonare le stalle europee alle ciminiere, assoggettando ai vincoli della direttiva anche gli allevamenti bovini.
Un errore scientifico e pratico che rischia di mettere a repentaglio decenni di avanzamento, capaci di farci raggiungere i più alti standard produttivi e di benessere animale al mondo.
Siamo pronti a lavorare insieme, caro Commissario, per sviluppare politiche altrettanto ambiziose ma che rispettino le peculiarità di differenti filiere produttive, a partire da quella bovina.
"
Paolo DE CASTRO,2023-06-15,IT,The water crisis in Europe (debate),https://www.europarl.europa.eu/doceo/document/CRE-9-2023-06-15-INT-4-066-0000_IT.html,"  Paolo De Castro (S&D).   – Signora Presidente, onorevoli colleghi, signora Commissaria, dopo un inverno siccitoso, le violente precipitazioni delle scorse settimane hanno causato vittime e sommerso centri abitati e decine di migliaia di ettari coltivati, mettendo in ginocchio imprese e aziende agricole in molte regioni europee. 
In Emilia-Romagna in solo due settimane sono caduti oltre quattro miliardi di metri cubi d'acqua, il triplo del fabbisogno annuo dell'intera regione. Risulta evidente come la frequenza delle precipitazioni stia progressivamente diminuendo, aumentando la concentrazione in periodi brevissimi. 
Per far fronte a questa situazione l'Unione europea deve mettere in campo azioni di prevenzione, inclusi investimenti per lo sviluppo rurale finanziabili con i fondi di Next GenerationEU, a partire da uno straordinario piano per la realizzazione di piccoli invasi a livello aziendale, in grado di garantire un'adeguata indipendenza idrica ai nostri agricoltori, oltre alla possibilità di utilizzare questi bacini come casse di espansione nel caso di eventi calamitosi. 
Anche questa volta i nostri cittadini si stanno dimostrando pronti a rialzarsi nonostante le enormi difficoltà. Tocca a noi non farci trovare impreparati di fronte alla futura crisi idrica. 
"
Paolo DE CASTRO,2023-06-13,IT,Ensuring food security and the long-term resilience of EU agriculture (debate),https://www.europarl.europa.eu/doceo/document/CRE-9-2023-06-13-INT-2-450-0000_IT.html,"  Paolo De Castro (S&D).   – Signora Presidente, onorevoli colleghi, signor Commissario, per troppo tempo l'Europa ha ritenuto la pace, così come la sicurezza alimentare, qualcosa di acquisito. L'attacco russo nei confronti del popolo ucraino ha fatto saltare questa convinzione, con ripercussioni profonde dal punto di vista umanitario, politico, sociale ed economico. 
Perciò è importante questa relazione. Una relazione positiva che noi sosterremo e ringrazio la relatrice Camilla Laureti per il lavoro che hanno svolto. Ma la rinnovata attenzione sulla sicurezza alimentare deve creare le condizioni per raggiungere una maggiore autonomia strategica dell'Unione, anche sui mercati agroalimentari, e per questo chiediamo alla Commissione di non limitarsi a continue iniziative legislative volte a imporre maggiori obblighi e maggiori restrizioni produttive. 
Al contrario, caro Commissario, i nostri agricoltori hanno bisogno di un piano, un piano fatto di alternative concrete, a partire dalle biotecnologie sostenibili, che li accompagni verso una vera intensificazione sostenibile, un sistema agroalimentare, e produrre di più e meglio. 
"
Paolo DE CASTRO,2023-06-01,IT,"Geographical Indications for wine, spirit drinks and agricultural products (A9-0173/2023 - Paolo De Castro)  (vote)",https://www.europarl.europa.eu/doceo/document/CRE-9-2023-06-01-INT-2-098-0000_IT.html,"  Paolo De Castro,  Rapporteur. – Signora Presidente, innanzitutto chiedo il ritorno in Commissione in base all'articolo 59/4 per avviare subito i negoziati interistituzionali e approfitto davvero per ringraziare tutti i colleghi. 
Un testo che ha avuto una così larga maggioranza, all'unanimità, approvato in commissione Agricoltura. Grazie davvero a tutti i colleghi. 
"
Paolo DE CASTRO,2023-05-31,IT,"Social and economic costs of climate change in light of the floods in Emilia Romagna, Marche and Toscana and the urgent need for European solidarity (debate)",https://www.europarl.europa.eu/doceo/document/CRE-9-2023-05-31-INT-1-211-0000_IT.html,"  Paolo De Castro (S&D).   – Signora Presidente, signor Commissario, onorevoli colleghi, le alluvioni delle scorse settimane, che hanno causato quindici vittime e sommerso, solo in Emilia-Romagna, decine di migliaia di ettari, mettendo in ginocchio il 50 per cento delle aziende agricole della regione, sono solo l'ultima delle sempre più frequenti catastrofi climatiche che affliggono le nostre aree rurali e tutti i nostri cittadini.
In questa situazione l'Unione europea non può rimanere in attesa. Oltre all'attivazione immediata del Fondo di solidarietà europeo, occorre mettere in campo, caro Commissario, tutte le azioni che contribuiscono al ripristino del potenziale produttivo agricolo e zootecnico danneggiato, accompagnate da opportune risorse. In questo senso, va garantita quella flessibilità alla regione Emilia-Romagna, che deve modificare il proprio piano di sviluppo rurale, con misure straordinarie da finanziare tramite l'utilizzo della riserva di crisi della PAC, come Lei ha detto.
Servono dunque decisioni urgenti e ambiziose per dare risposte concrete agli oltre 40 000 operatori impegnati nella filiera agroalimentare emiliano-romagnola, pronti a rialzarsi ancora una volta, nonostante le enormi difficoltà che stanno affrontando.
"
Paolo DE CASTRO,2023-05-31,IT,"Geographical Indications for wine, spirit drinks and agricultural products (debate)",https://www.europarl.europa.eu/doceo/document/CRE-9-2023-05-31-INT-1-220-0000_IT.html,"  Paolo De Castro,  Relatore. – Signora Presidente, Commissario, onorevoli colleghi, dopo oltre un anno di lavoro, ci accingiamo a esprimere la posizione del Parlamento sulla proposta di regolamento sulle indicazioni geografiche. 
Una proposta, caro Commissario, che rappresenta uno dei pochi, se non l'unico atto legislativo discusso in questa legislatura a supporto di un settore agricolo e agroalimentare più competitivo, integrato e in grado di creare valore aggiunto a beneficio delle nostre aree rurali. 
Voglio quindi ringraziare, innanzitutto, tutti i relatori ombra, i relatori dei pareri della commissione JURI e della commissione INTA e tutto il team negoziale del Parlamento per il lavoro svolto in questi mesi, che ha portato all'approvazione unanime del testo in commissione agricoltura. 
Un risultato inatteso che dimostra come, quando si condividano obiettivi sostanziali, lasciando da parte istanze più superficiali e di parte, è possibile raggiungere compromessi ambiziosi, nel solo interesse dei nostri agricoltori e dei nostri produttori. 
Venendo al testo, il nostro intento non è quello di rivoluzionare, ma di far evolvere un sistema senza eguali nel mondo, capace di generare valore senza bisogno di investire alcun fondo pubblico. Alcune modifiche sono quindi necessarie, già a partire dagli obiettivi di questa riforma, che dovranno garantire un reddito adeguato ai produttori di qualità, contribuendo al raggiungimento degli obiettivi dello sviluppo rurale. 
Il lavoro del Parlamento si è poi incardinato su quattro pilastri: il rafforzamento del ruolo dei consorzi, la maggiore protezione, la semplificazione e il chiarimento del ruolo dell'EUIPO, la sostenibilità e la trasparenza. 
In merito al primo punto, i consorzi, Commissario, rappresentano il motore dello sviluppo delle indicazioni geografiche e devono rimanere in mano solo ai produttori, con maggiori e migliori responsabilità, tra cui la lotta alle pratiche svalorizzanti e la promozione del ""turismo a indicazione geografica"", che riteniamo possa rivelarsi un vero volano per lo sviluppo dei nostri territori. 
Passando all'obiettivo della protezione più efficace, chiediamo più coraggio riguardo alla protezione online, che potrà e dovrà, a nostro avviso, diventare ex-officio, e la protezione quando le indicazioni geografiche vengono utilizzate come ingredienti, rendendo obbligatoria l'autorizzazione da parte del consorzio. 
Vogliamo poi eliminare tutte quelle falle del sistema che consentono a Stati membri o produttori di sfruttare indebitamente la reputazione delle indicazioni geografiche tramite norme tecniche nazionali o addirittura strumenti unionali, quali le menzioni tradizionali. 
Per semplificare davvero il sistema di registrazione, abbiamo definito tempi certi per l'esame delle richieste e delle modifiche dei disciplinari di produzione da parte della Commissione. Allo stesso tempo chiediamo di ridurre ai soli casi strettamente necessari il doppio scrutinio – nazionale prima e della Commissione poi – che ad oggi rallenta significativamente ogni procedura di modifica. 
Verranno quindi ridotti i dossier da analizzare a livello europeo, ed è per questo che si rende necessario un maggiore coinvolgimento, in particolare nella fase di scrutinio dei disciplinari, dell'Ufficio europeo della proprietà intellettuale. 
EUIPO, invece, potrà dare un importante supporto consultivo su questioni tecniche, amministrative e contribuire alla tutela e alla promozione delle indicazioni geografiche, tramite lo sviluppo di un registro europeo.
Venendo al necessario obiettivo della sostenibilità, la natura stessa delle IG, la loro tradizione secolare, confermano come questi prodotti siano sostenibili di per sé. Ma per poter meglio comunicare ai consumatori l'impegno dei nostri produttori, chiediamo ai consorzi di elaborare un rapporto di sostenibilità che spieghi ciò che svolgono in termini di sostenibilità ambientale, economica e sociale e di rispetto del benessere animale. 
Strettamente collegato al tema della sostenibilità è quello della trasparenza. Trasparenza verso il consumatore: per questo, chiediamo di indicare sull'etichetta di qualsiasi prodotto IG, il nome del produttore, e per prodotti IGP chiediamo che venga indicata l'origine della materia prima quando questa non è del paese membro dove è registrata. 
Presidente, Commissario, onorevoli colleghi, non abbiamo più tempo da perdere perché i nostri agricoltori possano beneficiare al più presto delle opportunità derivanti da questo regolamento. Per questo, chiedo a tutti un mandato forte in vista dell'avvio dei triloghi che inizieremo già la prossima settimana con la Presidenza svedese. 
"
Paolo DE CASTRO,2023-05-31,IT,"Geographical Indications for wine, spirit drinks and agricultural products (debate)",https://www.europarl.europa.eu/doceo/document/CRE-9-2023-05-31-INT-1-246-0000_IT.html,"  Paolo De Castro,  Relatore. – Signora Presidente grazie, grazie Commissario e un grazie sentito a tutti i colleghi e alle parole che hanno voluto usare per ringraziare il team negoziale. Un lavoro di squadra davvero importante di cui sono orgoglioso, e chissà che domani non avremo qualche minuto di soddisfazione vedendo tutto l'emiciclo sostenere questa importante relazione che ha visto la partecipazione di tutti. 
Non si tratta solo di curiosità gastronomiche. Vorrei concludere questo dibattito ricordando che stiamo parlando di un pezzo molto rilevante dell'agroalimentare europeo. Ormai abbiamo superato gli 80 miliardi di euro. Un pezzo di storia, di origine, di tradizione, di cultura europea. Dobbiamo essere orgogliosi perché è stata l'Europa che ha costruito questo strumento delle indicazioni geografiche. Lo ha fatto nel 1992, creando questo legame tra prodotto e territorio. 
Un'idea straordinaria che continua a crescere. Grazie di nuovo a tutti. Votiamo tutti a favore. È importante avere una forza dal Parlamento europeo per poter negoziare con la Commissione e con il Consiglio. 
"
Paolo DE CASTRO,2023-05-10,IT,The role of farmers as enablers of the green transition and a resilient agricultural sector (continuation of debate),https://www.europarl.europa.eu/doceo/document/CRE-9-2023-05-10-INT-3-058-0000_IT.html,"  Paolo De Castro (S&D).   – Signor Presidente, signora Commissaria McGuinness, onorevoli colleghi, le piogge della scorsa settimana hanno sommerso migliaia di ettari di frutteti e campi coltivati in Emilia Romagna.
È solo l'ultima delle sempre più frequenti catastrofi climatiche che affliggono le nostre aree rurali e tutti i nostri cittadini. Per affrontare la sfida dell'adattamento e della mitigazione dei cambiamenti climatici serve quindi una partecipazione convinta e coordinata dei nostri agricoltori.
Ma le nostre proposte negli ultimi mesi, le proposte della Commissione, sembrano a volte ignorare questa necessità, limitandosi a imporre maggiori obblighi e limitazioni produttive senza offrire alternative, a partire dalle biotecnologie sostenibili o da supporti adeguati.
Al contrario gli Stati Uniti, con l'Inflation Reduction Act, hanno destinato 20 miliardi di dollari al settore agricolo proprio per sostenere la transizione ecologica dei loro agricoltori.
Ebbene di fronte a tali cifre e alla totale assenza di contromisure da parte dell'Unione, come possiamo continuare a chiedere maggiori impegni ai nostri agricoltori con il rischio di perdite di competitività e di produttività che evidentemente impatterebbero anche sui consumatori?
"
Paolo DE CASTRO,2023-05-10,IT,Ukrainian cereals on the European market (debate),https://www.europarl.europa.eu/doceo/document/CRE-9-2023-05-10-INT-3-275-0000_IT.html,"  Paolo De Castro (S&D).   – Signora Presidente, signor Commissario Wojciechowski, onorevoli colleghi, il supporto e la solidarietà dell'Unione al popolo ucraino non può essere messa in discussione, soprattutto di fronte a una chiara strategia russa che mira a dividerci incoraggiando iniziative unilaterali e non conformi al diritto dell'Unione, come quelle prese da alcuni Stati membri nelle scorse settimane.
Tuttavia la Commissione non può lasciare che gli effetti delle misure a supporto dell'economia ucraina impattino in modo sproporzionato solo su alcuni settori, come quello agroalimentare, senza mettere in campo una strategia adeguata contro i fenomeni distorsivi che hanno portato a un crollo dei prezzi dei cereali, nonostante i costi di produzione sempre più elevati per i nostri agricoltori.
La mobilitazione della riserva di crisi per la seconda volta nel giro di pochi mesi dimostra come l'attuale budget della PAC non sia sufficiente a far fronte a situazioni geopolitiche emergenziali, aggravate da fenomeni speculativi all'interno dell'Unione.
Serve quindi uno sforzo maggiore anche sul fronte interno, signor Commissario, per continuare a essere davvero al fianco dell'Ucraina e, come sottolineato proprio ieri dal cancelliere Scholz, prepararne adeguatamente l'ingresso nell'Unione.
"
Paolo DE CASTRO,2023-03-16,IT,"European Citizens’ Initiative ""Save bees and farmers! Towards a bee-friendly agriculture for a healthy environment"" (debate)",https://www.europarl.europa.eu/doceo/document/CRE-9-2023-03-16-INT-4-065-0000_IT.html,"  Paolo De Castro (S&D).   – Signor Presidente, cara Commissaria, onorevoli colleghi, il dibattito di oggi rappresenta un successo del nostro funzionamento democratico ed è una prova di come ogni cittadino abbia il diritto di partecipare alla vita dell'Unione. 
Lo stato di salute degli impollinatori è uno dei campanelli d'allarme più urgenti di fronte a cui l'Unione deve dimostrarsi in prima linea: le api sono il primo alleato degli agricoltori e gli agricoltori europei riconoscono questo ruolo fondamentale. 
Negli ultimi decenni, infatti, abbiamo assistito a un calo dell'utilizzo dei fitofarmaci, che ha portato in alcuni paesi addirittura a dimezzarne l'uso, come l'Italia. Non solo: ma grazie alla dimensione ambientale della PAC, oggi nell'Unione oltre il 10% della superficie arabile è dedicata alla protezione della biodiversità. Ma possiamo e dobbiamo fare di più. 
Ed è per questo, cara Commissaria, che dobbiamo mettere a disposizione degli agricoltori europei tutte quelle soluzioni tecnologiche e innovative, a partire dalle biotecnologie sostenibili, alternative all'uso dei prodotti chimici nocivi per gli impollinatori. Sono delle scelte ambiziose ma solo così potremo salvaguardare oltre i 3/4 del cibo che arriva sulle nostre tavole e che, senza le api, non esisterebbe. 
"
Paolo DE CASTRO,2023-02-16,IT,Availability of fertilisers in the EU (debate),https://www.europarl.europa.eu/doceo/document/CRE-9-2023-02-16-INT-4-064-0000_IT.html,"  Paolo De Castro (S&D).   – Signor Presidente, onorevoli colleghi, signor Commissario, proprio ieri quest'Aula ha adottato la nostra posizione sul Chips Act, con l'obiettivo di affermare l'Europa come attore chiave nell'arena globale dei semiconduttori, strategici nella transizione digitale e verde. Questa è l'Europa che vogliamo, che vogliamo per i nostri cittadini, capace di identificare le proprie carenze e risolverle, al fine di raggiungere una vera autonomia strategica.
Al contrario, per i fertilizzanti siamo ancora fermi a una comunicazione da parte della Commissione, che sembra ignorare come il 50 % del nostro cibo, e di conseguenza la sicurezza alimentare dei cittadini europei, si basi sull'utilizzo di fertilizzanti di qualità.
Per questo voglio ringraziare il nostro presidente Lins e tutti i relatori, quelli che hanno lavorato al testo che ci apprestiamo a votare, chiedendo una risposta ambiziosa e concreta, per bloccare la corsa dei prezzi dei concimi e garantirne una disponibilità adeguata al fabbisogno delle nostre aziende agricole.
Risposte che l'Unione può mettere in campo subito, rapidamente, quali l'investimento su tutte le alternative disponibili in grado di garantire la competitività e la capacità produttiva agroalimentare europea, eliminando quei vincoli, come per esempio la soglia dei 170 chilogrammi di azoto per ettaro, che ancora oggi limitano l'utilizzo di fertilizzanti organici, e lo sviluppo di veri sistemi di economia circolare basati, sullo sfruttamento del digestato.
Di fronte a questa emergenza che colpisce in modo diseguale paesi, imprese e famiglie europee serve una risposta europea, capace di supportare il nostro sistema produttivo e accompagnarlo verso una sempre maggiore sostenibilità e indipendenza nelle produzioni più critiche.
"
Paolo DE CASTRO,2023-01-17,IT,Question Time (Commission) - Food price inflation in Europe,https://www.europarl.europa.eu/doceo/document/CRE-9-2023-01-17-INT-2-243-0000_IT.html,"  Paolo De Castro (S&D).   – Signor Presidente, onorevoli colleghi, signor Commissario, Lei sa bene quanto l'aumento dei prezzi dei generi alimentari stia mettendo in difficoltà migliaia di famiglie europee e sappiamo bene anche lo sforzo che Lei sta facendo per cercare di venire incontro a questa situazione complicata. 
Allora Le voglio fornire uno spunto per questa battaglia che dobbiamo fare tutti, perché l'inflazione significa problemi per i consumatori, ma significa problemi anche per la filiera agroalimentare. 
Ebbene, Lei sa che, non molto tempo fa, nell'agosto scorso, l'amministrazione Biden ha approvato l'Inflation Reduction Act, un importante strumento di intervento dell'amministrazione americana che ha messo in campo miliardi e miliardi di dollari, in particolare le misure che riguardano il settore agricolo alimentare negli Stati Uniti e un pacchetto da 20 miliardi di dollari solo per il settore agricolo, con investimenti sulla sostenibilità della produzione. 
Allora la mia domanda è: perché di fronte a queste difficoltà, all'invasione russa dell'Ucraina, perché l'Europa non risponde come hanno fatto gli Stati Uniti?
"
