MP,Date,Language,Title,Url,Content
Paolo DE CASTRO,2019-11-26,IT,2020 budgetary procedure: joint text (debate),https://www.europarl.europa.eu/doceo/document/CRE-9-2019-11-26-INT-2-218-0000_IT.html,"  Paolo De Castro (S&D).   – Signor Presidente, onorevoli colleghi, signor Commissario, questo Parlamento ha sempre lavorato affinché il bilancio 2020 rappresentasse un punto di partenza ambizioso per i negoziati che ci attendono sul futuro quadro finanziario pluriennale.
Oggi, grazie all'impegno di tutto il nostro team negoziale, che ringrazio, possiamo affermare di aver raggiunto questo obiettivo, rispondendo efficacemente alle richieste di un'Europa più vicina ai bisogni dei nostri cittadini. Una risposta che si incardina su risultati concreti, come l'incremento dei fondi per la lotta al cambiamento climatico e per la cultura, il potenziamento del programma Erasmus per migliaia di studenti e del supporto alle piccole e medie imprese, nonché il rafforzamento delle politiche di vicinato nel bacino del Mediterraneo, che sta diventando troppo spesso teatro di tragedie dovute alla crisi migratoria.
Ma non vogliamo fermarci qui, caro Commissario Oettinger. Continueremo quindi a impegnarci per trovare soluzioni che vadano incontro anche alle difficoltà di un settore, quello agroalimentare, vittima delle decisioni dell'amministrazione Trump di imporre tariffe punitive sui nostri prodotti.
Abbiamo fatto passi in avanti, importanti, come richiesto dalle nostre dichiarazioni al termine della procedura di conciliazione. Ora ci aspettiamo nei prossimi mesi un supporto concreto per le produzioni agroalimentari europee colpite da questa rappresaglia commerciale.
"
Paolo DE CASTRO,2019-11-26,IT,Measures to address the impact on European agriculture of the WTO ruling on the Airbus dispute (debate),https://www.europarl.europa.eu/doceo/document/CRE-9-2019-11-26-INT-2-388-0000_IT.html,"  Paolo De Castro,  a nome del gruppo S&D. – Signora Presidente, onorevoli colleghi, signora Commissario, è già passato più di un mese dall'inizio di questa rappresaglia commerciale nei confronti dei nostri prodotti agroalimentari e soprattutto nei confronti delle nostre eccellenze protette da sistemi di qualità europei, senza ancora oggi che l'Unione abbia messa in campo alcuna contromisura concreta.
La via diplomatica che il Parlamento europeo rafforzerà ulteriormente questa settimana, con l'assegnazione agli Stati Uniti di una quota del contingente tariffario per le importazioni di carne bovine di alta qualità, è sicuramente la strada da seguire. Ma non possiamo più permetterci però, cara Commissaria Malmström, di aspettare, mettendo a repentaglio la sostenibilità economica di un settore che, ricordiamolo, rappresenta la prima industria europea e impiega 44 milioni di operatori.
Per questo, la maggiore flessibilità concessa ai programmi di promozione dei nostri prodotti, sia in termini di durata che di cofinanziamento che di mercati, rappresenta un segnale importante. Chiediamo però l'utilizzo dei margini disponibili nel bilancio dell'Unione per finanziare un incremento dei fondi dedicati a queste misure e lanciare un vero e proprio piano di promozione straordinario per il nostro agroalimentare, quindi con interventi nuovi diretti anche alle catene distributive.
Tutto questo, caro Commissario, mantenendoci pronti ad attivare tutti gli strumenti disponibili nella PAC, che lei ha ricordato, per evitare che si inneschi una crisi di mercato, senza attendere che le conseguenze diventino irrimediabili per settori strategici dal punto di vista sociale, economico e ambientale. C'è in gioco il futuro dei nostri produttori e dell'intero comparto agroalimentare e solo mettendo in campo misure concrete a supporto degli agricoltori e trasformatori potremo dimostrarci all'altezza di questa sfida.
"
Paolo DE CASTRO,2019-10-22,IT,General budget of the European Union for 2020 - all sections (debate),https://www.europarl.europa.eu/doceo/document/CRE-9-2019-10-22-INT-2-174-0000_IT.html,"  Paolo De Castro,  relatore per parere della commissione per l'agricoltura. – Signora Presidente, Commissario, signor Ministro, onorevoli colleghi, il prossimo bilancio si pone come ambizioso obiettivo quello di fungere da ponte con il futuro dell'Unione, fornendo un valore aggiunto concreto e rispondendo alle richieste di cittadini, imprese, lavoratori e consumatori. 
Il Parlamento chiede un salto di qualità per raggiungere questo obiettivo e costituire un punto di partenza solido per l'avvio della nuova generazione di programmi e politiche prioritarie per l'Unione. Tra queste priorità, Commissario, non possiamo scordarci lo straordinario ruolo giocato dalla politica agricola comune nel processo di integrazione europea. Non accetteremo quindi tagli al bilancio della politica agricola, al contrario, Le chiediamo che l'Unione sia al fianco delle nostre imprese agricole e alimentari che, ancora una volta, sono vittime di rappresaglie commerciali decise da altri, come ha già ricordato la nostra relatrice Eider Gardiazabal Rubial. 
Chiediamo, quindi, un impegno affinché nel prossimo periodo di conciliazione vengano finanziate e rafforzate tutte le misure, quali la promozione dei nostri prodotti sui mercati esteri, necessarie ad attenuare l'impatto dei pesantissimi dazi imposti dagli Stati Uniti nei confronti delle nostre imprese. 
"
Paolo DE CASTRO,2019-10-09,IT,US tariffs on European goods following WTO's decision on the Airbus dispute (debate),https://www.europarl.europa.eu/doceo/document/CRE-9-2019-10-09-INT-1-206-0000_IT.html,"  Paolo De Castro (S&D).   – Signora Presidente, onorevoli colleghi, signor Commissario, le nostre esportazioni sono sotto attacco e lo sono ancora di più le nostre produzioni agroalimentari che, dopo la crisi dovuta all'embargo russo, devono pagare ancora una volta il conto di rappresaglie commerciali decise da altri. 
Signor Commissario, non possiamo farci cogliere impreparati. Quale strategia ha previsto la Commissione al fine di evitare una crisi di mercato che colpirebbe gravemente il nostro parmigiano, il nostro olio, il nostro vino? Dobbiamo dimostrare di essere al fianco dei nostri cittadini e delle nostre imprese e ottenere, come primo passo, un periodo di transizione sufficientemente lungo prima dell'eventuale applicazione dei dazi, scongiurando shock commerciali immediati per i nostri produttori. 
Ma questo non può essere sufficiente. Chiediamo di avviare subito le procedure necessarie all'attivazione della riserva di crisi, che è prevista dalla politica agricola comune per far fronte a queste situazioni. Lo stesso commissario designato Wojciechowski ce l'ha detto in sede di commissione per l'agricoltura. 
E poi è necessario rafforzare il pacchetto promozione per dare una mano ai nostri agricoltori. Servono scelte ambiziose, caro Commissario, per proteggere adeguatamente produzioni strategiche dal punto di vista economico e sociale. 
"
Paolo DE CASTRO,2019-09-18,IT,Presentation by the Council of its position on the draft general budget - 2020 financial year (debate),https://www.europarl.europa.eu/doceo/document/CRE-9-2019-09-18-INT-3-295-0000_IT.html,"  Paolo De Castro (S&D).   – Signora Presidente, signor Commissario, onorevoli colleghi, i nostri cittadini ci chiedono un'Europa più vicina, che sappia rispondere efficacemente alle loro richieste, ma le posizioni del Consiglio sulla proposta di bilancio per il 2020 sembrano volersi allontanare da questo obiettivo, con passi indietro significativi rispetto alla proposta della Commissione che, come Parlamento, avevamo giudicato poco ambiziosa.
Vogliamo invece continuare a investire in un settore, quello agroalimentare, che rappresenta la prima industria europea e la cui strategicità viene troppo spesso messa in secondo piano. I tagli previsti per il 2020 non tengono conto dell'attuale situazione geopolitica e degli effetti sui nostri prodotti già provocati dall'embargo russo e che si manifesteranno nel caso di una Brexit senza accordo.
C'è in gioco, signor Commissario, il futuro dei nostri giovani e dell'intero settore agroalimentare. Dimostriamoci all'altezza di questa sfida ed evitiamo passi indietro, che rappresenterebbero un segnale negativo in vista del negoziato sulla prossima programmazione finanziaria.
"
Paolo DE CASTRO,2019-09-16,IT,The situation of EU forests (debate),https://www.europarl.europa.eu/doceo/document/CRE-9-2019-09-16-INT-1-066-0000_IT.html,"  Paolo De Castro (S&D).   – Signor Presidente, signor Commissario, onorevoli colleghi, la situazione delle nostre foreste è sempre più a rischio e l'Unione europea deve essere, ancora una volta, capofila nella lotta contro questa emergenza.
Tanto è stato fatto, ed è utile ricordarlo, anche grazie alla politica agricola comune. Abbiamo assistito negli ultimi vent'anni a un incremento della nostra superficie forestale pari alla dimensione del Portogallo, segno di una strategia europea che va migliorata ma che ha portato già risultati importanti.
Tuttavia, caro Commissario, non possiamo fermarci. I tagli previsti alla politica agricola comune nella proposta della Commissione significano, in alcuni paesi, una pesante riduzione dei programmi di sviluppo rurale: in alcuni paesi si arriverà al 25 % di taglio e questo rappresenta certamente un passo indietro inaccettabile. I nostri agricoltori e i nostri silvicoltori devono essere protagonisti della sfida e correre ai ripari per quanto riguarda i problemi delle nostre foreste.
Allo stesso tempo bisogna intervenire anche nei confronti dei grandi paesi esportatori di legname con l'istituzione di un efficiente programma di certificazione che consenta l'attivazione di clausole di salvaguardia.
Ci troviamo davanti a una vera e propria emergenza climatica: solo un'Unione europea forte e unita saprà dare ai nostri cittadini le risposte coraggiose e non più rimandabili che ci attendono.
"
Paolo DE CASTRO,2019-09-16,IT,Patentability of plants and essential biological processes (debate),https://www.europarl.europa.eu/doceo/document/CRE-9-2019-09-16-INT-1-127-0000_IT.html,"  Paolo De Castro (S&D).   – Signor Presidente, signor Commissario, onorevoli colleghi, in un momento in cui l'innovazione e il miglioramento varietale non OGM delle piante sono l'unico modo per ridurre l'impatto ambientale del settore agricolo, la decisione da parte dell'Ufficio europeo dei brevetti è per noi inaccettabile.
Non possiamo permettere che la disponibilità di materiale vegetale venga limitata o che le capacità dei nostri laboratori di ricerca vengano messe a rischio, con pesanti ripercussioni sulla sostenibilità della nostra agricoltura e la salute di tutti i cittadini europei.
Per questo, caro Commissario, le chiediamo di intervenire al più presto, presentando le osservazioni necessarie per evitare che questa decisione vada contro il volere, più volte espresso, dai colegislatori e di ristabilire la certezza giuridica necessaria, perché l'agricoltura diventi sempre più protagonista nella lotta al cambiamento climatico e capace di rispondere, anche attraverso l'utilizzo di nuove tecniche di miglioramento varietale, in modo ambizioso alle richieste di milioni di cittadini.
"
