MP,Date,Language,Title,Url,Content
Paolo DE CASTRO,2022-12-12,IT,A long-term vision for the EU's rural areas (debate),https://www.europarl.europa.eu/doceo/document/CRE-9-2022-12-12-INT-1-140-0000_IT.html,"  Paolo De Castro (S&D).   – Signora Presidente, signor Commissario, onorevoli colleghi, le nostre aree rurali sono custodi di tradizioni, sono custodi di cultura e capacità e rappresentano uno dei nuclei fondanti della società europea.
Per questo, come ha ben sottolineato la relatrice Carvalhais, che voglio ringraziare per l'ottimo lavoro svolto, accogliamo con favore gli impegni assunti dalla Commissione nella visione a lungo termine delle aree rurali.
Tuttavia, perché questi impegni si traducano in azioni concrete, serve un cambio di passo nelle politiche dell'Unione per lo sviluppo dei territori interni, accompagnato da un maggior supporto per un'agricoltura sempre più sostenibile sul piano sociale, ambientale ed economico.
In questo senso stiamo lavorando per potenziare tutti gli strumenti, quali le indicazioni geografiche, fondamentali per lo sviluppo e la tenuta sociale del nostro territorio rurale.
Al contempo ci opporremo a quelle misure, come la direttiva sulle emissioni, che mettono a repentaglio la zootecnia, nonostante questa coinvolga pascoli di elevato valore ambientale e razze a rischio di estinzione, garantendo reddito e vitalità proprio nelle zone remote e montuose.
Serve, caro Commissario, un maggior coordinamento tra politiche di coesione, politica agricola comune, NextGenerationEU e tutti gli strumenti necessari a trasformare la strategia per le nostre aree rurali in un successo per lo sviluppo rurale, con territori più prosperi, resilienti e integrati.
"
Paolo DE CASTRO,2022-10-06,IT,The urgent need for an EU strategy on fertilisers to ensure food security in Europe (debate),https://www.europarl.europa.eu/doceo/document/CRE-9-2022-10-06-INT-4-035-0000_IT.html,"  Paolo De Castro (S&D).   – Signor Presidente, onorevoli colleghi, Commissario, l'escalation dei prezzi delle materie prime e dei costi energetici, a cui assistiamo ormai da mesi, sta generando conseguenze irreversibili di cui i nostri agricoltori rischiano, ancora una volta, di essere le prime vittime. Di fronte a questa emergenza, l'Unione deve mettere in campo al più presto una risposta ambiziosa e concreta per bloccare la corsa dei prezzi dei fertilizzanti e garantire una disponibilità adeguata al fabbisogno delle nostre aziende agricole. 
Il 50 % del nostro cibo, infatti, si basa sull'utilizzo di fertilizzanti di qualità che negli ultimi decenni hanno avuto un ruolo fondamentale nella rivoluzione verde del nostro sistema agricolo, aumentando le rese e garantendo sempre maggiore sicurezza alimentare a livello globale. 
Ora, caro Commissario, non possiamo permetterci passi indietro. La situazione dell'industria dei fertilizzanti, spesso costretta a interrompere le proprie linee produttive a causa degli aumenti insostenibili dei prezzi, ci obbliga a decisioni non più rinviabili. A partire, per esempio, dal tetto europeo al prezzo del gas, come chiesto ieri dalla quasi totalità di questo Parlamento, che avrebbe risvolti immediati su settori fondamentali come questo. 
Al contempo, per garantire la competitività e la capacità produttiva agroalimentare dell'Unione, dobbiamo investire su tutte le alternative disponibili ed eliminare quei vincoli, come la soglia dei 170 kg di azoto per ettaro all'anno, che ancora oggi limitano l'utilizzo di fertilizzanti organici e lo sviluppo di veri sistemi di economia circolare basati sullo sfruttamento del digestato. 
Di fronte a questa emergenza, che colpisce in modo diseguale i paesi, le imprese e le famiglie europei, serve dunque una risposta europea, capace di supportare il nostro sistema produttivo e accompagnarlo verso una sempre maggiore sostenibilità e indipendenza delle produzioni più critiche, dal gas all'ammoniaca, necessari per la produzione di fertilizzanti, fino alle materie prime agricole che garantiscono la nostra sicurezza alimentare. 
"
Paolo DE CASTRO,2022-09-13,IT,"Consequences of drought, fire, and other extreme weather phenomena: increasing EU's efforts to fight climate change (debate)",https://www.europarl.europa.eu/doceo/document/CRE-9-2022-09-13-INT-2-043-0000_IT.html,"  Paolo De Castro (S&D).   – Signor Presidente, signor Commissario, onorevoli colleghi, dopo le conseguenze delle misure di contrasto al COVID, devastanti per alcuni settori, e l'impennata dei prezzi delle materie prime conseguenti all'invasione russa, le condizioni meteorologiche e la siccità straordinaria degli ultimi mesi hanno messo in ginocchio l'intero comparto agroalimentare, soprattutto nelle regioni mediterranee.
È il momento di risposte forti perché i nostri agricoltori continuino a garantire la sicurezza alimentare dei cittadini europei. Per questo apprezziamo le deroghe ai requisiti della PAC volte a incrementare il nostro potenziale produttivo, ma non capiamo come questa scelta della Commissione possa conciliarsi con misure autolesionistiche come la proposta di un regolamento sui fitofarmaci che, senza offrire alternative concrete all'uso della chimica, porterebbe a perdite fino a un quinto delle nostre produzioni.
L'Unione deve mettere a disposizione dei nostri agricoltori tutti gli strumenti necessari per continuare a produrre cibo sufficiente, sostenibile e di qualità e non fissare obiettivi irrealizzabili se non a spese di produttori e consumatori. 
"
Paolo DE CASTRO,2022-06-06,IT,Question Time (Commission) Reducing the use of pesticides and strengthening consumer protection,https://www.europarl.europa.eu/doceo/document/CRE-9-2022-06-06-INT-1-213-0000_IT.html,"  Paolo De Castro (S&D).   – Signora Presidente, onorevoli colleghi, signora Commissaria, l'invasione russa dell'Ucraina ci ha fatto render conto di come, per troppo tempo, abbiamo dato per scontata la sicurezza alimentare. Purtroppo non è così.
Putin ha creato una crisi, sta creando una crisi, con l'accesso al cibo nel bacino del Mediterraneo, minando l'equilibrio geopolitico e creando le condizioni per una ripresa delle ondate migratorie che l'Unione ha già faticosamente affrontato durante le primavere arabe. Un contesto estremamente delicato che, tuttavia, le prime bozze di nuova normativa sui fitofarmaci sembrano del tutto ignorare, Commissaria.
In tali bozze la Commissione stessa stima impatti significativi sulla produzione europea, conseguenti sia all'aumento dei prezzi per i nostri consumatori, sia all'aumento delle importazioni da parte di paesi terzi. Tutto ciò non garantirà alcun rispetto dei nostri standard di sostenibilità e il tutto senza offrire ai nostri agricoltori alcuna alternativa valida all'utilizzo della chimica.
Come hanno detto tanti altri colleghi, Commissaria, non ritiene che sia arrivato il momento di rompere gli indugi e di mettere sul tavolo la nuova normativa sulle biotecnologie sostenibili? Così si potrà finalmente ridurre la chimica.
"
Paolo DE CASTRO,2022-06-06,IT,Question Time (Commission) Reducing the use of pesticides and strengthening consumer protection,https://www.europarl.europa.eu/doceo/document/CRE-9-2022-06-06-INT-1-215-0000_IT.html,"  Paolo De Castro (S&D).   – Grazie per la sua risposta, Commissaria, ma la mia domanda è la seguente: non ritiene che ci sia un controsenso se la Commissione, da una parte, vuole aumentare la produzione agricola europea – e infatti abbiamo sospeso temporaneamente l'ecological focus area, ovvero la messa a riposo obbligatoria del 5 % della superficie arabile – ma poi, dall'altra parte, presenta una proposta che vorrà ridurre la produzione europea? Credo che ci sia qualche incongruenza che va superata.
"
Paolo DE CASTRO,2022-06-06,IT,Question Time (Commission) Reducing the use of pesticides and strengthening consumer protection,https://www.europarl.europa.eu/doceo/document/CRE-9-2022-06-06-INT-1-217-0000_IT.html,"  Paolo De Castro (S&D).   – Signora Commissaria, adesso mi sente? Molto brevemente le domando come mai la Commissione, da una parte, ha interrotto temporaneamente l'ecological focus area, cioè di fatto l'obbligo di messa a riposo del 5 % della superficie arabile per aumentare la produzione europea e, dall'altra parte, con questo provvedimento che si annuncia sui fitofarmaci vuole ridurre la produzione europea? Perché questa è l'analisi di impatto che presenta proprio la proposta stessa della Commissione.
"
Paolo DE CASTRO,2022-05-02,IT,EU action plan for organic agriculture (debate),https://www.europarl.europa.eu/doceo/document/CRE-9-2022-05-02-INT-1-150-0000_IT.html,"  Paolo De Castro (S&D).   – Signora Presidente, Commissario, onorevoli colleghi, lo straordinario sviluppo dell'agricoltura biologica a livello europeo negli ultimi dieci anni è la dimostrazione di come i nostri agricoltori, se adeguatamente guidati e incentivati, rappresentino degli alleati imprescindibili nell'erogazione di servizi ambientali all'intera comunità e nel raggiungimento degli obiettivi del Green Deal. Un modello che merita quindi di essere rafforzato tramite un piano d'azione mirato e tramite la condivisione e l'implementazione su scala europea delle buone prassi sviluppate dagli Stati membri più virtuosi. 
Non possiamo permetterci quindi, Commissario, che obiettivi ambiziosi posti dalla Commissione sviliscano l'altissima qualità delle produzioni europee, aprendo le porte all'importazione di prodotti biologici che non rispettano i nostri standard di sostenibilità ambientale, ma anche sociale ed economica. 
Per questo chiediamo una valutazione d'impatto rigorosa affinché l'obiettivo del 25 per cento di superficie agricola destinata al biologico diventi un'opportunità per i nostri produttori e per i nostri consumatori, con l'obiettivo di innalzare la qualità delle nostre produzioni e non di svalutarle. 
"
Paolo DE CASTRO,2022-03-23,IT,Need for an urgent EU action plan to ensure food security inside and outside the EU in light of the Russian invasion of Ukraine (debate),https://www.europarl.europa.eu/doceo/document/CRE-9-2022-03-23-INT-1-178-0000_IT.html,"  Paolo De Castro (S&D).   – Signora Presidente, onorevoli colleghi, signor Commissario, per troppo tempo l'Europa ha ritenuto la pace, così come la sicurezza alimentare, qualcosa di acquisito. L'attacco russo nei confronti del popolo ucraino ha fatto saltare questa convinzione, con ripercussioni profonde da un punto di vista umanitario, politico, sociale ed economico.
Le misure messe in campo oggi, che raccolgono le richieste di questo Parlamento, caro Commissario, rappresentano un primo e importante segnale per i nostri produttori: l'Unione è al vostro fianco, con scelte a favore di una maggiore produttività e con la mobilitazione di 1,5 miliardi di euro a supporto dei settori più colpiti.
Non possiamo però strumentalizzare la guerra e rimettere in discussione gli obiettivi strategici fissati dal Green Deal. Al contrario, la rinnovata attenzione sulla sicurezza alimentare deve creare le condizioni per raggiungere una maggiore autonomia strategica dell'Unione, anche sui mercati agroalimentari.
Per vincere questa sfida serve una vera Global Food Policy, che superi posizioni che porterebbero alla decrescita del nostro potenziale produttivo e che renda agli agricoltori dunque un'arma formidabile per garantire cibo sufficiente, sostenibile e di qualità per tutti. 
"
Paolo DE CASTRO,2022-02-14,IT,Implementation report on on-farm animal welfare (debate),https://www.europarl.europa.eu/doceo/document/CRE-9-2022-02-14-INT-1-102-0000_IT.html,"  Paolo De Castro (S&D).   – Signora Presidente, onorevoli colleghi, signora Commissaria, a meno di un mese dall'approvazione in quest'Aula delle raccomandazioni della commissione ANIT, torniamo a discutere di benessere animale, segno dell'attenzione dell'Unione a questa sfida.
La salute degli animali è infatti la nostra salute e i nostri agricoltori e allevatori sono consapevoli di questa interconnessione. Grazie ai loro sforzi oggi l'Unione è leader a livello globale nella difesa dei più alti standard di salute e benessere animale. Ma non basta e per questo, signora Commissaria, chiediamo una più rigida applicazione da parte di tutti gli Stati membri delle norme vigenti, affinché nessun allevatore possa trovarsi in una condizione di svantaggio competitivo solo per essersi preso cura dei propri animali.
Sta a noi ora saper guidare e incentivare i nostri agricoltori verso un ulteriore salto di qualità nei sistemi di allevamento, di cui beneficeranno cittadini e consumatori e che dovrà essere difeso a livello internazionale, garantendo il pieno rispetto da parte dei nostri partner commerciali.
"
Paolo DE CASTRO,2021-11-23,IT,"Common agricultural policy - support for strategic plans to be drawn up by Member States and financed by the EAGF and by the EAFRD - Common agricultural policy: financing, management and monitoring - Common agricultural policy – amendment of the CMO and other regulations (debate)",https://www.europarl.europa.eu/doceo/document/CRE-9-2021-11-23-INT-2-017-0000_IT.html,"  Paolo De Castro,  a nome del gruppo S&D. – Signora Presidente, onorevoli colleghi, signor Commissario, dopo oltre tre anni di negoziato, oggi presentiamo ai cittadini europei la riforma della PAC, che accompagnerà i nostri agricoltori fino al 2027.
Una riforma che il nostro gruppo ha criticato, esprimendo la contrarietà alla rinazionalizzazione dell'intervento europeo per il settore agricolo, ma sulla quale abbiamo continuato a lavorare migliorandola, fino a raggiungere l'attuale equilibrio tra i tre livelli di sostenibilità economica, sociale e ambientale.
Ringrazio quindi tutto il team negoziale, i colleghi Pina Picierno, Eric Andrieu e Maria Noichl, e tutta la squadra tecnica che ha reso possibile questo risultato.
Senza la spinta del Parlamento, punti caratterizzanti di questo accordo non avrebbero visto la luce. A partire dal risultato storico sul fronte dei diritti dei lavoratori, per la prima volta abbiamo inserito un sistema di condizionalità che eviterà che i fondi pubblici finiscano nelle tasche di chi non rispetta i diritti dei lavoratori, ponendo fine alla distorsione di concorrenza tra imprenditori, che lucrano a discapito della tutela dei diritti, e la stragrande maggioranza di agricoltori, che invece si prende cura dei lavoratori.
Allo stesso modo abbiamo salvaguardato il ruolo delle regioni, che continueranno ad essere protagoniste nella redazione dei piani strategici, con quella conoscenza delle dinamiche territoriali necessaria per vincere le sfide ambientali e sociali che ci attendono.
Senza il Parlamento poi, sarebbe stata mortificata l'ambizione ambientale di una politica che invece, dal 2023, destinerà un quarto degli aiuti diretti agli ecoschemi e almeno il 35 % dei fondi dello sviluppo rurale a misure ad alto valore ambientale. Risultati questi che determineranno il contributo fondamentale della PAC e dei nostri agricoltori al raggiungimento degli obiettivi che l'Unione si è posta con il Green Deal.
Il tutto senza rinunciare alla dimensione economica della PAC. Vogliamo un'agricoltura ancora più forte e competitiva, capace di garantire la sicurezza alimentare dei nostri cittadini. Per questo il sostegno al reddito rimane un elemento essenziale, accompagnato da misure rafforzate di gestione dei rischi e da plafond maggiori per il supporto dei giovani e gli aiuti accoppiati.
In più, coltivazioni emblematiche del nostro sistema agroalimentare, quali ortofrutta, vino e olio d'oliva, insieme ad altre, a seconda delle specificità nazionali, continueranno ad essere supportate tramite interventi settoriali ad hoc. E tutto questo senza dimenticare le indicazioni geografiche dei consorzi di tutela, che potranno finalmente gestire l'offerta di prodotto e quindi meglio rispondere alle fluttuazioni di mercato.
Oggi voteremo su tutti questi risultati. E chiedo quindi anch'io a tutti di votare a favore di questa riforma, e lo chiedo anche forte a tutti i colleghi del mio gruppo, che pure non hanno tutti la stessa soddisfazione dei risultati. Io credo che dobbiamo rivendicare con orgoglio questo risultato. Sono stati tanti anni di negoziati, ma ne è valsa la pena, per una politica agricola più forte, comune, più equa e più sostenibile.
"
Paolo DE CASTRO,2021-10-19,IT,General budget of the European Union for the financial year 2022 - all sections (debate),https://www.europarl.europa.eu/doceo/document/CRE-9-2021-10-19-INT-2-174-0000_IT.html,"  Paolo De Castro,  relatore per parere della commissione per l'agricoltura. – Signora Presidente, signor Commissario, onorevoli colleghi, i nostri agricoltori e produttori agroalimentari hanno dato prova di una straordinaria resilienza e abnegazione di fronte alla crisi sanitaria ed economica che ci ha colpiti. 
Nonostante ciò, alcuni settori tra i più emblematici della nostra tradizione alimentare continuano a soffrire le conseguenze a causa di una richiesta di mercato ancora distante dai livelli pre-pandemia. Per questo, la commissione per l'agricoltura insiste sulla necessità di una dotazione finanziaria aggiuntiva per l'anno 2022, in grado di supportare la ripresa dei nostri agricoltori.
Su questo punto, signor Commissario, urge una riflessione sull'utilità e l'efficacia della riserva di crisi della PAC, soprattutto in considerazione dei significativi miglioramenti nel suo funzionamento, che il Parlamento ha inserito nel processo di riforma della politica agricola comune.
Non possiamo più permettere, infatti, che le aree rurali vengano lasciate in secondo piano, mettendo a repentaglio il senso di appartenenza europea di una parte dei nostri concittadini. Per questo, ci auguriamo che alla visione di lungo termine presentata dalla Commissione seguano iniziative concrete e adeguatamente finanziate già a partire dal 2022.
"
Paolo DE CASTRO,2021-10-18,IT,Farm to Fork Strategy (debate),https://www.europarl.europa.eu/doceo/document/CRE-9-2021-10-18-INT-1-036-0000_IT.html,"  Paolo De Castro,  relatore per parere della commissione per il commercio internazionale. – Signora Presidente, signora Commissaria, onorevoli colleghi, come relatore della commissione per il commercio internazionale, voglio innanzitutto ringraziare tutti i relatori e i relatori ombra per il lavoro svolto su un dossier che deve diventare un pilastro del Green Deal europeo.
Riteniamo tuttavia, cara Commissaria, che il raggiungimento degli obiettivi della strategia ""Farm to Fork"" non possa prescindere dalla nostra politica commerciale. L'Unione dovrà giocare un ruolo da protagonista nella transizione globale verso standard produttivi basati sul rispetto dei diritti umani e dei lavoratori, equa concorrenza e protezione ambientale. 
Serve quindi una vera reciprocità degli standard per tutti i prodotti importati nell'Unione. Dobbiamo scongiurare il rischio che la strategia ""Farm to Fork"" riduca il nostro potenziale produttivo, aprendo le porte a importazioni che per nulla contribuirebbero agli obiettivi che si pone. Chiediamo inoltre capitoli vincolanti sullo sviluppo sostenibile in tutti i nostri accordi commerciali.
Le dichiarazioni di questa mattina da parte della Commissione, inoltre, ci lasciano insoddisfatti. Serve infatti una valutazione ex ante dell'impatto combinato di tutti i target e di proposte proporzionali al raggiungimento di tali obiettivi, che salvaguardino la competitività dei nostri produttori. Una competitività che dovrà basarsi anche su un passo in avanti deciso da parte dell'Unione in materia di ricerca e innovazione, affinché i nostri produttori abbiano a disposizione alternative efficaci, a partire dalle biotecnologie sostenibili per produrre di più, in modo più rispettoso dell'ambiente e dei consumatori.
"
Paolo DE CASTRO,2021-10-05,IT,The future of EU-US relations (debate),https://www.europarl.europa.eu/doceo/document/CRE-9-2021-10-05-INT-2-053-0000_IT.html,"  Paolo De Castro (S&D).   – Signor Presidente, onorevoli colleghi, signor Alto rappresentante, le nostre relazioni con gli Stati Uniti sono ad una svolta. Se è vero infatti che, sin dall'insediamento, l'amministrazione Biden ha spesso dimostrato la volontà di collaborare tra alleati, adesso serve un cambio di passo per stabilire una partnership capace di far fronte alle sfide che ci attendono.
Ai segnali positivi, a partire dalla soluzione della vicenda Boeing-Airbus, che tanto ingiustamente ha pesato sui nostri produttori agroalimentari, fino alla prima riunione del Consiglio per il commercio e la tecnologia, ora devono seguire azioni concrete su questioni non più rinviabili, quali il raggiungimento di soluzioni durature per il settore alluminio e acciaio. Azioni che dovranno consolidare le relazioni commerciali rafforzando il coordinamento delle nostre priorità, quali la promozione dei diritti dei lavoratori, l'azione climatica, la gestione della trasformazione tecnologica. Serve quindi un rinnovato slancio nelle relazioni transatlantiche, perché le sfide comuni possano davvero trasformarsi in opportunità per i nostri cittadini e per le nostre imprese.
"
Paolo DE CASTRO,2021-09-15,IT,EU contribution to transforming global food systems to achieve the Sustainable Development Goals (debate),https://www.europarl.europa.eu/doceo/document/CRE-9-2021-09-15-INT-3-302-0000_IT.html,"  Paolo De Castro,  a nome del gruppo S&D. – Signora Presidente, signor Commissario, onorevoli colleghi, il vertice sui sistemi alimentari del prossimo 23 settembre rappresenta un'opportunità che non possiamo perdere se davvero vogliamo raggiungere il sempre più difficile obiettivo ""fame zero"" entro il 2030.
Ma perché questo vertice possa diventare un successo, l'Unione europea dovrà giocare un ruolo da protagonista, guidando la transizione verso standard basati sul rispetto dei diritti umani, equa concorrenza e protezione ambientale. Gli obiettivi che l'Unione si è posta negli ultimi anni da soli non possono infatti bastare. Servono interventi di cooperazione che mirino a rafforzare la conoscenza scientifica e la disponibilità tecnologica, affinché anche i paesi in via di sviluppo possano arrivare a produrre più cibo con minore impiego di risorse.
Non solo, l'emergenza a cui stiamo assistendo, con più di un terzo della popolazione mondiale che non può permettersi una dieta sana, ci obbliga a impegnarci nella promozione e diffusione di regimi dietetici più salutari e sostenibili, come la dieta mediterranea, capace di migliorare le aspettative di vita e di garantire un utilizzo più efficiente delle risorse naturali.
Target sempre più ambiziosi a livello europeo inoltre non possono prescindere da un'altrettanto ambiziosa politica commerciale, che definisca standard internazionali di sostenibilità ambientale, sociale e di rispetto dei diritti dei lavoratori, tramite sistemi di reciprocità e convergenza nell'interesse comune dei nostri partner commerciali.
Chiediamo quindi capitoli vincolanti sullo sviluppo sostenibile in tutti gli accordi commerciali dell'Unione. Solo tramite una leadership forte e fondata sull'esempio, l'Unione potrà contribuire concretamente a raggiungere gli obiettivi di sviluppo sostenibile delle Nazioni Unite.
"
Paolo DE CASTRO,2021-06-10,IT,European Citizens’ Initiative ‘End the cage age’’ (debate),https://www.europarl.europa.eu/doceo/document/CRE-9-2021-06-10-INT-4-012-0000_IT.html,"  Paolo De Castro,  a nome del gruppo S&D. – Signora Presidente, onorevoli colleghi, il testo che ci apprestiamo a votare rappresenta un successo del nostro funzionamento democratico, e una prova di come ogni cittadino abbia il diritto di partecipare alla vita dell'Unione tramite strumenti come l'iniziativa dei cittadini europei. 
Di fronte a quasi un milione e mezzo di cittadini che chiedono di dire basta agli allevamenti in gabbia, come Parlamento ci siamo resi parte attiva di questa sfida, chiedendo alla Commissione di mettere sul tavolo al più presto gli strumenti legislativi necessari per avviare la transizione verso sistemi di allevamento senza gabbie. 
La salute degli animali, cara Commissaria, è infatti la nostra salute, e gli agricoltori e allevatori dell'Unione hanno dimostrato di essere consapevoli di questa stretta interconnessione, investendo nell'eliminazione delle gabbie per numerose specie animali e in sistemi di allevamento sempre più innovativi che hanno permesso all'Unione di vantare oggi i più alti standard di salute e benessere animale a livello globale. 
Ora serve uno sforzo ulteriore affinché l'utilizzo di gabbie venga definitivamente archiviato, facendo spazio a sistemi di stabulazione più adeguati a seconda delle caratteristiche di ogni specie animale. Starà a noi saper guidare e incentivare i nostri agricoltori verso un salto di qualità nei sistemi di allevamento in cui potranno beneficiare i cittadini e consumatori e che dovrà essere difeso a livello internazionale garantendone il pieno rispetto anche da parte dei nostri partner commerciali. 
"
