MP,Date,Language,Title,Url,Content
Philippe OLIVIER,2022-11-22,FR,New EU strategy for enlargement (debate),https://www.europarl.europa.eu/doceo/document/CRE-9-2022-11-22-INT-2-434-0000_FR.html,"  Philippe Olivier,  au nom du groupe ID. – Madame la Présidente, chers collègues, ce débat sur l’élargissement traduit votre incapacité à tenir compte du réel et à évaluer les politiques que vous mettez en œuvre. Vous n’arrivez pas à travailler à 27 et vous voulez encore élargir. Vous êtes dans une fuite en avant. Avec Schengen, que vous voulez étendre, vous avez fait de l’Europe un continent passoire, qui, de l’agence d’accueil de migrants Frontex à l’Ocean Viking, montre chaque jour ses défaillances dans le contrôle des flux migratoires. 
L’extension que vous nous proposez est une extension sans fin, caractéristique d’un empire, un empire qui a pour nom l’Union européenne. Or, qui dit empire dit impérialisme, c’est-à-dire l’idée d’une soumission des peuples à un ordre supérieur, à une autorité centrale, un empereur qui est en l’occurrence une nébuleuse technocratique au service d’une idéologie marchande. 
Mais les promesses d’éternité dont se parent toujours les empires se heurtent immanquablement à l’instinct de survie des peuples. Il en a toujours été ainsi dans l’histoire. L’UE n’échappera pas à cette loi d’airain.
"
Philippe OLIVIER,2022-10-17,FR,Sustainable maritime fuels (FuelEU Maritime Initiative) - Deployment of alternative fuels infrastructure (debate),https://www.europarl.europa.eu/doceo/document/CRE-9-2022-10-17-INT-1-180-0000_FR.html,"  Philippe Olivier (ID).   – Monsieur le Président, chers collègues, si le sujet n’était pas si sérieux, nous pourrions nous amuser de vous voir débattre de vos contradictions. La proposition de règlement sur l’utilisation de carburants plus écoresponsables pour le transport maritime est évidemment louable et nous la voterons. Mais comment ne pas souligner les incohérences, non pas simplement de votre démarche, mais de votre modèle?
Vous vous agitez pour trouver des substituts au fioul lourd, le pire carburant du monde, qui est le carburant des super-cargos, alors même que votre modèle économique induit la généralisation de ce type de transport. Il y avait, selon Equasis, 57 700 cargos sur les mers en 2018. Il y en a près de 100 000 aujourd’hui. On constate les limites de l’exercice consistant à vouloir concilier mondialisme et écologisme, concilier votre principe théologique de libre circulation effrénée avec la juste protection de la planète.
Le contraire de la mobilité n’est pas l’immobilité, mais la proximité. Vos vertueuses propositions de réglementation écologique ne seront crédibles que si, dans le même temps, vous avez la lucidité de revoir votre logiciel mondialiste, qui est par nature écocide.
"
Philippe OLIVIER,2022-10-03,FR,The EU's actions in the field of freedom of religion or belief worldwide (debate),https://www.europarl.europa.eu/doceo/document/CRE-9-2022-10-03-INT-1-139-0000_FR.html,"  Philippe Olivier,  au nom du groupe ID. – Madame la Présidente, chers collègues, vous invoquez la liberté religieuse. Je pense qu’il ne viendrait à l’esprit de personne, ici, de contester cette liberté si essentielle à l’homme. 
Pour autant, vous vous égarez lorsque, sous prétexte d’une politique inclusive dévoyée, vous faites la promotion du voile islamique – et je dirais même du voile islamiste – dans l’ensemble de votre communication institutionnelle. Des femmes et même des fillettes y apparaissent voilées, comme si on devait les réduire à n’être que des objets de concupiscence masculine. La liberté ne peut servir à promouvoir un symbole d’oppression des femmes, pas plus que la submersion de l’espace public par des démonstrations permanentes, même vestimentaires. 
À l’heure où les Iraniennes se dressent pour leur liberté, votre indiscernement va à rebours de l’émancipation des femmes. En France, qui fut dans l’histoire un pays de terribles guerres de religion, nous avons trouvé un juste équilibre entre le libre exercice de la religion et le respect des consciences de tous: cela s’appelle la laïcité. Vous feriez bien de vous en inspirer.
"
Philippe OLIVIER,2022-09-13,FR,EU response to the increase in energy prices in Europe (debate),https://www.europarl.europa.eu/doceo/document/CRE-9-2022-09-13-INT-2-319-0000_FR.html,"  Philippe Olivier (ID).   – Madame la Présidente, Mesdames, Messieurs, chers collègues, la crise de l’énergie ne fait que pointer. C’est de bonne guerre pour vous, si j’ose dire, d’invoquer le conflit ukrainien pour justifier la situation. Mais les crises, nous le savons, révèlent les failles plus qu’elles ne les créent. L’Europe conduite par l’UE fait aujourd’hui les frais de trois fautes.
Une faute dans des choix énergétiques, en effondrant la filière nucléaire. Quand vous nous rendez dépendants du soleil et du vent, vous nous rendez dépendants des Russes. Une faute géostratégique: si des sanctions contre la Russie étaient certainement nécessaires, elles devaient être adaptées pour leur efficacité et réfléchies dans leurs conséquences. Enfin une faute conjoncturelle, car vous acceptez d’être les otages de la spéculation.
Plus globalement, nous payons votre conception idéologique ultralibérale qui ne fait pas la différence de valeur entre les produits comme l’eau, la nourriture essentielle ou l’énergie. Qui croit que tout peut être abandonné à la main invisible du marché? Et puis, si vous aviez accepté de faire les choix d’indépendance énergétique que propose Marine Le Pen depuis quinze ans, avec le nucléaire et l’énergie, nous n’en serions pas là. 
"
Philippe OLIVIER,2022-06-22,FR,Future of EU-Africa trade relations (debate),https://www.europarl.europa.eu/doceo/document/CRE-9-2022-06-22-INT-1-276-0000_FR.html,"  Philippe Olivier (ID).   – Madame la Présidente, mes chers collègues, si nous partageons la volonté exprimée dans le rapport de lutter contre la pauvreté et la faim et d’établir avec le continent africain des relations respectueuses et fructueuses, il nous semble que vos présupposés idéologiques vous égarent.
Vous raisonnez en termes de grands échanges mondiaux quand la solution réside dans la création de chaînes d’approvisionnement locales – ce que nous appelons le localisme –, dans l’indépendance alimentaire qui allie la recherche et la coopération, dans le droit des peuples à vivre sur leurs terres. Vous n’envisagez les relations que comme l’adhésion à votre modèle économique mondialiste qui est polluant, destructeur des filières locales et même des économies traditionnelles. Et puis vous liez obligatoirement libre circulation des biens et des personnes. Au hasard du texte, vous raccrochez le commerce à une immigration sûre et organisée, comprenez: la poursuite de la submersion de l’Europe.
Il est temps de vous départir de votre vision quasi théologique du «sans-frontiérisme» et de la libre circulation érigée en dogme théocratique. Vous prétendez en cela participer à la paix du monde. En réalité, vous préparez l’asservissement des peuples et des gens à des logiques économiques et prédatrices des deux côtés de la Méditerranée.
"
Philippe OLIVIER,2022-06-08,FR,"The Commission's proposal for ""Attracting skills and talent to the EU"", particularly the Talent Partnerships with North African countries (topical debate)",https://www.europarl.europa.eu/doceo/document/CRE-9-2022-06-08-INT-3-144-0000_FR.html,"  Philippe Olivier (ID).   – Monsieur le Président, Mesdames, messieurs, chers collègues, il n'est pas de bonne politique qui ne soit évaluée. Qu'est ce que ça coûte ? Qu'est ce que ça rapporte ? C'est une évaluation en amont et en aval pour mesurer le coût-avantage.
Le principe que vous appliquez est celui-ci dans tous les domaines, sauf pour l'immigration. C'est le syndrome de Cologne : quand il s'agit d'immigration, on ne veut pas voir la réalité. Pourquoi imposer à toute l'Europe une immigration de travail alors que par exemple mon pays, la France, connaît un chômage de masse ?
La question des compétences peut se régler par des coopérations inter-européennes ou par la formation. Que dire de la question éthique de retirer aux pays émergents leurs forces vives et leurs élites formées ?
L’immigration n'est pas pour vous un problème, ni même une nécessité économique, mais un projet politique et idéologique. En matière de migration légale ou illégale, nos pays ont atteint un point de saturation. Vous voulez nous faire croire qu'on va faire venir des médecins et des ingénieurs alors que dans les faits, avec votre immigration, on aboutit au chaos du Stade de France.
"
Philippe OLIVIER,2021-12-15,FR,EU response to the transport poverty (debate),https://www.europarl.europa.eu/doceo/document/CRE-9-2021-12-15-INT-3-319-0000_FR.html,"  Philippe Olivier,  au nom du groupe ID. – Monsieur le Président, Madame la Commissaire, en posant la question de la précarité énergétique, vous mettez en discussion un problème réel: l'explosion actuelle du coût de l'énergie – gaz, électricité, carburants – suscite dans mon pays un légitime climat de révolte. 
Mais il ne suffit pas d'évoquer des problèmes quand des présupposés idéologiques, au mieux vous interdisent d'y apporter des réponses, au pire contribuent à les aggraver. Force est de constater que les politiques de persécution fiscale des automobilistes ou d'inflation normative pour l'utilisation des énergies fossiles vont être particulièrement préjudiciables à deux catégories de personnes: les plus pauvres, qui ne peuvent pas changer de voiture, et les ruraux, qui ne bénéficient pas d'une offre de transports publics. 
Sous couvert d'écologie, votre politique ne contribue qu'à aggraver les inégalités sociales ou territoriales, à renforcer de fait la métropolisation. Nous pensons qu'il faut aller dans un sens inverse qui est la dé-métropolisation, c'est à dire le rééquilibrage entre les zones urbaines et les zones rurales. 
Cela passe évidemment par la nécessité de repenser le développement économique, les infrastructures, mais aussi une offre de transports publics et privés qui ne soit plus pénalisante.
"
Philippe OLIVIER,2021-11-24,FR,State of the Energy Union (debate),https://www.europarl.europa.eu/doceo/document/CRE-9-2021-11-24-INT-3-212-0000_FR.html,"  Philippe Olivier (ID).   – Monsieur le Président, Mesdames, Messieurs, en matière d’énergie, nous pouvons reconnaître à l’Union européenne au moins le mérite de la continuité; de la continuité dans l’erreur. 
Au niveau de la méthode, vous procédez par objectifs, sous forme d’ultimatums, sans considération des filières, des équilibres économiques, des histoires de chacun des pays. Vous assortissez vos injonctions de délais trop contraignants et faites ainsi peser sur les particuliers ou les États la menace de rétorsions injustes. Comme d’habitude, vous dégainez l’arme fiscale, peu importe qu’elle affecte d’abord les classes populaires de nos pays, pourtant si durement éprouvées par le lessivage de la mondialisation. Tout le monde n’a pas les moyens de se payer une voiture électrique, des voitures par ailleurs peu adaptées aux campagnes. 
Sur le fond, vous poursuivez le saccage de nos paysages avec vos éoliennes, sur terre ou en mer, pour une énergie intermittente, évanescente, exorbitante et enfin, du fait de la durée de vie d’installations difficilement recyclables, polluante. Et puis, il y a la question du nucléaire, énergie décarbonée s’il en est, dont les promoteurs du charbon en Allemagne voudraient, par pure idéologie, priver la France et l’Allemagne. Cette excommunication religieuse interdit à nos pays les moyens de leur puissance et de leur indépendance énergétique. Nous disposons, avec le nucléaire français, d’une filière d’excellence qui assure une électricité bon marché, constante, propre, qui peut se prolonger vers l’hydrogène décarboné, quand vous êtes coincés avec l’hydrogène renouvelable. 
Dans un dossier aussi important pour l’avenir de l’Europe, décidément, vous restez prisonniers de vos lubies idéologiques. 
"
Philippe OLIVIER,2021-11-10,FR,The European Education Area: a shared holistic approach (debate),https://www.europarl.europa.eu/doceo/document/CRE-9-2021-11-10-INT-1-183-0000_FR.html,"  Philippe Olivier (ID).   – Monsieur le Président, Mesdames, Messieurs, chers collègues, quand l’Union européenne nous parle d’organiser un espace commun de l’éducation, nous avons quelques raisons de nous inquiéter.
D’abord, parce que la responsabilité de la puissance publique n’est pas, en premier lieu, de satisfaire aux problèmes d’éducation, mais d’instruction. Cette question se pose notamment pour mon pays, la France, où le système scolaire parvient difficilement à transmettre les savoirs de base: lire, écrire, compter. J’ajoute que, selon nous, l’éducation relève de la famille et de la nation.
Nous sommes également inquiets parce qu’il n’est pas d’action de l’Union européenne qui ne soit dénuée d’arrière-pensée idéologique. Et effectivement, ce dossier n’échappe pas à la règle. Sous prétexte d’éducation, l’Union veut mettre en place le formatage idéologique des systèmes scolaires de nos pays. Comment comprendre autrement les priorités affichées de sensibilisation au changement climatique, à la lutte contre le populisme, à la dénonciation de la désinformation, c’est-à-dire la justification de la censure?
Vous voulez faire de cet espace d’éducation un vecteur d’influence de votre vision impériale. Ce que vous ambitionnez de mettre en place, ce n’est pas un système d’éducation, mais un programme de rééducation des populations.
"
Philippe OLIVIER,2021-10-20,FR,Pushbacks at the EU's external border (debate),https://www.europarl.europa.eu/doceo/document/CRE-9-2021-10-20-INT-3-349-0000_FR.html,"  Philippe Olivier (ID).   – Madame la Présidente, Madame la Commissaire, votre position sur la question du refoulement aux frontières est emblématique. Elle est emblématique de votre objectif politique, que dis-je politique, idéologique, qui est non pas de préserver nos pays, mais d’organiser leur submersion migratoire. Une submersion qui n’est pas pour vous un problème, mais un projet. Elle est emblématique de vos méthodes puisque, comme du temps de l’Union soviétique avec le communisme, vous arguez de vos échecs pour imposer toujours plus d’européisme. Elle est surtout emblématique de votre volonté de bafouer tous les principes réels de droit.
Vous partez d’un droit mou, c’est-à-dire de déclarations vagues, en l’occurrence le respect des droits humains, pour permettre à des autorités illégitimes d’édicter des mesures coercitives. Elles sont ensuite amenées à muter au gré des interprétations, interprétations judiciaires ou même extrajudiciaires, puisque vous sous-traitez leur contrôle à des ONG idéologisées. Un droit qui fluctue selon des interprétations partisanes, ce n’est pas du droit.
En matière de migration, votre souci n’est pas le droit, mais un projet de mondialisation démographique au mépris du respect des droits des peuples européens.
"
Philippe OLIVIER,2021-10-05,FR,Implementation report on the EU Trust Funds and the Facility for Refugees in Turkey (continuation of debate),https://www.europarl.europa.eu/doceo/document/CRE-9-2021-10-05-INT-2-245-0000_FR.html,"  Philippe Olivier (ID).   – Madame la Présidente, chers collègues, vous vous demandez aujourd’hui si l’argent public versé par l’Union européenne à la Turquie est bien utilisé et bien contrôlé. La réponse est non.
Progressivement, la Turquie laïque, qui était un allié du monde libre, est devenu, disons-le, un pays islamiste prosélyte à visée impérialiste. On le voit sur la scène internationale avec une politique néo-ottomane ou même chez nous, lorsque le régime de M. Erdoğan tente d’instrumentaliser politiquement les diasporas turques de nos pays.
C’est cette même Turquie, à la recherche permanente d’une épreuve de force, qui développe des attitudes inamicales quand elle ne menace pas directement des membres de l’Union européenne, notamment en Méditerranée. Que dire de son attitude pour le moins ambiguë dans la lutte contre le terrorisme?
Nous, Européens, qui avons eu le tort de lui sous-traiter le contrôle de notre politique migratoire, sommes aujourd’hui l’objet d’un chantage de grande envergure avec pour menace notre submersion. Un chantage financier et politique, un chantage qu’aucune puissance ne peut accepter.
L’Union européenne s’est scandalisée de l’utilisation de l’arme migratoire par la Biélorussie contre ses voisins européens, et notamment la Lituanie. Les sanctions ont immédiatement été envisagées par l’Union européenne. Pourquoi cette fermeté avec la Biélorussie et cette complaisance vis-à-vis de la Turquie? Pourquoi continuer à financer à fonds perdus un partenaire qui n’en est pas un et poursuivre un processus d’adhésion de plus en plus anachronique?
"
Philippe OLIVIER,2021-07-07,FR,Commission Work Programme 2022 (debate),https://www.europarl.europa.eu/doceo/document/CRE-9-2021-07-07-INT-3-152-0000_FR.html,"  Philippe Olivier,  au nom du groupe ID. – Monsieur le Président, Mesdames et Messieurs, il y a au moins un domaine où l’Union européenne s’ingénie à ne pas mesurer l’impact budgétaire de ses décisions, pour elle-même ou pour les États membres: c’est l’immigration.
Le 23 septembre 2020, la Commission a présenté les contours de son pacte pour l’asile et l’immigration, qui s’appuie sur une logique coercitive à l’égard des nations, avec notamment des relocalisations forcées ou la mise sous surveillance des États membres, ce qui va aboutir à élargir les possibilités d’accès à l’Europe à une immigration planétaire sans limite. Concrètement, ce pacte pour l’immigration va ouvrir la voie à 70 millions de candidats à la migration vers l’Europe, selon l’étude Gallup sur les intentions de migration extra-européenne vers nos pays.
Ce qui est frappant dans la procédure, il est vrai très opaque, d’adoption de ce pacte, c’est, compte tenu des masses en jeu, l’absence totale d’étude d’impact. Accueillir des dizaines de millions de personnes, les assister pour tout, les soigner, les nourrir, les loger, les former: cela va coûter des sommes folles. Pour vous donner un ordre d’idée, pensez, mes chers collègues, qu’en France, l’Association des départements a évalué à 50 000 euros par an et par personne le coût d’un seul mineur migrant isolé, soit pour la France une facture de 2 milliards d’euros, avec une augmentation exponentielle.
Une étude de l’Université d’Amsterdam chiffre pour la seule Hollande le coût de l’immigration à 400 milliards d’euros pour la période 1995-2019 et à 600 milliards d’euros pour les 20 prochaines années, soit 1 000 milliards d’euros en quarante ans. Pour un pays comme la France, cela représenterait plus de 3 000 milliards d’euros. Et encore, je ne prends pas en compte le fait que mon pays subit une immigration plus importante et offre un État providence plus généreux.
C’est pourquoi je vous demande, au nom de la raison et de la démocratie qui vous impose de dire la vérité aux citoyens, d’évaluer l’impact de votre folle politique migratoire, tant pour l’UE que pour les pays membres. Si vous ne voulez pas le faire, c’est que vous êtes favorables à l’immigration quoi qu’il en coûte et que la submersion de nos pays n’est pas pour vous une catastrophe annoncée, mais un projet.
"
Philippe OLIVIER,2021-06-07,FR,State of the SMEs Union – Implementation of better regulation agenda / Reduction target for administrative burden (debate),https://www.europarl.europa.eu/doceo/document/CRE-9-2021-06-07-INT-1-038-0000_FR.html,"  Philippe Olivier (ID).   – Monsieur le Président, en présentant la stratégie industrielle de l’Union, la Commission européenne nous invite à une réflexion économique opportune.
C’est le moment de poser la question des handicaps que vous imposez à nos entreprises: l’inflation des normes – dont certaines sont absurdes –, la concurrence faussée – je pense notamment aux travailleurs détachés –, l’impossibilité d’accès aux marchés publics de nos PME-TPE.
Transition numérique et écologique, dites-vous. Sur la transition numérique, on ne pourra que vous dire «enfin!». L’Europe a vu à cause de votre inertie bureaucratique la révolution numérique lui échapper. Ce sont les Américains et les Chinois qui ont pris une avance décisive.
Sur la transition écologique, gardez-vous d’une tentation qui sous-tend votre démarche, celle de l’écologie punitive. Les grandes révolutions – et la révolution écologique en est une – ne se font que par l’adhésion et non par la contrainte, par la collaboration positive et non par l’enrôlement forcé. La révolution culturelle coercitive, c’est celle de Mao Tsé-Toung, cela procède du totalitarisme et cela ne fonctionne pas. Usez donc de l’incitation plus que de la répression.
Cette réflexion écologique vous commande également de revoir votre logiciel mondialiste, celui qui programme, par exemple, la spécialisation des régions du monde par type d’activité. La Chine, usine du monde? Belle idée. On a vu ce que cela a donné pendant la COVID: la pénurie pour nos pays, l’humiliation d’une Europe incapable de produire des masques en papier. Aujourd’hui, être proche, c’est être écologiquement vertueux et cela signifie être pénalisé. C’est être contraint à des normes environnementales ou sociales écrasantes et être concurrencé par des pays qui s’affranchissent de toute règle. La révolution écologique que nous appelons de nos vœux est la révolution localiste: celle qui tourne le dos aux traités de libre-échange pour des traités de juste-échange permettant un commerce maîtrisé et vertueux. La révolution localiste, c’est mettre en œuvre partout des circuits courts pour produire, consommer et recycler sur place. Le maître-mot ne doit plus être la mobilité, mais la proximité.
"
Philippe OLIVIER,2021-02-10,FR,Democratic scrutiny of social media and the protection of fundamental rights (debate),https://www.europarl.europa.eu/doceo/document/CRE-9-2021-02-10-INT-3-189-0000_FR.html,"  Philippe Olivier (ID).   – Madame la Présidente, mes chers collègues, qu’est-ce que la liberté de s’exprimer si l’on vous interdit le papier et l’encre? C’est pourtant ce qui se passe aujourd’hui dans le monde entier pour des citoyens, des militants, des personnalités et des élus qui se voient arbitrairement censurés par les réseaux sociaux, sans condamnation préalable et sans possibilité d’appel.
Ainsi, en France, est-ce le cas, par exemple, du sénateur LR Sébastien Meurant, du député ex-LREM Joaquim Son-Forget ou encore de la députée Emmanuelle Ménard, tous trois censurés par Twitter pour avoir pensé autrement. Émettre une idée différente n’est pas un crime, c’est un droit.
Notre Parlement européen se grandirait à défendre la liberté d’expression face aux nouveaux censeurs que sont les géants du Net. C’est un combat difficile, mais la liberté d’expression n’a de sens que si elle permet de protéger les idées, toutes les idées, même celles qui peuvent aller à contre-courant. Les autres, les vérités officielles, on le sait, sont admises même dans les pires dictatures. 
"
Philippe OLIVIER,2021-01-20,FR,Presentation of the programme of activities of the Portuguese Presidency (debate),https://www.europarl.europa.eu/doceo/document/CRE-9-2021-01-20-INT-3-138-0000_FR.html,"  Philippe Olivier (ID).   – Madame la Présidente, au seuil de cette présidence portugaise, Monsieur le Premier ministre, vous exprimiez votre volonté de faire aboutir le pacte pour l'immigration, ce pacte avec le diable. Ce pacte prétendument équilibré est irresponsable et totalitaire. 
Il est irresponsable parce qu'il organise la submersion de l'Europe, avec pour objectif affiché son repeuplement. Il est totalitaire parce qu'il met en oeuvre des législations coercitives pour les États en étirant les traités, notamment les articles 79 et 80 du traité de fonctionnement de l'Union, en tordant le principe de subsidiarité, en faisant des migrations une compétence de droit commun de l'Union, quand elle n'était qu'une compétence d'exception. Or, on ne peut changer un traité que par un autre traité. 
Cette mondialisation démographique de l'Europe, vous voulez la décider entre vous, sans qu'aucun véritable débat démocratique n'ait lieu. Parce qu'il y va de l'existence de l'Europe et de sa civilisation, pour le pacte d'immigration, nous vous demandons, monsieur le Premier ministre, de donner la parole au peuple en appliquant le principe de l'Europe plurimillénaire à laquelle appartient votre beau pays: Vox populi, Vox dei. 
"
