MP,Date,Language,Title,Url,Content
Philippe OLIVIER,2020-05-13,FR,"Conclusions of the extraordinary European Council meeting of 23 April 2020 - New MFF, own resources and Recovery plan (debate)",https://www.europarl.europa.eu/doceo/document/CRE-9-2020-05-13-INT-1-094-0000_FR.html,"  Philippe Olivier (ID).   – Monsieur le Président, je voudrais évoquer un sujet tabou dans cette grande maison qu’est le Parlement: la décision de la Cour constitutionnelle allemande du 5 mai d’exiger de la BCE de justifier ses décisions au regard des traités européens.
Je ne veux pas entrer ici dans un débat financier, ni même juridique. Je voudrais m’en tenir aux principes que soulève cette décision, que dis-je, cet ultimatum.
Avec cette tradition spécifique qui consacre en Allemagne le pouvoir des juges, les magistrats de Karlsruhe ont agi comme des lanceurs d’alerte souverainistes. Ils sont venus réaffirmer que l’UE n’est pas un État fédéral et que les États restent maîtres des traités et de leurs intérêts nationaux.
Comme si de rien n’était, la Commission a mécaniquement réaffirmé la prééminence du droit européen sur le droit national. «Comme si de rien n’était»: c’est comme cela que pourrait se résumer le comportement de l’UE, qui s’affaire à l’adhésion du Kosovo ou de la Macédoine lorsque la crise sanitaire tourne au drame en Italie. Vous êtes comme le chauffeur à contresens sur l’autoroute, qui continue à toute allure en ignorant les appels de phares qui viennent d’en face.
"
Philippe OLIVIER,2020-01-29,FR,EU strategy for mobility and transport: measures needed until 2030 and beyond (debate),https://www.europarl.europa.eu/doceo/document/CRE-9-2020-01-29-INT-1-430-0000_FR.html,"  Philippe Olivier (ID).   – Madame la Présidente, laissez-moi vous rappeler une vérité simple: l’énergie la plus propre et celle qu’on ne consomme pas. Vous nous proposez de réduire la pollution des transports, vous avez raison. Mais comment ne pas penser que vous êtes atteinte d’une certaine schizophrénie, parce qu’ayant fait le constat que la planète s’asphyxie avec le développement des transports, vous vous acharnez à mettre en œuvre un modèle fondé sur le libre—échangisme, le nomadisme, c’est—à—dire en pratique le développement infini des transports, et l’on voit dans le monde, le ballet des super-cargos baladant des marchandises et même des déchets.
Vous ne parlez pas de citoyens, mais seulement de consommateurs, réduisant l’homme à cette fonction consumériste. C’est cette conception mercantiliste de l’homme qui vous place en pleine contradiction écologique. Au globalisme, nous opposons le localisme qui nous convie à produire, consommer, retraiter sur place. Au nomadisme, nous opposons le bonheur de vivre sur sa terre avec ses affections et ses traditions, à votre hyper—consumérisme nous opposons une sobriété qui, comme nous le rappelle Pierre Rabhi peut être source de bonheur. Je vous remercie.
"
Philippe OLIVIER,2019-09-19,FR,"Situation in Turkey, notably the removal of elected mayors",https://www.europarl.europa.eu/doceo/document/CRE-9-2019-09-19-INT-4-039-0000_FR.html,"  Philippe Olivier (ID).   – Monsieur le Président, récemment, le président turc, M. Erdogan, a brandi la menace de laisser se déverser sur l’Europe une vague migratoire s’il ne recevait pas des fonds supplémentaires. Nous payons là l’erreur coupable d’avoir délégué à d’autres notre protection vitale.
M. Erdogan, qui se voit comme un sultan du nouvel empire ottoman, sait que la politique est un rapport de force. Il est coutumier de ces comportements peu amicaux. Il s’en prend à la Grèce ou à Chypre, et lorsqu’un de nos collègues le fait remarquer dans cet hémicycle, l’Assemblée ne l’entend pas. Il instrumentalise les diasporas turques dans nos pays et l’Union européenne tourne la tête.
La situation que nous vivons avec la Turquie est éloquente: l’UE a fait de l’Europe l’empire de la faiblesse. Mais surtout, en détruisant nos protections frontalières, l’UE a désarmé nos nations et les a placées sous la menace d’une submersion migratoire aujourd’hui utilisée comme une arme de destruction massive. Ce n’est pas simplement une faute, c’est une forfaiture. 
"
Philippe OLIVIER,2019-07-16,FR,Situation in Venezuela (debate),https://www.europarl.europa.eu/doceo/document/CRE-9-2019-07-16-INT-2-204-0000_FR.html,"  Philippe Olivier,  au nom du groupe ID. – Monsieur le Président, le Venezuela, c’est d’abord un drame humain et, si on est pratiquement tous d’accord, la confirmation de la nocivité des systèmes d’aspiration collectiviste. Mais, le Venezuela, c’est pour bien des pays européens de l’Union, comme le mien, l’illustration de ce qui apparaît comme une double faute: l’allégeance et l’ingérence. 
L’allégeance, en donnant le sentiment de suivre servilement la position américaine en soutenant le président de l’assemblée, Juan Guaido, exactement dans le sillage du président Trump. À quoi sert une organisation européenne, si elle n’apparaît sur la scène internationale que comme le porte-drapeau d’une bannière étoilée qui n’est pas la sienne?
L’ingérence, en adoptant une attitude éminemment brutale dans un conflit intérieur qui peut dégénérer en guerre civile. L’Italie, qui a su tenir une position équilibrée, a fait preuve de clairvoyance. 
En ignorant la prudence qui lui commandait l’indépendance et la non-ingérence, l’Union a perdu son unité et son crédit diplomatique, ce qui la handicape aujourd’hui pour jouer un rôle de médiateur, pourtant si nécessaire. Que cette triste situation nous serve de leçon. 
"
