MP,Date,Language,Title,Url,Content
Reinhard BÜTIKOFER,2023-03-14,EN,Question Time (VPC/HR) - Strengthening the Trans-Atlantic ties in an ever challenging multilateral world,https://www.europarl.europa.eu/doceo/document/CRE-9-2023-03-14-INT-2-306-0000_EN.html,"  Reinhard Bütikofer (Verts/ALE).   – Mr Borrell, the cooperation on China is a core issue in transatlantic relations. Recent media excitement has focused on some lack of clarity as to where the EU stands. President von der Leyen has been accused of being overly hawkish. Some people even felt the need to say we should not be a vassal of the United States, while President Michel has been dubbed as the person who tries to avoid confrontation. 
Now, where should the EU stand with regard to transatlantic relations on China? And I have three specific questions. President Biden has said yes to all three. What are you saying? Should there be outbound investment screening? Should there be sanctions if China delivers arms to Russia? And should there be a deterrence policy to avoid an attack on Taiwan? 
"
Reinhard BÜTIKOFER,2023-03-14,DE,Deterioration of democracy in Israel and consequences on the occupied territories (debate),https://www.europarl.europa.eu/doceo/document/CRE-9-2023-03-14-INT-2-360-0000_DE.html,"  Reinhard Bütikofer (Verts/ALE).   – Herr Präsident! In der vorausgegangenen Debatte ist Israel zweimal des Faschismus bezichtigt worden. Ich finde, solche Worte sollten im Europäischen Parlament nicht fallen, und wenn sie fallen, sollten sie gerügt werden.
"
Reinhard BÜTIKOFER,2023-03-14,EN,Situation in Georgia (debate),https://www.europarl.europa.eu/doceo/document/CRE-9-2023-03-14-INT-2-383-0000_EN.html,"  Reinhard Bütikofer (Verts/ALE).   – Mr President, Commissioner, ironically speaking, I must say, I admire Mick Wallace because he again demonstrated that he will sure as hell always position himself on the side of reactionaries, authoritarians and oppressors. But the Georgian citizens have opted for another choice because they know that the so-called Georgian dream has turned into a Georgian nightmare. The Georgian government is paying lip service at best to European values and the European path. We should not let Georgian citizens alone in their fight for the European perspective. That is why we should consider measures beyond what’s been on the table. Will we continue unabated with the development cooperation without conditionality? Will we refuse to consider sanctions? We shouldn’t. And we should fight for the freedom of Saakashvili. 
"
Reinhard BÜTIKOFER,2023-02-15,EN,Access to strategic critical raw materials (debate),https://www.europarl.europa.eu/doceo/document/CRE-9-2023-02-15-INT-3-312-0000_EN.html,"  Reinhard Bütikofer (Verts/ALE).   – Madam President, Minister, Commissioner, it has been said several times that the EU’s supply with critical raw materials is not secure. That’s true. But that’s not news. That was true also ten years ago when we experienced the Senkaku crisis. 
But what did we do since? We refused to learn our lessons! Today, we’re more dependent on China than we were at that time. That’s not because China controls all the raw materials, all the rare earths, as rare earths are not really rare, but the processing capacity that China controls, that’s rare and concentrated, and that creates a dependency. 
Even with the greatest realism regarding a max of green mining inside Europe and a max of circularity in the use of raw materials, we will remain a continent depending on critical raw materials imported from other corners of the globe. 
That’s why we must invest in partnerships with other countries, and I’m grateful, Commissioner, that you mentioned the Global Gateway Initiative. That should be the tool that we employ to create the win—win partnerships that help us in overcoming these dependencies. 
"
Reinhard BÜTIKOFER,2023-01-19,EN,The Global Gateway Initiative (debate),https://www.europarl.europa.eu/doceo/document/CRE-9-2023-01-19-INT-4-051-0000_EN.html,"  Reinhard Bütikofer,  on behalf of the Verts/ALE Group. – Mr President, Commissioner, dear colleagues, when President von der Leyen, almost a year and a half ago, announced the Global Gateway Initiative, it was welcomed by this House. Because she proposed a plan to revive, to reorient and to enlarge in scope an initiative that had originally been promoted by her predecessor, Juncker, in the waning days of his own presidency. 
The principles of Global Gateway are good. Global Gateway is designed to combine three major thrusts: to invest into international infrastructure development; to promote the green and digital transformation; and to combine that with the geopolitical goals of the European Union. 
But a year and a half later, I’m sometimes tempted to say Global Gateway would be a good idea. Indeed, I agree with the colleagues who have said that it is now time to deliver. When DG INTPA, for instance, last year organised its traditional development days and put the label Global Gateway everywhere but didn’t change a thing on substance, that was not what we expect. That was old wine in new wineskins. Instead of creative geopolitical action, bureaucratic laziness. When one Commissioner says he has 84 lighthouse projects under the label of Global Gateway, he hasn’t understood the idea, obviously. 
The world is waiting for us to put our money where our mouth has been. And Udo Bullmann is right that this is a great opportunity. But Mr Tobé is also right when he says this has to be developed in a mutually beneficial way and we have to develop a real partnership. But that is not going to be successful if we pursue Global Gateway as a kind of Christmas tree project. 
We have to have clear priorities and we have to have the governance right. And what we are still missing is this. We are still missing the Business Advisory Council. We are still missing the civil society dialogue as a permanent exercise. We are still missing the Global Gateway Forum that was proposed in the strategy and that should be organised this autumn. And we will also need – and I think Mrs von der Leyen would be well advised to do that – the nomination of a high-level special envoy to represent Global Gateway for the European Union. 
"
Reinhard BÜTIKOFER,2023-01-17,EN,Implementation of the common foreign and security policy - annual report 2022 - Implementation of the common security and defence policy - annual report 2022 (debate),https://www.europarl.europa.eu/doceo/document/CRE-9-2023-01-17-INT-2-297-0000_EN.html,"  Reinhard Bütikofer,  on behalf of the Verts/ALE Group. – Madam President, Vice-President, HR/VP, David, colleagues, we do live in a new era. For the EU the next seven years will decide whether we will sit at the table or be on the menu. We have to start with realism, though. Overblown dreams of strategic autonomy can be and must be discarded because we learn in the present situation that without the United States’ support, we would not have been able to hold our own together to support Ukraine. That means we must continue to invest in transatlantic relations, but at the same time, we have to up our own game. We have to increase our capabilities: being an ally is not enough; we must be strong allies.
Second, we must not allow ourselves to be captured by delusions about the nature of authoritarian and totalitarian regimes. And that in particular means de-risk our relationship with China. Systemic rivalry is not just between Washington and Beijing. Nostra res agitur.
Third, cooperation with countries of the Global South to promote mutual benefit is not an option anymore, it’s a must – a geopolitical must, and that implies that we have to invest in the Global Gateway initiative.
And finally, the climate crisis has long been a threat—multiplier. This multiplication is getting more dangerous by the year. Fighting climate crisis is not everything, but without effectively fighting climate crisis, everything will come to nought.
"
Reinhard BÜTIKOFER,2022-12-15,EN,Resumption of the sitting,https://www.europarl.europa.eu/doceo/document/CRE-9-2022-12-15-INT-4-106-0000_EN.html,"  Reinhard Bütikofer (Verts/ALE).   – Madam President, colleagues, the EPP published a press release yesterday that has now been read to the Parliament twice, once by Ms Zovko last night, and just now. In this statement, and I quote, they question ‘the integrity of the foreign policy positions of the EP, as expressed in the urgency resolutions’. This casts a very dark shadow of suspicion and insinuation over the complete human rights work of this Parliament. And unfortunately they do so without the slightest indication that there is any reason to do it. They just take the corruption scandal that we have to fight against as an excuse for trying to kill the urgencies that they wanted to kill anyway.
Rule 144(2) of our Rules of Procedure states, and I quote, ‘[t]he Conference of Presidents shall draw up a list of subjects to be included in the final draft agenda for the next debate on cases of breaches of human rights, democracy and the rule of law on the basis of the request referred to in paragraph 1 and in accordance with the provisions of Annex IV. The total number of subjects included in the agenda shall not exceed three, including sub—chapters.’
On this basis, I request that the President ensures that the work of this Parliament on human rights that is founded in this paragraph of Rule 144 shall not be obstructed by the EPP, who call for a stop of all the work.
"
Reinhard BÜTIKOFER,2022-12-14,EN,EU response to the US Inflation Reduction Act (debate),https://www.europarl.europa.eu/doceo/document/CRE-9-2022-12-14-INT-3-072-0000_EN.html,"  Reinhard Bütikofer (Verts/ALE).   – Madam President, Executive Vice-President, Minister, the protectionist way in which the United States is pushing the dearly-needed green transition of their own economy hurts our interests. Our friends and partners in the United States are deviating important investment from the European to the US markets, thus effectively promoting European deindustrialisation somewhat, even if unintended. That runs counter to our shared interest, also to their own. And it has effects beyond just the economic dimension because it contributes to a creeping crisis of trust. 
Of course, I wish you well, Executive Vice-President, with the talks that you have ahead of you, but I will still reserve judgment as to what can effectively be done in the negotiations. So we have to focus on what we can do ourselves. I certainly support the reform of state aid rules. I think we should invest together, as Ernest Urtasun has emphasised, in a smart, fair and WTO-compatible way. And we should also go back to looking at the fragmentation that still exists in the single market and try to overcome that. One thing we should not do: we should not retaliate against protectionism with our own protectionism. 
"
Reinhard BÜTIKOFER,2022-12-14,DE,Chinese government crackdown on the peaceful protests across the People's Republic of China,https://www.europarl.europa.eu/doceo/document/CRE-9-2022-12-14-INT-3-425-0000_DE.html,"  Reinhard Bütikofer,  Verfasser. – Frau Präsidentin, Frau Kommissarin, liebe Kolleginnen und Kollegen! Gestern noch hat der Kollege David Leger von der EVP die Verhandlungen, die sehr harmonischen und konsensualen Verhandlungen über die Entschließung, über die wir morgen abstimmen werden, geleitet. Ich bedaure, dass er heute nicht als Koautor hier reden kann.
Zur Sache. Ich glaube, dass die landesweiten Proteste in China gegen die sogenannte Zero-Covid Policy der chinesischen Führung ein Ereignis von historischer Bedeutung darstellen. Da hat sich im Verhältnis zwischen dem Unterdrückerregime und dem unterdrückten Volk etwas geändert. Jahrzehntelang hatte es das nicht gegeben, dass sich landesweit Protest erhebt. Jahrzehntelang hatte es das nicht gegeben, dass Menschen aus den verschiedensten sozialen Gruppen gemeinsam protestieren. Und jahrzehntelang hatte es nicht gegeben, dass solche Forderungen direkt an die zentralen Verantwortlichen in Peking gerichtet werden. Die Pekinger Führung hat selber dafür gesorgt, dass dieser große Protest zustande gekommen ist. Und die Perspektive der chinesischen Freiheit, die im Moment so weit entfernt zu sein scheint, ist durch diese Proteste stärker geworden und näher gerückt.
"
Reinhard BÜTIKOFER,2022-12-14,EN,Chinese government crackdown on the peaceful protests across the People's Republic of China,https://www.europarl.europa.eu/doceo/document/CRE-9-2022-12-14-INT-3-430-0000_EN.html,"  Reinhard Bütikofer (Verts/ALE).   – Madam President, I would like to raise a point of order. My point of order is the request that Ms Zovko should be sanctioned because first, she misused a China debate to enact a hypocritical theatre, charging everybody else as culprits in a criminal gang system. And I also want to have her criticised for not even having the respect for her colleagues to wait until the question to her has been asked. I think that is completely objectionable behaviour. She should be sanctioned.
"
Reinhard BÜTIKOFER,2022-12-13,EN,Question Time (Commission) - “Protection of strategic infrastructure from China's influence”,https://www.europarl.europa.eu/doceo/document/CRE-9-2022-12-13-INT-2-262-0000_EN.html,"  Reinhard Bütikofer (Verts/ALE).   – Thank you, Executive Vice-President, for tackling this important issue here. I believe the protection of strategic infrastructure cannot just be expected from the executive branch of government. We need an all-of-society effort to deal with the integrated multi-actor activities from the Chinese side. 
In that regard, I think it’s important to raise the awareness of the public. I think the Commission should look into opportunities for supporting, for instance, mapping efforts by academia or think tanks that would help to raise awareness. Also, I believe that often on the local level there is a lack of China competency. In twinning relationships, small towns of below 100 000 inhabitants are twinned with several million inhabitants in a big Chinese metropolis. They could be overwhelmed. So there should be efforts to enhance their China competency to deal with these issues. 
And finally, the EU cannot impose a European port strategy, but the European Union can support efforts by national actors, by regional actors to coordinate. And there we have not been doing what we should be doing.
"
Reinhard BÜTIKOFER,2022-12-13,EN,Question Time (Commission) - “Protection of strategic infrastructure from China's influence”,https://www.europarl.europa.eu/doceo/document/CRE-9-2022-12-13-INT-2-264-0000_EN.html,"  Reinhard Bütikofer (Verts/ALE).   – Just one short additional remark. Some Member States, like the Dutch or the Swedish, have invested into creating national China competency centres or different institutions that help creating that competency that we need on all societal levels. And I think it would be helpful if the Commission could put some effort into propagating those shining examples.
"
Reinhard BÜTIKOFER,2022-12-13,EN,ASEAN relations ahead of the EU-ASEAN summit in December 2022 (debate),https://www.europarl.europa.eu/doceo/document/CRE-9-2022-12-13-INT-2-511-0000_EN.html,"  Reinhard Bütikofer (Verts/ALE).   – Madam President, dear colleagues, the commemorative summit that Brussels is preparing for, with the ASEAN Community, offers an opportunity for reflection of how serious we really are with our strategic partnership. That sounds nice, but how strategic is it really? 
We learned today from the media that the two sides have not been able to agree on common language about Taiwan or issues around Taiwan. 
So I think we should not fool ourselves. That strategic partnership is still much more of a promise and an aspiration than it is a reality. And I think we should clearly identify priority projects to make it a real strategic partnership. I think one of them would be, as Mr McAllister said, a region-to-region FTA. One of them would be cooperating on trusted connectivity projects and one would be systematic cooperation in international organisations.
"
Reinhard BÜTIKOFER,2022-11-22,EN,EU-China relations (debate),https://www.europarl.europa.eu/doceo/document/CRE-9-2022-11-22-INT-2-318-0000_EN.html,"  Reinhard Bütikofer,  on behalf of the Verts/ALE Group. – Mr President, Mr Borrell. To say it simply, Mr Borrell, I’m disappointed. I heard from you a lot of generalities, but very little indeed about the reality of EU-China relations.
Maybe there isn’t so much to report. What kind of a relationship do we have after all? The April summit, as you said, was a dialogue of the deaf. At the G20, Xi didn’t want to meet with the representatives of the EU. And at the COP 27, China stood squarely in the way of what we fought for.
There is no point in putting lipstick on a pig: EU China relations are at a very low ebb. China’s attitude is characterised by arrogance, divisiveness and hegemonic ambition. Unfortunately, many of our Member States are not yet prepared to learn the Russian lesson fully and to apply the Russian lesson to China: that we should not allow ourselves to become dependent on an authoritarian regime.
Scholz, Macron, Meloni or Sánchez, they all prefer to put their narrow self-interest in the first place. I would have thought that the English proverb ‘once bitten, twice shy’ might apply. But some people may want to be bitten more often, and they will if their self-centred actions, instead of developing common European China policies, will continue. We have a lot of common talk, but very little common walk.
In this context, I would expect of you, Mr Borrell, to take the lead and lead towards unitary European action. What about taking the lead with regard to getting rid of the extradition agreements that we have, of trying to use the EEAS services to counter Chinese representatives spreading the Russian lies in the Global South?
There is so much you could do, but you don’t take the lead.
"
Reinhard BÜTIKOFER,2022-09-14,DE,State of the Union (debate),https://www.europarl.europa.eu/doceo/document/CRE-9-2022-09-14-INT-3-084-0000_DE.html,"  Reinhard Bütikofer (Verts/ALE).   – Frau Präsidentin! Frau Präsidentin von der Leyen, ich möchte zwei Themen ansprechen, die Sie in Ihrer Rede gestreift haben. Zunächst: Global Gateway. Werden Sie die bislang ungelösten Governance-Fragen der Initiative Global Gateway vor Jahresende klären? Wie viele Leuchtturmprojekte von Global Gateway werden bis zum Dezember konkret identifiziert? Wie wird die Kooperation mit unseren Konnektivitätspartnern Japan und Indien forciert?
Zum Zweiten zur Chinapolitik: Ziehen wir die richtigen Konsequenzen aus der russischen Erfahrung? Xi Jinpings Regime wird immer repressiver nach innen und immer gefährlicher nach außen. China unterstützt die Aggression Russlands in der Ukraine ganz offen. Welche Schritte sehen Sie vor, um Taiwan besser zu unterstützen, um die europäische Menschenrechtspolitik wegen Xinjiang deutlicher zu machen, statt die Kritik von Frau Bachelet herunterzuspielen, und um wirkliche Unabhängigkeit im Wirtschaftsbereich gegenüber China zu erkämpfen?
"
Reinhard BÜTIKOFER,2022-09-13,EN,Question Time (VPC/HR) The state of play of the war in Ukraine,https://www.europarl.europa.eu/doceo/document/CRE-9-2022-09-13-INT-2-238-0000_EN.html,"  Reinhard Bütikofer (Verts/ALE).   – Mr President, I would like to say to the High Representative that he emphasised just a few minutes ago that obviously Member States have the remit to do defence policy, but still, as European leaders, we also have the responsibility to try to coordinate as best we can common efforts to support Ukraine’s defence of their own sovereignty and their own borders. 
In the past, many European leaders have rejected the call from Ukraine to provide modern tanks to help the Ukrainian army to fight more effectively. More recently, rumours have it that the American administration might be charting a new course. 
My question to you, High Representative, is, can you inform us where that conversation stands at the moment?
"
Reinhard BÜTIKOFER,2022-09-13,EN,The situation in the Strait of Taiwan (debate),https://www.europarl.europa.eu/doceo/document/CRE-9-2022-09-13-INT-2-253-0000_EN.html,"  Reinhard Bütikofer,  on behalf of the Verts/ALE Group. – Mr President, High Representative, for the EU Taiwan is a like—minded partner with whom we share good economic relations, but even more importantly, a common interest in defending human rights, the rule of law and democracy. This is why this Parliament has consistently stood in favour of enhancing the EU’s support for Taiwan’s democracy in the context of our own one—China policy.
Unilateral changes of the situation in the Taiwan Straits will continue to meet our strong opposition. We fully condemn the PRC’s threat of the use of force, their continuous provocations and the escalation of threats from Beijing against Taiwan, which are completely unjustified and an escalation of choice. We want to signal to Beijing that a strategy of aggression would come with a very high price for the PRC itself, and we want to deter them from undermining security and peace in the region.
Parliamentary diplomacy has to play a central role in this regard. We will continue travelling to Taiwan. We will invite the Taiwanese parliament, we will organise a parliamentary week and we will all make efforts to convince our colleagues in national parliaments to form a strong phalanx of solidarity with Taiwan.
"
Reinhard BÜTIKOFER,2022-07-06,EN,The arrest of Cardinal Zen and the trustees of the 612 relief fund in Hong Kong,https://www.europarl.europa.eu/doceo/document/CRE-9-2022-07-06-INT-3-392-0000_EN.html,"  Reinhard Bütikofer,  author. – Madam President, Vice—President, Commissioner, colleagues, the European Parliament has stood, and still stands and will continue to stand with Hong Kong. This Parliament continues to actively show solidarity with Hong Kong democrats against the Chinese Communist oppression.
Last week, several members of this House reminded us of the 25th anniversary of the handover of Hong Kong to the mainland authorities, and the second anniversary of the imposition of the national security law. This is the history of a betrayal, the betrayal of the trust of the citizens of Hong Kong and a betrayal also of the international community.
With this joint resolution, we strengthen our resolve to not forget and to not cease supporting. We want the charges dropped against Cardinal Zen, who is a towering figure but is also representing many, many other courageous Hong Kongers. We want the extradition agreements that still exist between EU Member States and the PRC and even Hong Kong terminated. We want lifeboat opportunities created for Hong Kongers that have to flee their city. And we want permanent monitoring of the human rights situation in Hong Kong through our offices there.
We will continue to stand tall. Only extremists from the left and the right do not join this call.
"
Reinhard BÜTIKOFER,2022-06-22,EN,"Preparation of the European Council meeting of 23-24 June 2022, including the meeting with Western Balkan leaders on 23 June - Candidate status of Ukraine, the Republic of Moldova and Georgia (debate)",https://www.europarl.europa.eu/doceo/document/CRE-9-2022-06-22-INT-1-118-0000_EN.html,"  Reinhard Bütikofer (Verts/ALE).   – Mr President, the Council decision this week will be a historic one. It will breathe a new lease on life into the EU’s enlargement strategy. It will present a chance to overcome the long—blocked effort to heal dangerous European divisions and open wounds. This pertains in particular to the countries in the Western Balkans, most notably Albania and North Macedonia, but also others. 
In doing this, in re-invigorating the enlargement policy, we’re not just being gracious. It is in our own interest not to have a grey zone of minor security, a kind of buffer zone between our borders and those of a revisionist Russia. Not sharing European stability with the Eastern partners that want to join the EU family would undermine our own security and our own future. 
But let me also be explicit about one obvious conditionality for Europe’s united perspective: without Ukraine’s success in defeating the Russian accession, the candidate status promises would fall flat. That’s why providing the necessary arms without hesitation must be enforced.
"
