MP,Date,Language,Title,Url,Content
Reinhard BÜTIKOFER,2020-11-26,EN,Elimination of customs duties on certain products (debate),https://www.europarl.europa.eu/doceo/document/CRE-9-2020-11-26-INT-4-065-0000_EN.html,"  Reinhard Bütikofer,  on behalf of the Verts/ALE Group. – Madam President, with the so—called ‘lobster’ trade deal between the EU and the United States that reduces some tariffs on either side, we open a door to shared efforts to overcome the trade war mentality which has poisoned transatlantic relations over the last four years. 
The deal is a fair and a balanced one. We’re not naive. That’s why we have also put two guardians at the door. One is the trade enforcement mechanism that we have put in place, the other is the retaliating tariffs, which we have legally imposed on the WTO rules to signal to the US that there is a need for an agreement in the age-old Boeing-Airbus battles. As we do open a door, we also emphasise that our efforts cannot be successful if this were to be a one-way traffic. Both sides have to be willing to go through this door. We expect the new Biden Administration to understand this. 
Low-hanging fruits will be an agreement on the new WTO Director-General, new efforts – shared efforts – to reform the WTO appellate body and overcoming the Boeing-Airbus mess. We’re willing to engage in broader shared efforts: WTO reform in general, lifting unfair sanctions on EU steel and aluminium, developing effective ways of greening trade rules in order to live up to the challenge of climate change. Let us revive trade multilateralism and modernise it at the same time. 
By the way, as Mr Lange said, this deal is also an opportunity for other countries because it’s organised under the MFN (most-favoured-nation) rule. It’s a multilateral solution, it doesn’t only help Maine’s lobster industry, that is suffering under the consequences of Trump’s trade war, but it can also help Australian producers that suffer under Chinese coercive measures. We support this deal and we hope for more to come. 
"
Reinhard BÜTIKOFER,2020-11-24,DE,The geopolitical implications of the Abraham Accords in the Middle East region (debate),https://www.europarl.europa.eu/doceo/document/CRE-9-2020-11-24-INT-2-222-0000_DE.html,"  Reinhard Bütikofer (Verts/ALE).   – Frau Präsidentin, Herr Borrell! Auch ich begrüße die Abraham-Abkommen Israels mit einigen arabischen Ländern, denn sie konsolidieren die Sicherheit Israels.
Auf arabischer Seite handelt es sich bei diesen Abkommen um einen Kurswechsel. Früher hieß es gegenüber Israel: „Einigt euch mit den Palästinensern, dann finden auch wir zusammen“. Diese Verbindung zwischen den zwei Elementen wurde nun gekappt, aber damit verschwindet nicht die palästinensische Realität.
Israel, das nun gestärkt ist, hat jetzt zwei Möglichkeiten: entweder triumphieren und die Siedlungspolitik vorantreiben oder auf Annexion verbindlich verzichten und doch den Ausgleich suchen.
Wir Europäer werden weiter für die Zweistaatenlösung investieren. Wichtig wird dabei auch sein, die Palästinenser zu der nötigen demokratischen Erneuerung zu bewegen.
"
Reinhard BÜTIKOFER,2020-11-23,EN,Order of business,https://www.europarl.europa.eu/doceo/document/CRE-9-2020-11-23-INT-1-019-0000_EN.html,"  Reinhard Bütikofer (Verts/ALE).   – Mr President, I would like to raise a point of order under Rule 39. In Hong Kong, four members of the Legislative Council have been disqualified from serving in their democratically elected positions by an order from Beijing, which violates Hong Kong’s Basic Law. As a consequence, the remaining 15 legislators from the democratic camp have also resigned. 
The European Parliament, in keeping with our resolutions on Hong Kong, should raise these issues with the Chinese authorities. I call on you, Mr President, to take this up. I believe sanctions are needed to respond.
Let me close by also highlighting the fate of the 12 Hong Kong youths that are languishing in detention in Shenzhen and must be returned to Hong Kong, and by expressing solidarity with the opposition trio of Joshua Wong, Agnes Chow and Ivan Lam, who are threatened with jail for organising a peaceful protest last year.
"
Reinhard BÜTIKOFER,2020-10-07,EN,The resumption of hostilities between Armenia and Azerbaijan in relation to the Nagorno-Karabakh conflict (debate),https://www.europarl.europa.eu/doceo/document/CRE-9-2020-10-07-INT-3-044-0000_EN.html,"  Reinhard Bütikofer (Verts/ALE).   – Mr President, there is obviously a sweeping consensus in this House that the fighting should be stopped without preconditions. But what then? And just pretending that sending the parties back to the negotiating table would bring them anywhere closer to a solution would be foolhardy because it hasn’t happened in 30 years. So what are we doing to show our own responsibility?
It’s not just tensions as usual in the South Caucasus. There are two factors that are changing. First, the United States are dialling down their engagement in the region, even though they are one of the three co-chairs, and, second, Turkey is not de—escalating – on the contrary.
We are presently in a situation where two European neighbours – Russia and Turkey – are squaring off against each other in three distinct arenas. Both neighbours have withdrawn from the international rule of law as a principle they adhere to. 
The EU does not have a formal role in this conflict, but if the EU doesn’t take more responsibility on itself, who will help in solving the issue? That’s why I subscribe to the term that Mr Kubilius has used, the strategic responsibility of the EU. 
"
Reinhard BÜTIKOFER,2020-10-07,EN,Situation in Iran (debate),https://www.europarl.europa.eu/doceo/document/CRE-9-2020-10-07-INT-3-131-0000_EN.html,"  Reinhard Bütikofer (Verts/ALE).   – (referring to Mr Canas’s remarks off mic) Madam President, I’m asking him to try to insult me in a language that I understand.
"
Reinhard BÜTIKOFER,2020-10-07,EN,Situation in Iran (debate),https://www.europarl.europa.eu/doceo/document/CRE-9-2020-10-07-INT-3-145-0000_EN.html,"  Reinhard Bütikofer (Verts/ALE).   – Madam President, Mr Borrell, the aggressive oppression of the people of Iran by the regime is presently the worst it’s been in over 30 years, and, as Ms Beer said, the regime is waging war on its people and we have to stand steadfastly on their side to protect them, to help them and to make the world know, and make the European public know, what is going on.
At the same time, we’re talking about the JCPOA, and we try to hold on to that – and we should. But we are holding on to a political ruin. Even if President Biden were to be elected in November, there is scarcely a chance that the US would return to the JCPOA, if we are honest with ourselves. The JCPOA was a European initiative. We are proud of that, but that pride should be translated into a new European initiative. I think there is a new dynamic in the region, particularly with some of the deals that have already been mentioned today. The European Union should start – you should start, Mr Borrell – an initiative for a regional conference for stability and peace, and of course we need the US on board, we need the Russians on board and the Chinese and all the powers in the region. But we should not just look back, deploring what went wrong, but look forward, finding new initiatives.
"
Reinhard BÜTIKOFER,2020-09-15,DE,"Situation in Belarus - Situation in Lebanon - Situation in Russia, the poisoning of Alexei Navalny (debate)",https://www.europarl.europa.eu/doceo/document/CRE-9-2020-09-15-INT-2-087-0000_DE.html,"  Reinhard Bütikofer (Verts/ALE).   – Herr Präsident, Herr Borrell, werte Kolleginnen und Kollegen! Die Europäische Union hat von Anfang an in diesem Konflikt die Aspirationen der Menschen in Belarus für Demokratie und Freiheit unterstützt, aber keine eigenen geopolitischen Ziele verfolgt. 
Ich glaube, das war richtig. Das heißt aber nicht, dass andere das nicht tun. Wer das Video gesehen hat, bei dem der ehemalige Diktator, diese lächerliche Figur Lukaschenko, Putin anflehte, ihm doch zu Hilfe zu kommen, der hat erkennen können, wie dort gerade die Gewichte verschoben werden. Russland hat längst angefangen, die Gewichte zu verschieben. 
Es gibt für Belarus zwei mögliche Zukünfte: eine weißrussische und eine russische. Wir haben kein Interesse daran, dass das zweite der Fall ist. Deswegen bin ich zwar einverstanden damit, dass man sagt: Wir wollen nicht antirussisch sein. Aber gegen Putin zu sein, ist nicht antirussisch, das würde ich gerne festhalten. 
Wir müssen aber meines Erachtens darauf Wert legen, dass Lukaschenko in Zukunft nur noch eine Funktion haben kann: Weißrussland Putin zu überliefern. Deswegen müssen wir klar sagen: Eine Zukunft, einen Ausweg für Weißrussland, kann es nur ohne Lukaschenko geben.
"
Reinhard BÜTIKOFER,2020-06-18,EN,Foreign policy consequences of the COVID-19 crisis - The PRC national security law for Hong Kong and the need for the EU to defend Hong Kong's high degree of autonomy - The EU's response to the possible Israeli annexation in the West Bank (debate),https://www.europarl.europa.eu/doceo/document/CRE-9-2020-06-18-INT-2-015-0000_EN.html,"  Reinhard Bütikofer,  on behalf of the Verts/ALE Group. – Mr President, Mr Borrell, colleagues, the fundamental crisis, which has captivated the globe is driven by the COVID-19 pandemic. But it’s also characterised by two novel features. 
It’s the first international crisis, since decades, in which the United States withdraws from any possible international leadership role, while China has been at the centre of this crisis, more than ever before, and this is not for the better. 
This situation reflects the ongoing continental drift in international relations. On the one hand, we have a hegemonic battle between two superpowers, on the other, international institutions are being weakened - in particular multilateral institutions - and undermined. Through the impact of the crisis, these tendencies are being accelerated.
For our EU this constitutes an imperative to step up to the plate and to shoulder our own international obligations more confidently. 
We have a mixed record. We failed when we imposed import-export bans for PPEs. We did well when the Commission organised a donors’ conference for financing vaccine research and we will lead a coalition at the WHO to require an inquiry into the origin and the spread of the pandemic.
But the challenges are many and they are huge. Battling for our values and our interests means finding allies and showing our opponents that we mean business. 
And let me end by making a remark regarding Hong Kong. I welcome the recent statement by the G7. 
Through our resolution, this EP will say that the EU will not just criticise. We want China to understand that reneging on international obligations doesn’t come free of cost. This message should be shared with Chinese leaders at the EU summit on Monday. 
"
Reinhard BÜTIKOFER,2020-06-17,EN,Protecting European strategic sectors from foreign takeovers in a post-COVID world (continuation of debate),https://www.europarl.europa.eu/doceo/document/CRE-9-2020-06-17-INT-1-199-0000_EN.html,"  Reinhard Bütikofer (Verts/ALE).   – Mr President, in protecting Europe’s strategic sectors there is no single silver bullet – we need the whole toolbox. That’s why I welcome the White Paper that looks at ways of reining in foreign subsidies, but we also will need to strengthen our investment screening approach vis-à-vis predatory takeovers. Even though the volume of capital invested has decreased recently, the number of investments has grown, which means that investment from China is going after smaller companies that still might have a strategic role. So I think we should try to start amending our investment screening mechanism once it comes into force in October and we could learn a lesson from this.
In addition, I think in order to protect our strategic sectors we must also protect their supply chains, and there it would be interesting to learn from Japan where they’re investing into relocating in order to protect supply chains, and they do that together with ASEAN countries. We could think of doing that with Western Balkan countries and other partners too.
"
Reinhard BÜTIKOFER,2020-02-12,EN,Coronavirus: ensuring fundamental rights and a coordinated European response (debate),https://www.europarl.europa.eu/doceo/document/CRE-9-2020-02-12-INT-3-612-0000_EN.html,"  Reinhard Bütikofer,  on behalf of the Verts/ALE Group. – Madam President, in this crisis we express our solidarity with the Chinese people and, in particular, with the people of Wuhan. We mourn all the victims and we send our condolences to the families of the deceased.
We declare our high esteem for the service of the Chinese frontline medical workers under the very difficult circumstances and high risks, and I want to hail, in particular, the courage and the sacrifice of Dr Li Wenliang and others.
We welcome the fact that the EU and the Member States have shown first responses in offering support to China. We must continue to provide assistance and cooperation wherever possible. This health crisis is not over. That is why we have to make sure that there is a strong and coordinated effort within the EU and, in particular, between the Member States, and in that regard, I fully support what has been said previously by colleagues.
International cooperation more generally is of paramount importance. This is why I want to explicitly emphasise that Taiwan must be fully included in the WHO—led international efforts.
Lastly, there is a deep concern – and I am grateful to the Commissioner that she mentioned it – about the increasing number of reports of anti—Chinese or anti—Asian xenophobia in some countries, including in the EU, in the context of this crisis. This is completely unacceptable. We want to show solidarity, not allow xenophobia and racism. And in that context, we also have to battle against fake news and fearmongering.
"
Reinhard BÜTIKOFER,2020-02-11,EN,US Middle East plan: EU response in line with international law (debate),https://www.europarl.europa.eu/doceo/document/CRE-9-2020-02-11-INT-2-223-0000_EN.html,"  Reinhard Bütikofer,  on behalf of the Verts/ALE Group. – Mr President, a great number of victims of the Israeli-Palestinian conflict have long been languishing for a peace plan. Such a peace plan must, of course, include painful concessions, but concessions from both sides. It must include security for Israel, but it must also include a viable sovereign, contiguous state for the Palestinians living side by side with the Israelis. 
This is not what Trump is presenting to us. It’s not a fresh start, it’s a dead end. The so—called peace plan is neither about peace, because it doesn’t overcome it prolongs the conflict, nor is it a plan as a point of departure for negotiations. It’s rather a dictate. When they talk about a peace plan they are effectively pushing for annexation – and a two-state solution is different from one state plus one canton. We cannot … 
(The President cut off the speaker)
"
Reinhard BÜTIKOFER,2020-01-15,EN,Distortion of European history and remembrance of the Second World War (topical debate),https://www.europarl.europa.eu/doceo/document/CRE-9-2020-01-15-INT-3-395-0000_EN.html,"  Reinhard Bütikofer,  on behalf of the Verts/ALE Group. – Madam President, I want to thank Commissioner Jourová for having Poland’s back in this public discussion. Recently, we have been having an increasing number of historical debates, and it’s not easy dealing with these topics. It’s not our role and it’s not our responsibility to exonerate anybody from their historical record.
Historical truth is not at the disposal of the powerful, nor at the disposal even of parliamentary majorities, but we must defend the facts as we best know them. That also applies to Soviet aggression, to Soviet suffering and to the role of appeasement in the run—up to the Second World War. But when a victim is being turned into the perpetrator of a crime, we have to speak up, and if a wolf cries wolf, we should call it out. 
I believe that these kinds of conversations are rarely just about the past. Shifting historical blame can easily be a first step in the direction of identifying a target for more than just rhetorical aggression. Europe should beware.
"
Reinhard BÜTIKOFER,2020-01-15,DE,Distortion of European history and remembrance of the Second World War (topical debate),https://www.europarl.europa.eu/doceo/document/CRE-9-2020-01-15-INT-3-413-0000_DE.html,"  Reinhard Bütikofer (Verts/ALE).   – Frau Präsidentin! Ich habe eine Frage zur Geschäftsordnung: Wäre es parlamentarisch zulässig, einen Redner, der sagt, es habe sich zwischen dem Zweiten Weltkrieg und heute nichts geändert, einen Spinner zu nennen?
"
Reinhard BÜTIKOFER,2020-01-14,EN,Situation in Iran and Iraq following recent escalations (debate),https://www.europarl.europa.eu/doceo/document/CRE-9-2020-01-14-INT-2-292-0000_EN.html,"  Reinhard Bütikofer (Verts/ALE).   – Madam President, I say to the High Representative: let me start with a note of realism: our European hand is weak in this conflict, our role is small. But if we want to take our responsibility seriously we have to stick together, and we have to coordinate well. And the coordination should be in the hands of the Vice—President / High Representative as it is his responsibility.
We want to defend the JCPOA but at the same time, we also must push back very clearly against Iranian aggression in other dimensions of its foreign policy. How can we keep the JCPOA alive? Not if we don’t insist on building the Instrument in Support of Trade Exchanges (INSTEX) and making it functional. And the Commission should join INSTEX and put capital into INSTEX and become a partner.
And the last note that I want to strike here is this: there are many dark clouds, there is one signal of hope and that’s the engagement of Iranian citizens, and just recently also Iraqi citizens. And I think it is our duty as the EU to show effective solidarity with them.
"
Reinhard BÜTIKOFER,2020-01-14,DE,Situation in Iran and Iraq following recent escalations (debate),https://www.europarl.europa.eu/doceo/document/CRE-9-2020-01-14-INT-2-294-0000_DE.html,"  Reinhard Bütikofer (Verts/ALE),  Frage nach dem Verfahren der „blauen Karte“. – Herr Mayer! Sie haben gerade im Zusammenhang mit dem Abschuss des ukrainischen Flugzeugs von „Pech“ gesprochen. Sind Sie bereit, sich bei den zivilen Opfern und diesem Haus für diesen Wortgebrauch zu entschuldigen? Man kann einen solchen Akt nicht als Pech bezeichnen, das ist extrem zynisch.
"
Reinhard BÜTIKOFER,2020-01-14,DE,Annual report on the implementation of the common foreign and security policy - Annual report on the implementation of the common security and defence policy (debate),https://www.europarl.europa.eu/doceo/document/CRE-9-2020-01-14-INT-2-381-0000_DE.html,"  Reinhard Bütikofer,  im Namen der Verts/ALE-Fraktion. – Frau Präsidentin, werte Kollegen! Die Gewinnung von Weltpolitikfähigkeit, wie Jean-Claude Juncker das genannt hat, ist das Zentrale an unserer Gemeinsamen Außen- und Sicherheitspolitik. Und ich stimme Ihnen zu, Herr Borrell, das heißt: Wir dürfen uns nicht im Status Quo ausruhen, wir müssen bereit sein, auch neue Verantwortung zu übernehmen.
Allerdings müssen wir die Richtung klar haben, eigene Werte und Interessen zu vertreten, ohne in die Falle einer eigenen Großmachtpolitik zu gehen, nicht dritte Supermacht werden zu wollen, aber auch zu verhindern, dass wir zwischen den beiden existierenden zerrieben werden. Dazu muss die EU Pfeiler einer multilateralen Ordnung sein und einer Entwicklung Widerstand leisten, wodurch die internationale Herrschaft des Rechts nur zu einer nostalgischen Erinnerung würde.
Der Bericht von Herrn McAllister ist ein guter Bericht. Vielen Dank dafür. Ich würde hoffen, dass wir uns in dieser Richtung auch mit den Kollegen aus den nationalen Parlamenten noch viel besser verständigen könnten.
"
Reinhard BÜTIKOFER,2020-01-14,EN,Annual report on the implementation of the common foreign and security policy - Annual report on the implementation of the common security and defence policy (debate),https://www.europarl.europa.eu/doceo/document/CRE-9-2020-01-14-INT-2-384-0000_EN.html,"  Reinhard Bütikofer (Verts/ALE),  blue-card question. – Mr Van Orden, you have not always been with the majority on these issues and we have not shared many points of view, maybe with the exception of our view on NATO and the need to strengthen transatlantic cooperation. Will you still allow me to hope, as this is your last plenary session in this Parliament, that you will be at least a little bit nostalgic when you think back on the work that we’ve been doing together?
"
Reinhard BÜTIKOFER,2019-12-18,EN,Situation of the Uyghur in China (China-cables) (debate),https://www.europarl.europa.eu/doceo/document/CRE-9-2019-12-18-INT-3-413-0000_EN.html,"  Reinhard Bütikofer,  on behalf of the Verts/ALE Group. – Madam President, I want to thank Mr Borrell for some clear words on behalf of the EU. The policy of the Chinese Communist Party towards the Uyghurs has never been liberal, but in 2014 a totalitarian turn was taken in Xinjiang that has created the worst police state that we have on the globe today. This extreme policy is even encountering some internal opposition, as we learn from the China cables, and I think that for a nation of such great cultural tradition as China, it is shameful to implement such policies.
Fighting terrorism is necessary, but it’s not an excuse for fighting people who want to think as they want, who want to speak as they want, who want to worship as they want. We strongly believe that it’s time to end the lies, to end the excuses and to end the distractions, and to close the camps. We, as Europeans, must also be active beyond just voicing critical words. That’s why this Parliament calls for the halt of exports and the tech transfer of products and services that are used to enhance cyber surveillance. This is why this Parliament asks that forced labour from internment camps must not be allowed to enter into EU-based companies’ value chains, and as has been said before, the products of forced labour must be banned from the European markets. We call on all EU-based companies to draw clear red lines. They are running a high reputational risks if they don’t implement a robust human rights due diligence system that makes sure that they’re not implicated in acts of repression.
We also need a human rights sanctions mechanism, as you have discussed with the foreign ministers in the Foreign Affairs Council, and we need that expeditiously.
Let me make a last sentence that alludes to Ilham Tohti, our Sakharov laureate. He is not allowed to see his family. He hasn’t seen his family for two years, even though Chinese law guarantees that. I think we should all insist that his family should be allowed to know where he lives and to see him.
"
Reinhard BÜTIKOFER,2019-12-16,DE,Commemoration of the 30th anniversary of the Romanian revolution of December 1989 (debate),https://www.europarl.europa.eu/doceo/document/CRE-9-2019-12-16-INT-1-042-0000_DE.html,"  Reinhard Bütikofer,  im Namen der Verts/ALE-Fraktion. – Frau Präsidentin, sehr geehrte Kolleginnen und Kollegen! Vor denjenigen, die in der rumänischen Revolution ihr Leben geopfert haben oder verwundet wurden, vor den Familien, die Opfer zu beklagen haben, können wir uns nur verneigen. Ich glaube, es gehört mit zu dem wertvollsten Erbe, das wir in Europa teilen, dass wir so viele Beispiele dafür haben, wie in unseren Ländern engagierte, mutige, tapfere Männer und Frauen sich immer wieder für die Freiheit und für die Demokratie engagiert haben, auch um einen hohen persönlichen Preis. Ich glaube, dieses Parlament hat an diesem Punkt einen großen Konsens.
Keinen Konsens haben wir allerdings von meiner Fraktion mit dem Bemühen, jetzt im Europäischen Parlament eine neue Praxis einzuführen, dass Stück für Stück Entschließungen zur Geschichte Europas verfasst werden und dann jeweils festgelegt wird, was „die Wahrheit“ über Europas Geschichte ist. Wer die Wahrheit sucht, muss die Vielfalt suchen, wer die Wahrheit sucht, muss sich in die Auseinandersetzung begeben, wer die Wahrheit sucht, soll ins Haus der Geschichte gehen, aber es ist nicht die Aufgabe eines Parlaments, per Mehrheit zu beschließen, was jeweils die Wahrheit über historische Ereignisse ist.
Ich glaube, das ist nicht hilfreich, egal, von welcher Seite es kommt – aus der Mitte, von links oder von rechts. Ich glaube, es ist ein Holzweg, auf den wir uns begeben würden, und deswegen bittet unsere Fraktion alle anderen, noch einmal zu überlegen, ob wir wirklich auf diesem Weg weitergehen sollen. Es gibt Formen, den Respekt zu äußern, ohne in diese Sackgasse zu laufen.
"
