MP,Date,Language,Title,Url,Content
Reinhard BÜTIKOFER,2023-12-13,EN,EU-Japan relations (A9-0373/2023 - Reinhard Bütikofer)  (vote),https://www.europarl.europa.eu/doceo/document/CRE-9-2023-12-13-INT-3-124-0000_EN.html,"  Reinhard Bütikofer,  rapporteur. – Madam President, colleagues, it’s been at least 10 years since we have not looked at the wider relationship between the EU and Japan, even though Japan obviously is one of our best and most important likeminded partners globally. 
The economic relations have thrived, but as regards other dimensions, including security, research and development, global high-quality infrastructure development, the dual digital and green transformation, upholding the multinational international order, working with developing nations or enhancing people to people contacts, there is much we can do beyond what we have. 
This report describes where we are and where we want to go. Next year, we will have an anniversary in that relationship, and I hope that this report can contribute to taking it to new heights. Thank you to all the shadows and all the staff. 
"
Reinhard BÜTIKOFER,2023-12-13,EN,The abduction of Tibetan children and forced assimilation practices through Chinese boarding schools in Tibet,https://www.europarl.europa.eu/doceo/document/CRE-9-2023-12-13-INT-3-447-0000_EN.html,"  Reinhard Bütikofer,  author. – Madam President, Commissioner, colleagues, we’re discussing here a Chinese policy that is of the making of the Communist Party, Emperor Xi Jinping himself. It’s a policy directed against 1 million Tibetan children and against the whole Tibetan nations. A diligently planned policy organised with the utmost brutally bureaucratic efficiency, a comprehensive and unrelenting push for the forced assimilation of the Tibetan young generation, pursued with the goal of depriving them of their cultural heritage, of cynically transforming them into willing colonial subjects of Great Han nationalism. This policy is a radical remake of oppressive so-called development policies, under the excuse of cultural enhancement that had been pursued by US, Canadian and Australian authorities against indigenous ethnic groups in their countries. The goal is the destruction of Tibetan culture. Even the name Tibet is attacked. They tried to annihilate the name. China has made a lot of hay with criticising the history of European colonialism, but Xi’s regime itself is a colonial regime, and that’s why we should stand in solidarity with the Tibetan people against them. 
"
Reinhard BÜTIKOFER,2023-12-12,EN,Framework for ensuring a secure and sustainable supply of critical raw materials (debate),https://www.europarl.europa.eu/doceo/document/CRE-9-2023-12-12-INT-2-061-0000_EN.html,"  Reinhard Bütikofer (Verts/ALE),  blue-card question. – Colleague, you have explained how much Polish coal stands at the centre of our future. My question is: for how long do you think should we stick to the coal approach that you are advocating? 10 years? 20 years? 50 years?
"
Reinhard BÜTIKOFER,2023-12-12,EN,EU-Taiwan trade and investment relations (debate),https://www.europarl.europa.eu/doceo/document/CRE-9-2023-12-12-INT-2-084-0000_EN.html,"  Reinhard Bütikofer,  on behalf of the Verts/ALE Group. – Mr President, Executive Vice-President, colleagues, first of all, I want to thank colleague Iuliu Winkler for his work. I also want to state that I’m proud that this Parliament, over the last almost five years, has done quite a lot to consequently work on enhancing the relationship between the EU and Taiwan. The debate today is another step in that direction, and I think that is very important.
I do recognise, Vice-President, that the Commission also has stepped up its efforts, as you explained, and I do also support your expectation towards Taiwan that there is homework to be done on their side also, in particular with regard to the issues that you mentioned, offshore wind and agricultural food products. But I also want to point out that when we look at what the US does or what Japan just did, in agreeing on memorandums of understanding or in trade facilitation deals with Taiwan, there’s room to improve our work.
Here I want to voice a warning. As colleague Winzig said, we have to combine trade and political stability and the effort to reap the fruits of trade without actively contributing to political stability will be futile.
We cannot just dodge the question, Vice-President, of whether we’re willing to sign an agreement with Taiwan. We need a resilient supply chain agreement, not just because of the beneficial trade results, but also because of the beneficial stability results, and the Commission should not dodge that necessity.
"
Reinhard BÜTIKOFER,2023-12-12,EN,"Need to release all hostages, to achieve a humanitarian ceasefire and prospect of the two-state solution (debate)",https://www.europarl.europa.eu/doceo/document/CRE-9-2023-12-12-INT-2-317-0000_EN.html,"  Reinhard Bütikofer (Verts/ALE).   – Mr President, HR/VP, colleagues, I will try to follow your advice, Josep Borrell, and talk without emotions.
There’s a lot that I would criticise or do criticise about the way in which the Netanyahu government conducts this self-defence against Hamas, but I think it is not right to put so much of the blame just one-sidedly on Israel.
You said, and I quote you, ‘Israel refuses a political solution’. Now, I have two questions there. Number one: do you have an idea of how to solve the issue of Hamas terror politically? Second: has Hamas offered a political solution? Why just put the blame on Israel?
Then people have said here Israel is sowing the seed of hate. Somebody else said terror is now spreading in Gaza. Has that terror not come from Gaza? Let’s not talk as if all the blame could put on Israel. I think that will not make us a partner in solutions.
"
Reinhard BÜTIKOFER,2023-12-12,EN,"Need to release all hostages, to achieve a humanitarian ceasefire and prospect of the two-state solution (debate)",https://www.europarl.europa.eu/doceo/document/CRE-9-2023-12-12-INT-2-327-0000_EN.html,"  Reinhard Bütikofer (Verts/ALE),  blue-card question. – Mrs Villanueva Ruiz, in the English translation that I followed, you said that Gaza is being turned into an extermination area by Israel. Can you please explain that sentence? 
"
Reinhard BÜTIKOFER,2023-12-12,EN,European Economic Security Strategy (debate),https://www.europarl.europa.eu/doceo/document/CRE-9-2023-12-12-INT-2-419-0000_EN.html,"  Reinhard Bütikofer,  on behalf of the Verts/ALE Group. – Mr President, Vice-President, colleagues, without an effective economic security strategy, ten years down the line European industry will not have a seat at the table but be on the menu. That’s why I’m grateful to President von der Leyen and also executive Vice-President Dombrovskis for taking the lead in this conversation. And I do agree with what you said, Mr Borrell, that we look to need to look into the governance issues and maybe also learn from Japan in that context. We need a full picture of our strategic dependencies and risks, and we should encourage the Member States to play along well in that regard. We should not think that we have seen all the dangers over the horizon yet. I believe that there is a real risk that there will be waves of dumping exports from China over the next couple of years. We must not fall into the trap of having a struggle between the Member States and Brussels. We must not fall into the trap of protectionism, and we must not fall into the trap of forgetting the strength of the single market. There, I agree with Mr Ferber, but there is more that we have to do long term. We need a strategy to internalise the external cost of security in our economies. And finally, if we want to play offence, we also need to team up with partners globally, including in countries of the Global South. 
"
Reinhard BÜTIKOFER,2023-12-12,EN,European Economic Security Strategy (debate),https://www.europarl.europa.eu/doceo/document/CRE-9-2023-12-12-INT-2-446-0000_EN.html,"  Reinhard Bütikofer (Verts/ALE).   – Mr President, I wanted to propose that we buy a ‘Wallace and Daly’ record and play it at the end of every debate.
"
Reinhard BÜTIKOFER,2023-12-12,EN,Environmental consequences of the Russian aggression against Ukraine and the need for accountability (debate),https://www.europarl.europa.eu/doceo/document/CRE-9-2023-12-12-INT-2-468-0000_EN.html,"  Reinhard Bütikofer (Verts/ALE),  blue-card question. – Thank you for taking my question. There are actors that aid and abet Russia’s war of aggression. What is your opinion on the question of whether we should also make those countries that aid and abet Russia’s war of aggression responsible and also try to make them pay the cost?
"
Reinhard BÜTIKOFER,2023-12-12,EN,EU-US relations (debate),https://www.europarl.europa.eu/doceo/document/CRE-9-2023-12-12-INT-2-492-0000_EN.html,"  Reinhard Bütikofer,  on behalf of the Verts/ALE Group. – Mr President, HR/VP, colleagues, the bottom line of our relationship with the United States can be captured in one sentence: ‘we should be partners in leadership and responsibility’, as you have quoted from the text. DC has often asked us to shoulder more responsibility, and that’s justified. But they do not always listen when we ask for more partnership in leadership.
However, the United States is not anymore the shining city on the hill that we can just always follow. Still, there’s a necessity to build on the partnership, to strengthen the partnership. But we almost also must address issues where we are not seeing eye to eye. And with regard to multilateralism, that pertains in particular to the trade realm, where the US often talk about rules-based order, but whenever it comes to WTO, they forget it. We need to be cooperating also with other like-minded partners in order to impress on our US partners that we want to shape the future.
And the last point is the most urgent one: that is Ukraine. What the US Congress is deliberating at the moment can be captured with the English saying ‘penny wise, pound foolish’: to not spend the money on supporting Ukraine would be suicidal in the strategic long term.
"
Reinhard BÜTIKOFER,2023-12-12,EN,EU-China relations (debate),https://www.europarl.europa.eu/doceo/document/CRE-9-2023-12-12-INT-2-534-0000_EN.html,"  Reinhard Bütikofer,  on behalf of the Verts/ALE Group. – Mr President, Vice-President / High Representative, colleagues, the recent EU China summit demonstrated that we’re far from out of the woods in our relations with Beijing, and we won’t be anytime soon. Of course, we can hope that at some point in the future, China may again try to become a responsible stakeholder, but presently, let’s not fool ourselves. China is a dictatorial and totalitarian regime with global hegemonic ambitions. 
I want to make just a few remarks on China’s foreign policy and our interests in that regard. Look at what happens in the Philippines neighbourhood. We have to push back hard against China’s efforts to change the facts in the sea. Maybe having multilateral patrols would be a good idea. Look at Taiwan, in January, there will be presidential election. China already threatens to coerce the new newly elected president. We should prepare for pushing back. Look at Hamas. China has not even called them a terrorist organisation. Look at the wave of dumping exports that is coming our way. Josep Borrell spoke a little bit about that. Look about Ukraine, where China supports Russia materially and politically. We have to call a spade a spade. And even as regards climate, you love saying, Vice-President Borrell, that China is a necessary partner. I would say they are necessary alright, but not yet a partner in that regard. So let’s do realistic policy and not pursue pipe dreams.
"
Reinhard BÜTIKOFER,2023-11-22,EN,"This is Europe - Debate with the Prime Minister of Bulgaria, Nikolay Denkov (debate)",https://www.europarl.europa.eu/doceo/document/CRE-9-2023-11-22-INT-3-085-0000_EN.html,"  Reinhard Bütikofer (Verts/ALE).   – Madam President, Prime Minister, Commission, colleagues, I want to thank you, Prime Minister Denkov, for talking to us and with us. You dwelt quite extensively on historic issues and you spoke about the European spirit of Bulgaria that your national hero emphasised, and I’m sure all of us loved it. You quoted JFK, and I like that too. So let me ask you this question: what will Bulgaria do for the EU with regard to EU enlargement?
You didn’t mention the name of your neighbouring country, North Macedonia, whose access so far has been blocked by Bulgaria. In vague terms only you seemed to question the real will of candidate countries. Can anybody question the real European will of North Macedonia, a country that even went as far as changing its name in order to open the door to Europe?
After Mr Dzhambazki spewed hate against North Macedonia here, I would like to ask you, Prime Minister, to be more specific. What will you do to help open the door for North Macedonia? I believe Bulgaria must avoid hampering the accession process with overhyped national blockades.
"
Reinhard BÜTIKOFER,2023-11-22,EN,Destruction of judicial independence and the persecution of democrats in Hong Kong (debate),https://www.europarl.europa.eu/doceo/document/CRE-9-2023-11-22-INT-3-253-0000_EN.html,"  Reinhard Bütikofer,  on behalf of the Verts/ALE Group. – President, Commissioner, colleagues, the 25th annual report on recent developments in Hong Kong is a dire, dark, dystopian report. Step by step, all the freedoms guaranteed under the Hong Kong Basic Law are being suffocated in violation of international law, and I join the criticism of colleague Lexmann that the Council has been dodging these developments. We demand on you to speak up.
The freedom of press is denied. The freedom of association, the freedom of speech, and the freedom of the vote. Not a single opposition candidate has been allowed to run for the district elections, because if just one opposition person would be elected, everybody would be able to see through the ruse of the totalitarian measures.
The United Nations Human Rights Council has urged Hong Kong to repeal the national security law, but instead hundreds have been arrested – some in custody since 2021, without trial, even in solitary confinement.
I would say we should focus on five demands in dealing with Hong Kong. First of all, don’t forget the fate of the democratic fighters like courageous Chow Hang-tung, who gave a very good speech in defence of democracy at her trial. So continue and guarantee trial observation.
Second, sanction John Lee. John Lee is one of the main culprits of these measures. Do not normalise the relationship with his regime. Make sure, through a business advisory, that European companies will not inadvertently become complicit and raise these issues and tell the public how you do that at the upcoming China EU summit.
"
Reinhard BÜTIKOFER,2023-11-22,EN,Destruction of judicial independence and the persecution of democrats in Hong Kong (debate),https://www.europarl.europa.eu/doceo/document/CRE-9-2023-11-22-INT-3-263-0000_EN.html,"  Reinhard Bütikofer (Verts/ALE),  blue-card question. – Mr Wallace, just hypothetically assuming that you were right and we were all illegitimate in raising human rights issues, why do you, as the self-declared human rights defender, not take up the cause? Why do you keep silent about the crimes that the CCP commits in China?
"
Reinhard BÜTIKOFER,2023-11-08,EN,EU enlargement policy 2023 (debate),https://www.europarl.europa.eu/doceo/document/CRE-9-2023-11-08-INT-1-149-0000_EN.html,"  Reinhard Bütikofer (Verts/ALE).   – Madam President, Commissioner, colleagues. It is indeed a historic date. And there are four clear winners on this historic date. There’s Ukraine and Moldova, where the leadership and the people together are moving in our direction. And there are two nations, the people of Georgia and the people of Bosnia and Herzegovina, who have upheld the flame of going into the direction of a European orientation. We can congratulate them.
But there’s also a new tone. And I want to highlight that. I share the criticism that my colleagues Picula and Moretti have said about the Serbian case. I think this is also an hour where the whitewashing of Serbia, where the appeasement against Serbia, will begin to end. And I read this in the sentence from the President of the Commission when she said that all countries have to take a choice between going the European direction or going the authoritarian direction. And you, Commissioner, will not hold us back with your appeasement policies.
"
Reinhard BÜTIKOFER,2023-10-18,DE,"The despicable terrorist attacks by Hamas against Israel, Israel’s right to defend itself in line with humanitarian and international law and the humanitarian situation in Gaza (debate)",https://www.europarl.europa.eu/doceo/document/CRE-9-2023-10-18-INT-3-033-0000_DE.html,"  Reinhard Bütikofer (Verts/ALE).   – Herr Präsident, liebe Kolleginnen und Kollegen! Seit dem Ende der Shoah, die immer mit dem Namen meines Landes verbunden bleiben wird, sind an keinem einzigen Tag mehr Menschen jüdischen Glaubens ermordet worden als am 7.  Oktober bei dem heimtückischen, barbarischen Massaker der Hamas. In ihrem grenzenlosen Vernichtungswillen knüpfen diese Terroristen unmittelbar bei den Nazis an. Gegen diesen Vernichtungswillen verdient Israel unsere unumschränkte Solidarität. Israel verteidigt sich, Israel muss sich verteidigen, und Europa muss das wenigstens verstehen.
Viele weltweit sind vor allem bewegt vom Leid der Palästinenser in Gaza. Ihnen sage ich: Ja! Ja, wir brauchen die Einhaltung des humanitären Völkerrechts, wir brauchen humanitäre Korridore und humanitäre Hilfe. Aber vergessen wir nicht: Es braucht auch den Schritt, der am meisten dazu beitragen könnte, dass diese Eskalation nicht weitergeht, nämlich die Freilassung, die bedingungslose Freilassung der Geiseln, die die Hamas hält.
Und wir sollten eine Warnung aussprechen an Hisbollah und Iran: Die Weltgemeinschaft wird es nicht vergessen, wenn sie jetzt weiter Öl ins Feuer gießen! Der Weg zum Frieden ist lang, aber er ist möglich.
"
Reinhard BÜTIKOFER,2023-10-18,EN,"The despicable terrorist attacks by Hamas against Israel, Israel’s right to defend itself in line with humanitarian and international law and the humanitarian situation in Gaza (debate)",https://www.europarl.europa.eu/doceo/document/CRE-9-2023-10-18-INT-3-057-0000_EN.html,"  Reinhard Bütikofer (Verts/ALE).   – Mr President, I have a point of order. The speaker Vilimsky just said that my group sympathises with Hamas. All speakers of our group have said exactly the opposite. It cannot be allowed that such lies are spread in the European Parliament. 
"
Reinhard BÜTIKOFER,2023-07-12,EN,"India, the situation in Manipur",https://www.europarl.europa.eu/doceo/document/CRE-9-2023-07-12-INT-3-475-0000_EN.html,"  Reinhard Bütikofer,  on behalf of the Verts/ALE Group. – Mr President, Commissioner, colleagues, this human rights emergency should not be used as an occasion to insult India or to voice threats with regard to the trade negotiations that were trying to bring to a successful end as soon as possible.
This is about specific human rights issues. And I think it is right to say that we have common ground with India in that regard and that we should reinforce, as the resolution says, the EU—India human rights dialogue. And, in particular, I would underscore the sentence that says there should be regular dialogue organised between the European Parliament and the Parliament of India.
My colleague Simon has said he doesn’t want to wag his finger at India. He couldn’t do without wagging though, so he wagged his finger at the Greens. I will not retaliate, I will just say we will defend religious freedom wherever it is endangered, be it Christians or otherwise. 
"
Reinhard BÜTIKOFER,2023-07-11,EN,Relations with the Palestinian Authority (debate),https://www.europarl.europa.eu/doceo/document/CRE-9-2023-07-11-INT-2-388-0000_EN.html,"  Reinhard Bütikofer (Verts/ALE).   – Madam President, colleagues, Israel is not an apartheid state and it is not like Russia. But some of those that cannot find enough hyperbole in criticising Israel turn quite gingerly when it comes to calling a spade a spade on the Palestinian side. Let me direct your attention to three amendments, namely amendments 45, 47 and 48 that try to deal with the issue of Palestinian terrorism. Several groups in this House seem to be determined to vote them down. I say that would be a very bad mistake. 
"
Reinhard BÜTIKOFER,2023-07-11,EN,2022 Report on Bosnia and Herzegovina (debate),https://www.europarl.europa.eu/doceo/document/CRE-9-2023-07-11-INT-2-410-0000_EN.html,"  Reinhard Bütikofer (Verts/ALE).   – Madam President, Commissioner, colleagues, earlier today this House came together in an act of commemoration for the more than 8 000 Muslim men and boys that were killed in the Srebrenica massacre 28 years ago. But in this debate, a Member of Parliament from the ID Group thinks it’s adequate to spew anti-Muslim hatred. What a shame!
But the question also goes to ourselves. Do we draw the necessary conclusions? Are we living up to our duty? Dodik is pursuing a blatant secessionist policy. I challenge you, Commissioner, to say it here: ‘blatant secessionist policy’. Call a spade a spade, and then let’s sanction him.
"
Reinhard BÜTIKOFER,2023-04-18,EN,The need for a coherent strategy for EU-China Relations (debate),https://www.europarl.europa.eu/doceo/document/CRE-9-2023-04-18-INT-2-021-0000_EN.html,"  Reinhard Bütikofer (Verts/ALE).   – Mr President, President von der Leyen, HR/VP Borrell, for an organisation that cherishes unity in diversity as we do in the EU, it’s never easy to talk with one voice. All the more grateful we can be that we have heard strong and clear voices recently regarding the EU’s China policy. I want to start by congratulating President von der Leyen for her China speech and for how she conducted her visit in China. That showed leadership.
There are of course, as you have said, Josep Borrell, different interests, but that cannot be an excuse for divergence on the fundamentals. The focus on human rights is not an accessoire for our foreign policy; it’s at the centre and we’re not selling it for a lentil stew.
We’re willing to cooperate with our systemic rival, China. But cooperation cannot be a one-way street. We have to be clear-eyed. China is a revisionist power with hegemonic ambition, aiming at building a Beijing-centric global order. If they would respect the principles of the United Nations, they would have called for Russia to leave Ukraine alone.
We must work together with like-minded partners in our China policy, in particular in cooperation with the US. Whoever splits that front is not serving our own values and interests. Strategic autonomy à la française would be risky for Europe. Mutual solidarity with democracies is basic, and that includes Taiwan’s democracy. In our relations with countries of the Global South, we must strive to be a better partner for them than China. And we must, as has been laid out by the President, de-risk in our economic relations in order to secure our economies. There is no way back, therefore, to the win-win illusion that shaped CAI. At the end, let me say we should never confuse the Chinese people and the great Chinese culture and their successes with the dictatorship of the totalitarian Xi Jinping regime.
"
Reinhard BÜTIKOFER,2023-03-15,DE,Strengthening the EU Defence in the context of the war in Ukraine: speeding up production and deliveries to Ukraine of weapons and ammunitions (debate),https://www.europarl.europa.eu/doceo/document/CRE-9-2023-03-15-INT-3-211-0000_DE.html,"  Reinhard Bütikofer (Verts/ALE).   – Frau Präsidentin, verehrte Kolleginnen und Kollegen! Es ist in der Tat schlimm, dass wir die Kapazität unserer Rüstungsindustrie hochfahren müssen. Aber wir tun das nicht, weil die EU plötzlich kriegsgeil geworden wäre, sondern wir müssen das tun, weil Russland zum Aggressor geworden ist, der nicht nur die Ukraine von der Landkarte löschen will, sondern die ganze europäische Friedens- und Sicherheitsarchitektur zerstören will. Deswegen müssen wir das tun.
Ich frage mich, wieso Sie eigentlich ihre Forderungen nicht an das faschistische Regime in Moskau richten, wieso Sie die ganze Zeit so tun, als läge es in der Macht der EU, den Krieg zu beenden! Haben Sie schon einmal zur Kenntnis genommen, dass die Ukraine das Recht auf Selbstverteidigung hat, dass die UNO-Charta verlangt, dass Russland sich zurückziehen muss, die nationale Souveränität und die territoriale Integrität der Ukraine akzeptieren muss? Wenn Sie so hochtrabende Worte im Mund führen, warum sagen Sie das nicht ein einziges Mal?
Nach der Logik, die Sie vertreten, hätte man die Anti-Hitler-Koalition verurteilen müssen, weil sie den Aggressor mit Waffen bekämpft? Das hat nichts mit Friedenspolitik zu tun, Frau Demirel; die Lügen, die Sie hier verbreiten, sind die Lügen der fünften Kolonne Moskaus.
"
