MP,Date,Language,Title,Url,Content
Tom VANDENDRIESSCHE,2020-05-13,NL,"Conclusions of the extraordinary European Council meeting of 23 April 2020 - New MFF, own resources and Recovery plan (debate)",https://www.europarl.europa.eu/doceo/document/CRE-9-2020-05-13-INT-1-048-0000_NL.html,"  Tom Vandendriessche,  namens de ID-Fractie. – Voorzitter, collega's, net zoals in Tsjernobyl probeerde een communistisch regime eerst de waarheid over het coronavirus te verbergen, dan zijn verantwoordelijkheid te ontkennen en ten slotte zijn aansprakelijkheid te ontlopen. Bovendien is gebleken hoe afhankelijk we geworden zijn van China. Europese landen moesten haast bedelen om de noodzakelijke beschermingsmiddelen.
Dertig jaar globalisering heeft van China ondertussen al de tweede wereldeconomie gemaakt. Daar is het land geraakt door oneerlijke concurrentie, dumpingpraktijken, marktmanipulaties en vooral de naïviteit van westerse politici. Het handelstekort met de Europese Unie bedraagt nu al 164 miljard euro.
Naast afhankelijk dreigen we economisch gekoloniseerd en op den duur politiek gedomineerd te worden door een communistische dictatuur. Daarom moeten we de relatie met China herbekijken. We moeten strategische sectoren en infrastructuur beschermen tegen vijandige Chinese overnames en infiltraties. We moeten afscheid nemen van de naïviteit tegenover China en Europa herindustrialiseren. Vooral na de immigratiecrisis en de financiële crisis mogen het niet opnieuw de gewone mensen zijn die de prijs hiervan moeten betalen. Bescherm daarom onze jobs en onze bedrijven voor coronataksen op Chinese import.
"
Tom VANDENDRIESSCHE,2020-02-12,NL,Humanitarian situation of refugees at EU external borders (debate),https://www.europarl.europa.eu/doceo/document/CRE-9-2020-02-12-INT-3-523-0000_NL.html,"  Tom Vandendriessche,  namens de ID-Fractie. – Voorzitter, sinds enkele jaren worden we overspoeld door ongewenste migratie. Maar dit is nog maar het begin. De bevolking van Afrika gaat deze eeuw van 1 naar 4 miljard inwoners. Honderden miljoenen zullen naar Europa komen. Daarom moeten we de grenzen bewaken. Niet uit haat tegenover wie zich buiten onze grenzen bevindt, maar wel uit liefde voor ons eigen volk. 
Linkse activisten en malafide advocaten misbruiken de mensenrechten om migratie te stimuleren en te propageren. Zij willen dat niet-burgers rechten kunnen afdwingen in onze thuislanden. Migratie willen ze verheffen tot een afdwingbaar mensenrecht, met de medewerking van wereldvreemde rechters, voor wie trouwens niemand ooit gestemd heeft. 
Het Europees Verdrag voor de rechten van de mens bijvoorbeeld was ooit bedoeld om burgers uit Europese landen te beschermen tegen tirannie. Vandaag echter is het geëvolueerd tot een instrument om een opengrenzenpolitiek door de strot te rammen van onze bevolking. We moeten de migratiecrisis aan onze grenzen oplossen. Dat doen we door economische gelukzoekers zonder pardon terug te sturen. Echte vluchtelingen moeten we opvangen in de regio van herkomst, en vooral moeten we de mensenrechtenverdragen aanpassen aan de realiteit van 2020, zodat ze niet langer misbruikt kunnen worden door de migratielobby. 
"
Tom VANDENDRIESSCHE,2020-01-15,NL,Ongoing hearings under article 7(1) of the TEU regarding Hungary (debate),https://www.europarl.europa.eu/doceo/document/CRE-9-2020-01-15-INT-3-470-0000_NL.html,"  Tom Vandendriessche (ID).   – Voorzitter, de strafprocedures van de Europese Unie tegen lidstaten als Hongarije en Polen gaan helemaal niet over inbreuken op de onafhankelijkheid van pers en gerecht. Anders zou een land als België met zijn gesubsidieerde media en zijn politiek benoemde rechters al lang vervolgd zijn. Waar het wel over gaat, is dat zij baas in hun eigen land willen blijven. Zij willen hun soevereiniteit, hun vrijheid en hun identiteit bewaren. Wie kan ze ongelijk geven? Deze Europese Unie biedt immers geen oplossingen, noch voor de eurocrisis, noch voor de migratiecrisis. In plaats van subsidiariteit en samenwerking kiest deze elite voor een superstaat en dwang. Landen die niet plooien, bestraffen ze. Jullie maken Europa kapot met deze Europese Unie van dictaten en bureaucraten. Met brexit vertrekt al een eerste land. Hoeveel landen zullen nog moeten volgen voor jullie eindelijk beginnen te luisteren naar de mensen? 
"
Tom VANDENDRIESSCHE,2019-10-23,NL,Search and rescue in the Mediterranean (debate),https://www.europarl.europa.eu/doceo/document/CRE-9-2019-10-23-INT-3-397-0000_NL.html,"  Tom Vandendriessche (ID).   – Voorzitter, collega's, wie de wet overtreedt, wordt gestraft. Dat is de manier waarop wij onze burgers beschermen. Zo kunnen onze burgers vertrouwen hebben in een democratische rechtsstaat. Maar dat is precies wat deze politieke elite weigert te doen. In plaats van onze grenzen te beschermen, worden illegale migranten die doelbewust onze wetten overtreden, beloond met een verblijfsvergunning.
In dit Parlement applaudisseren sommigen zelfs voor ngo's die illegale migratie stimuleren. Sommigen beweren dit te doen uit humanitaire overwegingen. Maar wat is er eigenlijk humanitair aan om het businessmodel van de mensensmokkel in stand te houden? Wat is er eigenlijk humanitair aan om onze bevolking over te leveren aan illegale indringers die tal van criminele feiten plegen? Wie oprechte humanitaire bezorgdheid heeft, breekt dat businessmodel van de mensensmokkel, sluit onze grenzen, beschermt onze bevolking, pakt illegalen op en stuurt ze zonder pardon terug naar waar ze vandaan komen. Dat is wat onze burgers verwachten.
"
