MP,Date,Language,Title,Url,Content
Younous OMARJEE,2022-06-06,FR,EU islands and cohesion policy (debate),https://www.europarl.europa.eu/doceo/document/CRE-9-2022-06-06-INT-1-140-0000_FR.html,"  Younous Omarjee,  rapporteur. – Monsieur le Président, Monsieur le Commissaire, nous appelons aujourd’hui à construire une vision de long terme pour les îles européennes, appuyée sur un pacte des îles et un agenda insulaire. 
L’article 174 du traité est clair: l’Union doit accorder une attention particulière aux régions insulaires, dont les handicaps naturels, graves et permanents sont reconnus. Cette attention particulière, aujourd’hui, Monsieur le Commissaire, n’existe pas suffisamment. C’est un vide à combler, et, disons-le, il y a à l’évidence une sous-estimation de ce que représentent les îles européennes. Car ces îles, ce sont plus de 20 millions d’habitants répartis sur environ 2 400 d’entre elles – principalement en Méditerranée et dans l’Atlantique – et appartenant à 13 États membres, parmi lesquels 3 sont insulaires. En réalité, l’Europe est un archipel, mais elle l'ignore toujours.
Il y a des évidences qu’il est parfois bon de rappeler: vivre sur une île, c’est vivre entouré d’eau, et ce n’est pas vivre sur le continent. Tout y est différent – l’économie, les transports, l’énergie, la gestion des déchets, les logiques d’import, d’export et les surcoûts qu’ils induisent pour tout, l’agriculture, la gestion de l’eau, l’économie bleue –, tout doit y être pensé différemment.
Ce rapport a donc vocation à être fondateur d’une nouvelle relation entre les îles et les institutions européennes, fondée sur la pleine prise en compte de l’article 174 du traité et la mise en œuvre de mesures spécifiques. Cela est pleinement justifié, car l’insularité, ce sont aussi des vulnérabilités supplémentaires accrues par les crises que nous connaissons. Nous le voyons avec la guerre en Ukraine, qui affecte directement ces régions par la suraugmentation des coûts liés à l’insularité et à l’éloignement.
Les îles sont également en première ligne, nous le savons, vis-à-vis des effets du changement climatique, et elles ont été plus durement frappées par la crise de la COVID-19. C’est pourquoi nous demandons tout simplement une meilleure prise en compte des îles dans les règlements et dans les futures discussions budgétaires. D’ores et déjà nous appelons à la réévaluation du régime d’aides d’État, à la suppression du plafond de minimis, à la création d’un programme spécifique pour les îles – comme il en existe un pour les îles grecques – et à la création d’une enveloppe compensatoire – autant d’objectifs que nous nous fixons.
Mes chers collègues, le monde est un monde composé d’îles, et chaque île est un monde en soi-même. L’Europe a, avec ses îles, l’occasion d’être à l’avant-garde pour toutes les îles du monde, de même qu’elle gagnerait à édifier une nouvelle diplomatie insulaire mondiale en s’appuyant sur les PTOM et sur les États tiers. C’est pourquoi notre rapport propose aussi de faire de l’année 2024 l’année européenne des îles.
Pour conclure, mes chers collègues, je vous invite à voter massivement pour ce rapport, qui a vocation à être fondateur, fondateur d’un temps nouveau dans la relation entre les îles et les institutions européennes, et j’appelle la Commission et le Conseil à entendre l’initiative de notre Parlement et à entendre aussi l’impatience des îles, car trop de temps a été perdu. Il est aujourd’hui plus que temps d’agir. Je vous le dis: l’heure des îles a sonné.
"
Younous OMARJEE,2022-06-06,FR,EU islands and cohesion policy (debate),https://www.europarl.europa.eu/doceo/document/CRE-9-2022-06-06-INT-1-172-0000_FR.html,"  Younous Omarjee,  rapporteur. – Madame la Présidente, je voudrais tout d’abord remercier l’ensemble des groupes politiques de la commission du développement régional pour avoir soutenu cette initiative importante pour les îles, et je crois que ce débat est un moment important dans la relation entre les îles de l’Union européenne et les institutions européennes.
J’ai écouté avec beaucoup d’attention le commissaire et je crois que nous devons évacuer tout malentendu. La Commission ne peut pas feindre d’ignorer le sens profond de ce rapport en jouant sur une confusion entre les régions ultrapériphériques et les autres îles, qui ne sont pas visées par l’article 349 du traité et relèvent de son article 174 – je pense en particulier aux îles de la Méditerranée. C’est pourquoi ce rapport vise à une pleine application, aujourd’hui, de l’article 174.
Il est vrai que la Commission – et la politique régionale, et la commission REGI – a un plan d’action ambitieux pour les régions ultrapériphériques. Ce plan d’action ambitieux doit être poursuivi, il doit être maintenu. Mais nous devons aussi entendre les fragilités de toutes les îles et de ce qu’elles peuvent apporter à l’Union européenne. 
Nous vous demandons systématiquement, en amont, de tenir compte des fragilités, des particularités, des spécificités aussi bien des régions ultrapériphériques que des autres îles de l’Union européenne, pour toutes les raisons qui ont été explicitées dans ce débat très riche, de qualité, et qui je l’espère va dès aujourd’hui ouvrir un temps nouveau pour que l’Union européenne ait une véritable ambition insulaire.
"
Younous OMARJEE,2022-05-04,FR,Discharge 2020 (debate),https://www.europarl.europa.eu/doceo/document/CRE-9-2022-05-04-INT-3-075-0000_FR.html,"  Younous Omarjee,  rapporteur. – Madame la Présidente, Monsieur le Commissaire, Monsieur le Président de la Cour des Comptes, Madame la Ministre, la décharge dont j’ai la responsabilité ne porte pas sur une agence, mais sur une politique, sur le Fonds européen de développement. Nous en sommes aujourd’hui au onzième FED et donc à sa onzième programmation pluriannuelle depuis son institution par le traité de Rome en 1957, puis par les fameux accords de Cotonou qui ont donné un cadre solide à la coopération avec les pays d’Afrique, des Caraïbes et du Pacifique et à l’aide au développement.
L’année 2020, pour laquelle nous examinons cette décharge, est la dernière année de ce onzième FED et, à partir de 2021, nous rentrerons dans le douzième FED et plus aucune convention de financement ne pourra être signée au titre du onzième FED. Le douzième FED sera par ailleurs, pour la première fois, intégré au cadre financier pluriannuel européen et sera donc soumis à un certain nombre de règlements européens auxquels il échappait jusqu’alors.
En 2020, l’exécution financière du FED a porté sur des décisions de financement représentant des engagements globaux de 2 687 000 000 d’euros, sur des contrats qui représentent des engagements individuels de 3 670 000 000 d’euros et sur des paiements représentant 4 600 000 000 d’euros. Et toutes ces dépenses ont été marquées par la crise de la COVID, et 2020 a été, en réalité, une année record pour les paiements en raison de l’augmentation des décaissements en faveur de projets contribuant à la lutte contre la crise de la COVID et cela a également conduit à l’accélération de l’absorption.
Notre rapport fait état d’un certain nombre de complications induites par l’épidémie de la COVID. Cependant, nous nous inquiétons tout de même de la hausse considérable des erreurs soulignées par la Cour des comptes et du refus d’organisations bénéficiaires de garantir à la Cour un accès complet et illimité aux documents et justificatifs.
Dans l’exécution 2020, je souhaite souligner que la Commission a réagi à temps et mis fin au financement d’un projet extrêmement problématique en Érythrée, s’appuyant sur le travail forcé et sur l’esclavage. Et sur la base des expériences tirées en Érythrée, j’invite à présent la Commission européenne à redoubler partout de vigilance et à inclure, aujourd’hui pour tous les pays, des clauses liées aux conditions de travail pour tous les projets qu’elle finance. Et la vigilance doit également être de mise pour tous les projets en République centrafricaine et pour les projets européens qui risquent de financer indirectement les milices Wagner qui, nous le savons, exercent une influence considérable sur l’armée de ce pays.
Pour conclure, je veux dire aussi que toutes les politiques européennes doivent être mises en cohérence avec les objectifs de la politique de développement. Car autrement, les investissements qui sont réalisés à travers le FED sont annihilés dans leur portée. Et je veux aussi dire que la Commission doit veiller à la bonne prise en compte des intérêts des régions ultrapériphériques et des pays et territoires d’outre-mer qui partagent le même bassin géographique avec les pays ACP.
Pour conclure, je veux dire que la politique de développement de l’Union poursuit l’objectif d’éradication de la pauvreté. Mais nous devons aussi, aujourd’hui, assumer sans hypocrisie la dimension de co-développement et d’intérêts partagés entre le développement des pays ACP et les intérêts de l’Union européenne.
"
Younous OMARJEE,2022-03-24,FR,Refugees in Europe: CARE (debate),https://www.europarl.europa.eu/doceo/document/CRE-9-2022-03-24-INT-2-098-0000_FR.html,"  Younous Omarjee,  au nom du groupe The Left. – Madame la Présidente, Madame la Commissaire, mes chers collègues, nous voterons dans quelques instants, à une quasi-unanimité j’en suis certain, le premier paquet de mesures qui permettra de mobiliser le Fonds de cohésion en vue d’accueillir les réfugiés.
Je veux vous remercier personnellement, chère Commissaire Elisa Ferreira, pour cette proposition qui grandit la politique de cohésion. Ce sont déjà 3,5 millions de réfugiés ukrainiens qui se trouvent au sein de l’Union européenne: un nombre tout à fait colossal. Une fois de plus, la politique de cohésion se fait un honneur d’intervenir concrètement en réaction à une crise, comme nous l’avons fait dès lors que la crise de la COVID-19 est survenue. À présent, la politique de cohésion a le devoir de venir en aide aux réfugiés, aux ONG, aux villes, aux régions et aux États qui sont en première ligne face à ce grand bouleversement.
Mais nous savons déjà, Madame la Commissaire, que l’ampleur des besoins oblige maintenant à un second train de mesures et à des moyens supplémentaires. La cohésion répondra de nouveau présente, et je salue donc la proposition CARE +, adoptée hier par le collège des commissaires. Vous pouvez, Madame la Commissaire, compter sur la pleine mobilisation de la commission REGI pour son adoption – je le souhaite, mes chers collègues – dans les meilleurs délais.
Pour conclure, je souhaite vous dire que l’Europe est née par la solidarité et qu’elle est née pour la solidarité. Nous voyons bien combien, en ces temps troublés, en ces temps de guerre, en ces temps où nous espérons tous la paix, que seule la solidarité permettra de résister aux épreuves du moment et d’ouvrir de nouveaux chemins plus intégrés pour l’Europe.
"
Younous OMARJEE,2022-03-23,FR,Votes on requests for urgent procedure (Rule 163),https://www.europarl.europa.eu/doceo/document/CRE-9-2022-03-23-INT-1-036-0000_FR.html,"  Younous Omarjee,  président de la commission REGI. – Madame la Présidente, au nom de notre commission REGI, je veux m’exprimer en faveur de ce vote d’urgence, qui, vous en conviendrez, ne porte pas sur une petite affaire, mais sur ce qu’il y a de plus horrible, de plus terrible, de plus tragique: la guerre, qui s’invite aujourd’hui dans nos travaux. 
Nous pressentons tous que cette guerre d’Ukraine aura des conséquences vertigineuses pour toute l’Europe. Déjà sous nos yeux, d’ailleurs, a lieu l’un des plus vastes mouvements de population de notre histoire européenne récente. Des millions d’Ukrainiens, pris au piège des bombardements de l’armée russe et de ce qu’il faut bien appeler les crimes de guerre de Vladimir Poutine, ont pris le chemin de l’exode. En moins de trois semaines, ils sont déjà plus de 4 millions à avoir fui les bombes pour trouver refuge au sein de l’Union européenne. À l’heure actuelle, la Pologne accueille 2 200 000 réfugiés, la Roumanie 500 000, la Hongrie 300 000, la Slovaquie 300 000 et la Tchéquie 300 000. Et nous savons tous que, au fur et à mesure que la guerre durera, la pression ira croissant. 
Partout, les besoins humanitaires augmentent de manière exponentielle, en majorité pour des femmes et pour des enfants. Ce sont des besoins premiers – aide alimentaire, santé, éducation et logement –, auxquels nous devons impérativement répondre. 
Pour ces pays, pour les réfugiés ukrainiens, pour ces citoyens européens qui s’acquittent, dans des conditions parfois inimaginables ici depuis Bruxelles, de ce devoir d’accueil, nous devons, par ce débat, dire que la cohésion est présente, que nous faisons tout et que nous ferons tout ce qu’il est possible de faire pour apporter un appui concret aux États, aux régions et aux villes qui se trouvent aux avant-postes. C’est là l’objet du règlement CARE proposé par la Commission européenne, que notre commission REGI soutient. C’est notre devoir et c’est notre honneur de le faciliter à travers la politique de cohésion.
Madame la Présidente, mes chers collègues, pour conclure, ce débat sera aussi, j’en suis certain, celui de l’unité réaffirmée de notre Parlement pour dire que nous n’abandonnons ni les réfugiés ukrainiens ni les citoyens européens, qui, fidèles aux valeurs de l’histoire, se hissent aujourd’hui au niveau du devoir historique de fraternité, de solidarité et d’humanité qui est le nôtre.
"
Younous OMARJEE,2022-03-07,FR,Implementation of the 2021-2027 cohesion policy (debate),https://www.europarl.europa.eu/doceo/document/CRE-9-2022-03-07-INT-1-025-0000_FR.html,"  Younous Omarjee,  auteur. – Madame la Présidente, Madame la Commissaire, mes chers collègues, avant d’évoquer notre question orale, je veux ici dire, au nom de toute notre commission du développement régional, notre solidarité pleine et sans faille avec le peuple ukrainien. Notre solidarité est aussi totale avec les Polonais, les Slovaques, les Roumains, les Hongrois, les Moldaves qui partagent une frontière physique avec l’Ukraine et sont aux avant-postes pour accueillir aujourd’hui les réfugiés ukrainiens qui fuient cette guerre ignoble et les bombes du Kremlin.
Nous sommes face, mes chers collègues, à l’un des mouvements de population les plus importants de toute l’histoire de l’Europe. En quelques jours, ce sont plus d’un million et demi de réfugiés qui sont sur les routes. C’est pourquoi notre solidarité doit être concrète. L’Europe et la politique de cohésion doivent répondre présent et faire la preuve de leur capacité à apporter maintenant un soutien supplémentaire à ces pays.
C’est pourquoi, Madame la Commissaire, je me félicite des propositions que vous avez l’intention de mettre sur la table. À la suite des discussions que nous avons eues ensemble au Conseil informel à Rouen ainsi qu’à Marseille, je vous confirme que notre commission du développement régional se tient prête, si cela s’avérait nécessaire, pour une modification des règlements de la cohésion afin de faciliter et de permettre de financer immédiatement le soutien aux villes et aux régions qui accueillent les réfugiés et de financer aussi le soutien aux réfugiés ukrainiens.
Nonobstant cette urgence, nous sommes inquiets pour la politique de cohésion, et c’est l’objet de notre question. Car deux ans après l’adoption des règlements, la politique de cohésion 2021-2027 n’a pas encore démarré et presqu’aucun accord de partenariat n’a été validé. Nous avons le devoir d’agir pour que cette programmation soit une réussite et nous espérons que les programmes seront opérationnels dans les régions et sur le terrain avant la fin de cette année.
Cette situation nous inquiète d’autant plus, Madame la Commissaire, que partout en Europe les plans de relance sont déployés dans les régions en concurrence, et non pas en cohérence, avec les règlements traditionnels. Et là où il y a des abus, les États doivent être maintenant rappelés à l’ordre et au strict respect des objectifs de la politique de cohésion auxquels ils sont tenus par les règlements.
Bien sûr, il faut faire face à l’urgence de la relance. C’est absolument nécessaire, mais il est aussi impératif d’engager des programmes pour le maintien des objectifs de long terme et plus que jamais, mes chers collègues, la mise en œuvre du FEDER est d’une urgente nécessité, notamment au regard des objectifs de l’accord de Paris et de l’objectif d’autonomie énergétique de l’Europe – plus que jamais nécessaire, d’ailleurs, si nous voulons nous libérer des dépendances extérieures, notamment de la Russie.
La nouvelle politique de cohésion doit donc pouvoir se déployer partout en Europe avant la fin de cette année. C’est le message de notre commission REGI et c’est aussi, je veux le dire, la préoccupation du Comité des régions. C’est pourquoi nous attendons des réponses aux questions suivantes.
Premièrement, quel est à ce jour l’état d’avancement des accords de partenariat et des programmes de cohésion quant à leur présentation et à leur approbation? Sont-ils plus ou moins avancés qu’au même stade de la période de programmation 2014-2020?
Deuxièmement, quel est à ce jour le délai moyen d’approbation des accords de partenariat et des programmes? De plus, quand la Commission envisage-t-elle de transférer les premiers paiements intermédiaires?
Troisièmement, la Commission continue-t-elle de partager la position du commissaire Hahn, qui a déclaré – vous vous en souvenez –, en octobre 2021, que la quasi-totalité de la dotation budgétaire de 2021 devrait être reprogrammée pour les années suivantes?
Quatrièmement, quelles mesures la Commission envisage-t-elle de prendre pour éviter le risque considérable de sous-exécution des Fonds?
Enfin, Madame la Commissaire, vous connaissez l’attachement du Parlement européen au principe de partenariat. Aussi, nous voulons savoir comment la Commission veille au respect et à la mise en œuvre par les États du principe de partenariat et, par là, de la consultation absolument nécessaire de tous les acteurs locaux et de la société civile. C’est ce que nous avons voulu dans les négociations et c’est ce que nous avons obtenu.
Pour conclure, Madame la Commissaire, je voudrais vous dire que vous êtes la garante des accords débattus, discutés, négociés avec vous et les États membres dans les trilogues. C’est pourquoi nous vous demandons – et nous savons pouvoir compter sur vous – de faire en sorte que les États membres et les régions respectent les accords trouvés et les règles convenues qui nous obligent tous à présent.
"
Younous OMARJEE,2022-02-17,FR,Droughts and other extreme weather phenomena on the Iberian Peninsula and other parts of Europe (debate),https://www.europarl.europa.eu/doceo/document/CRE-9-2022-02-17-INT-4-019-0000_FR.html,"  Younous Omarjee,  au nom du groupe The Left. – Monsieur le Président, Madame la Commissaire, l’épisode de sécheresse extrême qui frappe l’Espagne et le Portugal en plein hiver vient s’ajouter désormais à la longue liste des catastrophes naturelles annuelles, chaque fois plus nombreuses et chaque fois plus intenses. En première ligne, aujourd’hui, face à cette sécheresse dans ces deux pays, des agriculteurs et les pouvoirs publics nationaux et régionaux, à qui je veux ici réaffirmer, au nom de notre groupe et au nom de notre commission REGI, notre plus grande solidarité. Tout ce que nous pourrons faire pour aider, nous le ferons et, bien sûr, nous demandons – comme vous l’avez dit, Madame la Commissaire – la mobilisation du Fonds européen de solidarité aussitôt que possible et l’aide d’urgence là où elle peut être nécessaire.
Plus largement, la Terre, l’humanité et le monde du vivant sont entrés aujourd’hui dans une zone de turbulence dont la sortie n’est pas pour demain: 50 °C en Amérique du Nord cet été, des feux de forêt qui frappent désormais jusqu’au Grand Nord, la terre qui s’est littéralement effondrée sous les pieds des habitants d’Erftstadt – nous irons, avec la commission REGI, la semaine prochaine dans cette localité, en Allemagne – des villages de Belgique et des Pays-Bas qui sont sous les eaux et des cyclones tropicaux de plus en plus violents dans les régions ultrapériphériques. Voilà la nouvelle donne qui est devant nous.
En tant que président de la commission REGI, j’ai mis sur la table une proposition: la création d’un nouveau fonds, le fonds régional d’adaptation au changement climatique, qui s’appuie sur une cartographie des risques et des besoins, et sur les plans nationaux d’adaptation au changement climatique. Ce fonds vise à aider les régions à investir, désormais, dans des infrastructures plus résilientes aux effets des catastrophes naturelles.
En effet, aujourd’hui, tous nos efforts sont tournés vers la mitigation et la réduction des émissions de gaz à effet de serre. Bien sûr, il faut le faire; mais nous devons aussi pallier l’absence d’une véritable stratégie européenne en matière d’adaptation aux changements climatiques, qui sont déjà en cours, et qui sont devenus irréversibles, compte tenu de l’inertie du modèle climatique.
C’est notre responsabilité de préparer l’ensemble des régions européennes à adapter désormais leur stratégie de développement et leur plan d’investissement en fonction de cette nouvelle donne, qui va bousculer, vous le savez, l’ensemble des secteurs et qui nécessite des milliards d’euros d’investissements dans tous les domaines.
La présidente von der Leyen s’est engagée – je termine, Monsieur le Président – à appliquer un droit d’initiative du Parlement. C’est ce que nous faisons avec cette proposition. Saisissez la balle au bond lancée par la commission REGI et présentez au Parlement européen une proposition pour la création de ce nouveau fonds régional d’adaptation au changement climatique. 
"
Younous OMARJEE,2022-02-16,FR,The Rule of Law and the consequences of the ECJ ruling (debate),https://www.europarl.europa.eu/doceo/document/CRE-9-2022-02-16-INT-3-224-0000_FR.html,"  Younous Omarjee (The Left).   – Madame la Présidente, Monsieur le Ministre, Monsieur le Commissaire, la Pologne est un grand pays, l’un des plus vastes de notre Union, et l’histoire de ce pays dit le désir puissant de son peuple pour la liberté et la démocratie. C’est pourquoi nous devons d’abord dire, dans ce débat, que les premières victimes des atteintes à l’état de droit, en Pologne comme en Hongrie, sont les Polonais et les Hongrois eux-mêmes. C’est donc pour ces peuples – et pour les raisons pour lesquelles ils ont rejoint l’Union en 2004 – que la Commission européenne doit actionner maintenant le mécanisme de conditionnalité du budget au respect de l’état de droit.
L’état de droit n’est pas une option, c’est une condition. Une condition d’appartenance à notre Union – et, comme le dit la Cour, «pour la jouissance de tous les droits découlant des traités». À ceux qui, en Pologne, en Hongrie ou ailleurs, testent aujourd’hui l’Union européenne sur ses valeurs, la réponse doit être ferme, pour rappeler qu’il n’y a pas d’Union européenne ni de vie commune possible sans l’acceptation d’un ordre juridique commun.
"
Younous OMARJEE,2021-12-16,FR,An EU ban on the use of wild animals in circuses (debate),https://www.europarl.europa.eu/doceo/document/CRE-9-2021-12-16-INT-4-051-0000_FR.html,"  Younous Omarjee (The Left).   – Monsieur le Président, quand on prive les animaux dits sauvages de liberté, c’est l’homme qui s’ensauvage. Les animaux n’ont qu’une raison d’être: celle de vivre, de vivre libres, et s’ils ont une raison d’exister, ce n’est ni derrière les barreaux ni dans des cirques pour satisfaire nos petits divertissements et nos grandes démissions devant la condition et la souffrance animales.
Cela a été dit: beaucoup de pays européens, sous pression des citoyens – car les citoyens ont un temps d’avance –, ont déjà interdit les animaux sauvages dans les cirques. Mais il est temps maintenant d’une interdiction à l’échelle européenne pour une harmonisation des réglementations et pour bannir définitivement ces pratiques d’un autre temps.
Je pense que l’heure est venue, dans cette Europe des droits humains, de fonder maintenant, aussi, l’Europe des droits des animaux.
"
