MP,Date,Language,Title,Url,Content
Younous OMARJEE,2022-12-14,FR,Upscaling the 2021-2027 Multiannual Financial Framework (debate),https://www.europarl.europa.eu/doceo/document/CRE-9-2022-12-14-INT-3-367-0000_FR.html,"  Younous Omarjee,  au nom du groupe The Left. – Madame la Présidente, il y a deux ans, quand les États membres se sont mis d’accord sur le budget, c’était avant la guerre d’Ukraine. C’était avant les crises humanitaire, sociale, économique, migratoire et énergétique qui en ont découlé. C’était avant la terrible inflation. 
Aujourd’hui, les crises sont là. Elles se combinent et elles s’inscrivent dans la durée. Elles sont un véritable défi pour se donner la capacité budgétaire de mieux faire face aux accidents de l’histoire, tout en gardant le cap des ambitions stratégiques de cohésion, de réindustrialisation, de transition énergétique et de lutte contre la pauvreté. 
La solution, en réalité, nous la connaissons: c’est un grand budget européen, avec de grandes ressources fiscales propres et plus d’autonomie par rapport aux États. La taxe sur les transactions financières représente à elle seule 50 milliards d’euros de plus. Nous devons aujourd’hui la mettre en place, sans tarder. 
"
Younous OMARJEE,2022-11-21,FR,Assessment of Hungary's compliance with the rule of law conditions under the Conditionality Regulation and state of play of the Hungarian RRP (debate),https://www.europarl.europa.eu/doceo/document/CRE-9-2022-11-21-INT-1-051-0000_FR.html,"  Younous Omarjee,  au nom du groupe The Left. – Madame la Présidente, Monsieur le Commissaire, l’heure n’est pas de transiger sur les principes, ni de céder au chantage odieux de M. Orbán, qui utilise la guerre en Ukraine pour nous faire plier. 
Rappelons-le, en Hongrie, les voyants sont toujours au rouge, car depuis des années, tous les principes sont un à un foulés aux pieds: liberté de la presse, indépendance de la justice, mise à mal du principe d’élections équitables, violation continue des droits des personnes LGBT, mise en place d’un système clientéliste permettant aux proches du pouvoir d’empocher les marchés publics et les fonds européens, de la PAC au FEDER. 
Les mesures récemment proposées par le gouvernement hongrois doivent bien sûr être évaluées, mais nous ne sommes pas dupes. Ces mesures sont insuffisantes. Elles sont pleinement insuffisantes et c’est pourquoi les fonds doivent aujourd’hui être gelés. Ils doivent l’être non pour punir les Hongrois, mais pour faire avancer la Hongrie sur la voie du respect de l’état de droit et du partage du socle des valeurs qui fonde l’appartenance à l’Union européenne. 
Renoncer aujourd’hui à défendre cela coûte que coûte, c’est laisser s’étendre le poison distillé par les gouvernements illibéraux et faire courir, en définitive, à toute l’Union de graves dangers pour l’avenir.
"
Younous OMARJEE,2022-10-20,FR,Commission implementing Regulation (EU) 2022/1614 of 15 September 2022 determining the existing deep-sea fishing areas and establishing a list of areas where vulnerable marine ecosystems are known to occur or are likely to occur (debate),https://www.europarl.europa.eu/doceo/document/CRE-9-2022-10-20-INT-4-071-0000_FR.html,"  Younous Omarjee (The Left).   – Madame la Présidente, nous ne sommes pas dupes du jeu de la France qui, en coulisse, continue d’agir comme meilleur bras armé des lobbies de la pêche industrielle pour faire obstacle à la fermeture, dès 400 mètres de profondeur, de tous les écosystèmes vulnérables à toutes les méthodes de pêche touchant les fonds marins, ce qui est devenu absolument nécessaire. Nous ne sommes pas dupes non plus du jeu de l’Espagne, qui entend poursuivre la Commission devant la Cour de justice pour entraver ce règlement. Tout cela en dit long.
Madame Dalli, je me souviens, dans une autre législature, de la commissaire Damanaki qui, déjà, avait eu affaire à l’action néfaste de la France et de l’Espagne visant à entraver le règlement sur la pêche en eaux profondes. Et heureusement qu’il y a eu le Parlement européen, heureusement qu’il y a eu la commissaire Damanaki et la Commission. Tenez bon face aux menaces, tenez bon face aux lobbies, parce que les océans et les écosystèmes marins sont en grand danger aujourd’hui.
(L'orateur accepte de répondre à une intervention ""carton bleu"")
"
Younous OMARJEE,2022-10-20,FR,Commission implementing Regulation (EU) 2022/1614 of 15 September 2022 determining the existing deep-sea fishing areas and establishing a list of areas where vulnerable marine ecosystems are known to occur or are likely to occur (debate),https://www.europarl.europa.eu/doceo/document/CRE-9-2022-10-20-INT-4-073-0000_FR.html,"  Younous Omarjee (The Left),  réponse «carton bleu». – Chère collègue, j’entends votre remarque, mais nous sommes ici au Parlement européen et nous avons pour habitude d’embrasser l’intérêt général européen. Et lorsqu’il s’agit de mettre en cause les attitudes et positions des États membres au Conseil européen, nous le faisons et il n’y a pas à s’en émouvoir. 
Je veux vous dire que vous prétendez défendre les pêcheurs, mais si nous continuons au rythme actuel de prédation, il n’y aura plus, et c’est l’ONU qui le dit, un seul poisson, ni coquillages, ni crustacés disponibles pour la pêche commerciale d’ici 2050, c’est-à-dire demain. Il y a donc urgence à agir et il y a urgence à protéger les écosystèmes dans les grands fonds marins, qui sont en très grand danger.
"
Younous OMARJEE,2022-10-19,FR,Fighting sexualised violence - The importance of the Istanbul Convention and a comprehensive proposal for a directive against gender-based violence (debate),https://www.europarl.europa.eu/doceo/document/CRE-9-2022-10-19-INT-3-293-0000_FR.html,"  Younous Omarjee (The Left),  intervention «carton bleu». – Madame la Présidente, ma chère collègue, merci pour votre intervention. Dans ce débat, comme l’a souligné Karima Delli, seuls deux hommes sont intervenus à la tribune et nous ne sommes ici que deux ou trois hommes.
La question que je vous pose est la suivante: cela vous inquiète-t-il ? Quels enseignements en tirez-vous pour notre assemblée? Car à l’évidence, ce débat extrêmement important sur la convention d’Istanbul contre les violences sexuelles à l’encontre des femmes est un combat qui doit concerner d’abord et avant tout les hommes. 
"
Younous OMARJEE,2022-10-05,FR,Humanitarian situation after the devastating floods in Pakistan and the climate crisis (debate),https://www.europarl.europa.eu/doceo/document/CRE-9-2022-10-05-INT-3-309-0000_FR.html,"  Younous Omarjee,  au nom du groupe The Left. – Monsieur le Président, cet été la saison de la mousson a tourné à la catastrophe absolue au Pakistan. Le Pakistan, cela a été dit, n'émet que 0,3 % des gaz à effet de serre. Et pourtant, il paie aujourd'hui un lourd tribut au dérèglement climatique qui, combiné à l'ordre inégalitaire du monde, est une véritable double peine pour les pays pauvres et sera encore plus, demain, facteur de déstabilisation à l'échelle de la planète. 
Ici comme là-bas, j'invite donc l'Union européenne à honorer ses engagements vis-à-vis des pays en voie de développement et à intensifier ses efforts pour que l'adaptation au réchauffement climatique devienne une priorité à l'échelle globale et en particulier lors de la prochaine COP en Égypte. 
"
Younous OMARJEE,2022-10-04,FR,Situation of Roma people living in settlements in the EU (debate),https://www.europarl.europa.eu/doceo/document/CRE-9-2022-10-04-INT-2-135-0000_FR.html,"  Younous Omarjee (The Left).   – Madame la Présidente, Madame la Commissaire, Monsieur le Ministre, au cœur de l’Union européenne se trouvent des ghettos de Roms constitués de bidonvilles sur des montagnes de déchets, sans accès à l’eau potable, sans route, sans accès équitable aux soins, à l’éducation, au marché du travail ni aux aides sociales. C’est à cette réalité moyenâgeuse que nous avons été confrontés lors de la mission que notre commission REGI a menée dans l’est de la Slovaquie, et cette réalité est la même partout en Europe. 
C’est pourquoi je pose la question: comment cela est-il possible, avec les 370 milliards de la cohésion? Cette réalité, Madame la Commissaire, dit un racisme institutionnel, et il y a une complicité à tous les étages pour que rien ne change. Je vous le dis en tant que président de la commission REGI: la programmation 2021-2027 devra voir une réelle concrétisation à l’égard des communautés marginalisées. C’est le devoir et l’obligation de la Commission européenne d'y veiller et de prendre toutes les mesures en cas de manquement. 
Madame la Présidente, pour terminer je veux dire que nous n’acceptons pas, en Europe, une caste d’intouchables au sein de notre Union. 
"
Younous OMARJEE,2022-10-04,FR,Key objectives for the CITES CoP19 meeting in Panama (debate),https://www.europarl.europa.eu/doceo/document/CRE-9-2022-10-04-INT-2-173-0000_FR.html,"  Younous Omarjee,  au nom du groupe The Left. – Madame la Présidente, 100 000 euros pour une chasse obscène au rhinocéros, 15 000 euros pour une tête de buffle, quelques milliers d’euros pour une corne d’éléphant, quelques euros pour une planche de bois de rose, et combien pour les prétendues vertus aphrodisiaques des écailles de pangolin? 
C’est à ce prix – 195 milliards d’euros par an, presque l’équivalent du trafic de drogue – que s’organise l’exploitation brutale de la nature par l’homme et, disons-le, les crimes de l’humanité contre le monde du vivant. 
C’est pourquoi il est temps aujourd’hui, je crois, de pénaliser les acheteurs et les détenteurs des objets de ce trafic, car c’est la demande qui crée l’offre, et le marché, il est en Europe. 
Je pense aussi qu’il s’agit là d’une question de civilisation, qui touche à la conception que nous avons de nous-mêmes. Le commerce des espèces dites sauvages est un commerce par nature barbare et sauvage, et je crois qu’on ne réglemente pas la barbarie: on la combat et on la pénalise. 
"
Younous OMARJEE,2022-10-04,FR,Commission proposal for measures under the Rule of Law Conditionality Regulation in the case of Hungary (debate),https://www.europarl.europa.eu/doceo/document/CRE-9-2022-10-04-INT-2-269-0000_FR.html,"  Younous Omarjee (The Left).   – Madame la Présidente, Monsieur le Ministre, Monsieur le Commissaire, je me souviens d’une époque pas si éloignée où, au Conseil, aucune opposition ne se manifestait lorsqu’il s’agissait de déployer la troïka pour obliger la Grèce, le Portugal, l’Espagne à épurer leurs budgets nationaux pour les soumettre à la doxa autoritaire des politiques «austéritaires» du semestre européen. 
Mais lorsqu’il s’agit de corruption, d’indépendance de la justice, de nos valeurs, de l’application de la charte des droits fondamentaux – de l’état de droit, en fait –, alors là, on se tortille, et la marche est très fastidieuse. 
Ce que nous demandons aujourd’hui à la Commission et au Conseil, c’est l’application pleine et entière du mécanisme «état de droit» – et non une application au rabais – contre la Hongrie. Et nous demandons aussi des garanties pour l’indépendance budgétaire du parquet européen. 
(L’orateur accepte de répondre à une question «carton bleu»)
"
Younous OMARJEE,2022-10-04,FR,Commission proposal for measures under the Rule of Law Conditionality Regulation in the case of Hungary (debate),https://www.europarl.europa.eu/doceo/document/CRE-9-2022-10-04-INT-2-271-0000_FR.html,"  Younous Omarjee (The Left), réponse «carton bleu» – Monsieur Rzońca, je pensais devoir répondre à une question sérieuse, mais je crois que vous m’obligez à m’abaisser à un niveau auquel je ne souhaite pas m’abaisser. Et je veux aussi vous dire que nous sommes, ici, des députés européens, que nous essayons d’embrasser l’intérêt général européen, et que dans le propos qui était le mien je n’ai attaqué personne. J’ai fait des remarques d’ordre général sur le mécanisme «état de droit» ainsi que sur les sanctions qui, je crois, doivent à présent être imposées à la Hongrie. 
"
Younous OMARJEE,2022-09-14,FR,"Economic, social and territorial cohesion in the EU: the 8th Cohesion Report - EU border regions: living labs of European integration (debate)",https://www.europarl.europa.eu/doceo/document/CRE-9-2022-09-14-INT-3-386-0000_FR.html,"  Younous Omarjee,  rapporteur. – Madame la Présidente, Madame la Commissaire, mes chers collègues, tout d’abord, permettez-moi de féliciter chaleureusement Constanze Krehl pour son excellent 8e rapport sur la cohésion en Europe qui, j’en suis certain, sera massivement adopté demain en plénière.
S’agissant des régions frontalières, j’ai la conviction que ces régions, qui couvrent 40 % du territoire européen ‒ un Européen sur quatre, près de 120 millions d’Européens vivant de part et d’autre de 40 frontières intérieures terrestres ‒, expriment dans leur réalité historique, géographique, économique et culturelle ce qu’est véritablement le projet européen, qu’elles sont appelées à jouer un rôle de plus en plus important et qu’elles doivent être au cœur de toutes nos préoccupations dans le travail que nous engageons à présent pour penser le futur de la politique de cohésion.
Dans le temps de la crise du COVID, alors que nous étions en Europe habitués à vivre dans un espace de libre circulation totale, nous avons repris conscience du poids des barrières qui, soudainement, peuvent s’imposer à nouveau à nous avec toutes les difficultés engendrées, notamment pour les travailleurs transfrontaliers. Mais nous avons aussi perçu, dans le temps de la crise du COVID, la force des solidarités et la force des coopérations transfrontalières dans le domaine sanitaire, ce qui a permis de sauver des vies.
Aujourd’hui avec la guerre d’agression de la Russie en Ukraine, la conscience des frontières resurgit. Et plus que jamais, nous avons conscience que ce que nous avons réussi à construire en Europe est absolument extraordinaire. Un espace commun de droits, de libertés et de circulation pour la paix. À présent, la crise d’approvisionnement en énergie, qui s’impose à toutes les régions et en particulier aux régions frontalières, doit nous appeler à réfléchir à un certain nombre de propositions nouvelles. Et nous devons considérer que les projets énergétiques transfrontaliers d’intérêt européen participent sans doute aux solutions que nous devons rechercher pour notre souveraineté énergétique. C’est là, me semble-t-il, une piste de proposition pour REpowerEU.
Le rapport que je soumets à votre approbation aujourd’hui rappelle donc toute l’importance de ces régions et les défis économiques, sociaux, juridiques, géographiques et territoriaux auxquels les espaces transfrontaliers sont confrontés.
Madame la Commissaire, vous connaissez l’attachement de notre Parlement au mécanisme européen transfrontalier qui doit permettre de lever les obstacles juridiques entraînant de nombreuses difficultés pour les citoyens: insuffisance de transports publics transfrontaliers, problèmes d’accès à l’emploi, à l’éducation, à la santé, aux services culturels et aux loisirs, pour ne citer que ceux-là. Ce mécanisme est aujourd’hui bloqué par le Conseil et, comme je l’ai indiqué à Prague lors du sommet informel des ministres de la cohésion, nous devons relancer le processus. Nous avons pu rapprocher les positions, je crois, entre le Parlement et le Conseil ‒ je salue le travail de notre collègue Gozi ‒ et nous demandons à présent à la Commission de prendre une initiative. Comme nous attendons que la Commission concrétise les initiatives parlementaires de notre commission REGI, conformément aux engagements qui ont été pris par la présidente de la Commission, Ursula von der Leyen. Nous avons adopté des rapports d’initiative massivement en plénière. Nous attendons à présent que la Commission les traduise effectivement. 
"
Younous OMARJEE,2022-09-14,FR,"Economic, social and territorial cohesion in the EU: the 8th Cohesion Report - EU border regions: living labs of European integration (debate)",https://www.europarl.europa.eu/doceo/document/CRE-9-2022-09-14-INT-3-435-0000_FR.html,"  Younous Omarjee,  rapporteur. – Monsieur le Président, nous aurions peut-être dû inverser l’ordre des interventions pour que Constanze Krehl ait le dernier mot dans ce débat. Et pour la troisième fois, je veux évidemment rendre hommage au travail tout à fait extraordinaire qui a été accompli par Constanze Krehl au sein de la commission REGI. Et je crois qu’il y a peu de députés qui peuvent dire que par leur action, la vie concrète des citoyens européens aura été changée ‒ puisque, Constanze, tu as négocié sur trois programmations des fonds européens.
Très rapidement, le climat de ce débat et le soutien massif apporté au rapport de Constanze Krehl et au rapport sur les régions frontalières disent la grande unité au sein de la commission REGI et au sein du Parlement européen, tous groupes politiques confondus, quasiment, pour défendre la politique de cohésion et pour l’engager vers une modernisation. C’est la condition même pour son avenir. Je veux remercier tous les orateurs qui ont apporté leur soutien à mon rapport, et je ne suis pas étonné que ce soient les nationalistes et les fascistes qui s’opposent au rapport sur les régions frontalières parce qu’évidemment, ils n’y comprennent rien.
Madame la Commissaire, pour conclure je veux vous dire que nous allons voter massivement demain le rapport de Constanze Krehl. Nous allons voter, je l’espère, massivement, mon rapport. Dans son rapport, comme dans le mien, comme dans tous les rapports que nous avons adoptés en plénière, le rapport sur le FSUE, le rapport de la commission REGI sur les îles, les rapports que nous allons adopter, nous faisons des propositions très concrètes. Et je ne veux pas que les rapports d’initiative de notre commission REGI et du Parlement finissent dans des tiroirs. Il y a une base concrète pour que la Commission puisse mettre des propositions sur la table. S’agissant aujourd’hui du mécanisme transfrontalier, il est urgent, urgent que le Conseil comme la Commission répondent à la balle lancée par le Parlement. 
"
Younous OMARJEE,2022-09-13,FR,"Consequences of drought, fire, and other extreme weather phenomena: increasing EU's efforts to fight climate change (debate)",https://www.europarl.europa.eu/doceo/document/CRE-9-2022-09-13-INT-2-027-0000_FR.html,"  Younous Omarjee (The Left).   – Monsieur le Président, Monsieur le Commissaire, nous sommes entrés dans l’ère de l’imprévisible, celle d’un désordre planétaire et de bouleversements majeurs à l’échelle de l’Union. Précarité énergétique, insécurité alimentaire, perte du monde du vivant, risques géopolitiques, pandémies, bouleversements démographiques et catastrophes naturelles rendent l’avenir incertain. Et ce dont nous sommes sûrs, c’est que quelle que soit la trajectoire climatique que nous emprunterons, le climat continuera de s’emballer avec la multiplication des catastrophes naturelles et des conséquences dans tous les secteurs, pour toutes les régions d’Europe.
Mais il n’est pas trop tard pour en prévenir les conséquences et les atténuer. L’adaptation des régions d’Europe au réchauffement climatique doit devenir une priorité, en Europe aussi. Et c’est pourquoi je dis à la Commission: entendez les propositions très concrètes de la commission REGI, nous sommes prêts pour y travailler avec vous. 
"
Younous OMARJEE,2022-07-06,FR,"The situation of indigenous and environmental defenders in Brazil, including the killing of Dom Phillips and Bruno Pereira",https://www.europarl.europa.eu/doceo/document/CRE-9-2022-07-06-INT-3-412-0000_FR.html,"  Younous Omarjee,  au nom du groupe The Left. – Madame la Présidente, au Brésil, la réalité fait froid dans le dos. Chaque année, 13 000 kilomètres carrés de forêts sont incendiés. C’est 120 fois la ville de Paris.
Pourtant, ce sont les défenseurs des peuples autochtones et de la forêt qui sont pourchassés par un gouvernement criminel qui n’a qu’une seule politique: saccager, piller et détruire un héritage biologique de 55 millions d’années, bien commun de l’humanité.
Je le dis: le gouvernement raciste, xénophobe et néofasciste de Bolsonaro n’est pas seulement coupable de crimes contre la biodiversité. Il est complice d’une véritable persécution des peuples indigènes, à l’œuvre pour offrir la voie libre aux multinationales qui ne s’embarrassent pas du goût du sang et de l’odeur des arbres brûlés.
L’Europe gagnerait à entrer en action pour la sauvegarde des peuples autochtones et de la forêt. C’est un enjeu de civilisation.
"
Younous OMARJEE,2022-07-05,FR,"EU initiatives to address the rising cost of living, including the implementation of the European Pillar of Social Rights (debate)",https://www.europarl.europa.eu/doceo/document/CRE-9-2022-07-05-INT-2-120-0000_FR.html,"  Younous Omarjee (The Left).   – Monsieur le Président, Monsieur le Commissaire, pendant que nous parlons, une minorité de spéculateurs continuent de manière éhontée à tirer profit des crises et de la guerre, quand les citoyens européens, eux, souffrent. Ils souffrent de la flambée des prix dans tous les secteurs, notamment de l’alimentaire et de l’énergie, et, il faut bien le dire, après les années de crise de la COVID-19, nos peuples européens sont épuisés. Ils sont épuisés de voir leurs conditions de vie continuer à se dégrader après avoir consenti beaucoup d’efforts. Ce qu’ils attendent de nous aujourd’hui, ce sont des décisions immédiates et la capacité, en temps exceptionnel, de prendre des mesures exceptionnelles.
Taxer les profiteurs de crise maintenant pour que cessent les profits record des multinationales, contrôler les prix de l’énergie, baisser la TVA sur les produits de première nécessité, indexer les salaires sur l’inflation, augmenter le Fonds européen d’aide aux plus démunis pour que chaque personne puisse manger trois fois par jour: voilà, Monsieur le Président, des décisions immédiates qui seraient efficaces et qui pourraient maintenant permettre à des millions d’Européens de vivre et non pas de survivre.
"
