MP,Date,Language,Title,Url,Content
Younous OMARJEE,2021-05-17,FR,Review of the European Union Solidarity Fund (short presentation),https://www.europarl.europa.eu/doceo/document/CRE-9-2021-05-17-INT-1-136-0000_FR.html,"  Younous Omarjee,  rapporteur. – Madame la Présidente, Monsieur le Commissaire, par ce rapport, notre commission du développement régional réaffirme son attachement au Fonds de solidarité de l’Union européenne, qui, vous le savez, a été créé en 2002 à la suite des lourdes inondations qui avaient affecté l’Europe centrale.
Ce Fonds a une valeur toute particulière : il dit, à travers des aides financières apportées aux États et aux régions touchés par les catastrophes naturelles, ce qu’est la solidarité européenne. Depuis sa création, il a été mobilisé dans 24 pays européens pour une centaine de catastrophes naturelles majeures et un budget total de 6 milliards d’euros. 
Plus que jamais, le Fonds de solidarité doit prendre une place centrale dans la politique de cohésion, car nous sommes aujourd’hui face à une nouvelle donne, celle du caractère devenu presque permanent des catastrophes naturelles en Europe. Il ne se passe plus une année sans que les régions continentales, insulaires et ultrapériphériques ne subissent des catastrophes naturelles majeures, que ce soit des inondations, des tempêtes, des incendies, des ouragans, des cyclones tropicaux ou des séismes. Et pour cause, puisque les changements climatiques sont en cours et qu’il est désormais irréfutable que ces phénomènes climatiques extrêmes iront grandissant en fréquence et en intensité. Ces risques sont aujourd’hui devenus systémiques dans le monde entier. En Europe, ces catastrophes ont représenté 500 milliards d’euros de pertes économiques et 90 000 vies humaines de perdues depuis 1980.
Or, cela reste, je crois, tout à fait sous-estimé dans l’ensemble de nos politiques. À l’évidence, les catastrophes représentent aujourd’hui un facteur de déstabilisation considérable de l’ensemble des politiques, et en particulier de la politique régionale, par les dégâts occasionnés sur l’ensemble des infrastructures que nous finançons à travers le FEDER, et que nous réparons aussi à travers le FEDER. C’est aussi pourquoi, dans nos règlements relatifs à la cohésion, nous appelons les régions à prendre en compte l’adaptation au changement climatique dans leurs stratégies de développement et dans leurs investissements.
Notre rapport souligne également les réformes successives qui ont permis à ce Fonds de s’adapter de mieux en mieux aux réalités de terrain et à devenir de moins en moins complexe. Il prend en compte la reconnaissance des catastrophes régionales, la nécessaire simplification administrative et la réduction du délai de versement des aides. Nous saluons aussi le fait qu’avec RescEU, l’Union européenne se soit dotée de forces d’intervention qui permettent d’aider les États membres à faire face aux catastrophes lorsque leurs capacités nationales sont dépassées, avec entre autres des Canadairs et des équipements de pompage hydraulique.
Mais il est temps aujourd’hui, Monsieur le Commissaire, d’aller plus loin et d’engager aussi une réflexion pour couvrir demain les catastrophes sanitaires, sans avoir à légiférer dans l’urgence pour faire face à l’urgence, comme nous l’avons fait durant la crise de la COVID-19. Nous devons en permanence repenser nos instruments et adapter nos choix budgétaires à ces réalités nouvelles. C’est le sens de l’ensemble des propositions contenues dans ce rapport de la commission du développement régional qui, je l’espère, sera adopté demain à une très large majorité.
"
Younous OMARJEE,2021-03-24,FR,System of own resources of the European Union – Own resource based on non-recycled plastic packaging waste and certain aspects of the GNI-based own resource – Collection of own resources accruing from value added tax (debate),https://www.europarl.europa.eu/doceo/document/CRE-9-2021-03-24-INT-1-107-0000_FR.html,"  Younous Omarjee (The Left).   – Monsieur le Président, Monsieur le Commissaire, mes chers collègues, le temps est souvent un allié, mais il peut aussi devenir un ennemi. Beaucoup trop d’États prennent aujourd’hui leur temps pour ratifier les dispositions sur les ressources propres et ralentissent ainsi la mise en œuvre du plan de relance européen quand il faudrait au contraire accélérer. Nous les conjurons de le faire sans délai et nous ne pouvons nous retrouver dans une situation où les États-Unis seraient engagés dans la mise en œuvre de leurs 1 900 milliards de dollars et l’Europe, elle, en attente et à l’arrêt.
Le choc de la crise du COVID, vous le savez, est immense, et vous savez que l’Union européenne est sévèrement jugée. Il ne faut pas ajouter au fiasco des vaccinations et au retard pris dans la vaccination le retard dans le redémarrage de nos économies. Tous ces retards font désormais peser un risque sur l’avenir même de l’Union. Tout se joue donc maintenant. 
"
Younous OMARJEE,2021-03-11,FR,"Application of Regulation (EU, Euratom) 2020/2092, the rule of law conditionality mechanism (continuation of debate)",https://www.europarl.europa.eu/doceo/document/CRE-9-2021-03-11-INT-4-031-0000_FR.html,"  Younous Omarjee (The Left).   – Madame la Présidente, Monsieur le Commissaire, une communauté d’États ne peut exister sans communauté de droit.
Ce qui fonde l’Europe, c’est le socle commun de valeurs et ce sont ces valeurs affirmées puis défendues progressivement qui ont sorti l’Europe des ténèbres de l’absolutisme, du fascisme, des dictatures et des guerres pour devenir cet espace de liberté et d’égalité de droits qui nous définit. Le respect de l’état de droit n’est donc pas une option, ni même une simple conditionnalité. C’est une condition, une condition existentielle. Et c’est pourquoi, partout où en ce moment sont mis en cause les droits des femmes, les droits des minorités ethniques et religieuses, des LGBT, de l’indépendance de la justice, des libertés politiques, la Commission européenne doit sanctionner. Et elle doit sanctionner maintenant, car ne pas le faire, c’est prendre un risque immense pour l’avenir.
"
Younous OMARJEE,2021-03-10,FR,European Semester: annual sustainable growth strategy 2021 – European Semester: employment and social aspects in the annual sustainable growth strategy 2021 (debate),https://www.europarl.europa.eu/doceo/document/CRE-9-2021-03-10-INT-3-041-0000_FR.html,"  Younous Omarjee (The Left).   – Madame la Présidente, à présent, je pense qu’il faut poser la question de la sortie définitive du pacte de stabilité budgétaire. Ces règles étaient absurdes hier, elles sont devenues dangereuses aujourd’hui avec la crise qui va se prolonger, les divergences entre les économies se renforcer, la cohésion reculer et devant nous ce risque d’explosion même de la zone euro.
En réalité, ce pacte de stabilité budgétaire, qui bridera les capacités des États pour la relance à long terme, devient celui du désordre social et de l’accroissement des inégalités et seul un aveuglement idéologique pourrait conduire à son maintien.
Il est donc temps d’en sortir et d’inventer une nouvelle forme de gouvernance économique adossée sur des critères de cohésion, sur des critères sociaux et climatiques et c’est un temps nouveau, une occasion inespérée qui peut s’ouvrir pour une réforme du Semestre européen.
"
Younous OMARJEE,2021-03-09,FR,InvestEU programme (debate),https://www.europarl.europa.eu/doceo/document/CRE-9-2021-03-09-INT-2-038-0000_FR.html,"  Younous Omarjee (The Left).   – Madame la Présidente, Monsieur le Commissaire, je tiens tout d’abord à féliciter les corapporteurs, mais je veux dire mon inquiétude. Mon inquiétude au regard de la cohésion. Cela a été dit, aucune répartition géographique n’a été prévue pour orienter les milliards d’investissements qui seront levés à travers InvestEU vers les entreprises des régions les moins développées d’Europe. C’est d’autant plus regrettable que les fonds et programmes créés sur la base de l’article 175 du traité doivent poursuivre, vous le savez, les objectifs de la cohésion. À présent, il faudra veiller, Monsieur Gentiloni, à ce qu’InvestEU aide effectivement, à travers le soutien aux entreprises, à réduire effectivement les fractures territoriales plutôt que de prendre le risque de les aggraver. Vous pouvez compter sur la commission du développement régional pour vous y aider. Et tout ceci pose tout de même la question de la cohérence de nos politiques communautaires, nous devons en permanence y veiller.
"
Younous OMARJEE,2021-01-21,FR,Mitigating the consequences of earthquakes in Croatia (debate),https://www.europarl.europa.eu/doceo/document/CRE-9-2021-01-21-INT-4-016-0000_FR.html,"  Younous Omarjee,  au nom du groupe The Left. – Madame la Présidente, madame la Commissaire, mes chers collègues, l'inscription de ce débat par notre Parlement à l'ordre du jour sur les tremblements de terre qui ont frappé la Croatie rappelle ce qu'est l'Union européenne: un espace de solidarité et l'expression de fraternité qui nous anime tous quand l'un des peuples de l'Union européenne se trouve face à l'épreuve. 
Et je veux de nouveau ce matin adresser mes condoléances aux familles et exprimer ma profonde solidarité avec la Croatie, qui a dû faire face à ces tremblements de terre dans une année 2020 déjà terriblement difficile, touchée par la pandémie de la COVID-19 et la crise qu'elle a engendrée. Vous l'avez dit, madame la Commissaire, le Fonds de solidarité de l'Union européenne a été mobilisé, mais l'effort de reconstruction des infrastructures, de relance économique et de réparation sociale est extrêmement important et j'appelle la Commission au déploiement le plus rapide possible des fonds et des aides nécessaires. 
Tous les instruments européens doivent être combinés pour appuyer la reconstruction. Bien sûr, ceux de la politique de cohésion, mais aussi ceux de la relance. Pour conclure, je voudrais dire que les tremblements de terre en Croatie nous rappellent aussi que l'Europe est, en bien des endroits, menacées par des séismes. Ce fut le cas en Italie il n'y a pas si longtemps et nous savons que demain, ici ou là, un séisme majeur pourrait intervenir. Et c'est pourquoi nous devrons mettre en place de véritables stratégies régionales d'adaptation aux risques volcaniques et au risque sismique. 
"
Younous OMARJEE,2020-12-15,FR,Additional resources in the context of the COVID-19 pandemic: REACT-EU (debate),https://www.europarl.europa.eu/doceo/document/CRE-9-2020-12-15-INT-2-111-0000_FR.html,"  Younous Omarjee (GUE/NGL).   – Madame la Présidente, chère Elisa Ferreira, Madame la Commissaire, mes chers collègues, je veux tout d’abord féliciter chaleureusement Constanze Krehl et Andrey Novakov, les corapporteurs, et toute la commission REGI pour le travail tout à fait exceptionnel accompli sur ce règlement. Je veux aussi remercier Mme la commissaire Ferreira et la présidence allemande.
Notre politique a fait, je crois, la démonstration de sa capacité à être réactive en temps de crise, à être plus flexible pour venir en aide au plus près des besoins. Nous avons aussi relevé ce pari que beaucoup estimaient impossible: adopter en temps et en heure le paquet «cohésion» et conclure cinq négociations ouvertes en même temps – avec la plus-value donnée au règlement par le Parlement européen. Avec près de 370 milliards d’euros pour 2021-2027, auxquels s’ajoutent les fonds de relance, la politique de cohésion est centrale et les régions peuvent maintenant avancer en sécurité pour la programmation 2021-2027.
Je pense que nous pouvons aujourd’hui dire que le plan de relance commence avec l’adoption de REACT-EU et nous pouvons aussi, je crois, être fiers de la contribution de la politique de cohésion, cette politique de solidarité qui a permis de construire l’Europe et qui permettra aussi de la reconstruire.
"
Younous OMARJEE,2020-11-11,FR,"Multiannual Financial Framework (including Own Resources), Rule of Law Conditionality Mechanism and the Recovery Fund for Europe (debate)",https://www.europarl.europa.eu/doceo/document/CRE-9-2020-11-11-INT-1-046-0000_FR.html,"  Younous Omarjee (GUE/NGL).   – Monsieur le président, il y a toujours plus de mérite à effectuer qu’à empêcher. Et je veux saluer le rôle des négociateurs du Parlement, qui n’ont pas ménagé leurs efforts pour obtenir des avancées, notamment en liant le budget à un mécanisme «état de droit».
Sur un plan budgétaire, ces améliorations sont incontestables par rapport à la position au rabais du Conseil. Mais elles demeurent insuffisantes par rapport aux ambitions initiales du Parlement européen. Et les agriculteurs seront les premiers à pâtir de ce budget.
Sur la question des ressources propres, qui étaient, vous le savez tous, un marqueur fort pour le Parlement européen, bien sûr, il y a des novations mais ces novations sont très contraintes. La taxe sur les transactions financières est renvoyée aux calendes grecques, sans garantie de mise en œuvre. Et la contribution sur le plastique, que l’on appelle «ressource propre», est en réalité une contribution payée par les États membres et n’est pas fondée sur une taxe.
Mais le plus inquiétant est ailleurs. Ce budget pluriannuel, adossé au fonds de relance, ouvre le risque d’une renationalisation des politiques européennes. Et nous devons être très attentifs pour cela.
Pour finir, M. le président, nous souhaitions un budget d’un monde d’après et nous avons le budget d’un monde d’avant qui ne répond pas...
(Le Président retire la parole à l’orateur)
"
Younous OMARJEE,2020-11-11,FR,General budget of the European Union for the financial year 2021 – all sections (debate),https://www.europarl.europa.eu/doceo/document/CRE-9-2020-11-11-INT-1-155-0000_FR.html,"  Younous Omarjee,  rapporteur pour avis de la commission du développement régional. – Madame la Présidente, le budget de l’Union pour 2021 doit être réajusté pour pleinement tenir compte de la pandémie de COVID-19. Notre commission REGI rappelle le rôle central que la politique de cohésion jouera en 2021 dans l’atténuation des incidences économiques et sociales de la COVID, ainsi que dans la reprise à l’issue de la pandémie.
Nous rappelons aussi la contribution tout à fait essentielle de la politique de cohésion dans les réponses d’urgence qui ont déjà bénéficié aux régions d’Europe, à travers les règlements CRII et CRII Plus que nous avons adoptés ici, en plénière, pour l’utilisation des fonds ESI en réaction à la pandémie. Nous relevons aussi que la mise en place de ces mesures entraînera un besoin accru de crédits de paiement, dont il faudra tenir compte dans le budget pour l’exercice 2021 si nous voulons, Monsieur le Commissaire Hahn, que tous les projets engagés soit payés.
Nous nous félicitons également de la création du programme REACT-EU, qui mettra des fonds supplémentaires à la disposition du FEDER, ainsi que du FSE et du FEADER. Nous arrivons quasiment au terme du trilogue en cours sur REACT-EU. Nous aurons un trilogue d’accord final la semaine prochaine, les délais sont tenus et des fonds REACT-EU pourront ainsi se déployer en temps et en heure.
Enfin, nous considérons que l’instrument de relance de l’Union européenne est une étape importante vers une relance équitable et durable. Toutefois, nous redoutons, compte tenu des libertés accordées aux États membres, que les objectifs de cohésion, et notamment de réduction des fractures territoriales, ne soient perdus en cours de route.
"
Younous OMARJEE,2020-10-20,FR,"Common agricultural policy - support for strategic plans to be drawn up by Member States and financed by the EAGF and by the EAFRD - Common agricultural policy: financing, management and monitoring - Common agricultural policy – amendment of the CMO and other Regulations (debate)",https://www.europarl.europa.eu/doceo/document/CRE-9-2020-10-20-INT-2-024-0000_FR.html,"  Younous Omarjee,  rapporteur pour avis de la commission du développement régional. – Monsieur le Président, nous avons fait de la cohésion et de l’écologie les maîtres mots de la relance économique du nouveau pacte vert pour l’Europe et du nouveau cadre budgétaire. Nous devons veiller à la cohérence des objectifs dans les politiques communautaires et c’est précisément ce que nous attendons de la politique agricole commune. 
Pour notre commission du développement régional, la réduction des fractures territoriales est une obsession. Nous considérons que la politique agricole commune peut contribuer au développement des territoires ruraux, forestiers, agricoles et que ceci passe par le maintien des populations dans les zones rurales, ainsi que par des revenus viables pour les agriculteurs.
Notre commission REGI demande également que la future PAC ne pénalise pas des régions ultra-périphériques et c’est pourquoi notre rapport rejette les baisses proposées par la Commission européenne et je veux remercier, au nom de toute notre commission, la commission de l’agriculture et du développement durable, ainsi que le rapporteur Éric Andrieu d’avoir maintenu leur position ferme et intransigeante dans cette direction. 
Nous attendons désormais, Monsieur le Commissaire, que le Conseil, qui est réuni aujourd’hui, revienne à une position de raison et valide la position du Parlement européen pour le maintien du budget POSEI.
Pour conclure, j’appelle l’ensemble des collègues à tenir bon et à ne pas céder sur cette bataille.
"
Younous OMARJEE,2020-07-23,FR,Conclusions of the extraordinary European Council meeting of 17-21 July 2020 (continuation of debate),https://www.europarl.europa.eu/doceo/document/CRE-9-2020-07-23-INT-1-050-0000_FR.html,"  Younous Omarjee (GUE/NGL).   – Madame la Présidente, j’entends dire que l’accord trouvé au Conseil européen est historique. Mais nous savons, d’expérience et de lucidité, que les portes parfois ouvertes se referment très vite devant les logiques de concurrence et de compétition. L’avenir le dira.
Mais l’historicité ne peut être de court terme, et l’accord trouvé au Conseil s’est fait au prix de coupes dans les politiques de long terme de l’Union européenne: PAC, recherche, Erasmus, santé, pacte vert et FSE.
L’accord s’est fait, aussi, avec un début inquiétant de renationalisation des politiques européennes. Je crois qu’au final, cet accord marque que les intérêts nationaux ont prévalu sur les politiques européennes que nous défendons.
Pour conclure, je veux dire au Conseil que le Parlement européen a le dernier mot, que nous sommes codécisionnaires sur les règlements et que nous sommes les garants de la méthode communautaire. 
"
Younous OMARJEE,2020-07-10,FR,The role of cohesion policy in tackling the socio-economic fallout from COVID-19 (debate),https://www.europarl.europa.eu/doceo/document/CRE-9-2020-07-10-INT-3-056-0000_FR.html,"  Younous Omarjee,  auteur. – Monsieur le Président, Madame la Commissaire, chère Élisa Ferreira, mes chers collègues, le visage de l’Europe est défiguré par la crise de la COVID-19. Toutes les régions d’Europe sont lourdement affectées, le chômage est reparti à la hausse, les faillites se multiplient, l’économie réelle a été touchée de plein fouet, aucun secteur n’est épargné, aucune région n’est épargnée et les prévisions économiques sont plutôt catastrophiques.
Cette crise est un dur révélateur de nos fragilités. L’Europe est dans ce moment important où la relance n’est pas une option, c’est un impératif et, plus que jamais, les institutions et les politiques européennes se doivent de garder le cap, se doivent de garder des principes et se doivent de garder le cap de la cohésion.
En pleine catastrophe sanitaire, nous devons rappeler que la seule politique européenne qui a été en capacité de venir en aide à tous les États membres, c’est la politique de cohésion. Celle-ci a pu aider à la mise en place des dispositifs de chômage partiel pour les salariés, à l’achat de matériel pour les hôpitaux, à venir en aide aux PME. Notre commission du développement régional comme le Parlement européen ont pris toute leur part et ont été à la hauteur de leurs responsabilités en adoptant en urgence les règlements, et nous avons commencé le travail législatif sur REACT-EU. 
Ici même, mercredi, en plénière, la chancelière Angela Merkel et la présidente de la Commission européenne, Ursula von der Leyen et tous les présidents des groupes politiques ont plaidé pour une relance fondée sur la cohésion. Et nous attendons désormais que ces mots se traduisent par des actes et s’inscrivent dans la réalité concrète. Et nous attendons du Conseil européen qu’il soit à la hauteur des promesses et des attentes lors du prochain sommet.
Les financements proposés, Madame la Commissaire, dans le nouvel instrument Next Generation EU sont un pas en avant qui va dans le bon sens, même si notre Parlement attendait des fonds plus importants. Cependant, la politique de cohésion reste, quant à elle, fortement affectée par la nouvelle proposition du CFP et est en baisse de 12% par rapport à la programmation 2014-2020.
Nous devons rappeler que la politique de cohésion joue un rôle central dans toutes les régions d’Europe. Elle est une politique de terrain ayant pied dans l’économie réelle et, par conséquent, un soutien adéquat est absolument nécessaire afin de ne pas compromettre ses objectifs de long terme. Une plus grande flexibilité est attendue et une plus grande simplification, et, sur ces deux objectifs, vous nous trouverez à vos côtés pour les faciliter.
Si, entre le jour du dépôt de notre question orale et aujourd’hui, des réponses, il faut bien le reconnaître, ont été apportées, beaucoup de questions restent d’actualité. Nous serons très vigilants pour que la direction des 350 milliards du fonds de relance, à travers, nous l’espérons, essentiellement des subventions, vise bien les objectifs de la cohésion.
C’est pourquoi nous vous demandons, Madame la Commissaire, quelle place la Commission entend donner véritablement à la cohésion dans la relance. Et, en cela, comment le Semestre européen orientera-t-il ces fonds pour respecter les principes qui sont ceux de la cohésion, c’est-à-dire que la priorité soit donnée aux régions aussi bien moins développées qu’aux régions qui ont été fortement impactées par la crise? 
Comment aussi le Semestre européen ciblera-t-il, dans le cadre du plan de relance, les régions, les groupes et les secteurs qui en ont le plus besoin pour s’assurer que les régions insulaires et ultrapériphériques ne soient pas laissées pour compte? Enfin, à l’heure où tous les États vont s’endetter pour la relance, comment la Commission envisage-t-elle d’exclure du pacte de stabilité et de croissance des dépenses liées à la politique de cohésion pour la période 2021-2027?
Et pour conclure, je vous dirai, Madame la Commissaire, que nous espérons tous un bon accord au Conseil. Si cet accord devait être un accord qui satisfait le Parlement, alors notre commission du développement régional et l’ensemble des rapporteurs assumeront la responsabilité pour aller jusqu’à une négociation fin d’année, qui permette que l’année 2021 ne soit pas perdue.
"
